Job started on tiger-01 at Thu 26 Feb 11:08:14 GMT 2026
CPUs: 16  MEM: 64000
CMD: python -m src.utils.tune_8_optuna --stage2 --data_stage2 data/processed/output2.csv --task multiclass --model rf --n_splits 5 --max_races 80 --n_trials 500 --seed 42 --timeout_sec 170000 --outdir runs/tuning_8_final
[load_stage2_dataset] Dropped 36 rows with missing y_compound.
[I 2026-02-26 11:08:25,737] Trial 306 pruned. 
[I 2026-02-26 11:08:32,568] Trial 307 pruned. 
[I 2026-02-26 11:08:38,941] Trial 308 pruned. 
[I 2026-02-26 11:08:44,841] Trial 309 pruned. 
[I 2026-02-26 11:08:53,689] Trial 310 pruned. 
[I 2026-02-26 11:09:00,091] Trial 311 pruned. 
[I 2026-02-26 11:09:04,867] Trial 312 finished with value: 1.0486314499131373 and parameters: {'n_estimators': 1113, 'max_depth': 16, 'min_samples_leaf': 7, 'min_samples_split': 54, 'max_features': 0.24015788242542918, 'max_samples': 0.553409083009673, 'criterion': 'entropy', 'class_weight': None}. Best is trial 234 with value: 1.0473222925367989.
[I 2026-02-26 11:09:09,588] Trial 313 pruned. 
[I 2026-02-26 11:09:13,415] Trial 314 finished with value: 1.049036342637851 and parameters: {'n_estimators': 874, 'max_depth': 16, 'min_samples_leaf': 9, 'min_samples_split': 52, 'max_features': 0.2799072119062277, 'max_samples': 0.5633239464078577, 'criterion': 'entropy', 'class_weight': None}. Best is trial 234 with value: 1.0473222925367989.
[I 2026-02-26 11:09:16,937] Trial 315 pruned. 
[I 2026-02-26 11:09:21,333] Trial 316 pruned. 
[I 2026-02-26 11:09:24,406] Trial 317 pruned. 
[I 2026-02-26 11:09:29,553] Trial 318 pruned. 
[I 2026-02-26 11:09:34,413] Trial 319 pruned. 
[I 2026-02-26 11:09:38,388] Trial 320 finished with value: 1.048443363505467 and parameters: {'n_estimators': 918, 'max_depth': 16, 'min_samples_leaf': 9, 'min_samples_split': 55, 'max_features': 0.26208238682060586, 'max_samples': 0.6070533460823004, 'criterion': 'entropy', 'class_weight': None}. Best is trial 234 with value: 1.0473222925367989.
[I 2026-02-26 11:09:42,602] Trial 321 finished with value: 1.0497358686562488 and parameters: {'n_estimators': 986, 'max_depth': 16, 'min_samples_leaf': 9, 'min_samples_split': 58, 'max_features': 0.26409923375913363, 'max_samples': 0.6140053694476387, 'criterion': 'entropy', 'class_weight': None}. Best is trial 234 with value: 1.0473222925367989.
[I 2026-02-26 11:09:46,934] Trial 322 pruned. 
[I 2026-02-26 11:09:50,697] Trial 323 pruned. 
[I 2026-02-26 11:09:54,697] Trial 324 pruned. 
[I 2026-02-26 11:09:58,476] Trial 325 pruned. 
[I 2026-02-26 11:10:02,275] Trial 326 pruned. 
[I 2026-02-26 11:10:06,650] Trial 327 pruned. 
[I 2026-02-26 11:10:10,417] Trial 328 pruned. 
[I 2026-02-26 11:10:14,496] Trial 329 pruned. 
[I 2026-02-26 11:10:18,776] Trial 330 pruned. 
[I 2026-02-26 11:10:23,437] Trial 331 finished with value: 1.0494832266717162 and parameters: {'n_estimators': 1113, 'max_depth': 16, 'min_samples_leaf': 9, 'min_samples_split': 49, 'max_features': 0.21849760858415998, 'max_samples': 0.5524925428936731, 'criterion': 'entropy', 'class_weight': None}. Best is trial 234 with value: 1.0473222925367989.
[I 2026-02-26 11:10:26,841] Trial 332 pruned. 
[I 2026-02-26 11:10:32,980] Trial 333 finished with value: 1.0501490601237118 and parameters: {'n_estimators': 1491, 'max_depth': 16, 'min_samples_leaf': 9, 'min_samples_split': 57, 'max_features': 0.24922552649383775, 'max_samples': 0.6104077214063424, 'criterion': 'entropy', 'class_weight': None}. Best is trial 234 with value: 1.0473222925367989.
[I 2026-02-26 11:10:39,291] Trial 334 finished with value: 1.0483376052601918 and parameters: {'n_estimators': 1532, 'max_depth': 16, 'min_samples_leaf': 9, 'min_samples_split': 53, 'max_features': 0.23513809134846012, 'max_samples': 0.5670992137322214, 'criterion': 'entropy', 'class_weight': None}. Best is trial 234 with value: 1.0473222925367989.
[I 2026-02-26 11:10:45,609] Trial 335 pruned. 
[I 2026-02-26 11:10:51,481] Trial 336 finished with value: 1.0497351140806175 and parameters: {'n_estimators': 1451, 'max_depth': 16, 'min_samples_leaf': 9, 'min_samples_split': 54, 'max_features': 0.2307456947956092, 'max_samples': 0.5545509536577267, 'criterion': 'entropy', 'class_weight': None}. Best is trial 234 with value: 1.0473222925367989.
[I 2026-02-26 11:10:56,966] Trial 337 pruned. 
[I 2026-02-26 11:11:02,978] Trial 338 pruned. 
[I 2026-02-26 11:11:08,479] Trial 339 pruned. 
[I 2026-02-26 11:11:14,243] Trial 340 pruned. 
[I 2026-02-26 11:11:17,794] Trial 341 pruned. 
[I 2026-02-26 11:11:24,011] Trial 342 finished with value: 1.0490611042433018 and parameters: {'n_estimators': 1561, 'max_depth': 16, 'min_samples_leaf': 8, 'min_samples_split': 55, 'max_features': 0.28060672383950575, 'max_samples': 0.5433081236812132, 'criterion': 'entropy', 'class_weight': None}. Best is trial 234 with value: 1.0473222925367989.
[I 2026-02-26 11:11:28,799] Trial 343 finished with value: 1.048428604157207 and parameters: {'n_estimators': 1159, 'max_depth': 16, 'min_samples_leaf': 8, 'min_samples_split': 54, 'max_features': 0.25340679561157564, 'max_samples': 0.510683653627265, 'criterion': 'log_loss', 'class_weight': None}. Best is trial 234 with value: 1.0473222925367989.
[I 2026-02-26 11:11:32,662] Trial 344 pruned. 
[I 2026-02-26 11:11:37,182] Trial 345 pruned. 
[I 2026-02-26 11:11:41,653] Trial 346 finished with value: 1.0490469926114057 and parameters: {'n_estimators': 1108, 'max_depth': 16, 'min_samples_leaf': 8, 'min_samples_split': 54, 'max_features': 0.25662802354832287, 'max_samples': 0.5177473400666692, 'criterion': 'entropy', 'class_weight': None}. Best is trial 234 with value: 1.0473222925367989.
[I 2026-02-26 11:11:46,949] Trial 347 pruned. 
[I 2026-02-26 11:11:51,810] Trial 348 finished with value: 1.0495774124737423 and parameters: {'n_estimators': 1135, 'max_depth': 16, 'min_samples_leaf': 6, 'min_samples_split': 55, 'max_features': 0.29753922496920016, 'max_samples': 0.5157527461599558, 'criterion': 'log_loss', 'class_weight': None}. Best is trial 234 with value: 1.0473222925367989.
[I 2026-02-26 11:11:54,065] Trial 349 pruned. 
[I 2026-02-26 11:11:59,308] Trial 350 finished with value: 1.0484056839350802 and parameters: {'n_estimators': 1256, 'max_depth': 26, 'min_samples_leaf': 9, 'min_samples_split': 52, 'max_features': 0.27881851008051206, 'max_samples': 0.5003533383322437, 'criterion': 'log_loss', 'class_weight': None}. Best is trial 234 with value: 1.0473222925367989.
[I 2026-02-26 11:12:04,887] Trial 351 finished with value: 1.0496129051994638 and parameters: {'n_estimators': 1317, 'max_depth': 26, 'min_samples_leaf': 8, 'min_samples_split': 53, 'max_features': 0.23914592726015843, 'max_samples': 0.5040165781695695, 'criterion': 'log_loss', 'class_weight': None}. Best is trial 234 with value: 1.0473222925367989.
[I 2026-02-26 11:12:10,166] Trial 352 finished with value: 1.0495843350063123 and parameters: {'n_estimators': 1269, 'max_depth': 26, 'min_samples_leaf': 8, 'min_samples_split': 56, 'max_features': 0.2616852524682901, 'max_samples': 0.5073919953155105, 'criterion': 'log_loss', 'class_weight': None}. Best is trial 234 with value: 1.0473222925367989.
[I 2026-02-26 11:12:15,013] Trial 353 pruned. 
[I 2026-02-26 11:12:20,059] Trial 354 pruned. 
[I 2026-02-26 11:12:25,149] Trial 355 pruned. 
[I 2026-02-26 11:12:27,955] Trial 356 pruned. 
[I 2026-02-26 11:12:33,298] Trial 357 pruned. 
[I 2026-02-26 11:12:38,186] Trial 358 pruned. 
[I 2026-02-26 11:12:44,043] Trial 359 pruned. 
[I 2026-02-26 11:12:50,015] Trial 360 pruned. 
[I 2026-02-26 11:12:54,535] Trial 361 pruned. 
[I 2026-02-26 11:13:03,893] Trial 362 pruned. 
[I 2026-02-26 11:13:13,615] Trial 363 pruned. 
[I 2026-02-26 11:13:18,406] Trial 364 pruned. 
[I 2026-02-26 11:13:20,444] Trial 365 pruned. 
[I 2026-02-26 11:13:26,433] Trial 366 pruned. 
[I 2026-02-26 11:13:31,195] Trial 367 pruned. 
[I 2026-02-26 11:13:36,760] Trial 368 pruned. 
[I 2026-02-26 11:13:41,506] Trial 369 finished with value: 1.0482475116772954 and parameters: {'n_estimators': 1111, 'max_depth': 26, 'min_samples_leaf': 8, 'min_samples_split': 50, 'max_features': 0.2214507562651288, 'max_samples': 0.5394420643759779, 'criterion': 'gini', 'class_weight': None}. Best is trial 234 with value: 1.0473222925367989.
[I 2026-02-26 11:13:45,998] Trial 370 pruned. 
[I 2026-02-26 11:13:51,052] Trial 371 pruned. 
[I 2026-02-26 11:13:56,013] Trial 372 finished with value: 1.0496373867984532 and parameters: {'n_estimators': 1155, 'max_depth': 26, 'min_samples_leaf': 8, 'min_samples_split': 50, 'max_features': 0.21781352395836281, 'max_samples': 0.5216264961658953, 'criterion': 'gini', 'class_weight': None}. Best is trial 234 with value: 1.0473222925367989.
[I 2026-02-26 11:14:00,781] Trial 373 pruned. 
[I 2026-02-26 11:14:06,635] Trial 374 pruned. 
[I 2026-02-26 11:14:10,969] Trial 375 finished with value: 1.0480504570796623 and parameters: {'n_estimators': 1035, 'max_depth': 12, 'min_samples_leaf': 9, 'min_samples_split': 49, 'max_features': 0.23548232667621058, 'max_samples': 0.5425986674370314, 'criterion': 'log_loss', 'class_weight': None}. Best is trial 234 with value: 1.0473222925367989.
[I 2026-02-26 11:14:15,245] Trial 376 pruned. 
[I 2026-02-26 11:14:19,814] Trial 377 pruned. 
[I 2026-02-26 11:14:24,134] Trial 378 pruned. 
[I 2026-02-26 11:14:28,228] Trial 379 pruned. 
[I 2026-02-26 11:14:32,627] Trial 380 pruned. 
[I 2026-02-26 11:14:37,264] Trial 381 pruned. 
[I 2026-02-26 11:14:41,582] Trial 382 pruned. 
[I 2026-02-26 11:14:46,000] Trial 383 pruned. 
[I 2026-02-26 11:14:51,078] Trial 384 pruned. 
[I 2026-02-26 11:14:55,770] Trial 385 pruned. 
[I 2026-02-26 11:15:01,286] Trial 386 pruned. 
[I 2026-02-26 11:15:07,069] Trial 387 pruned. 
[I 2026-02-26 11:15:13,016] Trial 388 pruned. 
[I 2026-02-26 11:15:16,937] Trial 389 pruned. 
[I 2026-02-26 11:15:18,578] Trial 390 finished with value: 1.0496771254360393 and parameters: {'n_estimators': 306, 'max_depth': 12, 'min_samples_leaf': 8, 'min_samples_split': 56, 'max_features': 0.23367498108997337, 'max_samples': 0.5432760258589419, 'criterion': 'gini', 'class_weight': None}. Best is trial 234 with value: 1.0473222925367989.
[I 2026-02-26 11:15:24,689] Trial 391 pruned. 
[I 2026-02-26 11:15:29,783] Trial 392 pruned. 
[I 2026-02-26 11:15:36,307] Trial 393 finished with value: 1.0489403238398618 and parameters: {'n_estimators': 1610, 'max_depth': 16, 'min_samples_leaf': 7, 'min_samples_split': 53, 'max_features': 0.21842185918916127, 'max_samples': 0.5541197173755451, 'criterion': 'log_loss', 'class_weight': None}. Best is trial 234 with value: 1.0473222925367989.
[I 2026-02-26 11:15:40,904] Trial 394 pruned. 
[I 2026-02-26 11:15:45,267] Trial 395 pruned. 
[I 2026-02-26 11:15:51,651] Trial 396 pruned. 
[I 2026-02-26 11:15:55,980] Trial 397 pruned. 
[I 2026-02-26 11:16:01,782] Trial 398 pruned. 
[I 2026-02-26 11:16:08,147] Trial 399 pruned. 
[I 2026-02-26 11:16:13,072] Trial 400 pruned. 
[I 2026-02-26 11:16:18,336] Trial 401 pruned. 
[I 2026-02-26 11:16:24,984] Trial 402 pruned. 
[I 2026-02-26 11:16:30,401] Trial 403 pruned. 
[I 2026-02-26 11:16:36,861] Trial 404 pruned. 
[I 2026-02-26 11:16:42,865] Trial 405 pruned. 
[I 2026-02-26 11:16:49,382] Trial 406 pruned. 
[I 2026-02-26 11:16:53,933] Trial 407 pruned. 
[I 2026-02-26 11:16:58,763] Trial 408 pruned. 
[I 2026-02-26 11:17:00,545] Trial 409 finished with value: 1.049900543982589 and parameters: {'n_estimators': 355, 'max_depth': 26, 'min_samples_leaf': 8, 'min_samples_split': 52, 'max_features': 0.22013156536464704, 'max_samples': 0.5201792698080667, 'criterion': 'gini', 'class_weight': None}. Best is trial 234 with value: 1.0473222925367989.
[I 2026-02-26 11:17:09,626] Trial 410 pruned. 
[I 2026-02-26 11:17:19,102] Trial 411 pruned. 
[I 2026-02-26 11:17:24,862] Trial 412 pruned. 
[I 2026-02-26 11:17:31,026] Trial 413 pruned. 
[I 2026-02-26 11:17:37,346] Trial 414 finished with value: 1.0492579023621231 and parameters: {'n_estimators': 1556, 'max_depth': None, 'min_samples_leaf': 9, 'min_samples_split': 51, 'max_features': 0.2592637984081626, 'max_samples': 0.556665892921104, 'criterion': 'gini', 'class_weight': None}. Best is trial 234 with value: 1.0473222925367989.
[I 2026-02-26 11:17:42,034] Trial 415 finished with value: 1.0481079100019168 and parameters: {'n_estimators': 1126, 'max_depth': 12, 'min_samples_leaf': 8, 'min_samples_split': 57, 'max_features': 0.23367366126309003, 'max_samples': 0.5117693021934356, 'criterion': 'entropy', 'class_weight': None}. Best is trial 234 with value: 1.0473222925367989.
[I 2026-02-26 11:17:46,600] Trial 416 pruned. 
[I 2026-02-26 11:17:56,574] Trial 417 finished with value: 1.049479161242245 and parameters: {'n_estimators': 2488, 'max_depth': 12, 'min_samples_leaf': 7, 'min_samples_split': 50, 'max_features': 0.21807099413870437, 'max_samples': 0.5081581060558901, 'criterion': 'entropy', 'class_weight': None}. Best is trial 234 with value: 1.0473222925367989.
[I 2026-02-26 11:18:01,257] Trial 418 pruned. 
[I 2026-02-26 11:18:06,213] Trial 419 pruned. 
[I 2026-02-26 11:18:10,537] Trial 420 pruned. 
[I 2026-02-26 11:18:14,617] Trial 421 pruned. 
[I 2026-02-26 11:18:19,419] Trial 422 finished with value: 1.048627212490625 and parameters: {'n_estimators': 1144, 'max_depth': 12, 'min_samples_leaf': 8, 'min_samples_split': 55, 'max_features': 0.24072818044156796, 'max_samples': 0.5838984765437268, 'criterion': 'entropy', 'class_weight': None}. Best is trial 234 with value: 1.0473222925367989.
[I 2026-02-26 11:18:24,111] Trial 423 pruned. 
[I 2026-02-26 11:18:29,015] Trial 424 pruned. 
[I 2026-02-26 11:18:34,246] Trial 425 pruned. 
[I 2026-02-26 11:18:38,753] Trial 426 pruned. 
[I 2026-02-26 11:18:43,265] Trial 427 pruned. 
[I 2026-02-26 11:18:45,786] Trial 428 finished with value: 1.049172822715542 and parameters: {'n_estimators': 547, 'max_depth': 12, 'min_samples_leaf': 6, 'min_samples_split': 57, 'max_features': 0.24041403996914046, 'max_samples': 0.5720636216767491, 'criterion': 'entropy', 'class_weight': None}. Best is trial 234 with value: 1.0473222925367989.
[I 2026-02-26 11:18:50,485] Trial 429 pruned. 
[I 2026-02-26 11:18:55,476] Trial 430 pruned. 
[I 2026-02-26 11:19:00,520] Trial 431 pruned. 
[I 2026-02-26 11:19:06,413] Trial 432 pruned. 
[I 2026-02-26 11:19:10,717] Trial 433 pruned. 
[I 2026-02-26 11:19:13,588] Trial 434 finished with value: 1.0489430776091813 and parameters: {'n_estimators': 638, 'max_depth': 20, 'min_samples_leaf': 8, 'min_samples_split': 55, 'max_features': 0.22594855561769436, 'max_samples': 0.6065258628503415, 'criterion': 'entropy', 'class_weight': None}. Best is trial 234 with value: 1.0473222925367989.
[I 2026-02-26 11:19:18,157] Trial 435 pruned. 
[I 2026-02-26 11:19:22,186] Trial 436 finished with value: 1.0494171276790214 and parameters: {'n_estimators': 928, 'max_depth': None, 'min_samples_leaf': 7, 'min_samples_split': 53, 'max_features': 0.24209606550125023, 'max_samples': 0.5638702864091549, 'criterion': 'entropy', 'class_weight': None}. Best is trial 234 with value: 1.0473222925367989.
[I 2026-02-26 11:19:25,234] Trial 437 pruned. 
[I 2026-02-26 11:19:32,121] Trial 438 pruned. 
[I 2026-02-26 11:19:36,535] Trial 439 pruned. 
[I 2026-02-26 11:19:41,782] Trial 440 finished with value: 1.048077008972744 and parameters: {'n_estimators': 1258, 'max_depth': None, 'min_samples_leaf': 8, 'min_samples_split': 57, 'max_features': 0.2759578727861327, 'max_samples': 0.5150548694402975, 'criterion': 'entropy', 'class_weight': None}. Best is trial 234 with value: 1.0473222925367989.
[I 2026-02-26 11:19:47,109] Trial 441 pruned. 
[I 2026-02-26 11:19:52,373] Trial 442 pruned. 
[I 2026-02-26 11:19:57,937] Trial 443 finished with value: 1.0480499419431875 and parameters: {'n_estimators': 1329, 'max_depth': None, 'min_samples_leaf': 8, 'min_samples_split': 56, 'max_features': 0.2797405863663698, 'max_samples': 0.508617891178299, 'criterion': 'entropy', 'class_weight': None}. Best is trial 234 with value: 1.0473222925367989.
[I 2026-02-26 11:20:03,216] Trial 444 pruned. 
[I 2026-02-26 11:20:08,863] Trial 445 pruned. 
[I 2026-02-26 11:20:14,541] Trial 446 finished with value: 1.0496546668572786 and parameters: {'n_estimators': 1346, 'max_depth': None, 'min_samples_leaf': 7, 'min_samples_split': 58, 'max_features': 0.2866294220835672, 'max_samples': 0.5113712138039757, 'criterion': 'entropy', 'class_weight': None}. Best is trial 234 with value: 1.0473222925367989.
[I 2026-02-26 11:20:20,077] Trial 447 finished with value: 1.0495083401459424 and parameters: {'n_estimators': 1320, 'max_depth': None, 'min_samples_leaf': 8, 'min_samples_split': 56, 'max_features': 0.2862357685939066, 'max_samples': 0.5058693554562893, 'criterion': 'entropy', 'class_weight': None}. Best is trial 234 with value: 1.0473222925367989.
[I 2026-02-26 11:20:25,491] Trial 448 finished with value: 1.0498833105841698 and parameters: {'n_estimators': 1316, 'max_depth': None, 'min_samples_leaf': 8, 'min_samples_split': 56, 'max_features': 0.2759025892160615, 'max_samples': 0.5007907835914536, 'criterion': 'entropy', 'class_weight': None}. Best is trial 234 with value: 1.0473222925367989.
[I 2026-02-26 11:20:30,796] Trial 449 pruned. 
[I 2026-02-26 11:20:35,785] Trial 450 finished with value: 1.0493097443539536 and parameters: {'n_estimators': 1204, 'max_depth': None, 'min_samples_leaf': 8, 'min_samples_split': 56, 'max_features': 0.2745390729710828, 'max_samples': 0.5131471456631241, 'criterion': 'entropy', 'class_weight': None}. Best is trial 234 with value: 1.0473222925367989.
[I 2026-02-26 11:20:41,600] Trial 451 pruned. 
[I 2026-02-26 11:20:47,017] Trial 452 finished with value: 1.0489745374840216 and parameters: {'n_estimators': 1300, 'max_depth': None, 'min_samples_leaf': 8, 'min_samples_split': 55, 'max_features': 0.2666860686443755, 'max_samples': 0.5269993084917404, 'criterion': 'entropy', 'class_weight': None}. Best is trial 234 with value: 1.0473222925367989.
[I 2026-02-26 11:20:52,903] Trial 453 pruned. 
[I 2026-02-26 11:20:58,207] Trial 454 finished with value: 1.048844868214592 and parameters: {'n_estimators': 1251, 'max_depth': None, 'min_samples_leaf': 8, 'min_samples_split': 55, 'max_features': 0.2610165019939916, 'max_samples': 0.5189588789155296, 'criterion': 'entropy', 'class_weight': None}. Best is trial 234 with value: 1.0473222925367989.
[I 2026-02-26 11:21:04,465] Trial 455 pruned. 
[I 2026-02-26 11:21:09,356] Trial 456 finished with value: 1.0491546436599235 and parameters: {'n_estimators': 1169, 'max_depth': 16, 'min_samples_leaf': 8, 'min_samples_split': 54, 'max_features': 0.3183866013010554, 'max_samples': 0.528896341355165, 'criterion': 'entropy', 'class_weight': None}. Best is trial 234 with value: 1.0473222925367989.
[I 2026-02-26 11:21:14,422] Trial 457 finished with value: 1.0491046402507784 and parameters: {'n_estimators': 1220, 'max_depth': None, 'min_samples_leaf': 8, 'min_samples_split': 57, 'max_features': 0.27645330137615937, 'max_samples': 0.5100252062201802, 'criterion': 'log_loss', 'class_weight': None}. Best is trial 234 with value: 1.0473222925367989.
[I 2026-02-26 11:21:19,293] Trial 458 finished with value: 1.0496218785196865 and parameters: {'n_estimators': 1149, 'max_depth': None, 'min_samples_leaf': 4, 'min_samples_split': 55, 'max_features': 0.2541058556532042, 'max_samples': 0.5428121544337806, 'criterion': 'entropy', 'class_weight': None}. Best is trial 234 with value: 1.0473222925367989.
[I 2026-02-26 11:21:25,038] Trial 459 pruned. 
[I 2026-02-26 11:21:30,417] Trial 460 finished with value: 1.0492174220203387 and parameters: {'n_estimators': 1271, 'max_depth': None, 'min_samples_leaf': 7, 'min_samples_split': 59, 'max_features': 0.2508756255479758, 'max_samples': 0.5356389898134317, 'criterion': 'log_loss', 'class_weight': None}. Best is trial 234 with value: 1.0473222925367989.
[I 2026-02-26 11:21:36,613] Trial 461 pruned. 
[I 2026-02-26 11:21:42,103] Trial 462 finished with value: 1.0488748619075658 and parameters: {'n_estimators': 1311, 'max_depth': None, 'min_samples_leaf': 8, 'min_samples_split': 56, 'max_features': 0.24889079877322298, 'max_samples': 0.5468265700364485, 'criterion': 'entropy', 'class_weight': None}. Best is trial 234 with value: 1.0473222925367989.
[I 2026-02-26 11:21:47,052] Trial 463 pruned. 
[I 2026-02-26 11:21:49,101] Trial 464 pruned. 
[I 2026-02-26 11:21:54,690] Trial 465 pruned. 
[I 2026-02-26 11:22:00,972] Trial 466 finished with value: 1.0478803964836756 and parameters: {'n_estimators': 1466, 'max_depth': 12, 'min_samples_leaf': 8, 'min_samples_split': 50, 'max_features': 0.26803357281127194, 'max_samples': 0.5426239695727195, 'criterion': 'log_loss', 'class_weight': None}. Best is trial 234 with value: 1.0473222925367989.
[I 2026-02-26 11:22:06,830] Trial 467 pruned. 
[I 2026-02-26 11:22:11,602] Trial 468 pruned. 
[I 2026-02-26 11:22:17,383] Trial 469 finished with value: 1.0480971211149424 and parameters: {'n_estimators': 1396, 'max_depth': None, 'min_samples_leaf': 9, 'min_samples_split': 51, 'max_features': 0.27002915483453427, 'max_samples': 0.5421971523165484, 'criterion': 'entropy', 'class_weight': None}. Best is trial 234 with value: 1.0473222925367989.
[I 2026-02-26 11:22:23,211] Trial 470 finished with value: 1.04965250551044 and parameters: {'n_estimators': 1404, 'max_depth': None, 'min_samples_leaf': 9, 'min_samples_split': 52, 'max_features': 0.2750733042044563, 'max_samples': 0.5382146155510922, 'criterion': 'log_loss', 'class_weight': None}. Best is trial 234 with value: 1.0473222925367989.
[I 2026-02-26 11:22:28,918] Trial 471 pruned. 
[I 2026-02-26 11:22:34,710] Trial 472 finished with value: 1.0486489538437243 and parameters: {'n_estimators': 1368, 'max_depth': None, 'min_samples_leaf': 9, 'min_samples_split': 51, 'max_features': 0.2930748977581621, 'max_samples': 0.5148615209231524, 'criterion': 'log_loss', 'class_weight': None}. Best is trial 234 with value: 1.0473222925367989.
[I 2026-02-26 11:22:40,452] Trial 473 pruned. 
[I 2026-02-26 11:22:46,068] Trial 474 pruned. 
