[I 2026-02-26 11:49:22,440] Trial 794 pruned. 
[I 2026-02-26 11:49:29,974] Trial 795 pruned. 
[I 2026-02-26 11:49:37,665] Trial 796 pruned. 
[I 2026-02-26 11:49:42,320] Trial 797 pruned. 
[I 2026-02-26 11:49:46,398] Trial 798 pruned. 
[I 2026-02-26 11:49:51,155] Trial 799 pruned. 
[I 2026-02-26 11:49:57,541] Trial 800 pruned. 
[I 2026-02-26 11:50:02,106] Trial 801 pruned. 
[I 2026-02-26 11:50:07,225] Trial 802 pruned. 
[I 2026-02-26 11:50:13,139] Trial 803 pruned. 
[I 2026-02-26 11:50:22,033] Trial 804 pruned. 
[I 2026-02-26 11:50:27,681] Trial 805 pruned. 
{
  "study": "stage2_multiclass_rf",
  "optimised_objective": "logloss",
  "best_value_logloss_mean": 1.0472202813157694,
  "best_params": {
    "n_estimators": 1155,
    "max_depth": 26,
    "min_samples_leaf": 8,
    "min_samples_split": 56,
    "max_features": 0.2233022065043174,
    "max_samples": 0.5240069195243422,
    "criterion": "gini",
    "class_weight": null
  },
  "n_trials": 806,
  "n_splits": 5,
  "holdout_race_ids_excluded": [
    2,
    24,
    53,
    73,
    75
  ],
  "sample_frac": 1.0,
  "max_races": 80,
  "early_stopping_rounds": 50
}
{
  "study": "stage2_multiclass_rf",
  "task": "multiclass",
  "model": "rf",
  "metrics": {
    "accuracy_mean": 0.5561303488426438,
    "accuracy_std": 0.08284942900754344,
    "precision_macro_mean": 0.46656283335685844,
    "precision_macro_std": 0.11706449718613196,
    "recall_macro_mean": 0.4734179248538387,
    "recall_macro_std": 0.1406415994725994,
    "f1_macro_mean": 0.45164883579938825,
    "f1_macro_std": 0.11587641181293228,
    "logloss_mean": 1.0472202813157692,
    "logloss_std": 0.10039737405832769
  }
}
Job finished at Thu 26 Feb 11:50:32 GMT 2026
