[I 2026-02-26 11:22:51,630] Trial 475 pruned. 
[I 2026-02-26 11:22:57,576] Trial 476 pruned. 
[I 2026-02-26 11:23:03,695] Trial 477 pruned. 
[I 2026-02-26 11:23:09,025] Trial 478 pruned. 
[I 2026-02-26 11:23:14,068] Trial 479 pruned. 
[I 2026-02-26 11:23:20,075] Trial 480 finished with value: 1.0494730979808307 and parameters: {'n_estimators': 1465, 'max_depth': 16, 'min_samples_leaf': 9, 'min_samples_split': 53, 'max_features': 0.25483915311433597, 'max_samples': 0.5531641871193542, 'criterion': 'log_loss', 'class_weight': None}. Best is trial 234 with value: 1.0473222925367989.
[I 2026-02-26 11:23:25,713] Trial 481 pruned. 
[I 2026-02-26 11:23:31,504] Trial 482 pruned. 
[I 2026-02-26 11:23:37,346] Trial 483 pruned. 
[I 2026-02-26 11:23:42,534] Trial 484 pruned. 
[I 2026-02-26 11:23:47,986] Trial 485 pruned. 
[I 2026-02-26 11:23:52,837] Trial 486 pruned. 
[I 2026-02-26 11:23:58,899] Trial 487 pruned. 
[I 2026-02-26 11:24:03,907] Trial 488 pruned. 
[I 2026-02-26 11:24:08,630] Trial 489 pruned. 
[I 2026-02-26 11:24:14,269] Trial 490 pruned. 
[I 2026-02-26 11:24:19,224] Trial 491 pruned. 
[I 2026-02-26 11:24:25,275] Trial 492 pruned. 
[I 2026-02-26 11:24:28,866] Trial 493 pruned. 
[I 2026-02-26 11:24:34,154] Trial 494 pruned. 
[I 2026-02-26 11:24:39,945] Trial 495 pruned. 
[I 2026-02-26 11:24:42,592] Trial 496 pruned. 
[I 2026-02-26 11:24:46,258] Trial 497 pruned. 
[I 2026-02-26 11:24:52,067] Trial 498 pruned. 
[I 2026-02-26 11:24:57,222] Trial 499 pruned. 
[I 2026-02-26 11:25:02,049] Trial 500 finished with value: 1.0485676022807013 and parameters: {'n_estimators': 1132, 'max_depth': None, 'min_samples_leaf': 8, 'min_samples_split': 54, 'max_features': 0.28063886407043415, 'max_samples': 0.5002967246670215, 'criterion': 'entropy', 'class_weight': None}. Best is trial 234 with value: 1.0473222925367989.
[I 2026-02-26 11:25:06,768] Trial 501 pruned. 
[I 2026-02-26 11:25:11,545] Trial 502 pruned. 
[I 2026-02-26 11:25:15,742] Trial 503 pruned. 
[I 2026-02-26 11:25:20,089] Trial 504 pruned. 
[I 2026-02-26 11:25:21,910] Trial 505 pruned. 
[I 2026-02-26 11:25:26,814] Trial 506 pruned. 
[I 2026-02-26 11:25:31,344] Trial 507 finished with value: 1.0491012588375548 and parameters: {'n_estimators': 1081, 'max_depth': 12, 'min_samples_leaf': 8, 'min_samples_split': 56, 'max_features': 0.24157583408183456, 'max_samples': 0.545699431099149, 'criterion': 'entropy', 'class_weight': None}. Best is trial 234 with value: 1.0473222925367989.
[I 2026-02-26 11:25:35,658] Trial 508 pruned. 
[I 2026-02-26 11:25:40,566] Trial 509 pruned. 
[I 2026-02-26 11:25:45,246] Trial 510 pruned. 
[I 2026-02-26 11:25:49,796] Trial 511 pruned. 
[I 2026-02-26 11:25:55,113] Trial 512 finished with value: 1.0496295947917529 and parameters: {'n_estimators': 1217, 'max_depth': None, 'min_samples_leaf': 8, 'min_samples_split': 53, 'max_features': 0.26732015873874765, 'max_samples': 0.5227565907032568, 'criterion': 'entropy', 'class_weight': None}. Best is trial 234 with value: 1.0473222925367989.
[I 2026-02-26 11:26:01,333] Trial 513 pruned. 
[I 2026-02-26 11:26:05,703] Trial 514 pruned. 
[I 2026-02-26 11:26:09,566] Trial 515 pruned. 
[I 2026-02-26 11:26:12,718] Trial 516 pruned. 
[I 2026-02-26 11:26:19,298] Trial 517 finished with value: 1.0489918679562156 and parameters: {'n_estimators': 1613, 'max_depth': 16, 'min_samples_leaf': 8, 'min_samples_split': 50, 'max_features': 0.2560442216747085, 'max_samples': 0.5096036819110356, 'criterion': 'entropy', 'class_weight': None}. Best is trial 234 with value: 1.0473222925367989.
[I 2026-02-26 11:26:24,579] Trial 518 pruned. 
[I 2026-02-26 11:26:29,522] Trial 519 finished with value: 1.049561496706691 and parameters: {'n_estimators': 1178, 'max_depth': 12, 'min_samples_leaf': 8, 'min_samples_split': 55, 'max_features': 0.236713801505591, 'max_samples': 0.5323177848135131, 'criterion': 'entropy', 'class_weight': None}. Best is trial 234 with value: 1.0473222925367989.
[I 2026-02-26 11:26:34,093] Trial 520 pruned. 
[I 2026-02-26 11:26:40,369] Trial 521 pruned. 
[I 2026-02-26 11:26:44,949] Trial 522 pruned. 
[I 2026-02-26 11:26:50,940] Trial 523 pruned. 
[I 2026-02-26 11:26:55,903] Trial 524 pruned. 
[I 2026-02-26 11:27:02,322] Trial 525 finished with value: 1.0490585451724872 and parameters: {'n_estimators': 1562, 'max_depth': 12, 'min_samples_leaf': 8, 'min_samples_split': 56, 'max_features': 0.3251001854656064, 'max_samples': 0.5083515736905164, 'criterion': 'entropy', 'class_weight': None}. Best is trial 234 with value: 1.0473222925367989.
[I 2026-02-26 11:27:06,948] Trial 526 pruned. 
[I 2026-02-26 11:27:11,042] Trial 527 pruned. 
[I 2026-02-26 11:27:16,113] Trial 528 pruned. 
[I 2026-02-26 11:27:21,132] Trial 529 pruned. 
[I 2026-02-26 11:27:25,435] Trial 530 pruned. 
[I 2026-02-26 11:27:30,308] Trial 531 finished with value: 1.0483271844531024 and parameters: {'n_estimators': 1178, 'max_depth': 26, 'min_samples_leaf': 8, 'min_samples_split': 54, 'max_features': 0.25288728218092593, 'max_samples': 0.5370824241318239, 'criterion': 'gini', 'class_weight': None}. Best is trial 234 with value: 1.0473222925367989.
[I 2026-02-26 11:27:35,290] Trial 532 pruned. 
[I 2026-02-26 11:27:40,408] Trial 533 pruned. 
[I 2026-02-26 11:27:47,007] Trial 534 pruned. 
[I 2026-02-26 11:27:54,318] Trial 535 pruned. 
[I 2026-02-26 11:27:59,376] Trial 536 pruned. 
[I 2026-02-26 11:28:06,977] Trial 537 pruned. 
[I 2026-02-26 11:28:11,745] Trial 538 finished with value: 1.0472202813157694 and parameters: {'n_estimators': 1155, 'max_depth': 26, 'min_samples_leaf': 8, 'min_samples_split': 56, 'max_features': 0.2233022065043174, 'max_samples': 0.5240069195243422, 'criterion': 'gini', 'class_weight': None}. Best is trial 538 with value: 1.0472202813157694.
[I 2026-02-26 11:28:17,893] Trial 539 pruned. 
[I 2026-02-26 11:28:23,213] Trial 540 pruned. 
[I 2026-02-26 11:28:25,518] Trial 541 pruned. 
[I 2026-02-26 11:28:30,289] Trial 542 pruned. 
[I 2026-02-26 11:28:36,824] Trial 543 pruned. 
[I 2026-02-26 11:28:42,683] Trial 544 pruned. 
[I 2026-02-26 11:28:47,732] Trial 545 pruned. 
[I 2026-02-26 11:28:53,458] Trial 546 pruned. 
[I 2026-02-26 11:28:58,748] Trial 547 pruned. 
[I 2026-02-26 11:29:03,611] Trial 548 finished with value: 1.0494240357453162 and parameters: {'n_estimators': 1177, 'max_depth': 26, 'min_samples_leaf': 8, 'min_samples_split': 56, 'max_features': 0.25461653799559625, 'max_samples': 0.5094991697632215, 'criterion': 'gini', 'class_weight': None}. Best is trial 538 with value: 1.0472202813157694.
[I 2026-02-26 11:29:09,567] Trial 549 pruned. 
[I 2026-02-26 11:29:15,742] Trial 550 pruned. 
[I 2026-02-26 11:29:20,861] Trial 551 pruned. 
[I 2026-02-26 11:29:26,394] Trial 552 pruned. 
[I 2026-02-26 11:29:29,206] Trial 553 pruned. 
[I 2026-02-26 11:29:32,755] Trial 554 pruned. 
[I 2026-02-26 11:29:38,625] Trial 555 pruned. 
[I 2026-02-26 11:29:45,946] Trial 556 pruned. 
[I 2026-02-26 11:29:50,705] Trial 557 pruned. 
[I 2026-02-26 11:29:56,704] Trial 558 pruned. 
[I 2026-02-26 11:30:06,405] Trial 559 pruned. 
[I 2026-02-26 11:30:13,016] Trial 560 pruned. 
[I 2026-02-26 11:30:18,032] Trial 561 pruned. 
[I 2026-02-26 11:30:23,167] Trial 562 pruned. 
[I 2026-02-26 11:30:27,527] Trial 563 pruned. 
[I 2026-02-26 11:30:33,433] Trial 564 pruned. 
[I 2026-02-26 11:30:38,163] Trial 565 pruned. 
[I 2026-02-26 11:30:44,649] Trial 566 pruned. 
[I 2026-02-26 11:30:51,035] Trial 567 pruned. 
[I 2026-02-26 11:30:56,635] Trial 568 pruned. 
[I 2026-02-26 11:31:02,170] Trial 569 pruned. 
[I 2026-02-26 11:31:07,145] Trial 570 pruned. 
[I 2026-02-26 11:31:10,584] Trial 571 pruned. 
[I 2026-02-26 11:31:15,056] Trial 572 pruned. 
[I 2026-02-26 11:31:24,820] Trial 573 pruned. 
[I 2026-02-26 11:31:30,616] Trial 574 pruned. 
[I 2026-02-26 11:31:35,686] Trial 575 finished with value: 1.0492297207973913 and parameters: {'n_estimators': 1166, 'max_depth': None, 'min_samples_leaf': 8, 'min_samples_split': 54, 'max_features': 0.24583716132638797, 'max_samples': 0.5619159454554445, 'criterion': 'log_loss', 'class_weight': None}. Best is trial 538 with value: 1.0472202813157694.
[I 2026-02-26 11:31:42,527] Trial 576 pruned. 
[I 2026-02-26 11:31:48,588] Trial 577 pruned. 
[I 2026-02-26 11:31:52,386] Trial 578 pruned. 
[I 2026-02-26 11:31:54,541] Trial 579 pruned. 
[I 2026-02-26 11:32:00,002] Trial 580 pruned. 
[I 2026-02-26 11:32:05,420] Trial 581 pruned. 
[I 2026-02-26 11:32:11,390] Trial 582 pruned. 
[I 2026-02-26 11:32:16,131] Trial 583 pruned. 
[I 2026-02-26 11:32:22,631] Trial 584 pruned. 
[I 2026-02-26 11:32:28,372] Trial 585 pruned. 
[I 2026-02-26 11:32:32,664] Trial 586 pruned. 
[I 2026-02-26 11:32:37,612] Trial 587 pruned. 
[I 2026-02-26 11:32:42,339] Trial 588 pruned. 
[I 2026-02-26 11:32:47,554] Trial 589 pruned. 
[I 2026-02-26 11:32:49,499] Trial 590 pruned. 
[I 2026-02-26 11:32:53,663] Trial 591 pruned. 
[I 2026-02-26 11:32:58,119] Trial 592 pruned. 
[I 2026-02-26 11:33:03,673] Trial 593 pruned. 
[I 2026-02-26 11:33:09,952] Trial 594 pruned. 
[I 2026-02-26 11:33:15,567] Trial 595 pruned. 
[I 2026-02-26 11:33:20,765] Trial 596 pruned. 
[I 2026-02-26 11:33:25,259] Trial 597 pruned. 
[I 2026-02-26 11:33:30,055] Trial 598 pruned. 
[I 2026-02-26 11:33:34,818] Trial 599 pruned. 
[I 2026-02-26 11:33:43,606] Trial 600 pruned. 
[I 2026-02-26 11:33:48,741] Trial 601 pruned. 
[I 2026-02-26 11:33:52,921] Trial 602 pruned. 
[I 2026-02-26 11:33:55,620] Trial 603 pruned. 
[I 2026-02-26 11:34:01,540] Trial 604 pruned. 
[I 2026-02-26 11:34:07,115] Trial 605 finished with value: 1.0484612864345473 and parameters: {'n_estimators': 1453, 'max_depth': 16, 'min_samples_leaf': 8, 'min_samples_split': 53, 'max_features': 0.2834476520743084, 'max_samples': 0.5117861252868775, 'criterion': 'log_loss', 'class_weight': None}. Best is trial 538 with value: 1.0472202813157694.
[I 2026-02-26 11:34:12,976] Trial 606 pruned. 
[I 2026-02-26 11:34:19,222] Trial 607 pruned. 
[I 2026-02-26 11:34:25,548] Trial 608 pruned. 
[I 2026-02-26 11:34:31,750] Trial 609 pruned. 
[I 2026-02-26 11:34:37,551] Trial 610 pruned. 
[I 2026-02-26 11:34:43,417] Trial 611 finished with value: 1.0488803125479937 and parameters: {'n_estimators': 1412, 'max_depth': 16, 'min_samples_leaf': 9, 'min_samples_split': 53, 'max_features': 0.27461191293663273, 'max_samples': 0.564869016901205, 'criterion': 'log_loss', 'class_weight': None}. Best is trial 538 with value: 1.0472202813157694.
[I 2026-02-26 11:34:50,600] Trial 612 pruned. 
[I 2026-02-26 11:34:57,619] Trial 613 pruned. 
[I 2026-02-26 11:35:03,566] Trial 614 pruned. 
[I 2026-02-26 11:35:09,858] Trial 615 pruned. 
[I 2026-02-26 11:35:15,131] Trial 616 pruned. 
[I 2026-02-26 11:35:20,857] Trial 617 pruned. 
[I 2026-02-26 11:35:25,995] Trial 618 pruned. 
[I 2026-02-26 11:35:29,651] Trial 619 pruned. 
[I 2026-02-26 11:35:35,785] Trial 620 pruned. 
[I 2026-02-26 11:35:41,092] Trial 621 pruned. 
[I 2026-02-26 11:35:48,646] Trial 622 pruned. 
[I 2026-02-26 11:35:50,877] Trial 623 pruned. 
[I 2026-02-26 11:35:55,651] Trial 624 pruned. 
[I 2026-02-26 11:36:01,469] Trial 625 pruned. 
[I 2026-02-26 11:36:04,792] Trial 626 pruned. 
[I 2026-02-26 11:36:09,878] Trial 627 pruned. 
[I 2026-02-26 11:36:16,026] Trial 628 pruned. 
[I 2026-02-26 11:36:20,767] Trial 629 pruned. 
[I 2026-02-26 11:36:26,416] Trial 630 pruned. 
[I 2026-02-26 11:36:31,669] Trial 631 pruned. 
[I 2026-02-26 11:36:37,055] Trial 632 pruned. 
[I 2026-02-26 11:36:38,602] Trial 633 finished with value: 1.0479013135178177 and parameters: {'n_estimators': 339, 'max_depth': 16, 'min_samples_leaf': 8, 'min_samples_split': 54, 'max_features': 0.23042041276547, 'max_samples': 0.5308605899805758, 'criterion': 'log_loss', 'class_weight': None}. Best is trial 538 with value: 1.0472202813157694.
[I 2026-02-26 11:36:40,124] Trial 634 pruned. 
[I 2026-02-26 11:36:42,125] Trial 635 pruned. 
[I 2026-02-26 11:36:44,083] Trial 636 pruned. 
[I 2026-02-26 11:36:47,101] Trial 637 pruned. 
[I 2026-02-26 11:36:48,506] Trial 638 pruned. 
[I 2026-02-26 11:36:52,149] Trial 639 pruned. 
[I 2026-02-26 11:36:54,237] Trial 640 pruned. 
[I 2026-02-26 11:36:55,856] Trial 641 pruned. 
[I 2026-02-26 11:36:57,457] Trial 642 pruned. 
[I 2026-02-26 11:36:58,883] Trial 643 pruned. 
[I 2026-02-26 11:37:03,395] Trial 644 pruned. 
[I 2026-02-26 11:37:04,842] Trial 645 pruned. 
[I 2026-02-26 11:37:06,551] Trial 646 pruned. 
[I 2026-02-26 11:37:08,959] Trial 647 pruned. 
[I 2026-02-26 11:37:10,744] Trial 648 pruned. 
[I 2026-02-26 11:37:12,103] Trial 649 pruned. 
[I 2026-02-26 11:37:18,290] Trial 650 pruned. 
[I 2026-02-26 11:37:22,675] Trial 651 pruned. 
[I 2026-02-26 11:37:30,286] Trial 652 pruned. 
[I 2026-02-26 11:37:33,304] Trial 653 pruned. 
[I 2026-02-26 11:37:38,170] Trial 654 pruned. 
[I 2026-02-26 11:37:42,783] Trial 655 pruned. 
[I 2026-02-26 11:37:46,705] Trial 656 pruned. 
[I 2026-02-26 11:37:51,349] Trial 657 pruned. 
[I 2026-02-26 11:37:55,454] Trial 658 pruned. 
[I 2026-02-26 11:37:58,975] Trial 659 pruned. 
[I 2026-02-26 11:38:02,323] Trial 660 pruned. 
[I 2026-02-26 11:38:07,172] Trial 661 pruned. 
[I 2026-02-26 11:38:12,851] Trial 662 finished with value: 1.0488600416046823 and parameters: {'n_estimators': 1552, 'max_depth': 12, 'min_samples_leaf': 8, 'min_samples_split': 56, 'max_features': 0.25131973770426025, 'max_samples': 0.5430024871003443, 'criterion': 'entropy', 'class_weight': None}. Best is trial 538 with value: 1.0472202813157694.
[I 2026-02-26 11:38:17,132] Trial 663 pruned. 
[I 2026-02-26 11:38:22,013] Trial 664 pruned. 
[I 2026-02-26 11:38:26,492] Trial 665 pruned. 
[I 2026-02-26 11:38:28,701] Trial 666 pruned. 
[I 2026-02-26 11:38:37,369] Trial 667 pruned. 
[I 2026-02-26 11:38:38,895] Trial 668 pruned. 
[I 2026-02-26 11:38:44,836] Trial 669 pruned. 
[I 2026-02-26 11:38:48,877] Trial 670 pruned. 
[I 2026-02-26 11:38:53,145] Trial 671 pruned. 
[I 2026-02-26 11:38:57,634] Trial 672 pruned. 
[I 2026-02-26 11:39:03,723] Trial 673 pruned. 
[I 2026-02-26 11:39:09,187] Trial 674 pruned. 
[I 2026-02-26 11:39:12,072] Trial 675 pruned. 
[I 2026-02-26 11:39:17,870] Trial 676 pruned. 
[I 2026-02-26 11:39:22,834] Trial 677 pruned. 
[I 2026-02-26 11:39:28,352] Trial 678 pruned. 
[I 2026-02-26 11:39:32,594] Trial 679 pruned. 
[I 2026-02-26 11:39:36,977] Trial 680 pruned. 
[I 2026-02-26 11:39:41,747] Trial 681 finished with value: 1.0487732368074223 and parameters: {'n_estimators': 1252, 'max_depth': None, 'min_samples_leaf': 8, 'min_samples_split': 54, 'max_features': 0.23993397743570818, 'max_samples': 0.5431088893120347, 'criterion': 'entropy', 'class_weight': None}. Best is trial 538 with value: 1.0472202813157694.
[I 2026-02-26 11:39:46,886] Trial 682 pruned. 
[I 2026-02-26 11:39:52,110] Trial 683 pruned. 
[I 2026-02-26 11:39:57,695] Trial 684 pruned. 
[I 2026-02-26 11:40:01,907] Trial 685 pruned. 
[I 2026-02-26 11:40:07,322] Trial 686 pruned. 
[I 2026-02-26 11:40:14,231] Trial 687 pruned. 
[I 2026-02-26 11:40:17,848] Trial 688 pruned. 
[I 2026-02-26 11:40:21,155] Trial 689 pruned. 
[I 2026-02-26 11:40:23,249] Trial 690 pruned. 
[I 2026-02-26 11:40:31,667] Trial 691 pruned. 
[I 2026-02-26 11:40:36,059] Trial 692 pruned. 
[I 2026-02-26 11:40:40,005] Trial 693 pruned. 
[I 2026-02-26 11:40:44,574] Trial 694 pruned. 
[I 2026-02-26 11:40:49,340] Trial 695 pruned. 
[I 2026-02-26 11:40:55,092] Trial 696 pruned. 
[I 2026-02-26 11:41:01,221] Trial 697 pruned. 
[I 2026-02-26 11:41:06,544] Trial 698 pruned. 
[I 2026-02-26 11:41:12,082] Trial 699 pruned. 
[I 2026-02-26 11:41:16,337] Trial 700 pruned. 
[I 2026-02-26 11:41:21,735] Trial 701 pruned. 
[I 2026-02-26 11:41:26,618] Trial 702 pruned. 
[I 2026-02-26 11:41:29,569] Trial 703 pruned. 
[I 2026-02-26 11:41:33,520] Trial 704 pruned. 
[I 2026-02-26 11:41:35,362] Trial 705 pruned. 
[I 2026-02-26 11:41:36,902] Trial 706 pruned. 
[I 2026-02-26 11:41:40,243] Trial 707 pruned. 
[I 2026-02-26 11:41:45,593] Trial 708 pruned. 
[I 2026-02-26 11:41:50,190] Trial 709 pruned. 
[I 2026-02-26 11:41:54,951] Trial 710 pruned. 
[I 2026-02-26 11:42:00,982] Trial 711 pruned. 
[I 2026-02-26 11:42:07,179] Trial 712 pruned. 
[I 2026-02-26 11:42:11,595] Trial 713 finished with value: 1.0487003633930876 and parameters: {'n_estimators': 1158, 'max_depth': None, 'min_samples_leaf': 7, 'min_samples_split': 54, 'max_features': 0.25683542977513585, 'max_samples': 0.5515093580860065, 'criterion': 'entropy', 'class_weight': None}. Best is trial 538 with value: 1.0472202813157694.
[I 2026-02-26 11:42:15,646] Trial 714 pruned. 
[I 2026-02-26 11:42:21,469] Trial 715 pruned. 
[I 2026-02-26 11:42:26,006] Trial 716 pruned. 
[I 2026-02-26 11:42:34,801] Trial 717 pruned. 
[I 2026-02-26 11:42:39,902] Trial 718 pruned. 
[I 2026-02-26 11:42:45,328] Trial 719 pruned. 
[I 2026-02-26 11:42:50,346] Trial 720 finished with value: 1.0491097274594765 and parameters: {'n_estimators': 1346, 'max_depth': None, 'min_samples_leaf': 9, 'min_samples_split': 53, 'max_features': 0.2641209957772929, 'max_samples': 0.515868445720132, 'criterion': 'log_loss', 'class_weight': None}. Best is trial 538 with value: 1.0472202813157694.
[I 2026-02-26 11:42:55,947] Trial 721 pruned. 
[I 2026-02-26 11:43:04,845] Trial 722 pruned. 
[I 2026-02-26 11:43:09,532] Trial 723 pruned. 
[I 2026-02-26 11:43:14,070] Trial 724 finished with value: 1.0493836954505191 and parameters: {'n_estimators': 1193, 'max_depth': None, 'min_samples_leaf': 9, 'min_samples_split': 54, 'max_features': 0.2327528969723068, 'max_samples': 0.5289206233160736, 'criterion': 'log_loss', 'class_weight': None}. Best is trial 538 with value: 1.0472202813157694.
[I 2026-02-26 11:43:19,433] Trial 725 pruned. 
[I 2026-02-26 11:43:23,597] Trial 726 pruned. 
[I 2026-02-26 11:43:28,794] Trial 727 pruned. 
[I 2026-02-26 11:43:34,862] Trial 728 pruned. 
[I 2026-02-26 11:43:40,622] Trial 729 pruned. 
[I 2026-02-26 11:43:44,177] Trial 730 pruned. 
[I 2026-02-26 11:43:48,045] Trial 731 pruned. 
[I 2026-02-26 11:43:54,395] Trial 732 pruned. 
[I 2026-02-26 11:43:59,034] Trial 733 pruned. 
[I 2026-02-26 11:44:06,602] Trial 734 pruned. 
[I 2026-02-26 11:44:11,952] Trial 735 pruned. 
[I 2026-02-26 11:44:16,329] Trial 736 pruned. 
[I 2026-02-26 11:44:22,242] Trial 737 pruned. 
[I 2026-02-26 11:44:23,871] Trial 738 pruned. 
[I 2026-02-26 11:44:28,242] Trial 739 pruned. 
[I 2026-02-26 11:44:33,877] Trial 740 pruned. 
[I 2026-02-26 11:44:38,837] Trial 741 pruned. 
[I 2026-02-26 11:44:40,681] Trial 742 pruned. 
[I 2026-02-26 11:44:44,991] Trial 743 pruned. 
[I 2026-02-26 11:44:49,780] Trial 744 pruned. 
[I 2026-02-26 11:44:57,377] Trial 745 finished with value: 1.0489249448611497 and parameters: {'n_estimators': 2022, 'max_depth': None, 'min_samples_leaf': 8, 'min_samples_split': 53, 'max_features': 0.2642254487043611, 'max_samples': 0.530182679612583, 'criterion': 'entropy', 'class_weight': None}. Best is trial 538 with value: 1.0472202813157694.
[I 2026-02-26 11:45:01,072] Trial 746 pruned. 
[I 2026-02-26 11:45:06,279] Trial 747 pruned. 
[I 2026-02-26 11:45:12,008] Trial 748 pruned. 
[I 2026-02-26 11:45:14,786] Trial 749 pruned. 
[I 2026-02-26 11:45:19,364] Trial 750 pruned. 
[I 2026-02-26 11:45:24,975] Trial 751 pruned. 
[I 2026-02-26 11:45:30,331] Trial 752 pruned. 
[I 2026-02-26 11:45:34,773] Trial 753 finished with value: 1.0489458628844646 and parameters: {'n_estimators': 1195, 'max_depth': 26, 'min_samples_leaf': 8, 'min_samples_split': 54, 'max_features': 0.20930221806109262, 'max_samples': 0.5449926323469817, 'criterion': 'entropy', 'class_weight': None}. Best is trial 538 with value: 1.0472202813157694.
[I 2026-02-26 11:45:40,352] Trial 754 pruned. 
[I 2026-02-26 11:45:44,341] Trial 755 pruned. 
[I 2026-02-26 11:45:49,267] Trial 756 pruned. 
[I 2026-02-26 11:45:54,628] Trial 757 pruned. 
[I 2026-02-26 11:45:56,130] Trial 758 pruned. 
[I 2026-02-26 11:46:00,780] Trial 759 pruned. 
[I 2026-02-26 11:46:03,996] Trial 760 pruned. 
[I 2026-02-26 11:46:08,345] Trial 761 pruned. 
[I 2026-02-26 11:46:12,250] Trial 762 pruned. 
[I 2026-02-26 11:46:18,847] Trial 763 finished with value: 1.0475218118402476 and parameters: {'n_estimators': 1813, 'max_depth': None, 'min_samples_leaf': 8, 'min_samples_split': 52, 'max_features': 0.24997362707771106, 'max_samples': 0.5283566655468698, 'criterion': 'gini', 'class_weight': None}. Best is trial 538 with value: 1.0472202813157694.
[I 2026-02-26 11:46:25,653] Trial 764 pruned. 
[I 2026-02-26 11:46:32,810] Trial 765 pruned. 
[I 2026-02-26 11:46:38,750] Trial 766 pruned. 
[I 2026-02-26 11:46:45,247] Trial 767 pruned. 
[I 2026-02-26 11:46:52,302] Trial 768 pruned. 
[I 2026-02-26 11:46:57,662] Trial 769 pruned. 
[I 2026-02-26 11:47:04,024] Trial 770 pruned. 
[I 2026-02-26 11:47:10,712] Trial 771 pruned. 
[I 2026-02-26 11:47:16,537] Trial 772 pruned. 
[I 2026-02-26 11:47:23,232] Trial 773 pruned. 
[I 2026-02-26 11:47:28,706] Trial 774 pruned. 
[I 2026-02-26 11:47:37,385] Trial 775 pruned. 
[I 2026-02-26 11:47:42,441] Trial 776 pruned. 
[I 2026-02-26 11:47:50,890] Trial 777 pruned. 
[I 2026-02-26 11:47:56,675] Trial 778 pruned. 
[I 2026-02-26 11:48:02,311] Trial 779 pruned. 
[I 2026-02-26 11:48:08,903] Trial 780 pruned. 
[I 2026-02-26 11:48:13,719] Trial 781 pruned. 
[I 2026-02-26 11:48:19,320] Trial 782 pruned. 
[I 2026-02-26 11:48:24,585] Trial 783 pruned. 
[I 2026-02-26 11:48:29,893] Trial 784 pruned. 
[I 2026-02-26 11:48:36,353] Trial 785 pruned. 
[I 2026-02-26 11:48:40,898] Trial 786 pruned. 
[I 2026-02-26 11:48:45,393] Trial 787 pruned. 
[I 2026-02-26 11:48:51,448] Trial 788 pruned. 
[I 2026-02-26 11:48:57,144] Trial 789 pruned. 
[I 2026-02-26 11:49:01,688] Trial 790 finished with value: 1.0492009061032401 and parameters: {'n_estimators': 1150, 'max_depth': None, 'min_samples_leaf': 9, 'min_samples_split': 53, 'max_features': 0.2933664304939902, 'max_samples': 0.5256126579506664, 'criterion': 'log_loss', 'class_weight': None}. Best is trial 538 with value: 1.0472202813157694.
[I 2026-02-26 11:49:06,870] Trial 791 pruned. 
[I 2026-02-26 11:49:12,373] Trial 792 pruned. 
[I 2026-02-26 11:49:17,073] Trial 793 pruned. 
