Job started on tiger-02 at Thu 26 Feb 11:10:57 GMT 2026
CPUs: 16  MEM: 64000
CMD: python -m src.utils.tune_8_optuna --stage2 --data_stage2 data/processed/output2.csv --task multiclass --model svm --n_splits 5 --max_races 80 --n_trials 250 --seed 42 --timeout_sec 170000 --outdir runs/tuning_8_final
[load_stage2_dataset] Dropped 36 rows with missing y_compound.
[I 2026-02-26 11:11:05,923] Trial 1 finished with value: 1.6432645749037615 and parameters: {'kernel': 'rbf', 'class_weight': None, 'C': 0.04207988669606638, 'gamma': 6.025215736203858e-05, 'calib_method': 'isotonic', 'calib_cv': 5}. Best is trial 1 with value: 1.6432645749037615.
[I 2026-02-26 11:11:07,009] Trial 2 finished with value: 1.4622309385493077 and parameters: {'kernel': 'rbf', 'class_weight': None, 'C': 0.053370327626039576, 'gamma': 8.260808399079601e-05, 'calib_method': 'isotonic', 'calib_cv': 3}. Best is trial 2 with value: 1.4622309385493077.
[I 2026-02-26 11:11:08,165] Trial 3 finished with value: 1.4289183665936693 and parameters: {'kernel': 'linear', 'class_weight': 'balanced', 'C': 0.19069966103000435, 'tol': 0.0013826232179369874, 'max_iter': 5594, 'calib_method': 'isotonic', 'calib_cv': 5}. Best is trial 3 with value: 1.4289183665936693.
[I 2026-02-26 11:11:13,703] Trial 4 finished with value: 1.23810390157611 and parameters: {'kernel': 'linear', 'class_weight': 'balanced', 'C': 11.015056790269638, 'tol': 1.6536937182824424e-05, 'max_iter': 3758, 'calib_method': 'sigmoid', 'calib_cv': 5}. Best is trial 4 with value: 1.23810390157611.
[I 2026-02-26 11:11:15,088] Trial 5 finished with value: 1.2740977492613035 and parameters: {'kernel': 'rbf', 'class_weight': 'balanced', 'C': 0.17654048052495078, 'gamma': 0.003984190594434687, 'calib_method': 'sigmoid', 'calib_cv': 3}. Best is trial 4 with value: 1.23810390157611.
[I 2026-02-26 11:11:15,488] Trial 6 finished with value: 1.3643025080575477 and parameters: {'kernel': 'linear', 'class_weight': 'balanced', 'C': 0.0027698899227562817, 'tol': 6.0803901902966035e-06, 'max_iter': 2814, 'calib_method': 'isotonic', 'calib_cv': 5}. Best is trial 4 with value: 1.23810390157611.
[I 2026-02-26 11:11:22,606] Trial 7 finished with value: 1.2379419310087891 and parameters: {'kernel': 'linear', 'class_weight': None, 'C': 10.25616274847308, 'tol': 1.987021538542864e-06, 'max_iter': 19764, 'calib_method': 'sigmoid', 'calib_cv': 5}. Best is trial 7 with value: 1.2379419310087891.
[I 2026-02-26 11:11:23,807] Trial 8 finished with value: 1.2277375689835734 and parameters: {'kernel': 'rbf', 'class_weight': None, 'C': 0.27155819552829413, 'gamma': 3.79616689580081e-05, 'calib_method': 'sigmoid', 'calib_cv': 3}. Best is trial 8 with value: 1.2277375689835734.
[I 2026-02-26 11:11:24,862] Trial 9 finished with value: 1.4357806212217004 and parameters: {'kernel': 'rbf', 'class_weight': None, 'C': 35.387588647792406, 'gamma': 0.002296543234463434, 'calib_method': 'isotonic', 'calib_cv': 3}. Best is trial 8 with value: 1.2277375689835734.
[I 2026-02-26 11:11:25,289] Trial 10 finished with value: 1.1668268196272777 and parameters: {'kernel': 'linear', 'class_weight': None, 'C': 0.001339971723117972, 'tol': 2.7012557725439094e-06, 'max_iter': 2565, 'calib_method': 'sigmoid', 'calib_cv': 5}. Best is trial 10 with value: 1.1668268196272777.
[I 2026-02-26 11:11:25,707] Trial 11 finished with value: 1.1693375107009976 and parameters: {'kernel': 'linear', 'class_weight': None, 'C': 0.0010907785690006102, 'tol': 0.0003624038247549049, 'max_iter': 12181, 'calib_method': 'sigmoid', 'calib_cv': 5}. Best is trial 10 with value: 1.1668268196272777.
[I 2026-02-26 11:11:26,211] Trial 12 finished with value: 1.1699297293213442 and parameters: {'kernel': 'linear', 'class_weight': None, 'C': 0.0010428435182166151, 'tol': 0.000489126677270306, 'max_iter': 12980, 'calib_method': 'sigmoid', 'calib_cv': 5}. Best is trial 10 with value: 1.1668268196272777.
[I 2026-02-26 11:11:26,656] Trial 13 finished with value: 1.1647651602639135 and parameters: {'kernel': 'linear', 'class_weight': None, 'C': 0.007395912886954799, 'tol': 0.009548617037703395, 'max_iter': 10944, 'calib_method': 'sigmoid', 'calib_cv': 5}. Best is trial 13 with value: 1.1647651602639135.
[I 2026-02-26 11:11:27,113] Trial 14 finished with value: 1.1689021317096948 and parameters: {'kernel': 'linear', 'class_weight': None, 'C': 0.010745497168558821, 'tol': 0.008641710001999729, 'max_iter': 8977, 'calib_method': 'sigmoid', 'calib_cv': 5}. Best is trial 13 with value: 1.1647651602639135.
[I 2026-02-26 11:11:27,616] Trial 15 finished with value: 1.167059093255681 and parameters: {'kernel': 'linear', 'class_weight': None, 'C': 0.009220226338493745, 'tol': 4.292547213342915e-05, 'max_iter': 16908, 'calib_method': 'sigmoid', 'calib_cv': 5}. Best is trial 13 with value: 1.1647651602639135.
[I 2026-02-26 11:11:28,211] Trial 16 finished with value: 1.1650557608214203 and parameters: {'kernel': 'linear', 'class_weight': None, 'C': 0.007614073830653058, 'tol': 0.009190514349421168, 'max_iter': 8493, 'calib_method': 'sigmoid', 'calib_cv': 5}. Best is trial 13 with value: 1.1647651602639135.
[I 2026-02-26 11:11:28,773] Trial 17 finished with value: 1.1679269728188513 and parameters: {'kernel': 'linear', 'class_weight': None, 'C': 0.009904734163365915, 'tol': 0.009342405156686955, 'max_iter': 7937, 'calib_method': 'sigmoid', 'calib_cv': 5}. Best is trial 13 with value: 1.1647651602639135.
[I 2026-02-26 11:11:31,046] Trial 18 pruned. 
[I 2026-02-26 11:11:32,244] Trial 19 pruned. 
[I 2026-02-26 11:11:32,757] Trial 20 pruned. 
[I 2026-02-26 11:11:33,177] Trial 21 finished with value: 1.161288185108516 and parameters: {'kernel': 'linear', 'class_weight': None, 'C': 0.0029847018146340783, 'tol': 0.0009100234347247846, 'max_iter': 10840, 'calib_method': 'sigmoid', 'calib_cv': 5}. Best is trial 21 with value: 1.161288185108516.
[I 2026-02-26 11:11:33,634] Trial 22 finished with value: 1.1612479267991636 and parameters: {'kernel': 'linear', 'class_weight': None, 'C': 0.004149364539862382, 'tol': 0.0037179009590030225, 'max_iter': 10089, 'calib_method': 'sigmoid', 'calib_cv': 5}. Best is trial 22 with value: 1.1612479267991636.
[I 2026-02-26 11:11:34,080] Trial 23 finished with value: 1.1611250667654507 and parameters: {'kernel': 'linear', 'class_weight': None, 'C': 0.003479336387787658, 'tol': 0.0010675223741567115, 'max_iter': 10999, 'calib_method': 'sigmoid', 'calib_cv': 5}. Best is trial 23 with value: 1.1611250667654507.
[I 2026-02-26 11:11:34,584] Trial 24 finished with value: 1.1612361255454462 and parameters: {'kernel': 'linear', 'class_weight': None, 'C': 0.003074194099613775, 'tol': 0.0008450763666354556, 'max_iter': 13628, 'calib_method': 'sigmoid', 'calib_cv': 5}. Best is trial 23 with value: 1.1611250667654507.
[I 2026-02-26 11:11:35,016] Trial 25 finished with value: 1.1611943375171596 and parameters: {'kernel': 'linear', 'class_weight': None, 'C': 0.00316197992324567, 'tol': 7.60532000432085e-05, 'max_iter': 15087, 'calib_method': 'sigmoid', 'calib_cv': 5}. Best is trial 23 with value: 1.1611250667654507.
[I 2026-02-26 11:11:35,475] Trial 26 finished with value: 1.1613557790090834 and parameters: {'kernel': 'linear', 'class_weight': None, 'C': 0.0028933451728162854, 'tol': 9.077719261585464e-05, 'max_iter': 15107, 'calib_method': 'sigmoid', 'calib_cv': 5}. Best is trial 23 with value: 1.1611250667654507.
[I 2026-02-26 11:11:36,840] Trial 27 pruned. 
[I 2026-02-26 11:11:37,376] Trial 28 pruned. 
[I 2026-02-26 11:11:38,210] Trial 29 pruned. 
[I 2026-02-26 11:11:40,690] Trial 30 pruned. 
[I 2026-02-26 11:11:43,398] Trial 31 pruned. 
[I 2026-02-26 11:11:43,798] Trial 32 finished with value: 1.1611775075150088 and parameters: {'kernel': 'linear', 'class_weight': None, 'C': 0.0038796886816621335, 'tol': 0.003232325702368217, 'max_iter': 12035, 'calib_method': 'sigmoid', 'calib_cv': 5}. Best is trial 23 with value: 1.1611250667654507.
[I 2026-02-26 11:11:44,184] Trial 33 finished with value: 1.163084181762469 and parameters: {'kernel': 'linear', 'class_weight': None, 'C': 0.002005451147653505, 'tol': 0.001412575119462864, 'max_iter': 11884, 'calib_method': 'sigmoid', 'calib_cv': 5}. Best is trial 23 with value: 1.1611250667654507.
[I 2026-02-26 11:11:44,593] Trial 34 finished with value: 1.1616487112413274 and parameters: {'kernel': 'linear', 'class_weight': None, 'C': 0.004741482901937035, 'tol': 0.0001482869717141767, 'max_iter': 13753, 'calib_method': 'sigmoid', 'calib_cv': 5}. Best is trial 23 with value: 1.1611250667654507.
[I 2026-02-26 11:11:45,068] Trial 35 pruned. 
[I 2026-02-26 11:11:46,426] Trial 36 pruned. 
[I 2026-02-26 11:11:46,830] Trial 37 finished with value: 1.161893544502671 and parameters: {'kernel': 'linear', 'class_weight': None, 'C': 0.004988742336799623, 'tol': 0.003615063425169337, 'max_iter': 12484, 'calib_method': 'sigmoid', 'calib_cv': 5}. Best is trial 23 with value: 1.1611250667654507.
[I 2026-02-26 11:11:47,837] Trial 38 pruned. 
[I 2026-02-26 11:11:48,183] Trial 39 finished with value: 1.150494092666484 and parameters: {'kernel': 'linear', 'class_weight': None, 'C': 0.001955116882910721, 'tol': 0.0013622084992200721, 'max_iter': 13986, 'calib_method': 'sigmoid', 'calib_cv': 3}. Best is trial 39 with value: 1.150494092666484.
[I 2026-02-26 11:11:49,524] Trial 40 pruned. 
[I 2026-02-26 11:11:49,830] Trial 41 finished with value: 1.352190701579648 and parameters: {'kernel': 'linear', 'class_weight': None, 'C': 0.001801493621209157, 'tol': 0.0017163718393650358, 'max_iter': 14840, 'calib_method': 'isotonic', 'calib_cv': 3}. Best is trial 39 with value: 1.150494092666484.
[I 2026-02-26 11:11:50,162] Trial 42 finished with value: 1.1483792117267584 and parameters: {'kernel': 'linear', 'class_weight': None, 'C': 0.0027579716228857275, 'tol': 0.0008942978515543303, 'max_iter': 13801, 'calib_method': 'sigmoid', 'calib_cv': 3}. Best is trial 42 with value: 1.1483792117267584.
[I 2026-02-26 11:11:50,502] Trial 43 finished with value: 1.1512840047834065 and parameters: {'kernel': 'linear', 'class_weight': None, 'C': 0.0018130852029934223, 'tol': 0.004548302137444393, 'max_iter': 11800, 'calib_method': 'sigmoid', 'calib_cv': 3}. Best is trial 42 with value: 1.1483792117267584.
[I 2026-02-26 11:11:50,831] Trial 44 finished with value: 1.1524020353922353 and parameters: {'kernel': 'linear', 'class_weight': None, 'C': 0.0016538288141923281, 'tol': 0.004876422907994433, 'max_iter': 11640, 'calib_method': 'sigmoid', 'calib_cv': 3}. Best is trial 42 with value: 1.1483792117267584.
[I 2026-02-26 11:11:51,160] Trial 45 finished with value: 1.1494323006660256 and parameters: {'kernel': 'linear', 'class_weight': None, 'C': 0.0022169380041035303, 'tol': 0.00484555248448766, 'max_iter': 9680, 'calib_method': 'sigmoid', 'calib_cv': 3}. Best is trial 42 with value: 1.1483792117267584.
[I 2026-02-26 11:11:51,508] Trial 46 finished with value: 1.153549057528896 and parameters: {'kernel': 'linear', 'class_weight': None, 'C': 0.0015216817663398633, 'tol': 0.004084195666416769, 'max_iter': 5525, 'calib_method': 'sigmoid', 'calib_cv': 3}. Best is trial 42 with value: 1.1483792117267584.
[I 2026-02-26 11:11:51,833] Trial 47 finished with value: 1.1576466983737757 and parameters: {'kernel': 'linear', 'class_weight': None, 'C': 0.0011909406662637518, 'tol': 0.005576687858594515, 'max_iter': 10202, 'calib_method': 'sigmoid', 'calib_cv': 3}. Best is trial 42 with value: 1.1483792117267584.
[I 2026-02-26 11:11:52,858] Trial 48 pruned. 
[I 2026-02-26 11:11:53,194] Trial 49 finished with value: 1.150678158315568 and parameters: {'kernel': 'linear', 'class_weight': None, 'C': 0.0019193175491652227, 'tol': 0.005439347712236622, 'max_iter': 9218, 'calib_method': 'sigmoid', 'calib_cv': 3}. Best is trial 42 with value: 1.1483792117267584.
[I 2026-02-26 11:11:54,881] Trial 50 pruned. 
[I 2026-02-26 11:11:55,145] Trial 51 pruned. 
[I 2026-02-26 11:11:56,293] Trial 52 finished with value: 1.1505506971710797 and parameters: {'kernel': 'linear', 'class_weight': None, 'C': 0.001944003608761959, 'tol': 0.005390787983073815, 'max_iter': 9117, 'calib_method': 'sigmoid', 'calib_cv': 3}. Best is trial 42 with value: 1.1483792117267584.
[I 2026-02-26 11:11:56,624] Trial 53 finished with value: 1.150458611894869 and parameters: {'kernel': 'linear', 'class_weight': None, 'C': 0.0019621873664300168, 'tol': 0.0015027112498306701, 'max_iter': 8666, 'calib_method': 'sigmoid', 'calib_cv': 3}. Best is trial 42 with value: 1.1483792117267584.
[I 2026-02-26 11:11:56,922] Trial 54 pruned. 
[I 2026-02-26 11:11:57,250] Trial 55 finished with value: 1.1599032671709824 and parameters: {'kernel': 'linear', 'class_weight': None, 'C': 0.0010618111200588565, 'tol': 0.0015269820499140016, 'max_iter': 7809, 'calib_method': 'sigmoid', 'calib_cv': 3}. Best is trial 42 with value: 1.1483792117267584.
[I 2026-02-26 11:11:58,774] Trial 56 pruned. 
[I 2026-02-26 11:12:00,613] Trial 57 pruned. 
[I 2026-02-26 11:12:00,989] Trial 58 finished with value: 1.1496032451255833 and parameters: {'kernel': 'linear', 'class_weight': None, 'C': 0.0021654554114210987, 'tol': 0.0003636771893968765, 'max_iter': 7160, 'calib_method': 'sigmoid', 'calib_cv': 3}. Best is trial 42 with value: 1.1483792117267584.
[I 2026-02-26 11:12:01,331] Trial 59 finished with value: 1.1488181771425885 and parameters: {'kernel': 'linear', 'class_weight': None, 'C': 0.002452576748541384, 'tol': 0.00036866344749395674, 'max_iter': 3601, 'calib_method': 'sigmoid', 'calib_cv': 3}. Best is trial 42 with value: 1.1483792117267584.
[I 2026-02-26 11:12:01,621] Trial 60 pruned. 
[I 2026-02-26 11:12:03,122] Trial 61 pruned. 
[I 2026-02-26 11:12:03,459] Trial 62 finished with value: 1.1495089456514287 and parameters: {'kernel': 'linear', 'class_weight': None, 'C': 0.0021928540406529183, 'tol': 0.0004455277295158778, 'max_iter': 3750, 'calib_method': 'sigmoid', 'calib_cv': 3}. Best is trial 42 with value: 1.1483792117267584.
[I 2026-02-26 11:12:03,833] Trial 63 pruned. 
[I 2026-02-26 11:12:04,335] Trial 64 finished with value: 1.1485364359182648 and parameters: {'kernel': 'linear', 'class_weight': None, 'C': 0.002621116383381692, 'tol': 0.0004780575635170539, 'max_iter': 2587, 'calib_method': 'sigmoid', 'calib_cv': 3}. Best is trial 42 with value: 1.1483792117267584.
[I 2026-02-26 11:12:04,899] Trial 65 finished with value: 1.1482584480158486 and parameters: {'kernel': 'linear', 'class_weight': None, 'C': 0.002928495427651775, 'tol': 0.00043644936758000007, 'max_iter': 2350, 'calib_method': 'sigmoid', 'calib_cv': 3}. Best is trial 65 with value: 1.1482584480158486.
[I 2026-02-26 11:12:05,245] Trial 66 pruned. 
[I 2026-02-26 11:12:05,581] Trial 67 finished with value: 1.1486096967061363 and parameters: {'kernel': 'linear', 'class_weight': None, 'C': 0.002569601410242206, 'tol': 0.0005226282376831496, 'max_iter': 2076, 'calib_method': 'sigmoid', 'calib_cv': 3}. Best is trial 65 with value: 1.1482584480158486.
[I 2026-02-26 11:12:05,938] Trial 68 finished with value: 1.148289743081542 and parameters: {'kernel': 'linear', 'class_weight': None, 'C': 0.0028733538467457134, 'tol': 0.0005499805409659925, 'max_iter': 3509, 'calib_method': 'sigmoid', 'calib_cv': 3}. Best is trial 65 with value: 1.1482584480158486.
[I 2026-02-26 11:12:06,297] Trial 69 finished with value: 1.1489642329466707 and parameters: {'kernel': 'linear', 'class_weight': None, 'C': 0.0040945310323702265, 'tol': 0.0006561751783937855, 'max_iter': 2023, 'calib_method': 'sigmoid', 'calib_cv': 3}. Best is trial 65 with value: 1.1482584480158486.
[I 2026-02-26 11:12:06,556] Trial 70 pruned. 
[I 2026-02-26 11:12:06,997] Trial 71 pruned. 
[I 2026-02-26 11:12:07,339] Trial 72 finished with value: 1.1483594352073976 and parameters: {'kernel': 'linear', 'class_weight': None, 'C': 0.0027810071901451586, 'tol': 0.0005083380061584378, 'max_iter': 4700, 'calib_method': 'sigmoid', 'calib_cv': 3}. Best is trial 65 with value: 1.1482584480158486.
[I 2026-02-26 11:12:07,672] Trial 73 finished with value: 1.1482116724004992 and parameters: {'kernel': 'linear', 'class_weight': None, 'C': 0.003073335125778532, 'tol': 0.0008802574429766116, 'max_iter': 4591, 'calib_method': 'sigmoid', 'calib_cv': 3}. Best is trial 73 with value: 1.1482116724004992.
[I 2026-02-26 11:12:08,047] Trial 74 finished with value: 1.1483897930191778 and parameters: {'kernel': 'linear', 'class_weight': None, 'C': 0.0027453431678127757, 'tol': 0.0010034873474436261, 'max_iter': 4361, 'calib_method': 'sigmoid', 'calib_cv': 3}. Best is trial 73 with value: 1.1482116724004992.
[I 2026-02-26 11:12:08,304] Trial 75 pruned. 
[I 2026-02-26 11:12:08,636] Trial 76 finished with value: 1.1482171801749237 and parameters: {'kernel': 'linear', 'class_weight': None, 'C': 0.003246298072746384, 'tol': 0.0005056293304332251, 'max_iter': 4315, 'calib_method': 'sigmoid', 'calib_cv': 3}. Best is trial 73 with value: 1.1482116724004992.
[I 2026-02-26 11:12:08,922] Trial 77 pruned. 
[I 2026-02-26 11:12:09,900] Trial 78 pruned. 
[I 2026-02-26 11:12:10,253] Trial 79 finished with value: 1.1562922919281777 and parameters: {'kernel': 'linear', 'class_weight': None, 'C': 0.001282963413337137, 'tol': 0.0008972541179437009, 'max_iter': 5137, 'calib_method': 'sigmoid', 'calib_cv': 3}. Best is trial 73 with value: 1.1482116724004992.
[I 2026-02-26 11:12:10,586] Trial 80 finished with value: 1.1482865437746503 and parameters: {'kernel': 'linear', 'class_weight': None, 'C': 0.0028755461723824617, 'tol': 0.0007633268578726235, 'max_iter': 6160, 'calib_method': 'sigmoid', 'calib_cv': 3}. Best is trial 73 with value: 1.1482116724004992.
[I 2026-02-26 11:12:10,835] Trial 81 pruned. 
[I 2026-02-26 11:12:11,194] Trial 82 finished with value: 1.1482067858934262 and parameters: {'kernel': 'linear', 'class_weight': None, 'C': 0.0031119460229022825, 'tol': 0.0007791751468762718, 'max_iter': 3034, 'calib_method': 'sigmoid', 'calib_cv': 3}. Best is trial 82 with value: 1.1482067858934262.
[I 2026-02-26 11:12:11,471] Trial 83 pruned. 
[I 2026-02-26 11:12:11,799] Trial 84 finished with value: 1.1556042165022447 and parameters: {'kernel': 'linear', 'class_weight': None, 'C': 0.0013352407694462425, 'tol': 0.0021434709704171192, 'max_iter': 4883, 'calib_method': 'sigmoid', 'calib_cv': 3}. Best is trial 82 with value: 1.1482067858934262.
[I 2026-02-26 11:12:12,052] Trial 85 pruned. 
[I 2026-02-26 11:12:12,416] Trial 86 finished with value: 1.148298495809861 and parameters: {'kernel': 'linear', 'class_weight': None, 'C': 0.0034455080083658912, 'tol': 0.0008234482852334294, 'max_iter': 6487, 'calib_method': 'sigmoid', 'calib_cv': 3}. Best is trial 82 with value: 1.1482067858934262.
[I 2026-02-26 11:12:12,758] Trial 87 finished with value: 1.1482443998915617 and parameters: {'kernel': 'linear', 'class_weight': None, 'C': 0.003334158739240667, 'tol': 0.0006155349041871771, 'max_iter': 5935, 'calib_method': 'sigmoid', 'calib_cv': 3}. Best is trial 82 with value: 1.1482067858934262.
[I 2026-02-26 11:12:13,021] Trial 88 pruned. 
[I 2026-02-26 11:12:13,310] Trial 89 pruned. 
[I 2026-02-26 11:12:14,347] Trial 90 pruned. 
[I 2026-02-26 11:12:14,679] Trial 91 pruned. 
[I 2026-02-26 11:12:14,964] Trial 92 pruned. 
[I 2026-02-26 11:12:15,478] Trial 93 finished with value: 1.1482133660646192 and parameters: {'kernel': 'linear', 'class_weight': None, 'C': 0.0030618555056898494, 'tol': 0.0004449546387660335, 'max_iter': 4051, 'calib_method': 'sigmoid', 'calib_cv': 3}. Best is trial 82 with value: 1.1482067858934262.
[I 2026-02-26 11:12:15,929] Trial 94 finished with value: 1.1528454813485918 and parameters: {'kernel': 'linear', 'class_weight': None, 'C': 0.0015992146366831913, 'tol': 0.0006029882807534341, 'max_iter': 4068, 'calib_method': 'sigmoid', 'calib_cv': 3}. Best is trial 82 with value: 1.1482067858934262.
[I 2026-02-26 11:12:16,314] Trial 95 finished with value: 1.148206741777215 and parameters: {'kernel': 'linear', 'class_weight': None, 'C': 0.0031860178260231125, 'tol': 0.00046621954613830583, 'max_iter': 6556, 'calib_method': 'sigmoid', 'calib_cv': 3}. Best is trial 95 with value: 1.148206741777215.
[I 2026-02-26 11:12:16,582] Trial 96 pruned. 
[I 2026-02-26 11:12:16,893] Trial 97 pruned. 
[I 2026-02-26 11:12:17,224] Trial 98 finished with value: 1.1553155314861536 and parameters: {'kernel': 'linear', 'class_weight': None, 'C': 0.001358384318552385, 'tol': 0.0012367368809001133, 'max_iter': 6478, 'calib_method': 'sigmoid', 'calib_cv': 3}. Best is trial 95 with value: 1.148206741777215.
[I 2026-02-26 11:12:17,500] Trial 99 pruned. 
[I 2026-02-26 11:12:19,607] Trial 100 pruned. 
[I 2026-02-26 11:12:20,332] Trial 101 pruned. 
[I 2026-02-26 11:12:20,600] Trial 102 pruned. 
[I 2026-02-26 11:12:20,960] Trial 103 finished with value: 1.148281477613077 and parameters: {'kernel': 'linear', 'class_weight': None, 'C': 0.002883636763381609, 'tol': 0.0008475282435431587, 'max_iter': 3920, 'calib_method': 'sigmoid', 'calib_cv': 3}. Best is trial 95 with value: 1.148206741777215.
[I 2026-02-26 11:12:21,309] Trial 104 finished with value: 1.1536165981820818 and parameters: {'kernel': 'linear', 'class_weight': None, 'C': 0.0015146386679526418, 'tol': 0.0007839889888501917, 'max_iter': 2863, 'calib_method': 'sigmoid', 'calib_cv': 3}. Best is trial 95 with value: 1.148206741777215.
[I 2026-02-26 11:12:21,572] Trial 105 pruned. 
[I 2026-02-26 11:12:21,845] Trial 106 pruned. 
[I 2026-02-26 11:12:22,115] Trial 107 pruned. 
[I 2026-02-26 11:12:23,807] Trial 108 pruned. 
[I 2026-02-26 11:12:24,841] Trial 109 pruned. 
[I 2026-02-26 11:12:25,202] Trial 110 finished with value: 1.1488542888071354 and parameters: {'kernel': 'linear', 'class_weight': None, 'C': 0.0024351874880289667, 'tol': 0.0008087820870115874, 'max_iter': 2514, 'calib_method': 'sigmoid', 'calib_cv': 3}. Best is trial 95 with value: 1.148206741777215.
