[I 2026-02-26 13:59:22,900] Trial 156 finished with value: 0.10254205438530047 and parameters: {'kernel': 'rbf', 'class_weight_mode': 'custom', 'pos_weight': 13.213910882952934, 'C': 0.015146000675922134, 'gamma': 0.057970977971725866, 'calib_method': 'sigmoid', 'calib_cv': 5}. Best is trial 144 with value: 0.10247934963331459.
[I 2026-02-26 14:00:34,384] Trial 157 pruned. 
[I 2026-02-26 14:01:53,183] Trial 158 finished with value: 0.10251981943993205 and parameters: {'kernel': 'rbf', 'class_weight_mode': 'custom', 'pos_weight': 14.362871483655944, 'C': 0.013274021155064004, 'gamma': 0.053635122354132474, 'calib_method': 'sigmoid', 'calib_cv': 5}. Best is trial 144 with value: 0.10247934963331459.
[I 2026-02-26 14:03:10,337] Trial 159 finished with value: 0.10257650429353941 and parameters: {'kernel': 'rbf', 'class_weight_mode': 'custom', 'pos_weight': 13.934754575852395, 'C': 0.01176556440957129, 'gamma': 0.05000137620432245, 'calib_method': 'sigmoid', 'calib_cv': 5}. Best is trial 144 with value: 0.10247934963331459.
[I 2026-02-26 14:04:29,144] Trial 160 finished with value: 0.10258720340942981 and parameters: {'kernel': 'rbf', 'class_weight_mode': 'custom', 'pos_weight': 14.409776341942198, 'C': 0.012696682411608559, 'gamma': 0.047164669813632105, 'calib_method': 'sigmoid', 'calib_cv': 5}. Best is trial 144 with value: 0.10247934963331459.
[I 2026-02-26 14:05:47,301] Trial 161 pruned. 
[I 2026-02-26 14:07:02,079] Trial 162 pruned. 
[I 2026-02-26 14:07:04,832] Trial 163 pruned. 
[I 2026-02-26 14:08:16,542] Trial 164 finished with value: 0.10263355651267791 and parameters: {'kernel': 'rbf', 'class_weight_mode': 'custom', 'pos_weight': 12.98258135505672, 'C': 0.012461321130953192, 'gamma': 0.04810830595730885, 'calib_method': 'sigmoid', 'calib_cv': 5}. Best is trial 144 with value: 0.10247934963331459.
[I 2026-02-26 14:09:29,143] Trial 165 finished with value: 0.10261955022576805 and parameters: {'kernel': 'rbf', 'class_weight_mode': 'custom', 'pos_weight': 13.218627720728282, 'C': 0.012582668741863447, 'gamma': 0.0479486392976366, 'calib_method': 'sigmoid', 'calib_cv': 5}. Best is trial 144 with value: 0.10247934963331459.
[I 2026-02-26 14:10:45,866] Trial 166 finished with value: 0.10253737230107537 and parameters: {'kernel': 'rbf', 'class_weight_mode': 'custom', 'pos_weight': 13.994315213462544, 'C': 0.013468883662049744, 'gamma': 0.05210334523065753, 'calib_method': 'sigmoid', 'calib_cv': 5}. Best is trial 144 with value: 0.10247934963331459.
[I 2026-02-26 14:12:06,024] Trial 167 pruned. 
[I 2026-02-26 14:13:20,463] Trial 168 pruned. 
[I 2026-02-26 14:14:51,419] Trial 169 finished with value: 0.10364925001197448 and parameters: {'kernel': 'rbf', 'class_weight_mode': 'custom', 'pos_weight': 16.644179549732538, 'C': 0.01272432331016239, 'gamma': 0.0877639063991591, 'calib_method': 'sigmoid', 'calib_cv': 5}. Best is trial 144 with value: 0.10247934963331459.
[I 2026-02-26 14:15:25,082] Trial 170 pruned. 
[I 2026-02-26 14:16:45,497] Trial 171 finished with value: 0.10337487094890221 and parameters: {'kernel': 'rbf', 'class_weight_mode': 'custom', 'pos_weight': 14.43486846952603, 'C': 0.019947503663662547, 'gamma': 0.09347505533827878, 'calib_method': 'sigmoid', 'calib_cv': 5}. Best is trial 144 with value: 0.10247934963331459.
[I 2026-02-26 14:17:54,796] Trial 172 pruned. 
[I 2026-02-26 14:19:08,042] Trial 173 pruned. 
[I 2026-02-26 14:20:13,293] Trial 174 finished with value: 0.1026847971893566 and parameters: {'kernel': 'rbf', 'class_weight_mode': 'custom', 'pos_weight': 11.66280273393001, 'C': 0.015374039417210099, 'gamma': 0.05274223339911882, 'calib_method': 'sigmoid', 'calib_cv': 5}. Best is trial 144 with value: 0.10247934963331459.
[I 2026-02-26 14:21:23,143] Trial 175 finished with value: 0.10259928476859423 and parameters: {'kernel': 'rbf', 'class_weight_mode': 'custom', 'pos_weight': 12.39319181256667, 'C': 0.012547620887112186, 'gamma': 0.05664316376669971, 'calib_method': 'sigmoid', 'calib_cv': 5}. Best is trial 144 with value: 0.10247934963331459.
[I 2026-02-26 14:22:33,664] Trial 176 finished with value: 0.10260640097276227 and parameters: {'kernel': 'rbf', 'class_weight_mode': 'custom', 'pos_weight': 12.735440202712635, 'C': 0.0136325962318942, 'gamma': 0.050279050837339155, 'calib_method': 'sigmoid', 'calib_cv': 5}. Best is trial 144 with value: 0.10247934963331459.
[I 2026-02-26 14:23:53,558] Trial 177 finished with value: 0.10292309525018947 and parameters: {'kernel': 'rbf', 'class_weight_mode': 'custom', 'pos_weight': 14.835345428236302, 'C': 0.021489235835171747, 'gamma': 0.08209638620826606, 'calib_method': 'sigmoid', 'calib_cv': 5}. Best is trial 144 with value: 0.10247934963331459.
[I 2026-02-26 14:24:59,662] Trial 178 pruned. 
[I 2026-02-26 14:26:16,300] Trial 179 finished with value: 0.10258981544965703 and parameters: {'kernel': 'rbf', 'class_weight_mode': 'custom', 'pos_weight': 13.743513282866152, 'C': 0.011026632025822205, 'gamma': 0.0587297647784024, 'calib_method': 'sigmoid', 'calib_cv': 5}. Best is trial 144 with value: 0.10247934963331459.
[I 2026-02-26 14:27:36,367] Trial 180 finished with value: 0.10270299179838112 and parameters: {'kernel': 'rbf', 'class_weight_mode': 'custom', 'pos_weight': 14.333092677191058, 'C': 0.010550779652183151, 'gamma': 0.06537979774336573, 'calib_method': 'sigmoid', 'calib_cv': 5}. Best is trial 144 with value: 0.10247934963331459.
[I 2026-02-26 14:29:04,161] Trial 181 pruned. 
[I 2026-02-26 14:30:16,423] Trial 182 finished with value: 0.10433799846473757 and parameters: {'kernel': 'rbf', 'class_weight_mode': 'custom', 'pos_weight': 12.024351400977816, 'C': 0.018619827256027625, 'gamma': 0.12219912393422969, 'calib_method': 'sigmoid', 'calib_cv': 5}. Best is trial 144 with value: 0.10247934963331459.
[I 2026-02-26 14:31:31,952] Trial 183 finished with value: 0.10294089694164894 and parameters: {'kernel': 'rbf', 'class_weight_mode': 'custom', 'pos_weight': 13.746333356110426, 'C': 0.021208252382195578, 'gamma': 0.08247577692583206, 'calib_method': 'sigmoid', 'calib_cv': 5}. Best is trial 144 with value: 0.10247934963331459.
[I 2026-02-26 14:32:43,460] Trial 184 finished with value: 0.102583374387572 and parameters: {'kernel': 'rbf', 'class_weight_mode': 'custom', 'pos_weight': 12.931396246187669, 'C': 0.012001747392482364, 'gamma': 0.05313190573770197, 'calib_method': 'sigmoid', 'calib_cv': 5}. Best is trial 144 with value: 0.10247934963331459.
[I 2026-02-26 14:33:53,447] Trial 185 finished with value: 0.10260923640350539 and parameters: {'kernel': 'rbf', 'class_weight_mode': 'custom', 'pos_weight': 12.471612896614365, 'C': 0.011621882642568873, 'gamma': 0.06227872903395949, 'calib_method': 'sigmoid', 'calib_cv': 5}. Best is trial 144 with value: 0.10247934963331459.
[I 2026-02-26 14:35:14,369] Trial 186 finished with value: 0.10252566128767382 and parameters: {'kernel': 'rbf', 'class_weight_mode': 'custom', 'pos_weight': 14.785021580671664, 'C': 0.014872429250307228, 'gamma': 0.059429532224914566, 'calib_method': 'sigmoid', 'calib_cv': 5}. Best is trial 144 with value: 0.10247934963331459.
[I 2026-02-26 14:36:37,264] Trial 187 finished with value: 0.1036412841932958 and parameters: {'kernel': 'rbf', 'class_weight_mode': 'custom', 'pos_weight': 14.919731863314555, 'C': 0.016891686939844785, 'gamma': 0.09608768379964366, 'calib_method': 'sigmoid', 'calib_cv': 5}. Best is trial 144 with value: 0.10247934963331459.
[I 2026-02-26 14:38:05,459] Trial 188 pruned. 
[I 2026-02-26 14:39:11,302] Trial 189 finished with value: 0.10279170292262405 and parameters: {'kernel': 'rbf', 'class_weight_mode': 'custom', 'pos_weight': 11.437604427303826, 'C': 0.014509259687081841, 'gamma': 0.07220268755117222, 'calib_method': 'sigmoid', 'calib_cv': 5}. Best is trial 144 with value: 0.10247934963331459.
[I 2026-02-26 14:40:26,812] Trial 190 finished with value: 0.10242028256070472 and parameters: {'kernel': 'rbf', 'class_weight_mode': 'custom', 'pos_weight': 13.807632579679137, 'C': 0.018845277275605688, 'gamma': 0.05769329359861117, 'calib_method': 'sigmoid', 'calib_cv': 5}. Best is trial 190 with value: 0.10242028256070472.
[I 2026-02-26 14:41:46,537] Trial 191 pruned. 
[I 2026-02-26 14:43:03,070] Trial 192 finished with value: 0.10272962700807584 and parameters: {'kernel': 'rbf', 'class_weight_mode': 'custom', 'pos_weight': 13.862570026559709, 'C': 0.018388590294523412, 'gamma': 0.07371296996145471, 'calib_method': 'sigmoid', 'calib_cv': 5}. Best is trial 190 with value: 0.10242028256070472.
[I 2026-02-26 14:44:45,306] Trial 193 finished with value: 0.10424000140576259 and parameters: {'kernel': 'rbf', 'class_weight_mode': 'custom', 'pos_weight': 19.893854311554893, 'C': 0.015903514403272295, 'gamma': 0.10550587473512443, 'calib_method': 'sigmoid', 'calib_cv': 5}. Best is trial 190 with value: 0.10242028256070472.
[I 2026-02-26 14:45:59,743] Trial 194 finished with value: 0.10256151976727616 and parameters: {'kernel': 'rbf', 'class_weight_mode': 'custom', 'pos_weight': 13.38962211780007, 'C': 0.01255944105853791, 'gamma': 0.05569388926554587, 'calib_method': 'sigmoid', 'calib_cv': 5}. Best is trial 190 with value: 0.10242028256070472.
[I 2026-02-26 14:47:14,511] Trial 195 finished with value: 0.1025755247048058 and parameters: {'kernel': 'rbf', 'class_weight_mode': 'custom', 'pos_weight': 13.447482218233144, 'C': 0.011540790505004369, 'gamma': 0.058191943510719255, 'calib_method': 'sigmoid', 'calib_cv': 5}. Best is trial 190 with value: 0.10242028256070472.
[I 2026-02-26 14:48:34,980] Trial 196 pruned. 
[I 2026-02-26 14:49:47,625] Trial 197 finished with value: 0.10242978560018523 and parameters: {'kernel': 'rbf', 'class_weight_mode': 'custom', 'pos_weight': 13.280601848066178, 'C': 0.02361119600253496, 'gamma': 0.060131520465916265, 'calib_method': 'sigmoid', 'calib_cv': 5}. Best is trial 190 with value: 0.10242028256070472.
[I 2026-02-26 14:51:00,325] Trial 198 finished with value: 0.1024267347560005 and parameters: {'kernel': 'rbf', 'class_weight_mode': 'custom', 'pos_weight': 13.600252076083713, 'C': 0.02643392647529251, 'gamma': 0.05951273609339564, 'calib_method': 'sigmoid', 'calib_cv': 5}. Best is trial 190 with value: 0.10242028256070472.
[I 2026-02-26 14:52:11,582] Trial 199 finished with value: 0.10263507808557296 and parameters: {'kernel': 'rbf', 'class_weight_mode': 'custom', 'pos_weight': 12.963794652123001, 'C': 0.02601312627362827, 'gamma': 0.073111858065207, 'calib_method': 'sigmoid', 'calib_cv': 5}. Best is trial 190 with value: 0.10242028256070472.
[I 2026-02-26 14:52:12,804] Trial 200 pruned. 
[I 2026-02-26 14:53:06,811] Trial 201 finished with value: 0.10234078863893352 and parameters: {'kernel': 'rbf', 'class_weight_mode': 'custom', 'pos_weight': 25.77001454404118, 'C': 0.022897663781240727, 'gamma': 0.09343740780295114, 'calib_method': 'sigmoid', 'calib_cv': 3}. Best is trial 201 with value: 0.10234078863893352.
[I 2026-02-26 14:53:45,097] Trial 202 finished with value: 0.10381241136831862 and parameters: {'kernel': 'rbf', 'class_weight_mode': 'custom', 'pos_weight': 13.44379892928524, 'C': 0.022617547373072342, 'gamma': 0.11831357189083462, 'calib_method': 'sigmoid', 'calib_cv': 3}. Best is trial 201 with value: 0.10234078863893352.
[I 2026-02-26 14:54:16,273] Trial 203 finished with value: 0.11114963552542685 and parameters: {'kernel': 'rbf', 'class_weight_mode': 'custom', 'pos_weight': 11.11151560148648, 'C': 0.028855705058091024, 'gamma': 0.08448953095426329, 'calib_method': 'isotonic', 'calib_cv': 3}. Best is trial 201 with value: 0.10234078863893352.
[I 2026-02-26 14:55:14,245] Trial 204 pruned. 
[I 2026-02-26 14:57:05,403] Trial 205 pruned. 
[I 2026-02-26 14:57:41,486] Trial 206 finished with value: 0.10277028584999934 and parameters: {'kernel': 'rbf', 'class_weight_mode': 'custom', 'pos_weight': 13.143432557446744, 'C': 0.017786998610459254, 'gamma': 0.0902700052650472, 'calib_method': 'sigmoid', 'calib_cv': 3}. Best is trial 201 with value: 0.10234078863893352.
[I 2026-02-26 14:58:18,128] Trial 207 pruned. 
[I 2026-02-26 15:00:05,974] Trial 208 pruned. 
[I 2026-02-26 15:01:13,281] Trial 209 pruned. 
[I 2026-02-26 15:02:35,457] Trial 210 finished with value: 0.10269484839762866 and parameters: {'kernel': 'rbf', 'class_weight_mode': 'custom', 'pos_weight': 15.530887861252172, 'C': 0.021677209671548545, 'gamma': 0.07127527719440657, 'calib_method': 'sigmoid', 'calib_cv': 5}. Best is trial 201 with value: 0.10234078863893352.
[I 2026-02-26 15:04:42,181] Trial 211 pruned. 
[I 2026-02-26 15:05:52,981] Trial 212 pruned. 
[I 2026-02-26 15:06:31,652] Trial 213 finished with value: 0.10313297490703881 and parameters: {'kernel': 'rbf', 'class_weight_mode': 'custom', 'pos_weight': 14.156828561150014, 'C': 0.018203769852557162, 'gamma': 0.09436373675253601, 'calib_method': 'sigmoid', 'calib_cv': 3}. Best is trial 201 with value: 0.10234078863893352.
[I 2026-02-26 15:09:19,849] Trial 214 pruned. 
[I 2026-02-26 15:10:34,741] Trial 215 finished with value: 0.10258550360190541 and parameters: {'kernel': 'rbf', 'class_weight_mode': 'custom', 'pos_weight': 13.531061017490073, 'C': 0.015021170481960743, 'gamma': 0.06364766949281511, 'calib_method': 'sigmoid', 'calib_cv': 5}. Best is trial 201 with value: 0.10234078863893352.
[I 2026-02-26 15:11:45,349] Trial 216 finished with value: 0.10276642855277915 and parameters: {'kernel': 'rbf', 'class_weight_mode': 'custom', 'pos_weight': 12.370790103911027, 'C': 0.01554073520773416, 'gamma': 0.0737122282433347, 'calib_method': 'sigmoid', 'calib_cv': 5}. Best is trial 201 with value: 0.10234078863893352.
[I 2026-02-26 15:12:58,165] Trial 217 pruned. 
[I 2026-02-26 15:14:30,144] Trial 218 finished with value: 0.10278624847102777 and parameters: {'kernel': 'rbf', 'class_weight_mode': 'custom', 'pos_weight': 17.467438078934574, 'C': 0.013902708417792353, 'gamma': 0.06190872553361356, 'calib_method': 'sigmoid', 'calib_cv': 5}. Best is trial 201 with value: 0.10234078863893352.
[I 2026-02-26 15:15:49,480] Trial 219 pruned. 
[I 2026-02-26 15:17:00,525] Trial 220 pruned. 
[I 2026-02-26 15:18:17,244] Trial 221 finished with value: 0.10274460774354169 and parameters: {'kernel': 'rbf', 'class_weight_mode': 'custom', 'pos_weight': 13.703952661122553, 'C': 0.016884219871286636, 'gamma': 0.07354292196798742, 'calib_method': 'sigmoid', 'calib_cv': 5}. Best is trial 201 with value: 0.10234078863893352.
[I 2026-02-26 15:19:27,005] Trial 222 finished with value: 0.1038470508888207 and parameters: {'kernel': 'rbf', 'class_weight_mode': 'custom', 'pos_weight': 11.838179781903023, 'C': 0.011461579610995644, 'gamma': 0.10936306122195463, 'calib_method': 'sigmoid', 'calib_cv': 5}. Best is trial 201 with value: 0.10234078863893352.
[I 2026-02-26 15:20:43,083] Trial 223 pruned. 
[I 2026-02-26 15:21:58,141] Trial 224 finished with value: 0.10257273962016515 and parameters: {'kernel': 'rbf', 'class_weight_mode': 'custom', 'pos_weight': 13.42593234439809, 'C': 0.011793366878515985, 'gamma': 0.05828073443430695, 'calib_method': 'sigmoid', 'calib_cv': 5}. Best is trial 201 with value: 0.10234078863893352.
[I 2026-02-26 15:23:08,335] Trial 225 finished with value: 0.10257783529074038 and parameters: {'kernel': 'rbf', 'class_weight_mode': 'custom', 'pos_weight': 12.513410434366655, 'C': 0.014925613969538119, 'gamma': 0.05835947535925813, 'calib_method': 'sigmoid', 'calib_cv': 5}. Best is trial 201 with value: 0.10234078863893352.
[I 2026-02-26 15:24:18,633] Trial 226 pruned. 
[I 2026-02-26 15:25:24,054] Trial 227 finished with value: 0.10296293616378112 and parameters: {'kernel': 'rbf', 'class_weight_mode': 'custom', 'pos_weight': 11.338211592212867, 'C': 0.014181204395402823, 'gamma': 0.0805076977897539, 'calib_method': 'sigmoid', 'calib_cv': 5}. Best is trial 201 with value: 0.10234078863893352.
[I 2026-02-26 15:26:33,067] Trial 228 finished with value: 0.10261555806815348 and parameters: {'kernel': 'rbf', 'class_weight_mode': 'custom', 'pos_weight': 12.107703178239216, 'C': 0.012282084551598304, 'gamma': 0.057250192677515674, 'calib_method': 'sigmoid', 'calib_cv': 5}. Best is trial 201 with value: 0.10234078863893352.
[I 2026-02-26 15:28:32,769] Trial 229 pruned. 
[I 2026-02-26 15:29:59,337] Trial 230 finished with value: 0.10350487645394288 and parameters: {'kernel': 'rbf', 'class_weight_mode': 'custom', 'pos_weight': 15.977062432260057, 'C': 0.017336555214243925, 'gamma': 0.09306673424243073, 'calib_method': 'sigmoid', 'calib_cv': 5}. Best is trial 201 with value: 0.10234078863893352.
[I 2026-02-26 15:31:11,360] Trial 231 pruned. 
[I 2026-02-26 15:32:32,172] Trial 232 finished with value: 0.10262787708078805 and parameters: {'kernel': 'rbf', 'class_weight_mode': 'custom', 'pos_weight': 15.054329795733697, 'C': 0.019794591355462715, 'gamma': 0.06891380731672012, 'calib_method': 'sigmoid', 'calib_cv': 5}. Best is trial 201 with value: 0.10234078863893352.
[I 2026-02-26 15:32:34,381] Trial 233 pruned. 
[I 2026-02-26 15:33:47,286] Trial 234 pruned. 
[I 2026-02-26 15:34:57,496] Trial 235 finished with value: 0.10259842049102619 and parameters: {'kernel': 'rbf', 'class_weight_mode': 'custom', 'pos_weight': 12.566699271084376, 'C': 0.015349163711646742, 'gamma': 0.0636196746372845, 'calib_method': 'sigmoid', 'calib_cv': 5}. Best is trial 201 with value: 0.10234078863893352.
[I 2026-02-26 15:36:11,656] Trial 236 finished with value: 0.10251759969705825 and parameters: {'kernel': 'rbf', 'class_weight_mode': 'custom', 'pos_weight': 13.442839353187278, 'C': 0.015993087587626655, 'gamma': 0.05985690626130207, 'calib_method': 'sigmoid', 'calib_cv': 5}. Best is trial 201 with value: 0.10234078863893352.
[I 2026-02-26 15:36:53,870] Trial 237 pruned. 
[I 2026-02-26 15:38:11,932] Trial 238 pruned. 
[I 2026-02-26 15:39:21,548] Trial 239 finished with value: 0.10303343069008408 and parameters: {'kernel': 'rbf', 'class_weight_mode': 'custom', 'pos_weight': 12.20735546157869, 'C': 0.012244937088522489, 'gamma': 0.08445610489887254, 'calib_method': 'sigmoid', 'calib_cv': 5}. Best is trial 201 with value: 0.10234078863893352.
[I 2026-02-26 15:40:30,308] Trial 240 pruned. 
[I 2026-02-26 15:41:35,806] Trial 241 pruned. 
[I 2026-02-26 15:42:50,905] Trial 242 finished with value: 0.10266022709481279 and parameters: {'kernel': 'rbf', 'class_weight_mode': 'custom', 'pos_weight': 13.321201763529066, 'C': 0.01656944935397257, 'gamma': 0.06977339237565583, 'calib_method': 'sigmoid', 'calib_cv': 5}. Best is trial 201 with value: 0.10234078863893352.
[I 2026-02-26 15:43:28,362] Trial 243 pruned. 
[I 2026-02-26 15:44:42,976] Trial 244 finished with value: 0.10257497610028403 and parameters: {'kernel': 'rbf', 'class_weight_mode': 'custom', 'pos_weight': 13.54113229978331, 'C': 0.014533988051085606, 'gamma': 0.06212990665295097, 'calib_method': 'sigmoid', 'calib_cv': 5}. Best is trial 201 with value: 0.10234078863893352.
[I 2026-02-26 15:45:58,139] Trial 245 finished with value: 0.10250984302705916 and parameters: {'kernel': 'rbf', 'class_weight_mode': 'custom', 'pos_weight': 13.585995058699131, 'C': 0.015910067093537334, 'gamma': 0.06025290860265426, 'calib_method': 'sigmoid', 'calib_cv': 5}. Best is trial 201 with value: 0.10234078863893352.
[I 2026-02-26 15:47:20,307] Trial 246 finished with value: 0.10297025152285677 and parameters: {'kernel': 'rbf', 'class_weight_mode': 'custom', 'pos_weight': 15.16089681952576, 'C': 0.018537430591300808, 'gamma': 0.08100889067222099, 'calib_method': 'sigmoid', 'calib_cv': 5}. Best is trial 201 with value: 0.10234078863893352.
[I 2026-02-26 15:48:36,394] Trial 247 finished with value: 0.10256703788148402 and parameters: {'kernel': 'rbf', 'class_weight_mode': 'custom', 'pos_weight': 13.73760840129437, 'C': 0.015298440307082137, 'gamma': 0.06361661526267409, 'calib_method': 'sigmoid', 'calib_cv': 5}. Best is trial 201 with value: 0.10234078863893352.
[I 2026-02-26 15:49:51,637] Trial 248 finished with value: 0.10251376659882305 and parameters: {'kernel': 'rbf', 'class_weight_mode': 'custom', 'pos_weight': 13.83330688550416, 'C': 0.020944133458010498, 'gamma': 0.06577958024451229, 'calib_method': 'sigmoid', 'calib_cv': 5}. Best is trial 201 with value: 0.10234078863893352.
[I 2026-02-26 15:51:10,949] Trial 249 finished with value: 0.10383542233495009 and parameters: {'kernel': 'rbf', 'class_weight_mode': 'custom', 'pos_weight': 13.98323714136121, 'C': 0.022703252237027415, 'gamma': 0.10729897538573635, 'calib_method': 'sigmoid', 'calib_cv': 5}. Best is trial 201 with value: 0.10234078863893352.
[I 2026-02-26 15:52:33,695] Trial 250 finished with value: 0.10276187873208031 and parameters: {'kernel': 'rbf', 'class_weight_mode': 'custom', 'pos_weight': 15.679025226498595, 'C': 0.020542999121323992, 'gamma': 0.07383334387016621, 'calib_method': 'sigmoid', 'calib_cv': 5}. Best is trial 201 with value: 0.10234078863893352.
[I 2026-02-26 15:53:45,334] Trial 251 pruned. 
[I 2026-02-26 15:55:07,247] Trial 252 finished with value: 0.10319697670341332 and parameters: {'kernel': 'rbf', 'class_weight_mode': 'custom', 'pos_weight': 14.884399355646796, 'C': 0.01723976632232635, 'gamma': 0.08551621893146895, 'calib_method': 'sigmoid', 'calib_cv': 5}. Best is trial 201 with value: 0.10234078863893352.
[I 2026-02-26 15:56:28,205] Trial 253 finished with value: 0.1051698781455043 and parameters: {'kernel': 'rbf', 'class_weight_mode': 'custom', 'pos_weight': 13.512791867841464, 'C': 0.02619623934861658, 'gamma': 0.13876598302958804, 'calib_method': 'sigmoid', 'calib_cv': 5}. Best is trial 201 with value: 0.10234078863893352.
[I 2026-02-26 15:57:47,069] Trial 254 finished with value: 0.10256924446823001 and parameters: {'kernel': 'rbf', 'class_weight_mode': 'custom', 'pos_weight': 14.489613916695705, 'C': 0.017241422212209537, 'gamma': 0.06539920707767354, 'calib_method': 'sigmoid', 'calib_cv': 5}. Best is trial 201 with value: 0.10234078863893352.
