[I 2026-02-26 18:54:16,846] Trial 401 finished with value: 0.10470506144243948 and parameters: {'kernel': 'rbf', 'class_weight_mode': 'custom', 'pos_weight': 10.145055036640802, 'C': 0.011217327890009628, 'gamma': 0.16710017573845556, 'calib_method': 'sigmoid', 'calib_cv': 3}. Best is trial 399 with value: 0.10218229982833356.
[I 2026-02-26 18:54:47,172] Trial 402 pruned. 
[I 2026-02-26 18:55:22,933] Trial 403 finished with value: 0.11199734868908875 and parameters: {'kernel': 'rbf', 'class_weight_mode': 'custom', 'pos_weight': 12.612542984393771, 'C': 0.017855539418870768, 'gamma': 0.09981235252890217, 'calib_method': 'isotonic', 'calib_cv': 3}. Best is trial 399 with value: 0.10218229982833356.
[I 2026-02-26 18:55:56,088] Trial 404 finished with value: 0.10207317135953546 and parameters: {'kernel': 'rbf', 'class_weight_mode': 'custom', 'pos_weight': 11.96980621314396, 'C': 0.025432249151892742, 'gamma': 0.07590339072563411, 'calib_method': 'sigmoid', 'calib_cv': 3}. Best is trial 404 with value: 0.10207317135953546.
[I 2026-02-26 18:56:28,049] Trial 405 finished with value: 0.10219588193391922 and parameters: {'kernel': 'rbf', 'class_weight_mode': 'custom', 'pos_weight': 11.408436919434351, 'C': 0.028420088103366912, 'gamma': 0.08414801791685045, 'calib_method': 'sigmoid', 'calib_cv': 3}. Best is trial 404 with value: 0.10207317135953546.
[I 2026-02-26 18:57:00,464] Trial 406 finished with value: 0.10276789762271635 and parameters: {'kernel': 'rbf', 'class_weight_mode': 'custom', 'pos_weight': 10.654734857059724, 'C': 0.04385302391682602, 'gamma': 0.11670850632127071, 'calib_method': 'sigmoid', 'calib_cv': 3}. Best is trial 404 with value: 0.10207317135953546.
[I 2026-02-26 18:57:32,380] Trial 407 finished with value: 0.10232983462133112 and parameters: {'kernel': 'rbf', 'class_weight_mode': 'custom', 'pos_weight': 11.069900349318797, 'C': 0.03569255568329037, 'gamma': 0.09586524561992658, 'calib_method': 'sigmoid', 'calib_cv': 3}. Best is trial 404 with value: 0.10207317135953546.
[I 2026-02-26 18:58:08,057] Trial 408 finished with value: 0.10403046502173827 and parameters: {'kernel': 'rbf', 'class_weight_mode': 'custom', 'pos_weight': 11.275832219311205, 'C': 0.03580921999834883, 'gamma': 0.1450221607150866, 'calib_method': 'sigmoid', 'calib_cv': 3}. Best is trial 404 with value: 0.10207317135953546.
[I 2026-02-26 18:58:49,724] Trial 409 pruned. 
[I 2026-02-26 18:59:21,312] Trial 410 finished with value: 0.10243011041597716 and parameters: {'kernel': 'rbf', 'class_weight_mode': 'custom', 'pos_weight': 10.795128685237268, 'C': 0.037276342759131734, 'gamma': 0.10139454819706532, 'calib_method': 'sigmoid', 'calib_cv': 3}. Best is trial 404 with value: 0.10207317135953546.
[I 2026-02-26 18:59:54,221] Trial 411 finished with value: 0.10356118073205385 and parameters: {'kernel': 'rbf', 'class_weight_mode': 'custom', 'pos_weight': 9.884273614563591, 'C': 0.04047149964239258, 'gamma': 0.1384248887053531, 'calib_method': 'sigmoid', 'calib_cv': 3}. Best is trial 404 with value: 0.10207317135953546.
[I 2026-02-26 19:00:27,031] Trial 412 finished with value: 0.10278429700754821 and parameters: {'kernel': 'rbf', 'class_weight_mode': 'custom', 'pos_weight': 11.002531327513328, 'C': 0.03244624166295211, 'gamma': 0.10961133251591257, 'calib_method': 'sigmoid', 'calib_cv': 3}. Best is trial 404 with value: 0.10207317135953546.
[I 2026-02-26 19:01:05,023] Trial 413 finished with value: 0.10509917447910966 and parameters: {'kernel': 'rbf', 'class_weight_mode': 'custom', 'pos_weight': 10.203091588962018, 'C': 0.05344349197966025, 'gamma': 0.18304460497477987, 'calib_method': 'sigmoid', 'calib_cv': 3}. Best is trial 404 with value: 0.10207317135953546.
[I 2026-02-26 19:01:33,651] Trial 414 finished with value: 0.10229035044168407 and parameters: {'kernel': 'rbf', 'class_weight_mode': 'custom', 'pos_weight': 9.287474301091821, 'C': 0.04931293018568718, 'gamma': 0.10103938156393008, 'calib_method': 'sigmoid', 'calib_cv': 3}. Best is trial 404 with value: 0.10207317135953546.
[I 2026-02-26 19:02:05,861] Trial 415 finished with value: 0.10377547641525398 and parameters: {'kernel': 'rbf', 'class_weight_mode': 'custom', 'pos_weight': 9.201470370000514, 'C': 0.05468858097176849, 'gamma': 0.1458250888760378, 'calib_method': 'sigmoid', 'calib_cv': 3}. Best is trial 404 with value: 0.10207317135953546.
[I 2026-02-26 19:02:35,862] Trial 416 finished with value: 0.10314844330979005 and parameters: {'kernel': 'rbf', 'class_weight_mode': 'custom', 'pos_weight': 8.685192697424986, 'C': 0.04165450747015482, 'gamma': 0.11982646660788705, 'calib_method': 'sigmoid', 'calib_cv': 3}. Best is trial 404 with value: 0.10207317135953546.
[I 2026-02-26 19:03:07,170] Trial 417 finished with value: 0.1017528486098892 and parameters: {'kernel': 'rbf', 'class_weight_mode': 'custom', 'pos_weight': 11.014297115537426, 'C': 0.06918046086451275, 'gamma': 0.1006913293008225, 'calib_method': 'sigmoid', 'calib_cv': 3}. Best is trial 417 with value: 0.1017528486098892.
[I 2026-02-26 19:03:33,214] Trial 418 finished with value: 0.10244988297271454 and parameters: {'kernel': 'rbf', 'class_weight_mode': 'custom', 'pos_weight': 8.041390418509794, 'C': 0.0638059527463668, 'gamma': 0.0970664061795874, 'calib_method': 'sigmoid', 'calib_cv': 3}. Best is trial 417 with value: 0.1017528486098892.
[I 2026-02-26 19:04:05,214] Trial 419 finished with value: 0.10452513400386527 and parameters: {'kernel': 'rbf', 'class_weight_mode': 'custom', 'pos_weight': 8.55584881391881, 'C': 0.0458973310607677, 'gamma': 0.15756729308422535, 'calib_method': 'sigmoid', 'calib_cv': 3}. Best is trial 417 with value: 0.1017528486098892.
[I 2026-02-26 19:04:35,516] Trial 420 finished with value: 0.10274734256335642 and parameters: {'kernel': 'rbf', 'class_weight_mode': 'custom', 'pos_weight': 9.510291620129584, 'C': 0.04953371123034704, 'gamma': 0.11712504001052831, 'calib_method': 'sigmoid', 'calib_cv': 3}. Best is trial 417 with value: 0.1017528486098892.
[I 2026-02-26 19:04:39,903] Trial 421 pruned. 
[I 2026-02-26 19:05:11,145] Trial 422 finished with value: 0.10214495642147003 and parameters: {'kernel': 'rbf', 'class_weight_mode': 'custom', 'pos_weight': 10.455108339096999, 'C': 0.056343296991969195, 'gamma': 0.10512729725098027, 'calib_method': 'sigmoid', 'calib_cv': 3}. Best is trial 417 with value: 0.1017528486098892.
[I 2026-02-26 19:05:47,829] Trial 423 pruned. 
[I 2026-02-26 19:06:19,498] Trial 424 finished with value: 0.10231745222038335 and parameters: {'kernel': 'rbf', 'class_weight_mode': 'custom', 'pos_weight': 10.599250648315943, 'C': 0.10060825136516355, 'gamma': 0.12765690765989243, 'calib_method': 'sigmoid', 'calib_cv': 3}. Best is trial 417 with value: 0.1017528486098892.
[I 2026-02-26 19:06:52,135] Trial 425 finished with value: 0.10341746100490648 and parameters: {'kernel': 'rbf', 'class_weight_mode': 'custom', 'pos_weight': 9.71449827901794, 'C': 0.06158628895284633, 'gamma': 0.140896527429678, 'calib_method': 'sigmoid', 'calib_cv': 3}. Best is trial 417 with value: 0.1017528486098892.
[I 2026-02-26 19:07:20,807] Trial 426 finished with value: 0.14577383198137778 and parameters: {'kernel': 'rbf', 'class_weight_mode': 'custom', 'pos_weight': 8.551247661122398, 'C': 0.09624448819453991, 'gamma': 0.12529396421845523, 'calib_method': 'isotonic', 'calib_cv': 3}. Best is trial 417 with value: 0.1017528486098892.
[I 2026-02-26 19:07:59,958] Trial 427 finished with value: 0.1053129989533195 and parameters: {'kernel': 'rbf', 'class_weight_mode': 'custom', 'pos_weight': 10.537953940000692, 'C': 0.05528217758401924, 'gamma': 0.18960282988277397, 'calib_method': 'sigmoid', 'calib_cv': 3}. Best is trial 417 with value: 0.1017528486098892.
[I 2026-02-26 19:08:28,869] Trial 428 finished with value: 0.10174668022722973 and parameters: {'kernel': 'rbf', 'class_weight_mode': 'custom', 'pos_weight': 9.890780792135708, 'C': 0.07895480951156007, 'gamma': 0.0982653821530031, 'calib_method': 'sigmoid', 'calib_cv': 3}. Best is trial 428 with value: 0.10174668022722973.
[I 2026-02-26 19:09:02,731] Trial 429 finished with value: 0.10370621383968721 and parameters: {'kernel': 'rbf', 'class_weight_mode': 'custom', 'pos_weight': 9.986142946894317, 'C': 0.06637220225714183, 'gamma': 0.151076105112171, 'calib_method': 'sigmoid', 'calib_cv': 3}. Best is trial 428 with value: 0.10174668022722973.
[I 2026-02-26 19:09:35,632] Trial 430 finished with value: 0.10271212818547204 and parameters: {'kernel': 'rbf', 'class_weight_mode': 'custom', 'pos_weight': 10.727753784298354, 'C': 0.054828274789395906, 'gamma': 0.12218246359226133, 'calib_method': 'sigmoid', 'calib_cv': 3}. Best is trial 428 with value: 0.10174668022722973.
[I 2026-02-26 19:10:05,917] Trial 431 finished with value: 0.10196361633072556 and parameters: {'kernel': 'rbf', 'class_weight_mode': 'custom', 'pos_weight': 10.400946580434313, 'C': 0.05896221302021464, 'gamma': 0.10027704541028326, 'calib_method': 'sigmoid', 'calib_cv': 3}. Best is trial 428 with value: 0.10174668022722973.
[I 2026-02-26 19:10:35,798] Trial 432 finished with value: 0.10180966875218109 and parameters: {'kernel': 'rbf', 'class_weight_mode': 'custom', 'pos_weight': 10.327422508445132, 'C': 0.08401352506232622, 'gamma': 0.10308801719691563, 'calib_method': 'sigmoid', 'calib_cv': 3}. Best is trial 428 with value: 0.10174668022722973.
[I 2026-02-26 19:11:22,484] Trial 433 pruned. 
[I 2026-02-26 19:11:52,686] Trial 434 finished with value: 0.10202066986825284 and parameters: {'kernel': 'rbf', 'class_weight_mode': 'custom', 'pos_weight': 10.318572715642945, 'C': 0.08717348755326484, 'gamma': 0.11113957856859437, 'calib_method': 'sigmoid', 'calib_cv': 3}. Best is trial 428 with value: 0.10174668022722973.
[I 2026-02-26 19:12:30,156] Trial 435 finished with value: 0.10441359908690502 and parameters: {'kernel': 'rbf', 'class_weight_mode': 'custom', 'pos_weight': 10.47513433072573, 'C': 0.08600853908162942, 'gamma': 0.1780064165774711, 'calib_method': 'sigmoid', 'calib_cv': 3}. Best is trial 428 with value: 0.10174668022722973.
[I 2026-02-26 19:13:00,754] Trial 436 finished with value: 0.10194701365679933 and parameters: {'kernel': 'rbf', 'class_weight_mode': 'custom', 'pos_weight': 10.3648361043151, 'C': 0.08075654014853424, 'gamma': 0.10758107642464279, 'calib_method': 'sigmoid', 'calib_cv': 3}. Best is trial 428 with value: 0.10174668022722973.
[I 2026-02-26 19:14:07,897] Trial 437 pruned. 
[I 2026-02-26 19:14:41,218] Trial 438 finished with value: 0.10288659347350329 and parameters: {'kernel': 'rbf', 'class_weight_mode': 'custom', 'pos_weight': 10.600318154001451, 'C': 0.08538019790254822, 'gamma': 0.13964970054319117, 'calib_method': 'sigmoid', 'calib_cv': 3}. Best is trial 428 with value: 0.10174668022722973.
[I 2026-02-26 19:15:08,012] Trial 439 finished with value: 0.10180651124858338 and parameters: {'kernel': 'rbf', 'class_weight_mode': 'custom', 'pos_weight': 8.963402570716458, 'C': 0.1415554710911174, 'gamma': 0.10494689982393003, 'calib_method': 'sigmoid', 'calib_cv': 3}. Best is trial 428 with value: 0.10174668022722973.
[I 2026-02-26 19:15:36,106] Trial 440 finished with value: 0.10236110976995041 and parameters: {'kernel': 'rbf', 'class_weight_mode': 'custom', 'pos_weight': 8.912609403632654, 'C': 0.07230582419413147, 'gamma': 0.1068601970519687, 'calib_method': 'sigmoid', 'calib_cv': 3}. Best is trial 428 with value: 0.10174668022722973.
[I 2026-02-26 19:16:08,377] Trial 441 finished with value: 0.10385113249829711 and parameters: {'kernel': 'rbf', 'class_weight_mode': 'custom', 'pos_weight': 8.760426912491004, 'C': 0.11645321864847263, 'gamma': 0.1568518500059341, 'calib_method': 'sigmoid', 'calib_cv': 3}. Best is trial 428 with value: 0.10174668022722973.
[I 2026-02-26 19:16:37,032] Trial 442 finished with value: 0.10212927295487699 and parameters: {'kernel': 'rbf', 'class_weight_mode': 'custom', 'pos_weight': 9.395145701147536, 'C': 0.07424153724526539, 'gamma': 0.10486704552208687, 'calib_method': 'sigmoid', 'calib_cv': 3}. Best is trial 428 with value: 0.10174668022722973.
[I 2026-02-26 19:17:04,537] Trial 443 finished with value: 0.1016707876124735 and parameters: {'kernel': 'rbf', 'class_weight_mode': 'custom', 'pos_weight': 9.670613024252122, 'C': 0.14045115752859447, 'gamma': 0.10631674963849828, 'calib_method': 'sigmoid', 'calib_cv': 3}. Best is trial 443 with value: 0.1016707876124735.
[I 2026-02-26 19:17:31,770] Trial 444 finished with value: 0.10193745566406305 and parameters: {'kernel': 'rbf', 'class_weight_mode': 'custom', 'pos_weight': 9.059619072902718, 'C': 0.1410283676766105, 'gamma': 0.11068118801058541, 'calib_method': 'sigmoid', 'calib_cv': 3}. Best is trial 443 with value: 0.1016707876124735.
[I 2026-02-26 19:18:11,445] Trial 445 finished with value: 0.10539215803717705 and parameters: {'kernel': 'rbf', 'class_weight_mode': 'custom', 'pos_weight': 9.196056079966057, 'C': 0.17957244844417536, 'gamma': 0.21595193600556764, 'calib_method': 'sigmoid', 'calib_cv': 3}. Best is trial 443 with value: 0.1016707876124735.
[I 2026-02-26 19:18:40,428] Trial 446 finished with value: 0.10242905517272449 and parameters: {'kernel': 'rbf', 'class_weight_mode': 'custom', 'pos_weight': 9.115278246688696, 'C': 0.13483507704639955, 'gamma': 0.1265715100888131, 'calib_method': 'sigmoid', 'calib_cv': 3}. Best is trial 443 with value: 0.1016707876124735.
[I 2026-02-26 19:18:44,575] Trial 447 pruned. 
[I 2026-02-26 19:19:17,151] Trial 448 finished with value: 0.10333473538454219 and parameters: {'kernel': 'rbf', 'class_weight_mode': 'custom', 'pos_weight': 9.459063638814355, 'C': 0.14420334308203514, 'gamma': 0.15823902587723096, 'calib_method': 'sigmoid', 'calib_cv': 3}. Best is trial 443 with value: 0.1016707876124735.
{
  "study": "stage1_binary_svm",
  "optimised_objective": "logloss",
  "best_value_logloss_mean": 0.1016707876124735,
  "best_params": {
    "kernel": "rbf",
    "class_weight_mode": "custom",
    "pos_weight": 9.670613024252122,
    "C": 0.14045115752859447,
    "gamma": 0.10631674963849828,
    "calib_method": "sigmoid",
    "calib_cv": 3
  },
  "n_trials": 449,
  "n_splits": 5,
  "holdout_race_ids_excluded": [
    2,
    24,
    53,
    73,
    75
  ],
  "sample_frac": 1.0,
  "max_races": 80,
  "early_stopping_rounds": 50
}
{
  "study": "stage1_binary_svm",
  "task": "binary",
  "model": "svm",
  "metrics": {
    "accuracy_mean": 0.9726022369570859,
    "accuracy_std": 0.009097643748472889,
    "precision_mean": 0.24857142857142858,
    "precision_std": 0.4330244843904703,
    "recall_mean": 0.033174603174603176,
    "recall_std": 0.05295619680971488,
    "f1_mean": 0.04940222897669706,
    "f1_std": 0.07289263888046027,
    "roc_auc_mean": 0.8155582304057422,
    "roc_auc_std": 0.042285773514166014,
    "pr_auc_mean": 0.18482978876424438,
    "pr_auc_std": 0.06243405705500199,
    "logloss_mean": 0.10689032958044198,
    "logloss_std": 0.026671347917351946
  }
}
Job finished at Thu 26 Feb 19:19:34 GMT 2026
