[I 2026-02-26 15:59:05,225] Trial 255 finished with value: 0.10255620572817208 and parameters: {'kernel': 'rbf', 'class_weight_mode': 'custom', 'pos_weight': 14.403769432723662, 'C': 0.020038114164710352, 'gamma': 0.06680783545908404, 'calib_method': 'sigmoid', 'calib_cv': 5}. Best is trial 201 with value: 0.10234078863893352.
[I 2026-02-26 16:00:29,102] Trial 256 finished with value: 0.10272263266181544 and parameters: {'kernel': 'rbf', 'class_weight_mode': 'custom', 'pos_weight': 16.362521176775324, 'C': 0.02242258384126174, 'gamma': 0.06923107499346934, 'calib_method': 'sigmoid', 'calib_cv': 5}. Best is trial 201 with value: 0.10234078863893352.
[I 2026-02-26 16:01:50,592] Trial 257 finished with value: 0.10364728460751818 and parameters: {'kernel': 'rbf', 'class_weight_mode': 'custom', 'pos_weight': 14.623163249820953, 'C': 0.019253570098295127, 'gamma': 0.09902035528802235, 'calib_method': 'sigmoid', 'calib_cv': 5}. Best is trial 201 with value: 0.10234078863893352.
[I 2026-02-26 16:03:09,700] Trial 258 finished with value: 0.10263504927094975 and parameters: {'kernel': 'rbf', 'class_weight_mode': 'custom', 'pos_weight': 15.339707410620603, 'C': 0.024287945692989598, 'gamma': 0.06947240066116088, 'calib_method': 'sigmoid', 'calib_cv': 5}. Best is trial 201 with value: 0.10234078863893352.
[I 2026-02-26 16:04:42,144] Trial 259 pruned. 
[I 2026-02-26 16:05:59,079] Trial 260 finished with value: 0.10317894930001856 and parameters: {'kernel': 'rbf', 'class_weight_mode': 'custom', 'pos_weight': 14.337485025768176, 'C': 0.030080801852825325, 'gamma': 0.09409254345376368, 'calib_method': 'sigmoid', 'calib_cv': 5}. Best is trial 201 with value: 0.10234078863893352.
[I 2026-02-26 16:06:33,188] Trial 261 pruned. 
[I 2026-02-26 16:06:34,715] Trial 262 pruned. 
[I 2026-02-26 16:07:45,165] Trial 263 finished with value: 0.10246277840453191 and parameters: {'kernel': 'rbf', 'class_weight_mode': 'custom', 'pos_weight': 12.856411087814783, 'C': 0.020747320704178854, 'gamma': 0.05948986297499563, 'calib_method': 'sigmoid', 'calib_cv': 5}. Best is trial 201 with value: 0.10234078863893352.
[I 2026-02-26 16:09:12,724] Trial 264 finished with value: 0.1030958658635666 and parameters: {'kernel': 'rbf', 'class_weight_mode': 'custom', 'pos_weight': 17.024647307243846, 'C': 0.02129980317410234, 'gamma': 0.08312494983030802, 'calib_method': 'sigmoid', 'calib_cv': 5}. Best is trial 201 with value: 0.10234078863893352.
[I 2026-02-26 16:10:18,871] Trial 265 pruned. 
[I 2026-02-26 16:11:35,980] Trial 266 finished with value: 0.10471866404803107 and parameters: {'kernel': 'rbf', 'class_weight_mode': 'custom', 'pos_weight': 12.833387479140937, 'C': 0.021051161665829748, 'gamma': 0.12908705908613152, 'calib_method': 'sigmoid', 'calib_cv': 5}. Best is trial 201 with value: 0.10234078863893352.
[I 2026-02-26 16:12:52,309] Trial 267 finished with value: 0.10248944149105137 and parameters: {'kernel': 'rbf', 'class_weight_mode': 'custom', 'pos_weight': 13.788354400570704, 'C': 0.017012123721128907, 'gamma': 0.06075876833315772, 'calib_method': 'sigmoid', 'calib_cv': 5}. Best is trial 201 with value: 0.10234078863893352.
[I 2026-02-26 16:14:11,911] Trial 268 pruned. 
[I 2026-02-26 16:15:30,578] Trial 269 finished with value: 0.10276994030033097 and parameters: {'kernel': 'rbf', 'class_weight_mode': 'custom', 'pos_weight': 14.289395435369219, 'C': 0.01825244690693314, 'gamma': 0.07437447386733537, 'calib_method': 'sigmoid', 'calib_cv': 5}. Best is trial 201 with value: 0.10234078863893352.
[I 2026-02-26 16:16:41,140] Trial 270 finished with value: 0.10256520603961128 and parameters: {'kernel': 'rbf', 'class_weight_mode': 'custom', 'pos_weight': 12.635063542357923, 'C': 0.016462508057272514, 'gamma': 0.060699846353843345, 'calib_method': 'sigmoid', 'calib_cv': 5}. Best is trial 201 with value: 0.10234078863893352.
[I 2026-02-26 16:18:27,817] Trial 271 pruned. 
[I 2026-02-26 16:18:59,829] Trial 272 finished with value: 0.10284690527199922 and parameters: {'kernel': 'rbf', 'class_weight_mode': 'custom', 'pos_weight': 10.817348639779999, 'C': 0.024603598980145313, 'gamma': 0.10871849916259131, 'calib_method': 'sigmoid', 'calib_cv': 3}. Best is trial 201 with value: 0.10234078863893352.
[I 2026-02-26 16:20:04,871] Trial 273 pruned. 
[I 2026-02-26 16:21:15,027] Trial 274 finished with value: 0.10280538392445653 and parameters: {'kernel': 'rbf', 'class_weight_mode': 'custom', 'pos_weight': 12.749699863839114, 'C': 0.03084370492253164, 'gamma': 0.08127682131039717, 'calib_method': 'sigmoid', 'calib_cv': 5}. Best is trial 201 with value: 0.10234078863893352.
[I 2026-02-26 16:22:51,398] Trial 275 pruned. 
[I 2026-02-26 16:24:02,134] Trial 276 finished with value: 0.10264860774306868 and parameters: {'kernel': 'rbf', 'class_weight_mode': 'custom', 'pos_weight': 12.699545251842341, 'C': 0.016207734973682646, 'gamma': 0.06846315311805243, 'calib_method': 'sigmoid', 'calib_cv': 5}. Best is trial 201 with value: 0.10234078863893352.
[I 2026-02-26 16:25:09,071] Trial 277 pruned. 
[I 2026-02-26 16:26:22,961] Trial 278 pruned. 
[I 2026-02-26 16:27:43,102] Trial 279 finished with value: 0.10252966857550079 and parameters: {'kernel': 'rbf', 'class_weight_mode': 'custom', 'pos_weight': 14.635943508808772, 'C': 0.014300830436908848, 'gamma': 0.05960033966852817, 'calib_method': 'sigmoid', 'calib_cv': 5}. Best is trial 201 with value: 0.10234078863893352.
[I 2026-02-26 16:28:45,992] Trial 280 pruned. 
[I 2026-02-26 16:28:46,921] Trial 281 pruned. 
[I 2026-02-26 16:30:14,083] Trial 282 finished with value: 0.10387572299579044 and parameters: {'kernel': 'rbf', 'class_weight_mode': 'custom', 'pos_weight': 15.75291778358077, 'C': 0.013814722608311712, 'gamma': 0.096615152876118, 'calib_method': 'sigmoid', 'calib_cv': 5}. Best is trial 201 with value: 0.10234078863893352.
[I 2026-02-26 16:31:28,130] Trial 283 pruned. 
[I 2026-02-26 16:32:00,687] Trial 284 pruned. 
[I 2026-02-26 16:33:19,941] Trial 285 pruned. 
[I 2026-02-26 16:34:58,083] Trial 286 pruned. 
[I 2026-02-26 16:36:13,046] Trial 287 finished with value: 0.10293090582292064 and parameters: {'kernel': 'rbf', 'class_weight_mode': 'custom', 'pos_weight': 13.300130183265837, 'C': 0.013354180137519135, 'gamma': 0.0789562034271437, 'calib_method': 'sigmoid', 'calib_cv': 5}. Best is trial 201 with value: 0.10234078863893352.
[I 2026-02-26 16:37:29,743] Trial 288 finished with value: 0.10250862873662088 and parameters: {'kernel': 'rbf', 'class_weight_mode': 'custom', 'pos_weight': 14.095629337682713, 'C': 0.01662634845426611, 'gamma': 0.061696416427078384, 'calib_method': 'sigmoid', 'calib_cv': 5}. Best is trial 201 with value: 0.10234078863893352.
[I 2026-02-26 16:38:38,835] Trial 289 pruned. 
[I 2026-02-26 16:39:56,701] Trial 290 finished with value: 0.10244053681775933 and parameters: {'kernel': 'rbf', 'class_weight_mode': 'custom', 'pos_weight': 14.267939492662462, 'C': 0.017631900406812413, 'gamma': 0.0589386297383873, 'calib_method': 'sigmoid', 'calib_cv': 5}. Best is trial 201 with value: 0.10234078863893352.
[I 2026-02-26 16:41:00,424] Trial 291 pruned. 
[I 2026-02-26 16:42:17,284] Trial 292 finished with value: 0.10292859479303026 and parameters: {'kernel': 'rbf', 'class_weight_mode': 'custom', 'pos_weight': 14.793853648245726, 'C': 0.033369374757303116, 'gamma': 0.08421485678823867, 'calib_method': 'sigmoid', 'calib_cv': 5}. Best is trial 201 with value: 0.10234078863893352.
[I 2026-02-26 16:43:31,696] Trial 293 pruned. 
[I 2026-02-26 16:44:56,199] Trial 294 finished with value: 0.10433351643493874 and parameters: {'kernel': 'rbf', 'class_weight_mode': 'custom', 'pos_weight': 14.983457721934515, 'C': 0.018659416628932845, 'gamma': 0.11254846573181769, 'calib_method': 'sigmoid', 'calib_cv': 5}. Best is trial 201 with value: 0.10234078863893352.
[I 2026-02-26 16:45:23,964] Trial 295 pruned. 
[I 2026-02-26 16:46:39,186] Trial 296 pruned. 
[I 2026-02-26 16:47:48,036] Trial 297 pruned. 
[I 2026-02-26 16:49:12,564] Trial 298 pruned. 
[I 2026-02-26 16:50:28,627] Trial 299 finished with value: 0.10257417388378634 and parameters: {'kernel': 'rbf', 'class_weight_mode': 'custom', 'pos_weight': 14.171430924883095, 'C': 0.021118324814423006, 'gamma': 0.06935286114838829, 'calib_method': 'sigmoid', 'calib_cv': 5}. Best is trial 201 with value: 0.10234078863893352.
[I 2026-02-26 16:51:37,502] Trial 300 finished with value: 0.1029877756369526 and parameters: {'kernel': 'rbf', 'class_weight_mode': 'custom', 'pos_weight': 11.970573902283904, 'C': 0.016346433547810513, 'gamma': 0.08300079642841884, 'calib_method': 'sigmoid', 'calib_cv': 5}. Best is trial 201 with value: 0.10234078863893352.
[I 2026-02-26 16:52:47,046] Trial 301 pruned. 
[I 2026-02-26 16:55:16,035] Trial 302 pruned. 
[I 2026-02-26 16:56:35,415] Trial 303 finished with value: 0.10258164900112043 and parameters: {'kernel': 'rbf', 'class_weight_mode': 'custom', 'pos_weight': 15.203838638765674, 'C': 0.023297808489269066, 'gamma': 0.06598327549147712, 'calib_method': 'sigmoid', 'calib_cv': 5}. Best is trial 201 with value: 0.10234078863893352.
[I 2026-02-26 16:58:08,444] Trial 304 pruned. 
[I 2026-02-26 16:59:25,716] Trial 305 pruned. 
[I 2026-02-26 17:00:27,489] Trial 306 pruned. 
[I 2026-02-26 17:00:28,721] Trial 307 pruned. 
[I 2026-02-26 17:01:26,143] Trial 308 pruned. 
[I 2026-02-26 17:02:36,567] Trial 309 pruned. 
[I 2026-02-26 17:03:08,928] Trial 310 pruned. 
[I 2026-02-26 17:04:23,534] Trial 311 pruned. 
[I 2026-02-26 17:05:54,376] Trial 312 finished with value: 0.10440931476863305 and parameters: {'kernel': 'rbf', 'class_weight_mode': 'custom', 'pos_weight': 16.3626438529121, 'C': 0.013783196939235791, 'gamma': 0.10529869983979838, 'calib_method': 'sigmoid', 'calib_cv': 5}. Best is trial 201 with value: 0.10234078863893352.
[I 2026-02-26 17:07:11,213] Trial 313 finished with value: 0.1024702815966783 and parameters: {'kernel': 'rbf', 'class_weight_mode': 'custom', 'pos_weight': 14.552634517901092, 'C': 0.021845775675997135, 'gamma': 0.06056594088275329, 'calib_method': 'sigmoid', 'calib_cv': 5}. Best is trial 201 with value: 0.10234078863893352.
[I 2026-02-26 17:09:03,263] Trial 314 pruned. 
[I 2026-02-26 17:10:22,636] Trial 315 pruned. 
[I 2026-02-26 17:11:39,903] Trial 316 finished with value: 0.10284710401627314 and parameters: {'kernel': 'rbf', 'class_weight_mode': 'custom', 'pos_weight': 14.50470074334181, 'C': 0.027193864496239045, 'gamma': 0.08192294909186724, 'calib_method': 'sigmoid', 'calib_cv': 5}. Best is trial 201 with value: 0.10234078863893352.
[I 2026-02-26 17:13:06,673] Trial 317 pruned. 
[I 2026-02-26 17:14:25,173] Trial 318 pruned. 
[I 2026-02-26 17:14:58,921] Trial 319 finished with value: 0.10282887720359375 and parameters: {'kernel': 'rbf', 'class_weight_mode': 'custom', 'pos_weight': 11.92035149290274, 'C': 0.02017808107396699, 'gamma': 0.1006156687492339, 'calib_method': 'sigmoid', 'calib_cv': 3}. Best is trial 201 with value: 0.10234078863893352.
[I 2026-02-26 17:15:02,662] Trial 320 pruned. 
[I 2026-02-26 17:16:10,988] Trial 321 pruned. 
[I 2026-02-26 17:17:34,074] Trial 322 pruned. 
[I 2026-02-26 17:18:47,375] Trial 323 pruned. 
[I 2026-02-26 17:23:53,027] Trial 324 pruned. 
[I 2026-02-26 17:25:12,506] Trial 325 pruned. 
[I 2026-02-26 17:27:34,851] Trial 326 pruned. 
[I 2026-02-26 17:28:51,711] Trial 327 pruned. 
[I 2026-02-26 17:30:06,369] Trial 328 finished with value: 0.102547151452229 and parameters: {'kernel': 'rbf', 'class_weight_mode': 'custom', 'pos_weight': 13.390713714100766, 'C': 0.01602552335614162, 'gamma': 0.06229734736021043, 'calib_method': 'sigmoid', 'calib_cv': 5}. Best is trial 201 with value: 0.10234078863893352.
[I 2026-02-26 17:31:13,134] Trial 329 finished with value: 0.10331920844119417 and parameters: {'kernel': 'rbf', 'class_weight_mode': 'custom', 'pos_weight': 11.472601436946505, 'C': 0.014258742133446458, 'gamma': 0.09414027719705675, 'calib_method': 'sigmoid', 'calib_cv': 5}. Best is trial 201 with value: 0.10234078863893352.
[I 2026-02-26 17:31:44,320] Trial 330 pruned. 
[I 2026-02-26 17:32:19,289] Trial 331 pruned. 
[I 2026-02-26 17:33:26,782] Trial 332 pruned. 
[I 2026-02-26 17:34:10,351] Trial 333 finished with value: 0.10717093199363248 and parameters: {'kernel': 'rbf', 'class_weight_mode': 'custom', 'pos_weight': 84.2294966337745, 'C': 1.0486309402834726, 'gamma': 0.1231410147194522, 'calib_method': 'sigmoid', 'calib_cv': 5}. Best is trial 201 with value: 0.10234078863893352.
[I 2026-02-26 17:35:25,973] Trial 334 finished with value: 0.10256248634787295 and parameters: {'kernel': 'rbf', 'class_weight_mode': 'custom', 'pos_weight': 13.611418421110695, 'C': 0.01727260641138775, 'gamma': 0.06621723728072149, 'calib_method': 'sigmoid', 'calib_cv': 5}. Best is trial 201 with value: 0.10234078863893352.
[I 2026-02-26 17:36:36,085] Trial 335 pruned. 
[I 2026-02-26 17:37:52,226] Trial 336 finished with value: 0.10284952543461927 and parameters: {'kernel': 'rbf', 'class_weight_mode': 'custom', 'pos_weight': 13.720787739922194, 'C': 0.024305670066639282, 'gamma': 0.08216405463589907, 'calib_method': 'sigmoid', 'calib_cv': 5}. Best is trial 201 with value: 0.10234078863893352.
[I 2026-02-26 17:39:02,334] Trial 337 pruned. 
[I 2026-02-26 17:40:25,621] Trial 338 finished with value: 0.10250940894643487 and parameters: {'kernel': 'rbf', 'class_weight_mode': 'custom', 'pos_weight': 15.444430445426839, 'C': 0.014644315173580946, 'gamma': 0.05589864673501562, 'calib_method': 'sigmoid', 'calib_cv': 5}. Best is trial 201 with value: 0.10234078863893352.
[I 2026-02-26 17:41:54,445] Trial 339 finished with value: 0.10273527079421756 and parameters: {'kernel': 'rbf', 'class_weight_mode': 'custom', 'pos_weight': 16.50638276776302, 'C': 0.011381205441825947, 'gamma': 0.05966143941536967, 'calib_method': 'sigmoid', 'calib_cv': 5}. Best is trial 201 with value: 0.10234078863893352.
[I 2026-02-26 17:43:18,550] Trial 340 finished with value: 0.10308427994349494 and parameters: {'kernel': 'rbf', 'class_weight_mode': 'custom', 'pos_weight': 15.373726954482342, 'C': 0.014089337819891232, 'gamma': 0.078608307815741, 'calib_method': 'sigmoid', 'calib_cv': 5}. Best is trial 201 with value: 0.10234078863893352.
[I 2026-02-26 17:45:04,778] Trial 341 pruned. 
[I 2026-02-26 17:45:06,327] Trial 342 pruned. 
[I 2026-02-26 17:49:31,412] Trial 343 pruned. 
[I 2026-02-26 17:50:52,198] Trial 344 finished with value: 0.10384092967346428 and parameters: {'kernel': 'rbf', 'class_weight_mode': 'custom', 'pos_weight': 14.10828971965319, 'C': 0.01326915147486797, 'gamma': 0.10232355455272911, 'calib_method': 'sigmoid', 'calib_cv': 5}. Best is trial 201 with value: 0.10234078863893352.
[I 2026-02-26 17:51:45,084] Trial 345 pruned. 
[I 2026-02-26 17:53:05,061] Trial 346 pruned. 
[I 2026-02-26 17:54:10,804] Trial 347 pruned. 
[I 2026-02-26 17:54:41,459] Trial 348 pruned. 
[I 2026-02-26 17:55:40,899] Trial 349 pruned. 
[I 2026-02-26 17:57:10,124] Trial 350 finished with value: 0.10293452426693694 and parameters: {'kernel': 'rbf', 'class_weight_mode': 'custom', 'pos_weight': 16.879295629681454, 'C': 0.016629766913732934, 'gamma': 0.0749673869956104, 'calib_method': 'sigmoid', 'calib_cv': 5}. Best is trial 201 with value: 0.10234078863893352.
[I 2026-02-26 17:58:02,352] Trial 351 pruned. 
[I 2026-02-26 17:59:25,288] Trial 352 pruned. 
[I 2026-02-26 18:00:44,809] Trial 353 finished with value: 0.10306683888044894 and parameters: {'kernel': 'rbf', 'class_weight_mode': 'custom', 'pos_weight': 15.003079358519072, 'C': 0.0271027874395363, 'gamma': 0.08890531057079244, 'calib_method': 'sigmoid', 'calib_cv': 5}. Best is trial 201 with value: 0.10234078863893352.
[I 2026-02-26 18:01:19,803] Trial 354 pruned. 
[I 2026-02-26 18:02:31,519] Trial 355 finished with value: 0.10262249883459358 and parameters: {'kernel': 'rbf', 'class_weight_mode': 'custom', 'pos_weight': 12.875504538908016, 'C': 0.013256466562209088, 'gamma': 0.06452318091104367, 'calib_method': 'sigmoid', 'calib_cv': 5}. Best is trial 201 with value: 0.10234078863893352.
[I 2026-02-26 18:04:05,192] Trial 356 pruned. 
[I 2026-02-26 18:06:05,664] Trial 357 pruned. 
[I 2026-02-26 18:07:30,241] Trial 358 finished with value: 0.10281605570817438 and parameters: {'kernel': 'rbf', 'class_weight_mode': 'custom', 'pos_weight': 16.062402001475963, 'C': 0.019779886446929146, 'gamma': 0.07510795051462975, 'calib_method': 'sigmoid', 'calib_cv': 5}. Best is trial 201 with value: 0.10234078863893352.
[I 2026-02-26 18:08:13,655] Trial 359 pruned. 
[I 2026-02-26 18:08:16,334] Trial 360 pruned. 
[I 2026-02-26 18:08:55,346] Trial 361 pruned. 
[I 2026-02-26 18:10:14,860] Trial 362 finished with value: 0.10256575543363045 and parameters: {'kernel': 'rbf', 'class_weight_mode': 'custom', 'pos_weight': 14.536568018157968, 'C': 0.014978129575389312, 'gamma': 0.06293450429413876, 'calib_method': 'sigmoid', 'calib_cv': 5}. Best is trial 201 with value: 0.10234078863893352.
[I 2026-02-26 18:11:28,707] Trial 363 finished with value: 0.10327384420232873 and parameters: {'kernel': 'rbf', 'class_weight_mode': 'custom', 'pos_weight': 12.919488328817348, 'C': 0.011947916845321283, 'gamma': 0.09095606534866398, 'calib_method': 'sigmoid', 'calib_cv': 5}. Best is trial 201 with value: 0.10234078863893352.
[I 2026-02-26 18:12:49,880] Trial 364 pruned. 
[I 2026-02-26 18:13:29,064] Trial 365 pruned. 
[I 2026-02-26 18:14:37,360] Trial 366 pruned. 
[I 2026-02-26 18:15:41,375] Trial 367 finished with value: 0.10279107651502477 and parameters: {'kernel': 'rbf', 'class_weight_mode': 'custom', 'pos_weight': 11.231618831458857, 'C': 0.031150234836582205, 'gamma': 0.07491053909919364, 'calib_method': 'sigmoid', 'calib_cv': 5}. Best is trial 201 with value: 0.10234078863893352.
[I 2026-02-26 18:16:57,802] Trial 368 pruned. 
[I 2026-02-26 18:19:35,492] Trial 369 pruned. 
[I 2026-02-26 18:20:50,159] Trial 370 pruned. 
[I 2026-02-26 18:22:13,333] Trial 371 finished with value: 0.10317149349325214 and parameters: {'kernel': 'rbf', 'class_weight_mode': 'custom', 'pos_weight': 15.362110867207326, 'C': 0.01960420884529421, 'gamma': 0.08767981085663809, 'calib_method': 'sigmoid', 'calib_cv': 5}. Best is trial 201 with value: 0.10234078863893352.
[I 2026-02-26 18:23:24,057] Trial 372 finished with value: 0.10258066213549251 and parameters: {'kernel': 'rbf', 'class_weight_mode': 'custom', 'pos_weight': 12.905005114552205, 'C': 0.026570701450368734, 'gamma': 0.07067950058650815, 'calib_method': 'sigmoid', 'calib_cv': 5}. Best is trial 201 with value: 0.10234078863893352.
[I 2026-02-26 18:24:43,257] Trial 373 pruned. 
[I 2026-02-26 18:25:53,361] Trial 374 finished with value: 0.10398219811916773 and parameters: {'kernel': 'rbf', 'class_weight_mode': 'custom', 'pos_weight': 11.834990180322954, 'C': 0.014964251433679495, 'gamma': 0.1131169774630503, 'calib_method': 'sigmoid', 'calib_cv': 5}. Best is trial 201 with value: 0.10234078863893352.
[I 2026-02-26 18:27:07,367] Trial 375 pruned. 
[I 2026-02-26 18:27:48,349] Trial 376 pruned. 
[I 2026-02-26 18:28:57,024] Trial 377 pruned. 
[I 2026-02-26 18:30:18,354] Trial 378 finished with value: 0.10270958286119089 and parameters: {'kernel': 'rbf', 'class_weight_mode': 'custom', 'pos_weight': 14.83503910551947, 'C': 0.01648005897596971, 'gamma': 0.06994843892560411, 'calib_method': 'sigmoid', 'calib_cv': 5}. Best is trial 201 with value: 0.10234078863893352.
[I 2026-02-26 18:30:19,275] Trial 379 pruned. 
[I 2026-02-26 18:31:36,525] Trial 380 pruned. 
[I 2026-02-26 18:32:47,297] Trial 381 pruned. 
[I 2026-02-26 18:34:12,729] Trial 382 pruned. 
[I 2026-02-26 18:35:21,096] Trial 383 pruned. 
[I 2026-02-26 18:36:46,768] Trial 384 finished with value: 0.10295099656135587 and parameters: {'kernel': 'rbf', 'class_weight_mode': 'custom', 'pos_weight': 15.357229219810073, 'C': 0.011563674706691887, 'gamma': 0.07240391977432373, 'calib_method': 'sigmoid', 'calib_cv': 5}. Best is trial 201 with value: 0.10234078863893352.
[I 2026-02-26 18:37:54,864] Trial 385 pruned. 
[I 2026-02-26 18:39:11,141] Trial 386 pruned. 
[I 2026-02-26 18:40:20,005] Trial 387 pruned. 
[I 2026-02-26 18:41:00,201] Trial 388 finished with value: 0.10304086141628895 and parameters: {'kernel': 'rbf', 'class_weight_mode': 'custom', 'pos_weight': 14.878532760869541, 'C': 0.014856432868904852, 'gamma': 0.08594578064411099, 'calib_method': 'sigmoid', 'calib_cv': 3}. Best is trial 201 with value: 0.10234078863893352.
[I 2026-02-26 18:42:15,662] Trial 389 pruned. 
[I 2026-02-26 18:43:25,913] Trial 390 finished with value: 0.10263081473724159 and parameters: {'kernel': 'rbf', 'class_weight_mode': 'custom', 'pos_weight': 12.588086473736208, 'C': 0.026325822481099995, 'gamma': 0.07212597121236067, 'calib_method': 'sigmoid', 'calib_cv': 5}. Best is trial 201 with value: 0.10234078863893352.
[I 2026-02-26 18:44:49,536] Trial 391 finished with value: 0.10440376769401176 and parameters: {'kernel': 'rbf', 'class_weight_mode': 'custom', 'pos_weight': 14.539888238940543, 'C': 0.020566381651453036, 'gamma': 0.11682531805735231, 'calib_method': 'sigmoid', 'calib_cv': 5}. Best is trial 201 with value: 0.10234078863893352.
[I 2026-02-26 18:46:16,910] Trial 392 pruned. 
[I 2026-02-26 18:47:18,839] Trial 393 pruned. 
[I 2026-02-26 18:47:52,880] Trial 394 pruned. 
[I 2026-02-26 18:49:53,493] Trial 395 pruned. 
[I 2026-02-26 18:51:08,906] Trial 396 pruned. 
[I 2026-02-26 18:52:19,481] Trial 397 pruned. 
[I 2026-02-26 18:52:21,182] Trial 398 pruned. 
[I 2026-02-26 18:52:54,130] Trial 399 finished with value: 0.10218229982833356 and parameters: {'kernel': 'rbf', 'class_weight_mode': 'custom', 'pos_weight': 11.787226009150704, 'C': 0.01334832080426834, 'gamma': 0.07381519266289431, 'calib_method': 'sigmoid', 'calib_cv': 3}. Best is trial 399 with value: 0.10218229982833356.
[I 2026-02-26 18:53:42,684] Trial 400 pruned. 
