[I 2026-02-26 11:12:25,582] Trial 111 finished with value: 1.1522948257970103 and parameters: {'kernel': 'linear', 'class_weight': None, 'C': 0.0016672612478310462, 'tol': 0.0002990343043692989, 'max_iter': 7308, 'calib_method': 'sigmoid', 'calib_cv': 3}. Best is trial 95 with value: 1.148206741777215.
[I 2026-02-26 11:12:25,835] Trial 112 pruned. 
[I 2026-02-26 11:12:26,195] Trial 113 finished with value: 1.148508158148817 and parameters: {'kernel': 'linear', 'class_weight': None, 'C': 0.0026414753791502476, 'tol': 0.0005110530366590147, 'max_iter': 5997, 'calib_method': 'sigmoid', 'calib_cv': 3}. Best is trial 95 with value: 1.148206741777215.
[I 2026-02-26 11:12:26,485] Trial 114 pruned. 
[I 2026-02-26 11:12:26,834] Trial 115 finished with value: 1.1494452438732643 and parameters: {'kernel': 'linear', 'class_weight': None, 'C': 0.0022123918024276453, 'tol': 0.0014245053629590562, 'max_iter': 3909, 'calib_method': 'sigmoid', 'calib_cv': 3}. Best is trial 95 with value: 1.148206741777215.
[I 2026-02-26 11:12:28,128] Trial 116 pruned. 
[I 2026-02-26 11:12:28,394] Trial 117 pruned. 
[I 2026-02-26 11:12:29,027] Trial 118 pruned. 
[I 2026-02-26 11:12:29,296] Trial 119 pruned. 
[I 2026-02-26 11:12:29,587] Trial 120 pruned. 
[I 2026-02-26 11:12:29,934] Trial 121 finished with value: 1.1508741070095805 and parameters: {'kernel': 'linear', 'class_weight': None, 'C': 0.0018832722350326243, 'tol': 0.00039288662765290573, 'max_iter': 4224, 'calib_method': 'sigmoid', 'calib_cv': 3}. Best is trial 95 with value: 1.148206741777215.
[I 2026-02-26 11:12:30,281] Trial 122 finished with value: 1.1486480511147072 and parameters: {'kernel': 'linear', 'class_weight': None, 'C': 0.0025466049313479827, 'tol': 0.0008856176199444573, 'max_iter': 16507, 'calib_method': 'sigmoid', 'calib_cv': 3}. Best is trial 95 with value: 1.148206741777215.
[I 2026-02-26 11:12:30,540] Trial 123 pruned. 
[I 2026-02-26 11:12:30,813] Trial 124 pruned. 
[I 2026-02-26 11:12:31,154] Trial 125 finished with value: 1.1482606603952403 and parameters: {'kernel': 'linear', 'class_weight': None, 'C': 0.002922682620195183, 'tol': 0.0012844427341067034, 'max_iter': 5029, 'calib_method': 'sigmoid', 'calib_cv': 3}. Best is trial 95 with value: 1.148206741777215.
[I 2026-02-26 11:12:31,425] Trial 126 pruned. 
[I 2026-02-26 11:12:31,759] Trial 127 finished with value: 1.3821160204313254 and parameters: {'kernel': 'linear', 'class_weight': None, 'C': 0.003023871301400145, 'tol': 0.00033029764554886004, 'max_iter': 5705, 'calib_method': 'isotonic', 'calib_cv': 3}. Best is trial 95 with value: 1.148206741777215.
[I 2026-02-26 11:12:32,119] Trial 128 finished with value: 1.1493611484275963 and parameters: {'kernel': 'linear', 'class_weight': None, 'C': 0.0022386853295280995, 'tol': 0.00017286011719690165, 'max_iter': 4359, 'calib_method': 'sigmoid', 'calib_cv': 3}. Best is trial 95 with value: 1.148206741777215.
[I 2026-02-26 11:12:33,311] Trial 129 pruned. 
[I 2026-02-26 11:12:33,690] Trial 130 finished with value: 1.1530800696408623 and parameters: {'kernel': 'linear', 'class_weight': None, 'C': 0.0015722586989663295, 'tol': 4.533846526444959e-06, 'max_iter': 2865, 'calib_method': 'sigmoid', 'calib_cv': 3}. Best is trial 95 with value: 1.148206741777215.
[I 2026-02-26 11:12:33,964] Trial 131 pruned. 
[I 2026-02-26 11:12:34,375] Trial 132 finished with value: 1.148385429973636 and parameters: {'kernel': 'linear', 'class_weight': None, 'C': 0.0027516044175130046, 'tol': 0.0013238886564226713, 'max_iter': 8052, 'calib_method': 'sigmoid', 'calib_cv': 3}. Best is trial 95 with value: 1.148206741777215.
[I 2026-02-26 11:12:34,742] Trial 133 finished with value: 1.1504523753673654 and parameters: {'kernel': 'linear', 'class_weight': None, 'C': 0.001963282273090906, 'tol': 0.0007341608965571283, 'max_iter': 3831, 'calib_method': 'sigmoid', 'calib_cv': 3}. Best is trial 95 with value: 1.148206741777215.
[I 2026-02-26 11:12:35,119] Trial 134 pruned. 
[I 2026-02-26 11:12:35,433] Trial 135 pruned. 
[I 2026-02-26 11:12:35,786] Trial 136 finished with value: 1.1484784524459235 and parameters: {'kernel': 'linear', 'class_weight': None, 'C': 0.0026661973811672305, 'tol': 0.0004648729735760301, 'max_iter': 10436, 'calib_method': 'sigmoid', 'calib_cv': 3}. Best is trial 95 with value: 1.148206741777215.
[I 2026-02-26 11:12:36,096] Trial 137 pruned. 
[I 2026-02-26 11:12:36,405] Trial 138 pruned. 
[I 2026-02-26 11:12:36,699] Trial 139 pruned. 
[I 2026-02-26 11:12:37,093] Trial 140 finished with value: 1.149779172551341 and parameters: {'kernel': 'linear', 'class_weight': None, 'C': 0.0021179709062564066, 'tol': 0.002035782068103468, 'max_iter': 5470, 'calib_method': 'sigmoid', 'calib_cv': 3}. Best is trial 95 with value: 1.148206741777215.
[I 2026-02-26 11:12:37,489] Trial 141 finished with value: 1.1529203492183 and parameters: {'kernel': 'linear', 'class_weight': None, 'C': 0.0015904770737697029, 'tol': 0.0005262303923458396, 'max_iter': 6266, 'calib_method': 'sigmoid', 'calib_cv': 3}. Best is trial 95 with value: 1.148206741777215.
[I 2026-02-26 11:12:37,872] Trial 142 finished with value: 1.148304000325091 and parameters: {'kernel': 'linear', 'class_weight': None, 'C': 0.0028474872247304353, 'tol': 0.001318915283544957, 'max_iter': 7737, 'calib_method': 'sigmoid', 'calib_cv': 3}. Best is trial 95 with value: 1.148206741777215.
[I 2026-02-26 11:12:38,157] Trial 143 pruned. 
[I 2026-02-26 11:12:38,470] Trial 144 pruned. 
[I 2026-02-26 11:12:38,850] Trial 145 finished with value: 1.1490082663208487 and parameters: {'kernel': 'linear', 'class_weight': None, 'C': 0.002367034180927314, 'tol': 2.6531577284285632e-05, 'max_iter': 7645, 'calib_method': 'sigmoid', 'calib_cv': 3}. Best is trial 95 with value: 1.148206741777215.
[I 2026-02-26 11:12:39,146] Trial 146 pruned. 
[I 2026-02-26 11:12:39,425] Trial 147 pruned. 
[I 2026-02-26 11:12:39,833] Trial 148 finished with value: 1.3629201860710083 and parameters: {'kernel': 'linear', 'class_weight': None, 'C': 0.004372086837913529, 'tol': 0.0004074813416739803, 'max_iter': 13138, 'calib_method': 'isotonic', 'calib_cv': 3}. Best is trial 95 with value: 1.148206741777215.
[I 2026-02-26 11:12:40,243] Trial 149 finished with value: 1.1518106642749684 and parameters: {'kernel': 'linear', 'class_weight': None, 'C': 0.0017336098656705622, 'tol': 0.0008566633981805655, 'max_iter': 3465, 'calib_method': 'sigmoid', 'calib_cv': 3}. Best is trial 95 with value: 1.148206741777215.
[I 2026-02-26 11:12:41,264] Trial 150 pruned. 
[I 2026-02-26 11:12:41,530] Trial 151 pruned. 
[I 2026-02-26 11:12:41,913] Trial 152 finished with value: 1.1486134135596333 and parameters: {'kernel': 'linear', 'class_weight': None, 'C': 0.002567996095635997, 'tol': 0.0012543766855139882, 'max_iter': 7211, 'calib_method': 'sigmoid', 'calib_cv': 3}. Best is trial 95 with value: 1.148206741777215.
[I 2026-02-26 11:12:42,199] Trial 153 pruned. 
[I 2026-02-26 11:12:42,574] Trial 154 finished with value: 1.1499423502892392 and parameters: {'kernel': 'linear', 'class_weight': None, 'C': 0.0020764098011440994, 'tol': 0.0013269901668466956, 'max_iter': 8036, 'calib_method': 'sigmoid', 'calib_cv': 3}. Best is trial 95 with value: 1.148206741777215.
[I 2026-02-26 11:12:42,843] Trial 155 pruned. 
[I 2026-02-26 11:12:43,184] Trial 156 pruned. 
[I 2026-02-26 11:12:43,474] Trial 157 pruned. 
[I 2026-02-26 11:12:43,773] Trial 158 pruned. 
[I 2026-02-26 11:12:44,184] Trial 159 finished with value: 1.1516393319532887 and parameters: {'kernel': 'linear', 'class_weight': None, 'C': 0.0017588863698233639, 'tol': 0.0023360765751047345, 'max_iter': 3995, 'calib_method': 'sigmoid', 'calib_cv': 3}. Best is trial 95 with value: 1.148206741777215.
[I 2026-02-26 11:12:44,449] Trial 160 pruned. 
[I 2026-02-26 11:12:44,718] Trial 161 pruned. 
[I 2026-02-26 11:12:45,084] Trial 162 pruned. 
[I 2026-02-26 11:12:45,474] Trial 163 finished with value: 1.1494045291465071 and parameters: {'kernel': 'linear', 'class_weight': None, 'C': 0.002225224857897393, 'tol': 0.0013571577177019954, 'max_iter': 3745, 'calib_method': 'sigmoid', 'calib_cv': 3}. Best is trial 95 with value: 1.148206741777215.
[I 2026-02-26 11:12:45,744] Trial 164 pruned. 
[I 2026-02-26 11:12:46,071] Trial 165 pruned. 
[I 2026-02-26 11:12:46,372] Trial 166 pruned. 
[I 2026-02-26 11:12:46,727] Trial 167 finished with value: 1.150558379586707 and parameters: {'kernel': 'linear', 'class_weight': None, 'C': 0.0019421885196117346, 'tol': 0.0006997104571865608, 'max_iter': 7471, 'calib_method': 'sigmoid', 'calib_cv': 3}. Best is trial 95 with value: 1.148206741777215.
[I 2026-02-26 11:12:46,986] Trial 168 pruned. 
[I 2026-02-26 11:12:47,340] Trial 169 finished with value: 1.1487380006260508 and parameters: {'kernel': 'linear', 'class_weight': None, 'C': 0.0024945359301836935, 'tol': 0.0008236767361005907, 'max_iter': 6888, 'calib_method': 'sigmoid', 'calib_cv': 3}. Best is trial 95 with value: 1.148206741777215.
[I 2026-02-26 11:12:47,624] Trial 170 pruned. 
[I 2026-02-26 11:12:47,980] Trial 171 finished with value: 1.3224584892856308 and parameters: {'kernel': 'linear', 'class_weight': None, 'C': 0.0013382461862117894, 'tol': 0.0005510971541678308, 'max_iter': 3294, 'calib_method': 'isotonic', 'calib_cv': 3}. Best is trial 95 with value: 1.148206741777215.
[I 2026-02-26 11:12:48,355] Trial 172 finished with value: 1.1484902146212699 and parameters: {'kernel': 'linear', 'class_weight': None, 'C': 0.002656679951501724, 'tol': 0.00045565116330100223, 'max_iter': 11019, 'calib_method': 'sigmoid', 'calib_cv': 3}. Best is trial 95 with value: 1.148206741777215.
[I 2026-02-26 11:12:48,627] Trial 173 pruned. 
[I 2026-02-26 11:12:50,092] Trial 174 finished with value: 1.1493001354888097 and parameters: {'kernel': 'linear', 'class_weight': None, 'C': 0.0022589482262895563, 'tol': 0.0006146174316171365, 'max_iter': 10136, 'calib_method': 'sigmoid', 'calib_cv': 3}. Best is trial 95 with value: 1.148206741777215.
[I 2026-02-26 11:12:50,363] Trial 175 pruned. 
[I 2026-02-26 11:12:50,632] Trial 176 pruned. 
[I 2026-02-26 11:12:51,021] Trial 177 finished with value: 1.1504809537534253 and parameters: {'kernel': 'linear', 'class_weight': None, 'C': 0.0019577135813886337, 'tol': 0.00036366725239536267, 'max_iter': 3607, 'calib_method': 'sigmoid', 'calib_cv': 3}. Best is trial 95 with value: 1.148206741777215.
[I 2026-02-26 11:12:52,110] Trial 178 pruned. 
[I 2026-02-26 11:12:52,470] Trial 179 pruned. 
[I 2026-02-26 11:12:52,836] Trial 180 finished with value: 1.1519908663325507 and parameters: {'kernel': 'linear', 'class_weight': None, 'C': 0.0017081491642915998, 'tol': 0.00045460937275847407, 'max_iter': 4364, 'calib_method': 'sigmoid', 'calib_cv': 3}. Best is trial 95 with value: 1.148206741777215.
[I 2026-02-26 11:12:53,122] Trial 181 pruned. 
[I 2026-02-26 11:12:53,404] Trial 182 pruned. 
[I 2026-02-26 11:12:53,776] Trial 183 finished with value: 1.1487763031436395 and parameters: {'kernel': 'linear', 'class_weight': None, 'C': 0.002474087955533443, 'tol': 0.000519635524057615, 'max_iter': 11462, 'calib_method': 'sigmoid', 'calib_cv': 3}. Best is trial 95 with value: 1.148206741777215.
[I 2026-02-26 11:12:54,038] Trial 184 pruned. 
[I 2026-02-26 11:12:54,415] Trial 185 finished with value: 1.1492370735906234 and parameters: {'kernel': 'linear', 'class_weight': None, 'C': 0.002280419653607992, 'tol': 0.0006102881341217847, 'max_iter': 9778, 'calib_method': 'sigmoid', 'calib_cv': 3}. Best is trial 95 with value: 1.148206741777215.
[I 2026-02-26 11:12:54,687] Trial 186 pruned. 
[I 2026-02-26 11:12:54,963] Trial 187 pruned. 
[I 2026-02-26 11:12:56,721] Trial 188 pruned. 
[I 2026-02-26 11:12:56,983] Trial 189 pruned. 
[I 2026-02-26 11:12:57,262] Trial 190 pruned. 
[I 2026-02-26 11:12:57,543] Trial 191 pruned. 
[I 2026-02-26 11:12:57,889] Trial 192 finished with value: 1.148503805201646 and parameters: {'kernel': 'linear', 'class_weight': None, 'C': 0.002644985184713979, 'tol': 0.000516040585034868, 'max_iter': 6151, 'calib_method': 'sigmoid', 'calib_cv': 3}. Best is trial 95 with value: 1.148206741777215.
[I 2026-02-26 11:12:58,164] Trial 193 pruned. 
[I 2026-02-26 11:12:58,514] Trial 194 finished with value: 1.148659558116575 and parameters: {'kernel': 'linear', 'class_weight': None, 'C': 0.0025394828785188224, 'tol': 0.0006061594307823405, 'max_iter': 6253, 'calib_method': 'sigmoid', 'calib_cv': 3}. Best is trial 95 with value: 1.148206741777215.
[I 2026-02-26 11:12:58,868] Trial 195 finished with value: 1.1495963147067885 and parameters: {'kernel': 'linear', 'class_weight': None, 'C': 0.002167418068130922, 'tol': 0.00040285202499703156, 'max_iter': 5915, 'calib_method': 'sigmoid', 'calib_cv': 3}. Best is trial 95 with value: 1.148206741777215.
[I 2026-02-26 11:12:59,143] Trial 196 pruned. 
[I 2026-02-26 11:12:59,422] Trial 197 pruned. 
[I 2026-02-26 11:12:59,719] Trial 198 pruned. 
[I 2026-02-26 11:12:59,998] Trial 199 pruned. 
[I 2026-02-26 11:13:00,385] Trial 200 finished with value: 1.1513172040070754 and parameters: {'kernel': 'linear', 'class_weight': None, 'C': 0.0018085377346103038, 'tol': 0.0011910214080611175, 'max_iter': 3785, 'calib_method': 'sigmoid', 'calib_cv': 3}. Best is trial 95 with value: 1.148206741777215.
[I 2026-02-26 11:13:00,774] Trial 201 finished with value: 1.361711984494017 and parameters: {'kernel': 'linear', 'class_weight': None, 'C': 0.0038645075042682215, 'tol': 0.0006426136125480316, 'max_iter': 8250, 'calib_method': 'isotonic', 'calib_cv': 3}. Best is trial 95 with value: 1.148206741777215.
[I 2026-02-26 11:13:01,066] Trial 202 pruned. 
[I 2026-02-26 11:13:01,503] Trial 203 finished with value: 1.1492184813688218 and parameters: {'kernel': 'linear', 'class_weight': None, 'C': 0.002286780570911862, 'tol': 0.0005417951721071891, 'max_iter': 6575, 'calib_method': 'sigmoid', 'calib_cv': 3}. Best is trial 95 with value: 1.148206741777215.
[I 2026-02-26 11:13:01,778] Trial 204 pruned. 
[I 2026-02-26 11:13:02,047] Trial 205 pruned. 
[I 2026-02-26 11:13:02,438] Trial 206 finished with value: 1.1496649008775135 and parameters: {'kernel': 'linear', 'class_weight': None, 'C': 0.0021483466193997227, 'tol': 0.0010088087373710827, 'max_iter': 5492, 'calib_method': 'sigmoid', 'calib_cv': 3}. Best is trial 95 with value: 1.148206741777215.
[I 2026-02-26 11:13:02,714] Trial 207 pruned. 
[I 2026-02-26 11:13:03,029] Trial 208 pruned. 
[I 2026-02-26 11:13:04,189] Trial 209 pruned. 
[I 2026-02-26 11:13:04,505] Trial 210 pruned. 
[I 2026-02-26 11:13:04,805] Trial 211 pruned. 
[I 2026-02-26 11:13:05,164] Trial 212 finished with value: 1.1487734569206718 and parameters: {'kernel': 'linear', 'class_weight': None, 'C': 0.0024758476064273304, 'tol': 0.000509814564131388, 'max_iter': 2408, 'calib_method': 'sigmoid', 'calib_cv': 3}. Best is trial 95 with value: 1.148206741777215.
[I 2026-02-26 11:13:05,448] Trial 213 pruned. 
[I 2026-02-26 11:13:05,823] Trial 214 finished with value: 1.1492122772033238 and parameters: {'kernel': 'linear', 'class_weight': None, 'C': 0.002289233167653053, 'tol': 0.0006668081040740162, 'max_iter': 2318, 'calib_method': 'sigmoid', 'calib_cv': 3}. Best is trial 95 with value: 1.148206741777215.
[I 2026-02-26 11:13:06,188] Trial 215 finished with value: 1.150798523525658 and parameters: {'kernel': 'linear', 'class_weight': None, 'C': 0.0018969495461219322, 'tol': 0.00046444769484798893, 'max_iter': 2021, 'calib_method': 'sigmoid', 'calib_cv': 3}. Best is trial 95 with value: 1.148206741777215.
[I 2026-02-26 11:13:06,459] Trial 216 pruned. 
[I 2026-02-26 11:13:06,737] Trial 217 pruned. 
[I 2026-02-26 11:13:07,193] Trial 218 pruned. 
[I 2026-02-26 11:13:07,497] Trial 219 pruned. 
[I 2026-02-26 11:13:07,809] Trial 220 pruned. 
[I 2026-02-26 11:13:08,119] Trial 221 pruned. 
[I 2026-02-26 11:13:08,403] Trial 222 pruned. 
[I 2026-02-26 11:13:08,751] Trial 223 finished with value: 1.1494752675806728 and parameters: {'kernel': 'linear', 'class_weight': None, 'C': 0.0022029884956284874, 'tol': 0.00039259992412963744, 'max_iter': 2740, 'calib_method': 'sigmoid', 'calib_cv': 3}. Best is trial 95 with value: 1.148206741777215.
[I 2026-02-26 11:13:09,029] Trial 224 pruned. 
[I 2026-02-26 11:13:09,388] Trial 225 pruned. 
[I 2026-02-26 11:13:09,674] Trial 226 pruned. 
[I 2026-02-26 11:13:09,963] Trial 227 pruned. 
[I 2026-02-26 11:13:10,327] Trial 228 finished with value: 1.150567427504828 and parameters: {'kernel': 'linear', 'class_weight': None, 'C': 0.0019404620993241123, 'tol': 0.0008186057211549078, 'max_iter': 2193, 'calib_method': 'sigmoid', 'calib_cv': 3}. Best is trial 95 with value: 1.148206741777215.
[I 2026-02-26 11:13:10,693] Trial 229 finished with value: 1.1487588117391234 and parameters: {'kernel': 'linear', 'class_weight': None, 'C': 0.0024831644780052733, 'tol': 0.0005886233310776604, 'max_iter': 4822, 'calib_method': 'sigmoid', 'calib_cv': 3}. Best is trial 95 with value: 1.148206741777215.
[I 2026-02-26 11:13:10,969] Trial 230 pruned. 
[I 2026-02-26 11:13:11,320] Trial 231 finished with value: 1.3678843288109142 and parameters: {'kernel': 'linear', 'class_weight': None, 'C': 0.003095518689286629, 'tol': 0.0006761128575174199, 'max_iter': 3437, 'calib_method': 'isotonic', 'calib_cv': 3}. Best is trial 95 with value: 1.148206741777215.
[I 2026-02-26 11:13:11,672] Trial 232 finished with value: 1.1488545242627617 and parameters: {'kernel': 'linear', 'class_weight': None, 'C': 0.0024362779799216626, 'tol': 0.0011952882250556023, 'max_iter': 7296, 'calib_method': 'sigmoid', 'calib_cv': 3}. Best is trial 95 with value: 1.148206741777215.
[I 2026-02-26 11:13:12,049] Trial 233 pruned. 
[I 2026-02-26 11:13:13,988] Trial 234 pruned. 
[I 2026-02-26 11:13:14,355] Trial 235 finished with value: 1.1502891900656118 and parameters: {'kernel': 'linear', 'class_weight': None, 'C': 0.0019971563087360466, 'tol': 0.00129269594003724, 'max_iter': 2002, 'calib_method': 'sigmoid', 'calib_cv': 3}. Best is trial 95 with value: 1.148206741777215.
[I 2026-02-26 11:13:14,640] Trial 236 pruned. 
[I 2026-02-26 11:13:14,915] Trial 237 pruned. 
[I 2026-02-26 11:13:15,326] Trial 238 finished with value: 1.1492008704223173 and parameters: {'kernel': 'linear', 'class_weight': None, 'C': 0.0022930544061562264, 'tol': 0.0010940920681466071, 'max_iter': 4220, 'calib_method': 'sigmoid', 'calib_cv': 3}. Best is trial 95 with value: 1.148206741777215.
[I 2026-02-26 11:13:16,332] Trial 239 pruned. 
[I 2026-02-26 11:13:17,343] Trial 240 pruned. 
[I 2026-02-26 11:13:17,610] Trial 241 pruned. 
[I 2026-02-26 11:13:17,878] Trial 242 pruned. 
[I 2026-02-26 11:13:18,142] Trial 243 pruned. 
[I 2026-02-26 11:13:18,497] Trial 244 finished with value: 1.150864281225824 and parameters: {'kernel': 'linear', 'class_weight': None, 'C': 0.0018850699190052222, 'tol': 0.0009499631518398354, 'max_iter': 16493, 'calib_method': 'sigmoid', 'calib_cv': 3}. Best is trial 95 with value: 1.148206741777215.
[I 2026-02-26 11:13:18,858] Trial 245 finished with value: 1.1490788929887503 and parameters: {'kernel': 'linear', 'class_weight': None, 'C': 0.0023387822285462793, 'tol': 0.0005598718548185806, 'max_iter': 2577, 'calib_method': 'sigmoid', 'calib_cv': 3}. Best is trial 95 with value: 1.148206741777215.
[I 2026-02-26 11:13:19,134] Trial 246 pruned. 
[I 2026-02-26 11:13:19,440] Trial 247 pruned. 
[I 2026-02-26 11:13:19,701] Trial 248 pruned. 
[I 2026-02-26 11:13:19,972] Trial 249 pruned. 
[I 2026-02-26 11:13:20,273] Trial 250 pruned. 
{
  "study": "stage2_multiclass_svm",
  "optimised_objective": "logloss",
  "best_value_logloss_mean": 1.148206741777215,
  "best_params": {
    "kernel": "linear",
    "class_weight": null,
    "C": 0.0031860178260231125,
    "tol": 0.00046621954613830583,
    "max_iter": 6556,
    "calib_method": "sigmoid",
    "calib_cv": 3
  },
  "n_trials": 251,
  "n_splits": 5,
  "holdout_race_ids_excluded": [
    2,
    24,
    53,
    73,
    75
  ],
  "sample_frac": 1.0,
  "max_races": 80,
  "early_stopping_rounds": 50
}
{
  "study": "stage2_multiclass_svm",
  "task": "multiclass",
  "model": "svm",
  "metrics": {
    "accuracy_mean": 0.4776159560156753,
    "accuracy_std": 0.04127859506569974,
    "precision_macro_mean": 0.42036928175215704,
    "precision_macro_std": 0.11698379433057916,
    "recall_macro_mean": 0.34929207585140176,
    "recall_macro_std": 0.04613241932165756,
    "f1_macro_mean": 0.34093405047419106,
    "f1_macro_std": 0.059448634288846336,
    "logloss_mean": 1.148206741777215,
    "logloss_std": 0.05351822260771876
  }
}
Job finished at Thu 26 Feb 11:13:21 GMT 2026
