Job started on tiger-02 at Thu 26 Feb 11:12:03 GMT 2026
CPUs: 16  MEM: 64000
CMD: python -m src.utils.tune_8_optuna --data_stage1 data/processed/output1.csv --task binary --model svm --n_splits 5 --max_races 80 --n_trials 400 --seed 42 --timeout_sec 170000 --outdir runs/tuning_8_final
[I 2026-02-26 11:12:38,712] Trial 49 finished with value: 0.10677595108724056 and parameters: {'kernel': 'rbf', 'class_weight_mode': 'balanced', 'C': 24.281708108750575, 'gamma': 0.04017555853350587, 'calib_method': 'sigmoid', 'calib_cv': 5}. Best is trial 32 with value: 0.10665651935711515.
[I 2026-02-26 11:18:57,431] Trial 50 pruned. 
[I 2026-02-26 11:19:12,200] Trial 51 finished with value: 0.11582167278178586 and parameters: {'kernel': 'rbf', 'class_weight_mode': 'balanced', 'C': 66.38035939214815, 'gamma': 0.023789850119717754, 'calib_method': 'isotonic', 'calib_cv': 3}. Best is trial 32 with value: 0.10665651935711515.
[I 2026-02-26 11:19:49,139] Trial 52 finished with value: 0.10719589839233264 and parameters: {'kernel': 'rbf', 'class_weight_mode': 'balanced', 'C': 64.93398485765766, 'gamma': 0.09845942625033002, 'calib_method': 'sigmoid', 'calib_cv': 5}. Best is trial 32 with value: 0.10665651935711515.
[I 2026-02-26 11:20:41,686] Trial 53 pruned. 
[I 2026-02-26 11:21:12,249] Trial 54 finished with value: 0.10676741889306776 and parameters: {'kernel': 'rbf', 'class_weight_mode': 'balanced', 'C': 24.87971310836659, 'gamma': 0.031032129659694253, 'calib_method': 'sigmoid', 'calib_cv': 5}. Best is trial 32 with value: 0.10665651935711515.
[I 2026-02-26 11:21:43,765] Trial 55 finished with value: 0.10709830691817661 and parameters: {'kernel': 'rbf', 'class_weight_mode': 'balanced', 'C': 34.93241503609504, 'gamma': 0.06604876230219983, 'calib_method': 'sigmoid', 'calib_cv': 5}. Best is trial 32 with value: 0.10665651935711515.
[I 2026-02-26 11:22:42,337] Trial 56 finished with value: 0.10692691814454322 and parameters: {'kernel': 'rbf', 'class_weight_mode': 'balanced', 'C': 75.45960585706695, 'gamma': 0.17553274572068786, 'calib_method': 'sigmoid', 'calib_cv': 5}. Best is trial 32 with value: 0.10665651935711515.
[I 2026-02-26 11:23:13,178] Trial 57 finished with value: 0.10696062280302843 and parameters: {'kernel': 'rbf', 'class_weight_mode': 'balanced', 'C': 22.822478012169917, 'gamma': 0.02457282153932844, 'calib_method': 'sigmoid', 'calib_cv': 5}. Best is trial 32 with value: 0.10665651935711515.
[I 2026-02-26 11:23:46,275] Trial 58 pruned. 
[I 2026-02-26 11:24:27,931] Trial 59 pruned. 
[I 2026-02-26 11:25:12,032] Trial 60 finished with value: 0.10598184068659226 and parameters: {'kernel': 'rbf', 'class_weight_mode': 'balanced', 'C': 1.4166747096307422, 'gamma': 0.04031387454567317, 'calib_method': 'sigmoid', 'calib_cv': 5}. Best is trial 60 with value: 0.10598184068659226.
[I 2026-02-26 11:26:25,792] Trial 61 finished with value: 0.104626120272918 and parameters: {'kernel': 'rbf', 'class_weight_mode': 'balanced', 'C': 0.2671873415336475, 'gamma': 0.07115996162910974, 'calib_method': 'sigmoid', 'calib_cv': 5}. Best is trial 61 with value: 0.104626120272918.
[I 2026-02-26 11:26:34,770] Trial 62 pruned. 
[I 2026-02-26 11:27:15,993] Trial 63 finished with value: 0.10634254865743513 and parameters: {'kernel': 'rbf', 'class_weight_mode': 'balanced', 'C': 1.2267983233587592, 'gamma': 0.06201282284799075, 'calib_method': 'sigmoid', 'calib_cv': 5}. Best is trial 61 with value: 0.104626120272918.
[I 2026-02-26 11:31:33,971] Trial 64 pruned. 
[I 2026-02-26 11:32:11,578] Trial 65 finished with value: 0.1067457121375055 and parameters: {'kernel': 'rbf', 'class_weight_mode': 'balanced', 'C': 1.5938762451550796, 'gamma': 0.08317361196001063, 'calib_method': 'sigmoid', 'calib_cv': 5}. Best is trial 61 with value: 0.104626120272918.
[I 2026-02-26 11:33:24,383] Trial 66 finished with value: 0.10463071503493722 and parameters: {'kernel': 'rbf', 'class_weight_mode': 'balanced', 'C': 0.3063960184285188, 'gamma': 0.05245993048234012, 'calib_method': 'sigmoid', 'calib_cv': 5}. Best is trial 61 with value: 0.104626120272918.
[I 2026-02-26 11:34:57,500] Trial 67 finished with value: 0.10650245978621616 and parameters: {'kernel': 'rbf', 'class_weight_mode': 'balanced', 'C': 0.21599580127672807, 'gamma': 0.2016686213240643, 'calib_method': 'sigmoid', 'calib_cv': 5}. Best is trial 61 with value: 0.104626120272918.
[I 2026-02-26 11:36:13,945] Trial 68 finished with value: 0.10531879798311225 and parameters: {'kernel': 'rbf', 'class_weight_mode': 'balanced', 'C': 0.25539501127469494, 'gamma': 0.14503376724454276, 'calib_method': 'sigmoid', 'calib_cv': 5}. Best is trial 61 with value: 0.104626120272918.
[I 2026-02-26 11:37:37,946] Trial 69 finished with value: 0.1058946412192027 and parameters: {'kernel': 'rbf', 'class_weight_mode': 'balanced', 'C': 0.24767861771407493, 'gamma': 0.176221703229853, 'calib_method': 'sigmoid', 'calib_cv': 5}. Best is trial 61 with value: 0.104626120272918.
[I 2026-02-26 11:37:43,234] Trial 70 pruned. 
[I 2026-02-26 11:38:51,921] Trial 71 finished with value: 0.10594608323446612 and parameters: {'kernel': 'rbf', 'class_weight_mode': 'balanced', 'C': 0.4066477303047662, 'gamma': 0.16162530320027704, 'calib_method': 'sigmoid', 'calib_cv': 5}. Best is trial 61 with value: 0.104626120272918.
[I 2026-02-26 11:43:14,108] Trial 72 pruned. 
[I 2026-02-26 11:49:21,449] Trial 73 pruned. 
[I 2026-02-26 11:50:40,763] Trial 74 finished with value: 0.10571531269725865 and parameters: {'kernel': 'rbf', 'class_weight_mode': 'balanced', 'C': 0.2674313320761821, 'gamma': 0.1661685659535706, 'calib_method': 'sigmoid', 'calib_cv': 5}. Best is trial 61 with value: 0.104626120272918.
[I 2026-02-26 11:51:57,236] Trial 75 finished with value: 0.10541064119337355 and parameters: {'kernel': 'rbf', 'class_weight_mode': 'balanced', 'C': 0.2645754120218909, 'gamma': 0.1492844437255605, 'calib_method': 'sigmoid', 'calib_cv': 5}. Best is trial 61 with value: 0.104626120272918.
[I 2026-02-26 11:53:11,465] Trial 76 finished with value: 0.10536527065024726 and parameters: {'kernel': 'rbf', 'class_weight_mode': 'balanced', 'C': 0.2795503247309824, 'gamma': 0.14330084753849356, 'calib_method': 'sigmoid', 'calib_cv': 5}. Best is trial 61 with value: 0.104626120272918.
[I 2026-02-26 11:54:27,534] Trial 77 finished with value: 0.10524275223319757 and parameters: {'kernel': 'rbf', 'class_weight_mode': 'balanced', 'C': 0.256654547949156, 'gamma': 0.13937054370407984, 'calib_method': 'sigmoid', 'calib_cv': 5}. Best is trial 61 with value: 0.104626120272918.
[I 2026-02-26 11:58:21,647] Trial 78 pruned. 
[I 2026-02-26 12:00:19,154] Trial 79 finished with value: 0.10456644115606784 and parameters: {'kernel': 'rbf', 'class_weight_mode': 'balanced', 'C': 0.07766849527934991, 'gamma': 0.13745545006836737, 'calib_method': 'sigmoid', 'calib_cv': 5}. Best is trial 79 with value: 0.10456644115606784.
[I 2026-02-26 12:00:22,436] Trial 80 pruned. 
[I 2026-02-26 12:02:18,105] Trial 81 finished with value: 0.10468648729675686 and parameters: {'kernel': 'rbf', 'class_weight_mode': 'balanced', 'C': 0.08256812195741765, 'gamma': 0.141886923064782, 'calib_method': 'sigmoid', 'calib_cv': 5}. Best is trial 79 with value: 0.10456644115606784.
[I 2026-02-26 12:03:32,662] Trial 82 pruned. 
[I 2026-02-26 12:04:46,810] Trial 83 finished with value: 0.11214558448471894 and parameters: {'kernel': 'rbf', 'class_weight_mode': 'custom', 'pos_weight': 14.248006029513084, 'C': 0.07160530698604724, 'gamma': 0.12753140172688465, 'calib_method': 'isotonic', 'calib_cv': 5}. Best is trial 79 with value: 0.10456644115606784.
[I 2026-02-26 12:06:41,576] Trial 84 finished with value: 0.10752193761534205 and parameters: {'kernel': 'rbf', 'class_weight_mode': 'balanced', 'C': 0.13726403944965362, 'gamma': 0.23044662700601684, 'calib_method': 'sigmoid', 'calib_cv': 5}. Best is trial 79 with value: 0.10456644115606784.
[I 2026-02-26 12:12:09,189] Trial 85 pruned. 
[I 2026-02-26 12:14:17,637] Trial 86 finished with value: 0.10380475875801838 and parameters: {'kernel': 'rbf', 'class_weight_mode': 'balanced', 'C': 0.03575265776018722, 'gamma': 0.07968999800689697, 'calib_method': 'sigmoid', 'calib_cv': 5}. Best is trial 86 with value: 0.10380475875801838.
[I 2026-02-26 12:16:27,272] Trial 87 finished with value: 0.10376885019484616 and parameters: {'kernel': 'rbf', 'class_weight_mode': 'balanced', 'C': 0.03246021583587636, 'gamma': 0.06616848303144837, 'calib_method': 'sigmoid', 'calib_cv': 5}. Best is trial 87 with value: 0.10376885019484616.
[I 2026-02-26 12:18:42,166] Trial 88 finished with value: 0.10389461661546166 and parameters: {'kernel': 'rbf', 'class_weight_mode': 'balanced', 'C': 0.028186620483830232, 'gamma': 0.07664038999323053, 'calib_method': 'sigmoid', 'calib_cv': 5}. Best is trial 87 with value: 0.10376885019484616.
[I 2026-02-26 12:20:56,746] Trial 89 finished with value: 0.10386625210217497 and parameters: {'kernel': 'rbf', 'class_weight_mode': 'balanced', 'C': 0.029724966369118297, 'gamma': 0.07801038700682487, 'calib_method': 'sigmoid', 'calib_cv': 5}. Best is trial 87 with value: 0.10376885019484616.
[I 2026-02-26 12:23:06,807] Trial 90 finished with value: 0.10376997555187906 and parameters: {'kernel': 'rbf', 'class_weight_mode': 'balanced', 'C': 0.030731946829614134, 'gamma': 0.06075403180027898, 'calib_method': 'sigmoid', 'calib_cv': 5}. Best is trial 87 with value: 0.10376885019484616.
[I 2026-02-26 12:25:16,736] Trial 91 finished with value: 0.10378291219171894 and parameters: {'kernel': 'rbf', 'class_weight_mode': 'balanced', 'C': 0.03349406042608866, 'gamma': 0.07059631307110674, 'calib_method': 'sigmoid', 'calib_cv': 5}. Best is trial 87 with value: 0.10376885019484616.
[I 2026-02-26 12:27:28,870] Trial 92 finished with value: 0.10382222198702458 and parameters: {'kernel': 'rbf', 'class_weight_mode': 'balanced', 'C': 0.03235937114875505, 'gamma': 0.07761289621003128, 'calib_method': 'sigmoid', 'calib_cv': 5}. Best is trial 87 with value: 0.10376885019484616.
[I 2026-02-26 12:27:33,094] Trial 93 pruned. 
[I 2026-02-26 12:29:39,451] Trial 94 finished with value: 0.10374055881567049 and parameters: {'kernel': 'rbf', 'class_weight_mode': 'balanced', 'C': 0.03671199060227741, 'gamma': 0.06942445281813157, 'calib_method': 'sigmoid', 'calib_cv': 5}. Best is trial 94 with value: 0.10374055881567049.
[I 2026-02-26 12:31:49,362] Trial 95 finished with value: 0.10378222764824815 and parameters: {'kernel': 'rbf', 'class_weight_mode': 'balanced', 'C': 0.035110062564749626, 'gamma': 0.07512473349597788, 'calib_method': 'sigmoid', 'calib_cv': 5}. Best is trial 94 with value: 0.10374055881567049.
[I 2026-02-26 12:34:03,426] Trial 96 finished with value: 0.10386705965756267 and parameters: {'kernel': 'rbf', 'class_weight_mode': 'balanced', 'C': 0.03378994328116909, 'gamma': 0.08871766931352443, 'calib_method': 'sigmoid', 'calib_cv': 5}. Best is trial 94 with value: 0.10374055881567049.
[I 2026-02-26 12:37:21,469] Trial 97 pruned. 
[I 2026-02-26 12:39:24,996] Trial 98 finished with value: 0.10391444710599843 and parameters: {'kernel': 'rbf', 'class_weight_mode': 'balanced', 'C': 0.046284208368466855, 'gamma': 0.08774940679794452, 'calib_method': 'sigmoid', 'calib_cv': 5}. Best is trial 94 with value: 0.10374055881567049.
[I 2026-02-26 12:41:33,749] Trial 99 pruned. 
[I 2026-02-26 12:43:08,455] Trial 100 pruned. 
[I 2026-02-26 12:45:16,941] Trial 101 finished with value: 0.11172888580396564 and parameters: {'kernel': 'rbf', 'class_weight_mode': 'balanced', 'C': 0.035581329340331175, 'gamma': 0.0764869938218943, 'calib_method': 'isotonic', 'calib_cv': 5}. Best is trial 94 with value: 0.10374055881567049.
[I 2026-02-26 12:47:39,069] Trial 102 pruned. 
[I 2026-02-26 12:49:41,947] Trial 103 finished with value: 0.10401973625375889 and parameters: {'kernel': 'rbf', 'class_weight_mode': 'balanced', 'C': 0.05121796203943163, 'gamma': 0.09738748007512718, 'calib_method': 'sigmoid', 'calib_cv': 5}. Best is trial 94 with value: 0.10374055881567049.
[I 2026-02-26 12:51:46,564] Trial 104 finished with value: 0.10394191517253785 and parameters: {'kernel': 'rbf', 'class_weight_mode': 'balanced', 'C': 0.04608633274916957, 'gamma': 0.09166999776426717, 'calib_method': 'sigmoid', 'calib_cv': 5}. Best is trial 94 with value: 0.10374055881567049.
[I 2026-02-26 12:53:40,441] Trial 105 pruned. 
[I 2026-02-26 12:56:10,835] Trial 106 pruned. 
[I 2026-02-26 12:58:17,446] Trial 107 finished with value: 0.10376569764130925 and parameters: {'kernel': 'rbf', 'class_weight_mode': 'balanced', 'C': 0.03894995082558198, 'gamma': 0.07299112037358493, 'calib_method': 'sigmoid', 'calib_cv': 5}. Best is trial 94 with value: 0.10374055881567049.
[I 2026-02-26 13:00:21,616] Trial 108 pruned. 
[I 2026-02-26 13:02:22,106] Trial 109 finished with value: 0.10381341340226109 and parameters: {'kernel': 'rbf', 'class_weight_mode': 'custom', 'pos_weight': 41.34568204772192, 'C': 0.02647787392454699, 'gamma': 0.06987615749152062, 'calib_method': 'sigmoid', 'calib_cv': 5}. Best is trial 94 with value: 0.10374055881567049.
[I 2026-02-26 13:04:23,808] Trial 110 pruned. 
[I 2026-02-26 13:07:00,396] Trial 111 finished with value: 0.10427119241008605 and parameters: {'kernel': 'rbf', 'class_weight_mode': 'custom', 'pos_weight': 75.67468477265763, 'C': 0.015884478131911406, 'gamma': 0.06652542812256024, 'calib_method': 'sigmoid', 'calib_cv': 5}. Best is trial 94 with value: 0.10374055881567049.
[I 2026-02-26 13:08:28,178] Trial 112 finished with value: 0.10359267547931908 and parameters: {'kernel': 'rbf', 'class_weight_mode': 'custom', 'pos_weight': 22.421552850077784, 'C': 0.05685152462402032, 'gamma': 0.10329975634345404, 'calib_method': 'sigmoid', 'calib_cv': 5}. Best is trial 112 with value: 0.10359267547931908.
[I 2026-02-26 13:10:22,454] Trial 113 finished with value: 0.1076460981828248 and parameters: {'kernel': 'rbf', 'class_weight_mode': 'custom', 'pos_weight': 22.505355130052145, 'C': 0.061921992300674106, 'gamma': 0.23206529892668074, 'calib_method': 'sigmoid', 'calib_cv': 5}. Best is trial 112 with value: 0.10359267547931908.
[I 2026-02-26 13:12:22,272] Trial 114 finished with value: 0.10439289841331093 and parameters: {'kernel': 'rbf', 'class_weight_mode': 'custom', 'pos_weight': 46.0745003313021, 'C': 0.03679141596194256, 'gamma': 0.11712867649181495, 'calib_method': 'sigmoid', 'calib_cv': 5}. Best is trial 112 with value: 0.10359267547931908.
[I 2026-02-26 13:14:23,204] Trial 115 finished with value: 0.10390679797930535 and parameters: {'kernel': 'rbf', 'class_weight_mode': 'custom', 'pos_weight': 33.518148260770985, 'C': 0.02521947567807782, 'gamma': 0.1015313442247678, 'calib_method': 'sigmoid', 'calib_cv': 5}. Best is trial 112 with value: 0.10359267547931908.
[I 2026-02-26 13:15:36,282] Trial 116 finished with value: 0.10265879523124917 and parameters: {'kernel': 'rbf', 'class_weight_mode': 'custom', 'pos_weight': 13.233319213358918, 'C': 0.012334294960436545, 'gamma': 0.045748968926021025, 'calib_method': 'sigmoid', 'calib_cv': 5}. Best is trial 116 with value: 0.10265879523124917.
[I 2026-02-26 13:16:45,573] Trial 117 finished with value: 0.10268175496304699 and parameters: {'kernel': 'rbf', 'class_weight_mode': 'custom', 'pos_weight': 12.526007011892826, 'C': 0.010777760608997706, 'gamma': 0.046709486036883144, 'calib_method': 'sigmoid', 'calib_cv': 5}. Best is trial 116 with value: 0.10265879523124917.
[I 2026-02-26 13:17:58,579] Trial 118 pruned. 
[I 2026-02-26 13:18:00,239] Trial 119 pruned. 
[I 2026-02-26 13:18:47,387] Trial 120 pruned. 
[I 2026-02-26 13:19:56,350] Trial 121 finished with value: 0.1090276221981961 and parameters: {'kernel': 'rbf', 'class_weight_mode': 'custom', 'pos_weight': 12.213933864664924, 'C': 0.013041642791502862, 'gamma': 0.059223276653568295, 'calib_method': 'isotonic', 'calib_cv': 5}. Best is trial 116 with value: 0.10265879523124917.
[I 2026-02-26 13:21:28,693] Trial 122 pruned. 
[I 2026-02-26 13:22:55,814] Trial 123 pruned. 
[I 2026-02-26 13:23:56,935] Trial 124 finished with value: 0.10278260524061085 and parameters: {'kernel': 'rbf', 'class_weight_mode': 'custom', 'pos_weight': 10.682009065273531, 'C': 0.026059905371785368, 'gamma': 0.06574233570729733, 'calib_method': 'sigmoid', 'calib_cv': 5}. Best is trial 116 with value: 0.10265879523124917.
[I 2026-02-26 13:24:56,100] Trial 125 finished with value: 0.10271377697558995 and parameters: {'kernel': 'rbf', 'class_weight_mode': 'custom', 'pos_weight': 10.59344514522022, 'C': 0.04229611246346931, 'gamma': 0.06276897741068171, 'calib_method': 'sigmoid', 'calib_cv': 5}. Best is trial 116 with value: 0.10265879523124917.
[I 2026-02-26 13:25:59,223] Trial 126 pruned. 
[I 2026-02-26 13:26:58,577] Trial 127 finished with value: 0.10283071711288612 and parameters: {'kernel': 'rbf', 'class_weight_mode': 'custom', 'pos_weight': 10.426921794268646, 'C': 0.024266971452519735, 'gamma': 0.0604410574984855, 'calib_method': 'sigmoid', 'calib_cv': 5}. Best is trial 116 with value: 0.10265879523124917.
[I 2026-02-26 13:27:55,599] Trial 128 pruned. 
[I 2026-02-26 13:28:56,136] Trial 129 finished with value: 0.1026373846727194 and parameters: {'kernel': 'rbf', 'class_weight_mode': 'custom', 'pos_weight': 10.974367334272925, 'C': 0.042096001953834686, 'gamma': 0.05889167402670678, 'calib_method': 'sigmoid', 'calib_cv': 5}. Best is trial 129 with value: 0.1026373846727194.
[I 2026-02-26 13:29:54,928] Trial 130 pruned. 
[I 2026-02-26 13:31:17,787] Trial 131 finished with value: 0.10253852644098549 and parameters: {'kernel': 'rbf', 'class_weight_mode': 'custom', 'pos_weight': 15.750076830753349, 'C': 0.019654001761647853, 'gamma': 0.058873183877306036, 'calib_method': 'sigmoid', 'calib_cv': 5}. Best is trial 131 with value: 0.10253852644098549.
[I 2026-02-26 13:32:45,660] Trial 132 finished with value: 0.10432373668361161 and parameters: {'kernel': 'rbf', 'class_weight_mode': 'custom', 'pos_weight': 15.800076633414694, 'C': 0.0191351999994411, 'gamma': 0.11293296812507049, 'calib_method': 'sigmoid', 'calib_cv': 5}. Best is trial 131 with value: 0.10253852644098549.
[I 2026-02-26 13:34:01,876] Trial 133 finished with value: 0.10258568522147134 and parameters: {'kernel': 'rbf', 'class_weight_mode': 'custom', 'pos_weight': 13.840905258182739, 'C': 0.011598008275492077, 'gamma': 0.057903834904204116, 'calib_method': 'sigmoid', 'calib_cv': 5}. Best is trial 131 with value: 0.10253852644098549.
[I 2026-02-26 13:35:11,526] Trial 134 finished with value: 0.10257954711752296 and parameters: {'kernel': 'rbf', 'class_weight_mode': 'custom', 'pos_weight': 12.540138545384067, 'C': 0.014896805173964134, 'gamma': 0.055678467567834865, 'calib_method': 'sigmoid', 'calib_cv': 5}. Best is trial 131 with value: 0.10253852644098549.
[I 2026-02-26 13:36:19,635] Trial 135 pruned. 
[I 2026-02-26 13:37:36,927] Trial 136 pruned. 
[I 2026-02-26 13:38:35,299] Trial 137 pruned. 
[I 2026-02-26 13:39:42,055] Trial 138 finished with value: 0.10252565127972824 and parameters: {'kernel': 'rbf', 'class_weight_mode': 'custom', 'pos_weight': 11.964449859850088, 'C': 0.023154035830654215, 'gamma': 0.05701303330500069, 'calib_method': 'sigmoid', 'calib_cv': 5}. Best is trial 138 with value: 0.10252565127972824.
[I 2026-02-26 13:40:47,002] Trial 139 pruned. 
[I 2026-02-26 13:41:46,517] Trial 140 finished with value: 0.10391128560076009 and parameters: {'kernel': 'rbf', 'class_weight_mode': 'custom', 'pos_weight': 9.799572159949514, 'C': 0.01351041419540496, 'gamma': 0.11169332163807841, 'calib_method': 'sigmoid', 'calib_cv': 5}. Best is trial 138 with value: 0.10252565127972824.
[I 2026-02-26 13:41:47,368] Trial 141 pruned. 
[I 2026-02-26 13:42:35,351] Trial 142 pruned. 
[I 2026-02-26 13:43:39,262] Trial 143 pruned. 
[I 2026-02-26 13:44:52,280] Trial 144 finished with value: 0.10247934963331459 and parameters: {'kernel': 'rbf', 'class_weight_mode': 'custom', 'pos_weight': 13.111365239683114, 'C': 0.017866135823169618, 'gamma': 0.05718396656435895, 'calib_method': 'sigmoid', 'calib_cv': 5}. Best is trial 144 with value: 0.10247934963331459.
[I 2026-02-26 13:46:04,537] Trial 145 finished with value: 0.1025518504559487 and parameters: {'kernel': 'rbf', 'class_weight_mode': 'custom', 'pos_weight': 13.141401049043214, 'C': 0.01778594866620127, 'gamma': 0.04694241640925544, 'calib_method': 'sigmoid', 'calib_cv': 5}. Best is trial 144 with value: 0.10247934963331459.
[I 2026-02-26 13:47:14,997] Trial 146 pruned. 
[I 2026-02-26 13:48:42,375] Trial 147 pruned. 
[I 2026-02-26 13:49:35,204] Trial 148 pruned. 
[I 2026-02-26 13:50:49,281] Trial 149 pruned. 
[I 2026-02-26 13:51:51,456] Trial 150 pruned. 
[I 2026-02-26 13:53:16,984] Trial 151 pruned. 
[I 2026-02-26 13:54:30,100] Trial 152 finished with value: 0.10257690170498175 and parameters: {'kernel': 'rbf', 'class_weight_mode': 'custom', 'pos_weight': 13.085741045521013, 'C': 0.014991669662114168, 'gamma': 0.062225858199426554, 'calib_method': 'sigmoid', 'calib_cv': 5}. Best is trial 144 with value: 0.10247934963331459.
[I 2026-02-26 13:55:43,517] Trial 153 finished with value: 0.10252572542118363 and parameters: {'kernel': 'rbf', 'class_weight_mode': 'custom', 'pos_weight': 13.255286476567672, 'C': 0.01593295750799791, 'gamma': 0.058544220965476776, 'calib_method': 'sigmoid', 'calib_cv': 5}. Best is trial 144 with value: 0.10247934963331459.
[I 2026-02-26 13:56:56,524] Trial 154 finished with value: 0.10252328167904898 and parameters: {'kernel': 'rbf', 'class_weight_mode': 'custom', 'pos_weight': 13.21217514807282, 'C': 0.016409557212771257, 'gamma': 0.05924544405975166, 'calib_method': 'sigmoid', 'calib_cv': 5}. Best is trial 144 with value: 0.10247934963331459.
[I 2026-02-26 13:58:09,919] Trial 155 finished with value: 0.10252057519626241 and parameters: {'kernel': 'rbf', 'class_weight_mode': 'custom', 'pos_weight': 13.357852030058758, 'C': 0.015566079610690883, 'gamma': 0.05360343272547919, 'calib_method': 'sigmoid', 'calib_cv': 5}. Best is trial 144 with value: 0.10247934963331459.
