[I 2026-02-26 13:35:25,310] Trial 229 finished with value: 1.1458438285242536 and parameters: {'n_layers': 2, 'hidden_units': 128, 'dropout': 0.34408869407642273, 'l2': 3.996914256262699e-05, 'optimizer': 'nadam', 'learning_rate': 0.00045354378998792685, 'batch_size': 32, 'label_smoothing': 0.01293914068443207}. Best is trial 198 with value: 1.1439984761334152.
[I 2026-02-26 13:36:22,484] Trial 230 finished with value: 1.1483791157831995 and parameters: {'n_layers': 2, 'hidden_units': 128, 'dropout': 0.29711629404995493, 'l2': 1.8922475971969726e-05, 'optimizer': 'nadam', 'learning_rate': 0.0003492008642906246, 'batch_size': 32, 'label_smoothing': 0.005593134060440954}. Best is trial 198 with value: 1.1439984761334152.
[I 2026-02-26 13:37:18,780] Trial 231 pruned. 
[I 2026-02-26 13:38:15,868] Trial 232 pruned. 
[I 2026-02-26 13:39:13,139] Trial 233 finished with value: 1.1457753608113295 and parameters: {'n_layers': 2, 'hidden_units': 128, 'dropout': 0.3371456936780867, 'l2': 4.789388308777865e-05, 'optimizer': 'nadam', 'learning_rate': 0.00043425002492259384, 'batch_size': 32, 'label_smoothing': 0.030793555923856443}. Best is trial 198 with value: 1.1439984761334152.
[I 2026-02-26 13:40:09,677] Trial 234 pruned. 
[I 2026-02-26 13:41:07,044] Trial 235 pruned. 
[I 2026-02-26 13:42:05,206] Trial 236 pruned. 
[I 2026-02-26 13:43:02,317] Trial 237 pruned. 
[I 2026-02-26 13:44:00,499] Trial 238 finished with value: 1.1457690280201767 and parameters: {'n_layers': 2, 'hidden_units': 128, 'dropout': 0.3305520209981427, 'l2': 1.4537728903969434e-05, 'optimizer': 'nadam', 'learning_rate': 0.0004733661214854999, 'batch_size': 32, 'label_smoothing': 0.007774133813206748}. Best is trial 198 with value: 1.1439984761334152.
[I 2026-02-26 13:44:59,083] Trial 239 pruned. 
[I 2026-02-26 13:45:58,310] Trial 240 pruned. 
[I 2026-02-26 13:46:56,890] Trial 241 pruned. 
[I 2026-02-26 13:47:56,155] Trial 242 finished with value: 1.1442954620933545 and parameters: {'n_layers': 2, 'hidden_units': 128, 'dropout': 0.3372098467111752, 'l2': 2.121313631322385e-05, 'optimizer': 'nadam', 'learning_rate': 0.0004882571265556301, 'batch_size': 32, 'label_smoothing': 0.01571333421214645}. Best is trial 198 with value: 1.1439984761334152.
[I 2026-02-26 13:48:55,551] Trial 243 finished with value: 1.1459036741098854 and parameters: {'n_layers': 2, 'hidden_units': 128, 'dropout': 0.33957989351909923, 'l2': 2.1350225274874266e-05, 'optimizer': 'nadam', 'learning_rate': 0.00044488272896336354, 'batch_size': 32, 'label_smoothing': 0.015490618957102431}. Best is trial 198 with value: 1.1439984761334152.
[I 2026-02-26 13:49:57,556] Trial 244 finished with value: 1.1446099483716015 and parameters: {'n_layers': 2, 'hidden_units': 128, 'dropout': 0.35664017648858665, 'l2': 1.624360483618953e-05, 'optimizer': 'nadam', 'learning_rate': 0.00047347831784058956, 'batch_size': 32, 'label_smoothing': 0.011807337014161229}. Best is trial 198 with value: 1.1439984761334152.
[I 2026-02-26 13:50:57,698] Trial 245 pruned. 
[I 2026-02-26 13:51:57,562] Trial 246 finished with value: 1.1462015224843676 and parameters: {'n_layers': 2, 'hidden_units': 128, 'dropout': 0.34746082648336624, 'l2': 1.639407494909577e-05, 'optimizer': 'nadam', 'learning_rate': 0.0004973902304349745, 'batch_size': 32, 'label_smoothing': 0.01644825693823132}. Best is trial 198 with value: 1.1439984761334152.
[I 2026-02-26 13:52:58,920] Trial 247 pruned. 
[I 2026-02-26 13:54:00,519] Trial 248 pruned. 
[I 2026-02-26 13:55:00,503] Trial 249 pruned. 
[I 2026-02-26 13:56:01,129] Trial 250 finished with value: 1.1456945090985322 and parameters: {'n_layers': 2, 'hidden_units': 128, 'dropout': 0.3003240747532451, 'l2': 1.1795373823009536e-05, 'optimizer': 'nadam', 'learning_rate': 0.00043776531303276584, 'batch_size': 32, 'label_smoothing': 0.023680988683487725}. Best is trial 198 with value: 1.1439984761334152.
[I 2026-02-26 13:57:02,039] Trial 251 pruned. 
[I 2026-02-26 13:58:03,244] Trial 252 finished with value: 1.1475784654325016 and parameters: {'n_layers': 2, 'hidden_units': 128, 'dropout': 0.3013719176186929, 'l2': 1.1801062453026934e-05, 'optimizer': 'nadam', 'learning_rate': 0.0004047039699415861, 'batch_size': 32, 'label_smoothing': 0.024177704862272158}. Best is trial 198 with value: 1.1439984761334152.
[I 2026-02-26 13:59:04,584] Trial 253 pruned. 
[I 2026-02-26 14:00:04,737] Trial 254 pruned. 
[I 2026-02-26 14:01:07,275] Trial 255 pruned. 
[I 2026-02-26 14:02:09,524] Trial 256 pruned. 
[I 2026-02-26 14:03:12,634] Trial 257 pruned. 
[I 2026-02-26 14:04:13,525] Trial 258 pruned. 
[I 2026-02-26 14:05:16,140] Trial 259 finished with value: 1.1452136015971455 and parameters: {'n_layers': 2, 'hidden_units': 128, 'dropout': 0.33430042433696583, 'l2': 7.144503616611949e-05, 'optimizer': 'nadam', 'learning_rate': 0.0004940645534947622, 'batch_size': 32, 'label_smoothing': 0.005728941029201544}. Best is trial 198 with value: 1.1439984761334152.
[I 2026-02-26 14:06:19,316] Trial 260 finished with value: 1.1445388317681748 and parameters: {'n_layers': 2, 'hidden_units': 128, 'dropout': 0.3356353463530398, 'l2': 7.014766318100553e-05, 'optimizer': 'nadam', 'learning_rate': 0.0005056760171847971, 'batch_size': 32, 'label_smoothing': 0.005573462880050204}. Best is trial 198 with value: 1.1439984761334152.
[I 2026-02-26 14:07:21,177] Trial 261 pruned. 
[I 2026-02-26 14:08:24,128] Trial 262 finished with value: 1.1464376464419526 and parameters: {'n_layers': 2, 'hidden_units': 128, 'dropout': 0.3334073569089434, 'l2': 7.445177644669083e-05, 'optimizer': 'nadam', 'learning_rate': 0.0005105884976852538, 'batch_size': 32, 'label_smoothing': 0.0026045695401600392}. Best is trial 198 with value: 1.1439984761334152.
[I 2026-02-26 14:09:27,565] Trial 263 pruned. 
[I 2026-02-26 14:10:31,557] Trial 264 finished with value: 1.1439965498099014 and parameters: {'n_layers': 2, 'hidden_units': 128, 'dropout': 0.34921470874158866, 'l2': 6.13412829200519e-05, 'optimizer': 'nadam', 'learning_rate': 0.0005060147609613892, 'batch_size': 32, 'label_smoothing': 0.008458145426437894}. Best is trial 264 with value: 1.1439965498099014.
[I 2026-02-26 14:11:34,486] Trial 265 pruned. 
[I 2026-02-26 14:12:38,463] Trial 266 finished with value: 1.144449559207397 and parameters: {'n_layers': 2, 'hidden_units': 128, 'dropout': 0.3427756472378077, 'l2': 5.958001230616408e-05, 'optimizer': 'nadam', 'learning_rate': 0.0005100005060592196, 'batch_size': 32, 'label_smoothing': 0.009406894890143881}. Best is trial 264 with value: 1.1439965498099014.
[I 2026-02-26 14:13:41,622] Trial 267 pruned. 
[I 2026-02-26 14:14:46,253] Trial 268 pruned. 
[I 2026-02-26 14:15:50,298] Trial 269 pruned. 
[I 2026-02-26 14:16:55,415] Trial 270 finished with value: 1.1444269811495915 and parameters: {'n_layers': 2, 'hidden_units': 128, 'dropout': 0.3613919151369534, 'l2': 8.840678167784462e-05, 'optimizer': 'nadam', 'learning_rate': 0.0004915874977612136, 'batch_size': 32, 'label_smoothing': 0.00897303729160007}. Best is trial 264 with value: 1.1439965498099014.
[I 2026-02-26 14:18:06,527] Trial 271 pruned. 
[I 2026-02-26 14:19:11,901] Trial 272 pruned. 
[I 2026-02-26 14:20:18,652] Trial 273 pruned. 
[I 2026-02-26 14:21:23,804] Trial 274 pruned. 
[I 2026-02-26 14:22:29,537] Trial 275 pruned. 
[I 2026-02-26 14:23:34,807] Trial 276 pruned. 
[I 2026-02-26 14:24:41,167] Trial 277 pruned. 
[I 2026-02-26 14:25:45,356] Trial 278 pruned. 
[I 2026-02-26 14:26:53,037] Trial 279 pruned. 
[I 2026-02-26 14:28:00,620] Trial 280 pruned. 
[I 2026-02-26 14:29:07,844] Trial 281 finished with value: 1.1440719665050858 and parameters: {'n_layers': 2, 'hidden_units': 128, 'dropout': 0.35887306773833316, 'l2': 5.59298142384103e-05, 'optimizer': 'nadam', 'learning_rate': 0.0004933461183743097, 'batch_size': 32, 'label_smoothing': 0.00913768078862555}. Best is trial 264 with value: 1.1439965498099014.
[I 2026-02-26 14:30:16,098] Trial 282 finished with value: 1.1444118538573476 and parameters: {'n_layers': 2, 'hidden_units': 128, 'dropout': 0.3636174339724016, 'l2': 5.8323666330936625e-05, 'optimizer': 'nadam', 'learning_rate': 0.0005103778336698951, 'batch_size': 32, 'label_smoothing': 0.009576281498771872}. Best is trial 264 with value: 1.1439965498099014.
[I 2026-02-26 14:31:23,352] Trial 283 pruned. 
[I 2026-02-26 14:32:31,016] Trial 284 finished with value: 1.145306488443216 and parameters: {'n_layers': 2, 'hidden_units': 128, 'dropout': 0.38000838993467834, 'l2': 7.25432653496528e-05, 'optimizer': 'nadam', 'learning_rate': 0.0004928283209462179, 'batch_size': 32, 'label_smoothing': 0.01296118610720825}. Best is trial 264 with value: 1.1439965498099014.
[I 2026-02-26 14:33:39,209] Trial 285 finished with value: 1.145925520347387 and parameters: {'n_layers': 2, 'hidden_units': 128, 'dropout': 0.38292686782906277, 'l2': 7.609518011757755e-05, 'optimizer': 'nadam', 'learning_rate': 0.00048344288696650084, 'batch_size': 32, 'label_smoothing': 0.013021360944595252}. Best is trial 264 with value: 1.1439965498099014.
[I 2026-02-26 14:34:46,194] Trial 286 pruned. 
[I 2026-02-26 14:35:54,554] Trial 287 finished with value: 1.1464632749858201 and parameters: {'n_layers': 2, 'hidden_units': 128, 'dropout': 0.36715235831666787, 'l2': 8.211862389184411e-05, 'optimizer': 'nadam', 'learning_rate': 0.0005376104297432087, 'batch_size': 32, 'label_smoothing': 0.012736549526472516}. Best is trial 264 with value: 1.1439965498099014.
[I 2026-02-26 14:37:03,112] Trial 288 pruned. 
[I 2026-02-26 14:38:12,014] Trial 289 finished with value: 1.1471324945982508 and parameters: {'n_layers': 2, 'hidden_units': 128, 'dropout': 0.36091221565412135, 'l2': 7.429483436269692e-05, 'optimizer': 'nadam', 'learning_rate': 0.00046809990756422725, 'batch_size': 32, 'label_smoothing': 9.703820470020766e-05}. Best is trial 264 with value: 1.1439965498099014.
[I 2026-02-26 14:39:22,051] Trial 290 pruned. 
[I 2026-02-26 14:40:30,881] Trial 291 pruned. 
[I 2026-02-26 14:41:40,715] Trial 292 pruned. 
[I 2026-02-26 14:42:50,058] Trial 293 finished with value: 1.1443387305497459 and parameters: {'n_layers': 2, 'hidden_units': 128, 'dropout': 0.38625418250830545, 'l2': 8.936055916382598e-05, 'optimizer': 'nadam', 'learning_rate': 0.0005641369914476514, 'batch_size': 32, 'label_smoothing': 0.015181537564137215}. Best is trial 264 with value: 1.1439965498099014.
[I 2026-02-26 14:43:59,675] Trial 294 pruned. 
[I 2026-02-26 14:45:09,556] Trial 295 pruned. 
[I 2026-02-26 14:46:20,171] Trial 296 finished with value: 1.147825397538223 and parameters: {'n_layers': 2, 'hidden_units': 128, 'dropout': 0.3882076758417865, 'l2': 8.602241887622788e-05, 'optimizer': 'nadam', 'learning_rate': 0.00047007102792841394, 'batch_size': 32, 'label_smoothing': 0.013113808386365519}. Best is trial 264 with value: 1.1439965498099014.
[I 2026-02-26 14:47:33,014] Trial 297 pruned. 
[I 2026-02-26 14:48:44,095] Trial 298 finished with value: 1.1432186857814057 and parameters: {'n_layers': 2, 'hidden_units': 128, 'dropout': 0.3822487125525975, 'l2': 0.00010823290944374768, 'optimizer': 'nadam', 'learning_rate': 0.0005174197842896542, 'batch_size': 32, 'label_smoothing': 0.007503883720701273}. Best is trial 298 with value: 1.1432186857814057.
[I 2026-02-26 14:49:53,802] Trial 299 pruned. 
[I 2026-02-26 14:51:05,375] Trial 300 finished with value: 1.1453951116118097 and parameters: {'n_layers': 2, 'hidden_units': 128, 'dropout': 0.4086499064698434, 'l2': 0.00010183756052319983, 'optimizer': 'nadam', 'learning_rate': 0.0005537717379127728, 'batch_size': 32, 'label_smoothing': 0.012758091374682206}. Best is trial 298 with value: 1.1432186857814057.
