Job started on tiger-01 at Thu 26 Feb 11:01:10 GMT 2026
CPUs: 16  MEM: 64000
CMD: python -m src.utils.tune_8_optuna --stage2 --data_stage2 data/processed/output2.csv --task multiclass --model vse_compound_ann --n_splits 5 --max_races 80 --n_trials 300 --seed 42 --timeout_sec 170000 --outdir runs/tuning_8_final
[load_stage2_dataset] Dropped 36 rows with missing y_compound.
[I 2026-02-26 11:01:27,854] Trial 1 finished with value: 1.1932278370096863 and parameters: {'n_layers': 2, 'hidden_units': 32, 'dropout': 0.07799726016810132, 'l2': 1.7073967431528114e-06, 'optimizer': 'adam', 'learning_rate': 0.0005675206026988746, 'batch_size': 64, 'label_smoothing': 0.02727374508106509}. Best is trial 1 with value: 1.1932278370096863.
[I 2026-02-26 11:01:49,444] Trial 2 finished with value: 1.169145448618645 and parameters: {'n_layers': 1, 'hidden_units': 64, 'dropout': 0.30592644736118974, 'l2': 3.6138942712165278e-06, 'optimizer': 'nadam', 'learning_rate': 0.0001348157560360141, 'batch_size': 32, 'label_smoothing': 0.006967561907999659}. Best is trial 2 with value: 1.169145448618645.
[I 2026-02-26 11:02:08,719] Trial 3 finished with value: 1.1908529375288954 and parameters: {'n_layers': 2, 'hidden_units': 256, 'dropout': 0.40419867405823057, 'l2': 1.6536937182824424e-05, 'optimizer': 'nadam', 'learning_rate': 0.0001231150363241564, 'batch_size': 256, 'label_smoothing': 0.03881699724000254}. Best is trial 2 with value: 1.169145448618645.
[I 2026-02-26 11:02:22,267] Trial 4 finished with value: 1.1475324569633316 and parameters: {'n_layers': 2, 'hidden_units': 128, 'dropout': 0.4847923138822793, 'l2': 0.001260466458564947, 'optimizer': 'adam', 'learning_rate': 0.00030274065464556537, 'batch_size': 32, 'label_smoothing': 0.04879954961448965}. Best is trial 4 with value: 1.1475324569633316.
[I 2026-02-26 11:02:30,552] Trial 5 finished with value: 1.175304262599124 and parameters: {'n_layers': 2, 'hidden_units': 64, 'dropout': 0.27134804157912423, 'l2': 3.6618192203924288e-06, 'optimizer': 'adam', 'learning_rate': 0.0027838036931305005, 'batch_size': 256, 'label_smoothing': 0.10602860157714257}. Best is trial 4 with value: 1.1475324569633316.
[I 2026-02-26 11:03:29,909] Trial 6 finished with value: 1.2468997362348382 and parameters: {'n_layers': 3, 'hidden_units': 32, 'dropout': 0.43155171293779676, 'l2': 0.0003113095956122125, 'optimizer': 'adam', 'learning_rate': 5.89306076111462e-05, 'batch_size': 256, 'label_smoothing': 0.07083223877429239}. Best is trial 4 with value: 1.1475324569633316.
[I 2026-02-26 11:04:42,995] Trial 7 finished with value: 1.178856261012291 and parameters: {'n_layers': 1, 'hidden_units': 256, 'dropout': 0.24689779818219537, 'l2': 0.00012329098365270507, 'optimizer': 'adam', 'learning_rate': 1.8503766823590136e-05, 'batch_size': 64, 'label_smoothing': 0.13613497108891395}. Best is trial 4 with value: 1.1475324569633316.
[I 2026-02-26 11:05:00,649] Trial 8 finished with value: 1.19326633777699 and parameters: {'n_layers': 1, 'hidden_units': 64, 'dropout': 0.144875726456884, 'l2': 4.414536876494481e-06, 'optimizer': 'adam', 'learning_rate': 0.00037069600706460563, 'batch_size': 256, 'label_smoothing': 0.08090133628734761}. Best is trial 4 with value: 1.1475324569633316.
[I 2026-02-26 11:05:17,770] Trial 9 finished with value: 1.1680492013160542 and parameters: {'n_layers': 3, 'hidden_units': 32, 'dropout': 0.21355389431312816, 'l2': 0.0018709365688887364, 'optimizer': 'adam', 'learning_rate': 0.00018415478124479592, 'batch_size': 32, 'label_smoothing': 0.14143645558687787}. Best is trial 4 with value: 1.1475324569633316.
[I 2026-02-26 11:05:54,797] Trial 10 finished with value: 1.1746365349676826 and parameters: {'n_layers': 1, 'hidden_units': 256, 'dropout': 0.4812236474710556, 'l2': 1.0165510266418738e-05, 'optimizer': 'adam', 'learning_rate': 5.0767343982976065e-05, 'batch_size': 64, 'label_smoothing': 0.04179696963549171}. Best is trial 4 with value: 1.1475324569633316.
[I 2026-02-26 11:06:05,229] Trial 11 finished with value: 1.1780232246648232 and parameters: {'n_layers': 2, 'hidden_units': 128, 'dropout': 0.003773659658146522, 'l2': 0.005997863556602822, 'optimizer': 'nadam', 'learning_rate': 0.0015440176087274393, 'batch_size': 128, 'label_smoothing': 0.06259045625333402}. Best is trial 4 with value: 1.1475324569633316.
[I 2026-02-26 11:06:18,388] Trial 12 finished with value: 1.169138325849522 and parameters: {'n_layers': 3, 'hidden_units': 128, 'dropout': 0.20942142343722026, 'l2': 0.0030140816146116234, 'optimizer': 'adam', 'learning_rate': 0.0004577807929173276, 'batch_size': 32, 'label_smoothing': 0.1416489969421202}. Best is trial 4 with value: 1.1475324569633316.
[I 2026-02-26 11:06:34,582] Trial 13 finished with value: 1.1719062540342513 and parameters: {'n_layers': 3, 'hidden_units': 32, 'dropout': 0.367567299247064, 'l2': 0.0010738870283637418, 'optimizer': 'adam', 'learning_rate': 0.0003186082355348022, 'batch_size': 32, 'label_smoothing': 0.10298286985005728}. Best is trial 4 with value: 1.1475324569633316.
[I 2026-02-26 11:06:47,037] Trial 14 finished with value: 1.1604298040067351 and parameters: {'n_layers': 3, 'hidden_units': 128, 'dropout': 0.1737933869517573, 'l2': 0.0007045490097809963, 'optimizer': 'adam', 'learning_rate': 0.0008013045645915862, 'batch_size': 32, 'label_smoothing': 0.11456715757540664}. Best is trial 4 with value: 1.1475324569633316.
[I 2026-02-26 11:06:58,781] Trial 15 finished with value: 1.1630077065004432 and parameters: {'n_layers': 2, 'hidden_units': 128, 'dropout': 0.1206195101121777, 'l2': 0.0005521008712893733, 'optimizer': 'adam', 'learning_rate': 0.0009397032021012223, 'batch_size': 32, 'label_smoothing': 0.10983452098482539}. Best is trial 4 with value: 1.1475324569633316.
[I 2026-02-26 11:07:10,999] Trial 16 pruned. 
[I 2026-02-26 11:07:23,489] Trial 17 pruned. 
[I 2026-02-26 11:08:46,775] Trial 18 finished with value: 1.1536018935003711 and parameters: {'n_layers': 2, 'hidden_units': 128, 'dropout': 0.16399266073423122, 'l2': 0.00015441218747040418, 'optimizer': 'adam', 'learning_rate': 1.16795155388464e-05, 'batch_size': 32, 'label_smoothing': 0.06180976129983212}. Best is trial 4 with value: 1.1475324569633316.
[I 2026-02-26 11:09:46,576] Trial 19 finished with value: 1.155129510024861 and parameters: {'n_layers': 2, 'hidden_units': 128, 'dropout': 0.06212430058298632, 'l2': 5.783440209220082e-05, 'optimizer': 'nadam', 'learning_rate': 1.5972901149014366e-05, 'batch_size': 32, 'label_smoothing': 0.05238307245534256}. Best is trial 4 with value: 1.1475324569633316.
[I 2026-02-26 11:10:35,958] Trial 20 pruned. 
[I 2026-02-26 11:11:35,172] Trial 21 finished with value: 1.165052367927119 and parameters: {'n_layers': 1, 'hidden_units': 128, 'dropout': 0.41231611276099045, 'l2': 3.1038495511408337e-05, 'optimizer': 'adam', 'learning_rate': 3.267734037453554e-05, 'batch_size': 32, 'label_smoothing': 0.056733684120352595}. Best is trial 4 with value: 1.1475324569633316.
[I 2026-02-26 11:13:03,061] Trial 22 finished with value: 1.1552746917029184 and parameters: {'n_layers': 2, 'hidden_units': 128, 'dropout': 0.04269268448518207, 'l2': 5.6626438218955734e-05, 'optimizer': 'nadam', 'learning_rate': 1.0224298704653588e-05, 'batch_size': 32, 'label_smoothing': 0.04863988172166561}. Best is trial 4 with value: 1.1475324569633316.
[I 2026-02-26 11:14:33,993] Trial 23 finished with value: 1.154549156765683 and parameters: {'n_layers': 2, 'hidden_units': 128, 'dropout': 0.0909450919179361, 'l2': 0.0003058967250216802, 'optimizer': 'nadam', 'learning_rate': 1.041278470149682e-05, 'batch_size': 32, 'label_smoothing': 0.029467604122567062}. Best is trial 4 with value: 1.1475324569633316.
[I 2026-02-26 11:16:01,658] Trial 24 finished with value: 1.1543032427414037 and parameters: {'n_layers': 2, 'hidden_units': 128, 'dropout': 0.10793481157294074, 'l2': 0.00034033488229896975, 'optimizer': 'nadam', 'learning_rate': 1.1064057720398557e-05, 'batch_size': 32, 'label_smoothing': 0.024837722044928963}. Best is trial 4 with value: 1.1475324569633316.
[I 2026-02-26 11:17:05,228] Trial 25 pruned. 
[I 2026-02-26 11:17:26,856] Trial 26 finished with value: 1.151997087476832 and parameters: {'n_layers': 2, 'hidden_units': 128, 'dropout': 0.12251253164268139, 'l2': 0.0003526556027791098, 'optimizer': 'nadam', 'learning_rate': 9.66614830379185e-05, 'batch_size': 32, 'label_smoothing': 0.0010199749501090677}. Best is trial 4 with value: 1.1475324569633316.
[I 2026-02-26 11:17:45,466] Trial 27 pruned. 
[I 2026-02-26 11:18:14,746] Trial 28 pruned. 
[I 2026-02-26 11:18:40,527] Trial 29 pruned. 
[I 2026-02-26 11:18:54,988] Trial 30 pruned. 
[I 2026-02-26 11:19:11,539] Trial 31 finished with value: 1.1540599398738538 and parameters: {'n_layers': 2, 'hidden_units': 128, 'dropout': 0.17990548355057007, 'l2': 1.1458422209579277e-06, 'optimizer': 'adam', 'learning_rate': 0.000261759485452812, 'batch_size': 32, 'label_smoothing': 0.016033172778991224}. Best is trial 4 with value: 1.1475324569633316.
[I 2026-02-26 11:19:28,421] Trial 32 finished with value: 1.153507092117957 and parameters: {'n_layers': 2, 'hidden_units': 128, 'dropout': 0.19121647651076448, 'l2': 2.5753785707990866e-05, 'optimizer': 'adam', 'learning_rate': 0.00025197686179664674, 'batch_size': 32, 'label_smoothing': 0.015870502341190484}. Best is trial 4 with value: 1.1475324569633316.
[I 2026-02-26 11:19:47,600] Trial 33 pruned. 
[I 2026-02-26 11:20:09,335] Trial 34 finished with value: 1.1536480097821142 and parameters: {'n_layers': 2, 'hidden_units': 128, 'dropout': 0.12946044631389658, 'l2': 1.6847186244003126e-05, 'optimizer': 'adam', 'learning_rate': 0.00010131887189368807, 'batch_size': 32, 'label_smoothing': 0.010322267501960192}. Best is trial 4 with value: 1.1475324569633316.
[I 2026-02-26 11:20:25,103] Trial 35 pruned. 
[I 2026-02-26 11:20:41,985] Trial 36 pruned. 
[I 2026-02-26 11:21:02,175] Trial 37 pruned. 
[I 2026-02-26 11:21:29,199] Trial 38 pruned. 
[I 2026-02-26 11:22:31,694] Trial 39 pruned. 
[I 2026-02-26 11:23:05,608] Trial 40 pruned. 
[I 2026-02-26 11:23:24,514] Trial 41 pruned. 
[I 2026-02-26 11:23:46,048] Trial 42 finished with value: 1.1539152856882637 and parameters: {'n_layers': 2, 'hidden_units': 128, 'dropout': 0.12303414067610408, 'l2': 2.0214220043649005e-05, 'optimizer': 'adam', 'learning_rate': 0.00012811679103985342, 'batch_size': 32, 'label_smoothing': 0.00636045592329873}. Best is trial 4 with value: 1.1475324569633316.
[I 2026-02-26 11:24:06,090] Trial 43 finished with value: 1.1566432677476282 and parameters: {'n_layers': 2, 'hidden_units': 128, 'dropout': 0.10330469916065864, 'l2': 1.143941195422859e-05, 'optimizer': 'adam', 'learning_rate': 0.00016017319121293568, 'batch_size': 32, 'label_smoothing': 0.013145580495796795}. Best is trial 4 with value: 1.1475324569633316.
[I 2026-02-26 11:24:35,202] Trial 44 finished with value: 1.1526224346709637 and parameters: {'n_layers': 2, 'hidden_units': 128, 'dropout': 0.1327663160192788, 'l2': 6.560304049471172e-06, 'optimizer': 'adam', 'learning_rate': 5.5149756859052024e-05, 'batch_size': 32, 'label_smoothing': 0.04092264869062326}. Best is trial 4 with value: 1.1475324569633316.
[I 2026-02-26 11:25:25,120] Trial 45 finished with value: 1.152137863371837 and parameters: {'n_layers': 2, 'hidden_units': 128, 'dropout': 0.19854867710936408, 'l2': 2.8946283962062803e-06, 'optimizer': 'adam', 'learning_rate': 2.4677949744369752e-05, 'batch_size': 32, 'label_smoothing': 0.04187465712891208}. Best is trial 4 with value: 1.1475324569633316.
[I 2026-02-26 11:26:14,503] Trial 46 finished with value: 1.1522489195951768 and parameters: {'n_layers': 2, 'hidden_units': 128, 'dropout': 0.19830935935355348, 'l2': 2.4253572215279085e-06, 'optimizer': 'adam', 'learning_rate': 2.4743140830066545e-05, 'batch_size': 32, 'label_smoothing': 0.041169363192715976}. Best is trial 4 with value: 1.1475324569633316.
[I 2026-02-26 11:27:06,234] Trial 47 finished with value: 1.152226480777139 and parameters: {'n_layers': 2, 'hidden_units': 128, 'dropout': 0.2255998687630954, 'l2': 2.8485096326819493e-06, 'optimizer': 'adam', 'learning_rate': 2.4607848816092128e-05, 'batch_size': 32, 'label_smoothing': 0.03975651237146157}. Best is trial 4 with value: 1.1475324569633316.
[I 2026-02-26 11:28:17,592] Trial 48 pruned. 
[I 2026-02-26 11:29:12,961] Trial 49 pruned. 
[I 2026-02-26 11:30:47,234] Trial 50 pruned. 
[I 2026-02-26 11:32:16,149] Trial 51 pruned. 
[I 2026-02-26 11:32:49,293] Trial 52 finished with value: 1.1512247393577928 and parameters: {'n_layers': 2, 'hidden_units': 128, 'dropout': 0.19739066790810517, 'l2': 4.0172422315267866e-06, 'optimizer': 'adam', 'learning_rate': 5.13576754812972e-05, 'batch_size': 32, 'label_smoothing': 0.04181083032264648}. Best is trial 4 with value: 1.1475324569633316.
[I 2026-02-26 11:33:23,754] Trial 53 finished with value: 1.15047251006096 and parameters: {'n_layers': 2, 'hidden_units': 128, 'dropout': 0.20760283069038277, 'l2': 1.7845641144591195e-06, 'optimizer': 'adam', 'learning_rate': 4.796771444796088e-05, 'batch_size': 32, 'label_smoothing': 0.038726987394239486}. Best is trial 4 with value: 1.1475324569633316.
[I 2026-02-26 11:34:01,093] Trial 54 finished with value: 1.1517711292508346 and parameters: {'n_layers': 2, 'hidden_units': 128, 'dropout': 0.22792654332086307, 'l2': 1.700764548189027e-06, 'optimizer': 'adam', 'learning_rate': 4.471790922185244e-05, 'batch_size': 32, 'label_smoothing': 0.028401403876344905}. Best is trial 4 with value: 1.1475324569633316.
[I 2026-02-26 11:34:38,361] Trial 55 finished with value: 1.1519146056884093 and parameters: {'n_layers': 2, 'hidden_units': 128, 'dropout': 0.26133364101079376, 'l2': 5.823900303873777e-06, 'optimizer': 'adam', 'learning_rate': 4.538251969263292e-05, 'batch_size': 32, 'label_smoothing': 0.025198905212670784}. Best is trial 4 with value: 1.1475324569633316.
[I 2026-02-26 11:35:17,921] Trial 56 pruned. 
[I 2026-02-26 11:35:55,075] Trial 57 pruned. 
[I 2026-02-26 11:36:39,904] Trial 58 pruned. 
[I 2026-02-26 11:37:12,063] Trial 59 pruned. 
[I 2026-02-26 11:37:49,019] Trial 60 pruned. 
[I 2026-02-26 11:38:51,157] Trial 61 pruned. 
[I 2026-02-26 11:39:28,330] Trial 62 finished with value: 1.1526808817510845 and parameters: {'n_layers': 2, 'hidden_units': 128, 'dropout': 0.16476129045202192, 'l2': 7.589768994575982e-06, 'optimizer': 'adam', 'learning_rate': 4.322303449703719e-05, 'batch_size': 32, 'label_smoothing': 0.04820525689970421}. Best is trial 4 with value: 1.1475324569633316.
[I 2026-02-26 11:40:04,301] Trial 63 finished with value: 1.151394418238518 and parameters: {'n_layers': 2, 'hidden_units': 128, 'dropout': 0.20180819299099043, 'l2': 1.8569151511492158e-06, 'optimizer': 'adam', 'learning_rate': 5.311236771082859e-05, 'batch_size': 32, 'label_smoothing': 0.03710452726704658}. Best is trial 4 with value: 1.1475324569633316.
[I 2026-02-26 11:40:45,553] Trial 64 pruned. 
[I 2026-02-26 11:41:18,491] Trial 65 finished with value: 1.1505035927318779 and parameters: {'n_layers': 2, 'hidden_units': 128, 'dropout': 0.2552681961087671, 'l2': 1.0362334437426575e-06, 'optimizer': 'adam', 'learning_rate': 6.535760348700347e-05, 'batch_size': 32, 'label_smoothing': 0.019566602973966583}. Best is trial 4 with value: 1.1475324569633316.
[I 2026-02-26 11:41:51,334] Trial 66 finished with value: 1.1503858333051886 and parameters: {'n_layers': 2, 'hidden_units': 128, 'dropout': 0.25598609724057797, 'l2': 1.1791089608840842e-06, 'optimizer': 'adam', 'learning_rate': 6.763866456161032e-05, 'batch_size': 32, 'label_smoothing': 0.020640988783617534}. Best is trial 4 with value: 1.1475324569633316.
[I 2026-02-26 11:42:24,907] Trial 67 finished with value: 1.151519710820282 and parameters: {'n_layers': 2, 'hidden_units': 128, 'dropout': 0.2423396419408187, 'l2': 1.0191125645950745e-06, 'optimizer': 'adam', 'learning_rate': 6.159294487894072e-05, 'batch_size': 32, 'label_smoothing': 0.019534892938549913}. Best is trial 4 with value: 1.1475324569633316.
[I 2026-02-26 11:42:58,220] Trial 68 finished with value: 1.1507261119730636 and parameters: {'n_layers': 2, 'hidden_units': 128, 'dropout': 0.24635327859435918, 'l2': 1.4924810840236709e-06, 'optimizer': 'adam', 'learning_rate': 6.433281507299779e-05, 'batch_size': 32, 'label_smoothing': 0.01963718268837437}. Best is trial 4 with value: 1.1475324569633316.
[I 2026-02-26 11:43:28,726] Trial 69 finished with value: 1.1500207817786605 and parameters: {'n_layers': 2, 'hidden_units': 128, 'dropout': 0.20755300578829244, 'l2': 1.3447259272907978e-06, 'optimizer': 'adam', 'learning_rate': 8.076431546006256e-05, 'batch_size': 32, 'label_smoothing': 0.05679038340238068}. Best is trial 4 with value: 1.1475324569633316.
[I 2026-02-26 11:44:02,078] Trial 70 pruned. 
[I 2026-02-26 11:44:37,039] Trial 71 pruned. 
[I 2026-02-26 11:45:20,922] Trial 72 pruned. 
[I 2026-02-26 11:45:54,572] Trial 73 pruned. 
[I 2026-02-26 11:46:28,865] Trial 74 finished with value: 1.1506713023244557 and parameters: {'n_layers': 2, 'hidden_units': 128, 'dropout': 0.24647494325892907, 'l2': 1.9747769307938923e-06, 'optimizer': 'adam', 'learning_rate': 6.58603226675075e-05, 'batch_size': 32, 'label_smoothing': 0.053343315718924006}. Best is trial 4 with value: 1.1475324569633316.
[I 2026-02-26 11:46:54,874] Trial 75 finished with value: 1.1525085157813344 and parameters: {'n_layers': 2, 'hidden_units': 128, 'dropout': 0.25154401670994464, 'l2': 1.36165082976343e-06, 'optimizer': 'adam', 'learning_rate': 0.00019194317662349215, 'batch_size': 32, 'label_smoothing': 0.0531279824363602}. Best is trial 4 with value: 1.1475324569633316.
[I 2026-02-26 11:47:26,704] Trial 76 pruned. 
[I 2026-02-26 11:47:58,066] Trial 77 pruned. 
[I 2026-02-26 11:48:22,366] Trial 78 pruned. 
[I 2026-02-26 11:48:59,107] Trial 79 pruned. 
[I 2026-02-26 11:49:26,790] Trial 80 finished with value: 1.1516566143895806 and parameters: {'n_layers': 2, 'hidden_units': 128, 'dropout': 0.21886637111541785, 'l2': 2.124376344233955e-06, 'optimizer': 'adam', 'learning_rate': 0.0001417676070558552, 'batch_size': 32, 'label_smoothing': 0.043939866252778896}. Best is trial 4 with value: 1.1475324569633316.
[I 2026-02-26 11:49:59,881] Trial 81 finished with value: 1.1534820133893262 and parameters: {'n_layers': 2, 'hidden_units': 128, 'dropout': 0.15182589518574205, 'l2': 3.1984651038585e-06, 'optimizer': 'adam', 'learning_rate': 6.998808290396894e-05, 'batch_size': 32, 'label_smoothing': 0.005304509618156244}. Best is trial 4 with value: 1.1475324569633316.
[I 2026-02-26 11:50:37,680] Trial 82 pruned. 
[I 2026-02-26 11:51:31,344] Trial 83 finished with value: 1.1517718991310453 and parameters: {'n_layers': 2, 'hidden_units': 128, 'dropout': 0.23901319681278493, 'l2': 1.6740767236802515e-06, 'optimizer': 'adam', 'learning_rate': 2.8906479841206405e-05, 'batch_size': 32, 'label_smoothing': 0.031237866505204003}. Best is trial 4 with value: 1.1475324569633316.
[I 2026-02-26 11:52:16,483] Trial 84 pruned. 
[I 2026-02-26 11:53:10,951] Trial 85 pruned. 
[I 2026-02-26 11:53:43,663] Trial 86 pruned. 
[I 2026-02-26 11:54:25,236] Trial 87 pruned. 
[I 2026-02-26 11:55:06,231] Trial 88 finished with value: 1.1454054673855558 and parameters: {'n_layers': 2, 'hidden_units': 128, 'dropout': 0.498349464814708, 'l2': 0.005995906727301191, 'optimizer': 'adam', 'learning_rate': 0.00014231922824304688, 'batch_size': 32, 'label_smoothing': 0.03839084798235034}. Best is trial 88 with value: 1.1454054673855558.
[I 2026-02-26 11:55:46,888] Trial 89 pruned. 
[I 2026-02-26 11:56:17,141] Trial 90 finished with value: 1.1465213490975183 and parameters: {'n_layers': 2, 'hidden_units': 128, 'dropout': 0.45640718484809306, 'l2': 0.0015575498480020413, 'optimizer': 'adam', 'learning_rate': 0.00018471645513715458, 'batch_size': 32, 'label_smoothing': 0.12627540247277913}. Best is trial 88 with value: 1.1454054673855558.
[I 2026-02-26 11:56:57,254] Trial 91 pruned. 
[I 2026-02-26 11:57:26,408] Trial 92 finished with value: 1.1483589277190935 and parameters: {'n_layers': 2, 'hidden_units': 128, 'dropout': 0.4198638838345543, 'l2': 0.0008104784758301528, 'optimizer': 'adam', 'learning_rate': 0.000222585588160733, 'batch_size': 32, 'label_smoothing': 0.10731643460787475}. Best is trial 88 with value: 1.1454054673855558.
[I 2026-02-26 11:57:55,604] Trial 93 pruned. 
[I 2026-02-26 11:58:28,209] Trial 94 pruned. 
[I 2026-02-26 11:58:59,707] Trial 95 pruned. 
[I 2026-02-26 11:59:27,250] Trial 96 pruned. 
[I 2026-02-26 11:59:59,901] Trial 97 pruned. 
[I 2026-02-26 12:00:39,792] Trial 98 pruned. 
[I 2026-02-26 12:01:25,061] Trial 99 pruned. 
[I 2026-02-26 12:02:01,466] Trial 100 pruned. 
[I 2026-02-26 12:02:28,070] Trial 101 pruned. 
[I 2026-02-26 12:03:05,915] Trial 102 finished with value: 1.149444633393043 and parameters: {'n_layers': 2, 'hidden_units': 128, 'dropout': 0.2226870169852815, 'l2': 0.0005054021232421701, 'optimizer': 'adam', 'learning_rate': 8.130251560610755e-05, 'batch_size': 32, 'label_smoothing': 0.046135994030573065}. Best is trial 88 with value: 1.1454054673855558.
[I 2026-02-26 12:03:36,768] Trial 103 finished with value: 1.1513284648756756 and parameters: {'n_layers': 2, 'hidden_units': 128, 'dropout': 0.22981079552979106, 'l2': 0.0004836263487264696, 'optimizer': 'adam', 'learning_rate': 0.0002591499901191657, 'batch_size': 32, 'label_smoothing': 0.1124581380503143}. Best is trial 88 with value: 1.1454054673855558.
[I 2026-02-26 12:04:18,769] Trial 104 pruned. 
[I 2026-02-26 12:05:03,592] Trial 105 pruned. 
[I 2026-02-26 12:05:39,033] Trial 106 finished with value: 1.1499914705883456 and parameters: {'n_layers': 2, 'hidden_units': 128, 'dropout': 0.22326795414501496, 'l2': 0.00043235088949585557, 'optimizer': 'adam', 'learning_rate': 0.00011576578913668043, 'batch_size': 32, 'label_smoothing': 0.10776920301070111}. Best is trial 88 with value: 1.1454054673855558.
[I 2026-02-26 12:06:15,371] Trial 107 pruned. 
[I 2026-02-26 12:06:50,894] Trial 108 pruned. 
