[I 2026-02-26 12:07:28,473] Trial 109 pruned. 
[I 2026-02-26 12:08:03,546] Trial 110 pruned. 
[I 2026-02-26 12:08:35,478] Trial 111 finished with value: 1.15139862317125 and parameters: {'n_layers': 2, 'hidden_units': 128, 'dropout': 0.2284415641969346, 'l2': 0.00026192944404025725, 'optimizer': 'adam', 'learning_rate': 0.0002334978924826207, 'batch_size': 32, 'label_smoothing': 0.12503969206867233}. Best is trial 88 with value: 1.1454054673855558.
[I 2026-02-26 12:09:16,813] Trial 112 pruned. 
[I 2026-02-26 12:10:01,714] Trial 113 pruned. 
[I 2026-02-26 12:10:35,809] Trial 114 pruned. 
[I 2026-02-26 12:11:27,122] Trial 115 pruned. 
[I 2026-02-26 12:12:22,117] Trial 116 pruned. 
[I 2026-02-26 12:12:57,139] Trial 117 pruned. 
[I 2026-02-26 12:13:35,673] Trial 118 pruned. 
[I 2026-02-26 12:14:17,644] Trial 119 finished with value: 1.1489197919505427 and parameters: {'n_layers': 2, 'hidden_units': 128, 'dropout': 0.2358213199149924, 'l2': 0.00016390873389294166, 'optimizer': 'nadam', 'learning_rate': 8.404654449887337e-05, 'batch_size': 32, 'label_smoothing': 0.028994907552885453}. Best is trial 88 with value: 1.1454054673855558.
[I 2026-02-26 12:15:07,426] Trial 120 pruned. 
[I 2026-02-26 12:15:40,774] Trial 121 finished with value: 1.1460297374096764 and parameters: {'n_layers': 2, 'hidden_units': 128, 'dropout': 0.297847368282961, 'l2': 0.00013573812227323426, 'optimizer': 'nadam', 'learning_rate': 0.0004353639994258303, 'batch_size': 32, 'label_smoothing': 0.10703068528337899}. Best is trial 88 with value: 1.1454054673855558.
[I 2026-02-26 12:16:13,186] Trial 122 pruned. 
[I 2026-02-26 12:16:46,607] Trial 123 finished with value: 1.1498204915573509 and parameters: {'n_layers': 2, 'hidden_units': 128, 'dropout': 0.20446144442255718, 'l2': 0.00017783473569872636, 'optimizer': 'nadam', 'learning_rate': 0.00040606679165829763, 'batch_size': 32, 'label_smoothing': 0.028891536504566755}. Best is trial 88 with value: 1.1454054673855558.
[I 2026-02-26 12:17:18,607] Trial 124 pruned. 
[I 2026-02-26 12:17:52,817] Trial 125 pruned. 
[I 2026-02-26 12:18:26,615] Trial 126 finished with value: 1.151920997045156 and parameters: {'n_layers': 2, 'hidden_units': 128, 'dropout': 0.20195914287028385, 'l2': 0.0001496391629310544, 'optimizer': 'nadam', 'learning_rate': 0.000425136441306063, 'batch_size': 32, 'label_smoothing': 0.10620352822311883}. Best is trial 88 with value: 1.1454054673855558.
[I 2026-02-26 12:19:01,930] Trial 127 pruned. 
[I 2026-02-26 12:19:37,040] Trial 128 finished with value: 1.1501983590337421 and parameters: {'n_layers': 2, 'hidden_units': 128, 'dropout': 0.2977743741503716, 'l2': 8.39501691498162e-05, 'optimizer': 'nadam', 'learning_rate': 0.00028913027668014263, 'batch_size': 32, 'label_smoothing': 0.02634882845931126}. Best is trial 88 with value: 1.1454054673855558.
[I 2026-02-26 12:20:13,609] Trial 129 pruned. 
[I 2026-02-26 12:20:48,053] Trial 130 finished with value: 1.1497095117320615 and parameters: {'n_layers': 2, 'hidden_units': 128, 'dropout': 0.33556650246064096, 'l2': 8.96729191806873e-05, 'optimizer': 'nadam', 'learning_rate': 0.00038101736947922444, 'batch_size': 32, 'label_smoothing': 0.02749454071160892}. Best is trial 88 with value: 1.1454054673855558.
[I 2026-02-26 12:21:22,498] Trial 131 finished with value: 1.1449474101155892 and parameters: {'n_layers': 2, 'hidden_units': 128, 'dropout': 0.3427192425394222, 'l2': 7.441563087721082e-05, 'optimizer': 'nadam', 'learning_rate': 0.000525971613818826, 'batch_size': 32, 'label_smoothing': 0.023602252585434753}. Best is trial 131 with value: 1.1449474101155892.
[I 2026-02-26 12:21:57,522] Trial 132 finished with value: 1.1470423993863994 and parameters: {'n_layers': 2, 'hidden_units': 128, 'dropout': 0.3411280825683537, 'l2': 7.64876130917786e-05, 'optimizer': 'nadam', 'learning_rate': 0.0005563394398537348, 'batch_size': 32, 'label_smoothing': 0.025798481981121044}. Best is trial 131 with value: 1.1449474101155892.
[I 2026-02-26 12:22:32,808] Trial 133 finished with value: 1.144261651782226 and parameters: {'n_layers': 2, 'hidden_units': 128, 'dropout': 0.34955909857225953, 'l2': 7.064239937334744e-05, 'optimizer': 'nadam', 'learning_rate': 0.000529743525981024, 'batch_size': 32, 'label_smoothing': 0.02729388582241327}. Best is trial 133 with value: 1.144261651782226.
[I 2026-02-26 12:23:08,271] Trial 134 finished with value: 1.1467495146837452 and parameters: {'n_layers': 2, 'hidden_units': 128, 'dropout': 0.3428475856412667, 'l2': 0.0001268528494479591, 'optimizer': 'nadam', 'learning_rate': 0.00041955551672913653, 'batch_size': 32, 'label_smoothing': 0.03337586329821013}. Best is trial 133 with value: 1.144261651782226.
[I 2026-02-26 12:23:44,650] Trial 135 finished with value: 1.1453799524694859 and parameters: {'n_layers': 2, 'hidden_units': 128, 'dropout': 0.3363601204844196, 'l2': 6.497301436720483e-05, 'optimizer': 'nadam', 'learning_rate': 0.0005227222370216238, 'batch_size': 32, 'label_smoothing': 0.03323324312869737}. Best is trial 133 with value: 1.144261651782226.
[I 2026-02-26 12:24:20,308] Trial 136 finished with value: 1.1475143754744777 and parameters: {'n_layers': 2, 'hidden_units': 128, 'dropout': 0.33900098331444495, 'l2': 6.334783706310935e-05, 'optimizer': 'nadam', 'learning_rate': 0.0005611034016060568, 'batch_size': 32, 'label_smoothing': 0.03355179470443748}. Best is trial 133 with value: 1.144261651782226.
[I 2026-02-26 12:24:56,567] Trial 137 finished with value: 1.1457706601024957 and parameters: {'n_layers': 2, 'hidden_units': 128, 'dropout': 0.3360189482048341, 'l2': 4.3432383136591166e-05, 'optimizer': 'nadam', 'learning_rate': 0.0005246051553410379, 'batch_size': 32, 'label_smoothing': 0.033917226269103616}. Best is trial 133 with value: 1.144261651782226.
[I 2026-02-26 12:25:32,814] Trial 138 pruned. 
[I 2026-02-26 12:26:08,278] Trial 139 pruned. 
[I 2026-02-26 12:26:45,134] Trial 140 pruned. 
[I 2026-02-26 12:27:19,506] Trial 141 pruned. 
[I 2026-02-26 12:27:56,550] Trial 142 finished with value: 1.1443992218376844 and parameters: {'n_layers': 2, 'hidden_units': 128, 'dropout': 0.3379366263074749, 'l2': 8.619539522079547e-05, 'optimizer': 'nadam', 'learning_rate': 0.00046792998266275755, 'batch_size': 32, 'label_smoothing': 0.02855946763135725}. Best is trial 133 with value: 1.144261651782226.
[I 2026-02-26 12:28:34,234] Trial 143 finished with value: 1.1453986650938253 and parameters: {'n_layers': 2, 'hidden_units': 128, 'dropout': 0.3449043144001193, 'l2': 5.180422169919059e-05, 'optimizer': 'nadam', 'learning_rate': 0.0005077086516304707, 'batch_size': 32, 'label_smoothing': 0.03213538323828872}. Best is trial 133 with value: 1.144261651782226.
[I 2026-02-26 12:29:11,906] Trial 144 pruned. 
[I 2026-02-26 12:29:48,175] Trial 145 pruned. 
[I 2026-02-26 12:30:24,537] Trial 146 pruned. 
[I 2026-02-26 12:31:01,760] Trial 147 pruned. 
[I 2026-02-26 12:31:40,042] Trial 148 finished with value: 1.1467705104798502 and parameters: {'n_layers': 2, 'hidden_units': 128, 'dropout': 0.3448176195760221, 'l2': 5.6698985354728555e-05, 'optimizer': 'nadam', 'learning_rate': 0.0005394897440324336, 'batch_size': 32, 'label_smoothing': 0.028699887360674595}. Best is trial 133 with value: 1.144261651782226.
[I 2026-02-26 12:32:18,508] Trial 149 pruned. 
[I 2026-02-26 12:32:56,812] Trial 150 finished with value: 1.1474943617529243 and parameters: {'n_layers': 2, 'hidden_units': 128, 'dropout': 0.3446018922537885, 'l2': 2.1567022301848297e-05, 'optimizer': 'nadam', 'learning_rate': 0.0005561419086638785, 'batch_size': 32, 'label_smoothing': 0.033585725932272444}. Best is trial 133 with value: 1.144261651782226.
[I 2026-02-26 12:33:34,889] Trial 151 pruned. 
[I 2026-02-26 12:34:13,419] Trial 152 pruned. 
[I 2026-02-26 12:34:52,834] Trial 153 finished with value: 1.14787818892572 and parameters: {'n_layers': 2, 'hidden_units': 128, 'dropout': 0.3675312859566342, 'l2': 5.534096851104069e-05, 'optimizer': 'nadam', 'learning_rate': 0.0005070169493387348, 'batch_size': 32, 'label_smoothing': 0.02240910702133229}. Best is trial 133 with value: 1.144261651782226.
[I 2026-02-26 12:35:32,281] Trial 154 finished with value: 1.1483059050076676 and parameters: {'n_layers': 2, 'hidden_units': 128, 'dropout': 0.36868986994596065, 'l2': 5.464603728542436e-05, 'optimizer': 'nadam', 'learning_rate': 0.0005109246950962654, 'batch_size': 32, 'label_smoothing': 0.025426612883868466}. Best is trial 133 with value: 1.144261651782226.
[I 2026-02-26 12:36:12,988] Trial 155 finished with value: 1.145797197665597 and parameters: {'n_layers': 2, 'hidden_units': 128, 'dropout': 0.35213849176599193, 'l2': 3.859072484128479e-05, 'optimizer': 'nadam', 'learning_rate': 0.00044881158084574034, 'batch_size': 32, 'label_smoothing': 0.02107794854339342}. Best is trial 133 with value: 1.144261651782226.
[I 2026-02-26 12:36:53,067] Trial 156 finished with value: 1.1452033459550492 and parameters: {'n_layers': 2, 'hidden_units': 128, 'dropout': 0.314206515364896, 'l2': 4.0678298350486324e-05, 'optimizer': 'nadam', 'learning_rate': 0.0004445293107255017, 'batch_size': 32, 'label_smoothing': 0.04187126070954873}. Best is trial 133 with value: 1.144261651782226.
[I 2026-02-26 12:37:33,128] Trial 157 finished with value: 1.1454238427477776 and parameters: {'n_layers': 2, 'hidden_units': 128, 'dropout': 0.31055451794110817, 'l2': 1.338373635846774e-05, 'optimizer': 'nadam', 'learning_rate': 0.00043080529471077253, 'batch_size': 32, 'label_smoothing': 0.030639174207933308}. Best is trial 133 with value: 1.144261651782226.
[I 2026-02-26 12:38:13,944] Trial 158 finished with value: 1.1483923008532384 and parameters: {'n_layers': 2, 'hidden_units': 128, 'dropout': 0.3149494542179023, 'l2': 1.365325346008979e-05, 'optimizer': 'nadam', 'learning_rate': 0.0003533853869705145, 'batch_size': 32, 'label_smoothing': 0.029365794304335592}. Best is trial 133 with value: 1.144261651782226.
[I 2026-02-26 12:38:54,486] Trial 159 finished with value: 1.1451300719466517 and parameters: {'n_layers': 2, 'hidden_units': 128, 'dropout': 0.3534297192960179, 'l2': 2.2417018691067105e-05, 'optimizer': 'nadam', 'learning_rate': 0.0004455602185462653, 'batch_size': 32, 'label_smoothing': 0.019115846536713492}. Best is trial 133 with value: 1.144261651782226.
[I 2026-02-26 12:39:35,983] Trial 160 finished with value: 1.1456361151145444 and parameters: {'n_layers': 2, 'hidden_units': 128, 'dropout': 0.3076972104800206, 'l2': 3.8243504706202795e-05, 'optimizer': 'nadam', 'learning_rate': 0.00043420797319570917, 'batch_size': 32, 'label_smoothing': 0.018161576774992177}. Best is trial 133 with value: 1.144261651782226.
[I 2026-02-26 12:40:17,734] Trial 161 finished with value: 1.1449436049050177 and parameters: {'n_layers': 2, 'hidden_units': 128, 'dropout': 0.3066123945719688, 'l2': 3.523675099863997e-05, 'optimizer': 'nadam', 'learning_rate': 0.0004296693630568554, 'batch_size': 32, 'label_smoothing': 0.01007115788548512}. Best is trial 133 with value: 1.144261651782226.
[I 2026-02-26 12:40:59,092] Trial 162 finished with value: 1.1452155001983462 and parameters: {'n_layers': 2, 'hidden_units': 128, 'dropout': 0.3044371144277113, 'l2': 3.868396658897725e-05, 'optimizer': 'nadam', 'learning_rate': 0.0004523803954233825, 'batch_size': 32, 'label_smoothing': 0.009909506939134591}. Best is trial 133 with value: 1.144261651782226.
[I 2026-02-26 12:41:40,671] Trial 163 finished with value: 1.1450406160335778 and parameters: {'n_layers': 2, 'hidden_units': 128, 'dropout': 0.3089158445320734, 'l2': 3.463734386722776e-05, 'optimizer': 'nadam', 'learning_rate': 0.0004381296058597385, 'batch_size': 32, 'label_smoothing': 0.010818641176184658}. Best is trial 133 with value: 1.144261651782226.
[I 2026-02-26 12:42:22,607] Trial 164 finished with value: 1.1456493530224232 and parameters: {'n_layers': 2, 'hidden_units': 128, 'dropout': 0.308771328666375, 'l2': 3.345376939389604e-05, 'optimizer': 'nadam', 'learning_rate': 0.00043912765126916835, 'batch_size': 32, 'label_smoothing': 0.0112675295375555}. Best is trial 133 with value: 1.144261651782226.
[I 2026-02-26 12:43:05,216] Trial 165 finished with value: 1.149039700269789 and parameters: {'n_layers': 2, 'hidden_units': 128, 'dropout': 0.30844004554479093, 'l2': 3.540477683618721e-05, 'optimizer': 'nadam', 'learning_rate': 0.00037391182609618857, 'batch_size': 32, 'label_smoothing': 0.008242425695532948}. Best is trial 133 with value: 1.144261651782226.
[I 2026-02-26 12:43:47,135] Trial 166 pruned. 
[I 2026-02-26 12:44:29,691] Trial 167 finished with value: 1.1446749727715981 and parameters: {'n_layers': 2, 'hidden_units': 128, 'dropout': 0.30144712178003785, 'l2': 1.63175544728904e-05, 'optimizer': 'nadam', 'learning_rate': 0.0004485364109678429, 'batch_size': 32, 'label_smoothing': 0.002434516228637151}. Best is trial 133 with value: 1.144261651782226.
[I 2026-02-26 12:45:11,349] Trial 168 pruned. 
[I 2026-02-26 12:45:53,979] Trial 169 pruned. 
[I 2026-02-26 12:46:37,817] Trial 170 pruned. 
[I 2026-02-26 12:47:18,727] Trial 171 pruned. 
[I 2026-02-26 12:48:01,836] Trial 172 finished with value: 1.1464102161217449 and parameters: {'n_layers': 2, 'hidden_units': 128, 'dropout': 0.2928023880690214, 'l2': 3.060047340086952e-05, 'optimizer': 'nadam', 'learning_rate': 0.0004545444080104078, 'batch_size': 32, 'label_smoothing': 0.006719942342864667}. Best is trial 133 with value: 1.144261651782226.
[I 2026-02-26 12:48:45,822] Trial 173 pruned. 
[I 2026-02-26 12:49:29,437] Trial 174 finished with value: 1.1462420261524984 and parameters: {'n_layers': 2, 'hidden_units': 128, 'dropout': 0.3064675364183965, 'l2': 1.8287877160621762e-05, 'optimizer': 'nadam', 'learning_rate': 0.0004147084447782702, 'batch_size': 32, 'label_smoothing': 0.013478398947793152}. Best is trial 133 with value: 1.144261651782226.
[I 2026-02-26 12:50:12,609] Trial 175 pruned. 
[I 2026-02-26 12:50:54,834] Trial 176 pruned. 
[I 2026-02-26 12:51:39,773] Trial 177 pruned. 
[I 2026-02-26 12:52:24,117] Trial 178 finished with value: 1.1478490268539872 and parameters: {'n_layers': 2, 'hidden_units': 128, 'dropout': 0.31376748808659455, 'l2': 4.6928100361667614e-05, 'optimizer': 'nadam', 'learning_rate': 0.0003564575787547429, 'batch_size': 32, 'label_smoothing': 0.018851754664404148}. Best is trial 133 with value: 1.144261651782226.
[I 2026-02-26 12:53:07,690] Trial 179 pruned. 
[I 2026-02-26 12:53:53,045] Trial 180 pruned. 
[I 2026-02-26 12:54:38,076] Trial 181 pruned. 
[I 2026-02-26 12:55:23,261] Trial 182 finished with value: 1.1478460922265648 and parameters: {'n_layers': 2, 'hidden_units': 128, 'dropout': 0.30790227582525187, 'l2': 1.804286131913163e-05, 'optimizer': 'nadam', 'learning_rate': 0.0004079916078174473, 'batch_size': 32, 'label_smoothing': 0.011838411486013984}. Best is trial 133 with value: 1.144261651782226.
[I 2026-02-26 12:56:08,963] Trial 183 finished with value: 1.146078752780364 and parameters: {'n_layers': 2, 'hidden_units': 128, 'dropout': 0.29932092105934366, 'l2': 3.059308601218808e-05, 'optimizer': 'nadam', 'learning_rate': 0.00042623569545137863, 'batch_size': 32, 'label_smoothing': 0.014128918617127239}. Best is trial 133 with value: 1.144261651782226.
[I 2026-02-26 12:56:54,928] Trial 184 pruned. 
[I 2026-02-26 12:57:41,036] Trial 185 pruned. 
[I 2026-02-26 12:58:27,305] Trial 186 pruned. 
[I 2026-02-26 12:59:13,749] Trial 187 finished with value: 1.1454811567232381 and parameters: {'n_layers': 2, 'hidden_units': 128, 'dropout': 0.3745258916437585, 'l2': 5.0812062876786806e-05, 'optimizer': 'nadam', 'learning_rate': 0.0004981706316808051, 'batch_size': 32, 'label_smoothing': 0.02208468755464473}. Best is trial 133 with value: 1.144261651782226.
[I 2026-02-26 13:00:00,330] Trial 188 pruned. 
[I 2026-02-26 13:00:46,064] Trial 189 pruned. 
[I 2026-02-26 13:01:32,739] Trial 190 pruned. 
[I 2026-02-26 13:02:20,562] Trial 191 finished with value: 1.1483281367865048 and parameters: {'n_layers': 2, 'hidden_units': 128, 'dropout': 0.4021687071194054, 'l2': 6.400500927048722e-05, 'optimizer': 'nadam', 'learning_rate': 0.00048310891798357885, 'batch_size': 32, 'label_smoothing': 0.0037018522358859707}. Best is trial 133 with value: 1.144261651782226.
[I 2026-02-26 13:03:07,559] Trial 192 finished with value: 1.1457396306032375 and parameters: {'n_layers': 2, 'hidden_units': 128, 'dropout': 0.3166523331974435, 'l2': 4.9059105107199846e-05, 'optimizer': 'nadam', 'learning_rate': 0.0004365269407848715, 'batch_size': 32, 'label_smoothing': 0.014833420208180367}. Best is trial 133 with value: 1.144261651782226.
[I 2026-02-26 13:03:56,605] Trial 193 pruned. 
[I 2026-02-26 13:04:45,060] Trial 194 pruned. 
[I 2026-02-26 13:05:33,207] Trial 195 finished with value: 1.146567176008239 and parameters: {'n_layers': 2, 'hidden_units': 128, 'dropout': 0.3332890259247776, 'l2': 6.609179869849521e-05, 'optimizer': 'nadam', 'learning_rate': 0.0004474798968514479, 'batch_size': 32, 'label_smoothing': 0.010195465609697328}. Best is trial 133 with value: 1.144261651782226.
[I 2026-02-26 13:06:21,677] Trial 196 pruned. 
[I 2026-02-26 13:07:08,172] Trial 197 pruned. 
[I 2026-02-26 13:07:57,856] Trial 198 finished with value: 1.1439984761334152 and parameters: {'n_layers': 2, 'hidden_units': 128, 'dropout': 0.3140043937563305, 'l2': 7.974010251801742e-05, 'optimizer': 'nadam', 'learning_rate': 0.0004721683742459201, 'batch_size': 32, 'label_smoothing': 0.007597951610166473}. Best is trial 198 with value: 1.1439984761334152.
[I 2026-02-26 13:08:48,103] Trial 199 pruned. 
[I 2026-02-26 13:09:38,601] Trial 200 pruned. 
[I 2026-02-26 13:10:29,371] Trial 201 finished with value: 1.1449553952372267 and parameters: {'n_layers': 2, 'hidden_units': 128, 'dropout': 0.33612710137631896, 'l2': 2.2399257787449617e-05, 'optimizer': 'nadam', 'learning_rate': 0.0004784734257562415, 'batch_size': 32, 'label_smoothing': 0.0005009685158787018}. Best is trial 198 with value: 1.1439984761334152.
[I 2026-02-26 13:11:19,797] Trial 202 finished with value: 1.1453242449587029 and parameters: {'n_layers': 2, 'hidden_units': 128, 'dropout': 0.3339322183222499, 'l2': 1.4884900419354855e-05, 'optimizer': 'nadam', 'learning_rate': 0.00047697672995821475, 'batch_size': 32, 'label_smoothing': 0.0012060611463982195}. Best is trial 198 with value: 1.1439984761334152.
[I 2026-02-26 13:12:09,715] Trial 203 pruned. 
[I 2026-02-26 13:13:00,767] Trial 204 finished with value: 1.146751854832975 and parameters: {'n_layers': 2, 'hidden_units': 128, 'dropout': 0.3281652600740705, 'l2': 2.1871023792099765e-05, 'optimizer': 'nadam', 'learning_rate': 0.0004959227257666683, 'batch_size': 32, 'label_smoothing': 0.0027564157590864533}. Best is trial 198 with value: 1.1439984761334152.
[I 2026-02-26 13:13:52,204] Trial 205 pruned. 
[I 2026-02-26 13:14:43,515] Trial 206 pruned. 
[I 2026-02-26 13:15:35,149] Trial 207 finished with value: 1.1444615617330396 and parameters: {'n_layers': 2, 'hidden_units': 128, 'dropout': 0.34230482155980285, 'l2': 2.003353877752659e-05, 'optimizer': 'nadam', 'learning_rate': 0.00045994340693828037, 'batch_size': 32, 'label_smoothing': 0.007469440450934988}. Best is trial 198 with value: 1.1439984761334152.
[I 2026-02-26 13:16:28,038] Trial 208 pruned. 
[I 2026-02-26 13:17:20,348] Trial 209 pruned. 
[I 2026-02-26 13:18:12,059] Trial 210 pruned. 
[I 2026-02-26 13:19:03,784] Trial 211 pruned. 
[I 2026-02-26 13:19:55,934] Trial 212 pruned. 
[I 2026-02-26 13:20:49,232] Trial 213 pruned. 
[I 2026-02-26 13:21:41,947] Trial 214 pruned. 
[I 2026-02-26 13:22:35,317] Trial 215 finished with value: 1.1475555722366209 and parameters: {'n_layers': 2, 'hidden_units': 128, 'dropout': 0.3721666909885494, 'l2': 5.393243903791121e-05, 'optimizer': 'nadam', 'learning_rate': 0.00048059099606769537, 'batch_size': 32, 'label_smoothing': 0.03005941382642633}. Best is trial 198 with value: 1.1439984761334152.
[I 2026-02-26 13:23:30,424] Trial 216 pruned. 
[I 2026-02-26 13:24:24,353] Trial 217 finished with value: 1.1478440350712311 and parameters: {'n_layers': 2, 'hidden_units': 128, 'dropout': 0.39039022020700315, 'l2': 4.233575020510933e-05, 'optimizer': 'nadam', 'learning_rate': 0.00045070844082664843, 'batch_size': 32, 'label_smoothing': 0.04040917062537868}. Best is trial 198 with value: 1.1439984761334152.
[I 2026-02-26 13:25:17,973] Trial 218 finished with value: 1.1494483883045543 and parameters: {'n_layers': 2, 'hidden_units': 128, 'dropout': 0.3037621555125833, 'l2': 1.7427470615086937e-05, 'optimizer': 'nadam', 'learning_rate': 0.0005273322035960993, 'batch_size': 32, 'label_smoothing': 0.005530280238268969}. Best is trial 198 with value: 1.1439984761334152.
[I 2026-02-26 13:26:11,408] Trial 219 pruned. 
[I 2026-02-26 13:27:05,739] Trial 220 pruned. 
[I 2026-02-26 13:28:00,205] Trial 221 pruned. 
[I 2026-02-26 13:28:54,988] Trial 222 finished with value: 1.1441613088131735 and parameters: {'n_layers': 2, 'hidden_units': 128, 'dropout': 0.3563432917939828, 'l2': 3.672317354905075e-05, 'optimizer': 'nadam', 'learning_rate': 0.00045224473464045787, 'batch_size': 32, 'label_smoothing': 0.01638579198214618}. Best is trial 198 with value: 1.1439984761334152.
[I 2026-02-26 13:29:50,458] Trial 223 pruned. 
[I 2026-02-26 13:30:46,655] Trial 224 pruned. 
[I 2026-02-26 13:31:42,444] Trial 225 finished with value: 1.145536383146909 and parameters: {'n_layers': 2, 'hidden_units': 128, 'dropout': 0.3310937319510497, 'l2': 4.119122534247107e-05, 'optimizer': 'nadam', 'learning_rate': 0.00048138347670403345, 'batch_size': 32, 'label_smoothing': 0.014537750901660075}. Best is trial 198 with value: 1.1439984761334152.
[I 2026-02-26 13:32:38,028] Trial 226 pruned. 
[I 2026-02-26 13:33:33,177] Trial 227 pruned. 
[I 2026-02-26 13:34:28,891] Trial 228 pruned. 
