Job: tune-binary-rf
Repo: /dcs/23/u5514578/cs310/y3p
PWD: /dcs/23/u5514578/cs310/y3p
Python: /dcs/23/u5514578/cs310/y3p/venv/bin/python
src import OK
Task=binary Model=rf DataFile=data/processed/dataset1.csv NTrials=100
Running on tiger-02
[I 2026-03-20 01:12:50,125] Trial 0 finished with value: 0.10391991662071938 and parameters: {'n_estimators': 574, 'max_depth': None, 'min_samples_leaf': 1, 'min_samples_split': 18, 'max_features': 0.5, 'class_weight': None}. Best is trial 0 with value: 0.10391991662071938.
[I 2026-03-20 01:15:21,418] Trial 1 finished with value: 0.09668683986220308 and parameters: {'n_estimators': 383, 'max_depth': 20, 'min_samples_leaf': 2, 'min_samples_split': 7, 'max_features': 0.3, 'class_weight': None}. Best is trial 1 with value: 0.09668683986220308.
[I 2026-03-20 01:16:58,547] Trial 2 finished with value: 0.09596063844111123 and parameters: {'n_estimators': 808, 'max_depth': 14, 'min_samples_leaf': 4, 'min_samples_split': 3, 'max_features': 'sqrt', 'class_weight': None}. Best is trial 2 with value: 0.09596063844111123.
[I 2026-03-20 01:21:52,671] Trial 3 finished with value: 0.1691448288580828 and parameters: {'n_estimators': 863, 'max_depth': 20, 'min_samples_leaf': 8, 'min_samples_split': 19, 'max_features': 0.3, 'class_weight': 'balanced'}. Best is trial 2 with value: 0.09596063844111123.
[I 2026-03-20 01:22:05,857] Trial 4 finished with value: 0.1067134608263712 and parameters: {'n_estimators': 589, 'max_depth': 6, 'min_samples_leaf': 2, 'min_samples_split': 17, 'max_features': 'log2', 'class_weight': None}. Best is trial 2 with value: 0.09596063844111123.
[I 2026-03-20 01:30:32,988] Trial 5 finished with value: 0.0946672461785216 and parameters: {'n_estimators': 929, 'max_depth': 20, 'min_samples_leaf': 7, 'min_samples_split': 8, 'max_features': 0.5, 'class_weight': None}. Best is trial 5 with value: 0.0946672461785216.
[I 2026-03-20 01:32:58,699] Trial 6 finished with value: 0.20854318408070416 and parameters: {'n_estimators': 319, 'max_depth': 14, 'min_samples_leaf': 6, 'min_samples_split': 10, 'max_features': 0.5, 'class_weight': 'balanced'}. Best is trial 5 with value: 0.0946672461785216.
[I 2026-03-20 01:33:30,699] Trial 7 finished with value: 0.10038438238663532 and parameters: {'n_estimators': 449, 'max_depth': 6, 'min_samples_leaf': 2, 'min_samples_split': 19, 'max_features': 0.3, 'class_weight': None}. Best is trial 5 with value: 0.0946672461785216.
[I 2026-03-20 01:35:41,247] Trial 8 finished with value: 0.2619433731050828 and parameters: {'n_estimators': 1008, 'max_depth': None, 'min_samples_leaf': 9, 'min_samples_split': 18, 'max_features': 'log2', 'class_weight': 'balanced'}. Best is trial 5 with value: 0.0946672461785216.
[I 2026-03-20 01:39:41,419] Trial 9 finished with value: 0.2037169042769818 and parameters: {'n_estimators': 523, 'max_depth': 14, 'min_samples_leaf': 3, 'min_samples_split': 11, 'max_features': 0.5, 'class_weight': 'balanced'}. Best is trial 5 with value: 0.0946672461785216.
[I 2026-03-20 01:46:30,058] Trial 10 finished with value: 0.09637848583616711 and parameters: {'n_estimators': 1170, 'max_depth': 10, 'min_samples_leaf': 6, 'min_samples_split': 2, 'max_features': 0.8, 'class_weight': None}. Best is trial 5 with value: 0.0946672461785216.
[I 2026-03-20 01:48:06,513] Trial 11 finished with value: 0.09596639810849333 and parameters: {'n_estimators': 803, 'max_depth': 14, 'min_samples_leaf': 4, 'min_samples_split': 3, 'max_features': 'sqrt', 'class_weight': None}. Best is trial 5 with value: 0.0946672461785216.
[I 2026-03-20 01:50:56,461] Trial 12 finished with value: 0.09514065420455822 and parameters: {'n_estimators': 980, 'max_depth': 20, 'min_samples_leaf': 5, 'min_samples_split': 6, 'max_features': 'sqrt', 'class_weight': None}. Best is trial 5 with value: 0.0946672461785216.
[I 2026-03-20 01:53:48,284] Trial 13 finished with value: 0.09487718360065953 and parameters: {'n_estimators': 1023, 'max_depth': 20, 'min_samples_leaf': 7, 'min_samples_split': 6, 'max_features': 'sqrt', 'class_weight': None}. Best is trial 5 with value: 0.0946672461785216.
[I 2026-03-20 02:09:51,944] Trial 14 finished with value: 0.09725777027172842 and parameters: {'n_estimators': 1185, 'max_depth': 20, 'min_samples_leaf': 8, 'min_samples_split': 14, 'max_features': 0.8, 'class_weight': None}. Best is trial 5 with value: 0.0946672461785216.
[I 2026-03-20 02:19:04,212] Trial 15 finished with value: 0.09461958537272659 and parameters: {'n_estimators': 1010, 'max_depth': 20, 'min_samples_leaf': 7, 'min_samples_split': 7, 'max_features': 0.5, 'class_weight': None}. Best is trial 15 with value: 0.09461958537272659.
[I 2026-03-20 02:19:55,528] Trial 16 finished with value: 0.09542571661818658 and parameters: {'n_estimators': 213, 'max_depth': 10, 'min_samples_leaf': 10, 'min_samples_split': 9, 'max_features': 0.5, 'class_weight': None}. Best is trial 15 with value: 0.09461958537272659.
[I 2026-03-20 02:26:10,245] Trial 17 finished with value: 0.0951536886895438 and parameters: {'n_estimators': 685, 'max_depth': 20, 'min_samples_leaf': 7, 'min_samples_split': 13, 'max_features': 0.5, 'class_weight': None}. Best is trial 15 with value: 0.09461958537272659.
[I 2026-03-20 02:27:40,421] Trial 18 pruned. 
[I 2026-03-20 02:37:20,537] Trial 19 finished with value: 0.09522651345539795 and parameters: {'n_estimators': 1079, 'max_depth': 20, 'min_samples_leaf': 8, 'min_samples_split': 5, 'max_features': 0.5, 'class_weight': None}. Best is trial 15 with value: 0.09461958537272659.
[I 2026-03-20 02:37:35,404] Trial 20 pruned. 
[I 2026-03-20 02:40:30,146] Trial 21 finished with value: 0.09488794660229374 and parameters: {'n_estimators': 1047, 'max_depth': 20, 'min_samples_leaf': 7, 'min_samples_split': 5, 'max_features': 'sqrt', 'class_weight': None}. Best is trial 15 with value: 0.09461958537272659.
[I 2026-03-20 02:43:34,839] Trial 22 finished with value: 0.09491720208754219 and parameters: {'n_estimators': 1105, 'max_depth': 20, 'min_samples_leaf': 7, 'min_samples_split': 8, 'max_features': 'sqrt', 'class_weight': None}. Best is trial 15 with value: 0.09461958537272659.
[I 2026-03-20 02:43:55,585] Trial 23 pruned. 
[I 2026-03-20 02:49:25,620] Trial 24 finished with value: 0.09641628610848943 and parameters: {'n_estimators': 948, 'max_depth': 10, 'min_samples_leaf': 6, 'min_samples_split': 7, 'max_features': 0.8, 'class_weight': None}. Best is trial 15 with value: 0.09461958537272659.
[I 2026-03-20 02:49:54,045] Trial 25 pruned. 
[I 2026-03-20 03:00:24,842] Trial 26 finished with value: 0.09581293036324126 and parameters: {'n_estimators': 1117, 'max_depth': None, 'min_samples_leaf': 9, 'min_samples_split': 4, 'max_features': 0.5, 'class_weight': None}. Best is trial 15 with value: 0.09461958537272659.
[I 2026-03-20 03:01:33,698] Trial 27 pruned. 
[I 2026-03-20 03:02:08,636] Trial 28 pruned. 
[I 2026-03-20 03:09:42,250] Trial 29 finished with value: 0.09822826740199833 and parameters: {'n_estimators': 758, 'max_depth': None, 'min_samples_leaf': 6, 'min_samples_split': 9, 'max_features': 0.5, 'class_weight': None}. Best is trial 15 with value: 0.09461958537272659.
[I 2026-03-20 03:10:02,830] Trial 30 pruned. 
[I 2026-03-20 03:10:38,414] Trial 31 pruned. 
[I 2026-03-20 03:11:12,653] Trial 32 pruned. 
[I 2026-03-20 03:11:51,373] Trial 33 pruned. 
[I 2026-03-20 03:17:52,266] Trial 34 finished with value: 0.09410441472030248 and parameters: {'n_estimators': 986, 'max_depth': 20, 'min_samples_leaf': 6, 'min_samples_split': 2, 'max_features': 0.3, 'class_weight': None}. Best is trial 34 with value: 0.09410441472030248.
[I 2026-03-20 03:24:00,948] Trial 35 finished with value: 0.09459635708795029 and parameters: {'n_estimators': 962, 'max_depth': 20, 'min_samples_leaf': 4, 'min_samples_split': 2, 'max_features': 0.3, 'class_weight': None}. Best is trial 34 with value: 0.09410441472030248.
[I 2026-03-20 03:24:12,679] Trial 36 pruned. 
[I 2026-03-20 03:25:22,450] Trial 37 pruned. 
[I 2026-03-20 03:29:09,610] Trial 38 finished with value: 0.09577315910589064 and parameters: {'n_estimators': 807, 'max_depth': 14, 'min_samples_leaf': 1, 'min_samples_split': 2, 'max_features': 0.3, 'class_weight': None}. Best is trial 34 with value: 0.09410441472030248.
[I 2026-03-20 03:30:20,552] Trial 39 pruned. 
[I 2026-03-20 03:30:38,909] Trial 40 pruned. 
[I 2026-03-20 03:36:48,513] Trial 41 finished with value: 0.09411070576138328 and parameters: {'n_estimators': 1011, 'max_depth': 20, 'min_samples_leaf': 6, 'min_samples_split': 7, 'max_features': 0.3, 'class_weight': None}. Best is trial 34 with value: 0.09410441472030248.
[I 2026-03-20 03:42:12,859] Trial 42 finished with value: 0.09417916090505207 and parameters: {'n_estimators': 889, 'max_depth': 20, 'min_samples_leaf': 6, 'min_samples_split': 8, 'max_features': 0.3, 'class_weight': None}. Best is trial 34 with value: 0.09410441472030248.
[I 2026-03-20 03:48:11,652] Trial 43 finished with value: 0.09410460191601779 and parameters: {'n_estimators': 984, 'max_depth': 20, 'min_samples_leaf': 6, 'min_samples_split': 9, 'max_features': 0.3, 'class_weight': None}. Best is trial 34 with value: 0.09410441472030248.
[I 2026-03-20 03:53:32,436] Trial 44 finished with value: 0.0941917892081149 and parameters: {'n_estimators': 878, 'max_depth': 20, 'min_samples_leaf': 6, 'min_samples_split': 11, 'max_features': 0.3, 'class_weight': None}. Best is trial 34 with value: 0.09410441472030248.
[I 2026-03-20 03:53:44,499] Trial 45 pruned. 
[I 2026-03-20 03:58:33,306] Trial 46 finished with value: 0.09424547540469341 and parameters: {'n_estimators': 787, 'max_depth': 20, 'min_samples_leaf': 6, 'min_samples_split': 10, 'max_features': 0.3, 'class_weight': None}. Best is trial 34 with value: 0.09410441472030248.
[I 2026-03-20 04:02:21,415] Trial 47 finished with value: 0.09390325659332624 and parameters: {'n_estimators': 855, 'max_depth': 14, 'min_samples_leaf': 5, 'min_samples_split': 9, 'max_features': 0.3, 'class_weight': None}. Best is trial 47 with value: 0.09390325659332624.
[I 2026-03-20 04:02:59,255] Trial 48 pruned. 
[I 2026-03-20 04:06:20,923] Trial 49 finished with value: 0.09393282419264905 and parameters: {'n_estimators': 756, 'max_depth': 14, 'min_samples_leaf': 5, 'min_samples_split': 8, 'max_features': 0.3, 'class_weight': None}. Best is trial 47 with value: 0.09390325659332624.
[I 2026-03-20 04:09:38,620] Trial 50 finished with value: 0.09456446129765542 and parameters: {'n_estimators': 738, 'max_depth': 14, 'min_samples_leaf': 3, 'min_samples_split': 9, 'max_features': 0.3, 'class_weight': None}. Best is trial 47 with value: 0.09390325659332624.
[I 2026-03-20 04:13:23,463] Trial 51 finished with value: 0.0938971101636744 and parameters: {'n_estimators': 841, 'max_depth': 14, 'min_samples_leaf': 5, 'min_samples_split': 8, 'max_features': 0.3, 'class_weight': None}. Best is trial 51 with value: 0.0938971101636744.
[I 2026-03-20 04:17:05,520] Trial 52 finished with value: 0.09389902418899825 and parameters: {'n_estimators': 832, 'max_depth': 14, 'min_samples_leaf': 5, 'min_samples_split': 10, 'max_features': 0.3, 'class_weight': None}. Best is trial 51 with value: 0.0938971101636744.
[I 2026-03-20 04:20:51,171] Trial 53 finished with value: 0.0938971101636744 and parameters: {'n_estimators': 841, 'max_depth': 14, 'min_samples_leaf': 5, 'min_samples_split': 10, 'max_features': 0.3, 'class_weight': None}. Best is trial 51 with value: 0.0938971101636744.
[I 2026-03-20 04:23:41,797] Trial 54 finished with value: 0.09420717796867052 and parameters: {'n_estimators': 642, 'max_depth': 14, 'min_samples_leaf': 5, 'min_samples_split': 12, 'max_features': 0.3, 'class_weight': None}. Best is trial 51 with value: 0.0938971101636744.
[I 2026-03-20 04:27:28,783] Trial 55 finished with value: 0.0940833250346662 and parameters: {'n_estimators': 846, 'max_depth': 14, 'min_samples_leaf': 4, 'min_samples_split': 10, 'max_features': 0.3, 'class_weight': None}. Best is trial 51 with value: 0.0938971101636744.
[I 2026-03-20 04:30:55,764] Trial 56 finished with value: 0.09412591976134459 and parameters: {'n_estimators': 772, 'max_depth': 14, 'min_samples_leaf': 4, 'min_samples_split': 10, 'max_features': 0.3, 'class_weight': None}. Best is trial 51 with value: 0.0938971101636744.
[I 2026-03-20 04:32:34,438] Trial 57 pruned. 
[I 2026-03-20 04:34:52,751] Trial 58 finished with value: 0.09430776622965839 and parameters: {'n_estimators': 516, 'max_depth': 14, 'min_samples_leaf': 4, 'min_samples_split': 10, 'max_features': 0.3, 'class_weight': None}. Best is trial 51 with value: 0.0938971101636744.
[I 2026-03-20 04:35:41,422] Trial 59 pruned. 
[I 2026-03-20 04:35:52,665] Trial 60 pruned. 
[I 2026-03-20 04:39:37,776] Trial 61 finished with value: 0.09389772121164783 and parameters: {'n_estimators': 838, 'max_depth': 14, 'min_samples_leaf': 5, 'min_samples_split': 8, 'max_features': 0.3, 'class_weight': None}. Best is trial 51 with value: 0.0938971101636744.
[I 2026-03-20 04:43:20,065] Trial 62 finished with value: 0.09390186695774709 and parameters: {'n_estimators': 829, 'max_depth': 14, 'min_samples_leaf': 5, 'min_samples_split': 8, 'max_features': 0.3, 'class_weight': None}. Best is trial 51 with value: 0.0938971101636744.
[I 2026-03-20 04:46:58,355] Trial 63 finished with value: 0.09390851458820502 and parameters: {'n_estimators': 814, 'max_depth': 14, 'min_samples_leaf': 5, 'min_samples_split': 8, 'max_features': 0.3, 'class_weight': None}. Best is trial 51 with value: 0.0938971101636744.
[I 2026-03-20 04:50:35,888] Trial 64 finished with value: 0.09390557806661472 and parameters: {'n_estimators': 812, 'max_depth': 14, 'min_samples_leaf': 5, 'min_samples_split': 8, 'max_features': 0.3, 'class_weight': None}. Best is trial 51 with value: 0.0938971101636744.
[I 2026-03-20 04:54:42,579] Trial 65 finished with value: 0.09392071974912863 and parameters: {'n_estimators': 925, 'max_depth': 14, 'min_samples_leaf': 5, 'min_samples_split': 7, 'max_features': 0.3, 'class_weight': None}. Best is trial 51 with value: 0.0938971101636744.
[I 2026-03-20 04:56:19,318] Trial 66 pruned. 
[I 2026-03-20 04:59:31,892] Trial 67 finished with value: 0.09394184188817306 and parameters: {'n_estimators': 717, 'max_depth': 14, 'min_samples_leaf': 5, 'min_samples_split': 8, 'max_features': 0.3, 'class_weight': None}. Best is trial 51 with value: 0.0938971101636744.
[I 2026-03-20 05:02:33,814] Trial 68 finished with value: 0.0943017447154056 and parameters: {'n_estimators': 675, 'max_depth': 14, 'min_samples_leaf': 4, 'min_samples_split': 6, 'max_features': 0.3, 'class_weight': None}. Best is trial 51 with value: 0.0938971101636744.
[I 2026-03-20 05:02:46,197] Trial 69 pruned. 
[I 2026-03-20 05:06:46,178] Trial 70 finished with value: 0.09421271683167184 and parameters: {'n_estimators': 905, 'max_depth': 14, 'min_samples_leaf': 4, 'min_samples_split': 11, 'max_features': 0.3, 'class_weight': None}. Best is trial 51 with value: 0.0938971101636744.
[I 2026-03-20 05:10:26,052] Trial 71 finished with value: 0.09390654575278637 and parameters: {'n_estimators': 818, 'max_depth': 14, 'min_samples_leaf': 5, 'min_samples_split': 8, 'max_features': 0.3, 'class_weight': None}. Best is trial 51 with value: 0.0938971101636744.
[I 2026-03-20 05:14:10,902] Trial 72 finished with value: 0.09390154467804188 and parameters: {'n_estimators': 836, 'max_depth': 14, 'min_samples_leaf': 5, 'min_samples_split': 7, 'max_features': 0.3, 'class_weight': None}. Best is trial 51 with value: 0.0938971101636744.
[I 2026-03-20 05:18:04,362] Trial 73 finished with value: 0.0939124762512594 and parameters: {'n_estimators': 869, 'max_depth': 14, 'min_samples_leaf': 5, 'min_samples_split': 7, 'max_features': 0.3, 'class_weight': None}. Best is trial 51 with value: 0.0938971101636744.
[I 2026-03-20 05:21:47,384] Trial 74 finished with value: 0.09390154467804188 and parameters: {'n_estimators': 836, 'max_depth': 14, 'min_samples_leaf': 5, 'min_samples_split': 7, 'max_features': 0.3, 'class_weight': None}. Best is trial 51 with value: 0.0938971101636744.
[I 2026-03-20 05:25:53,409] Trial 75 finished with value: 0.09418599786179936 and parameters: {'n_estimators': 912, 'max_depth': 14, 'min_samples_leaf': 4, 'min_samples_split': 7, 'max_features': 0.3, 'class_weight': None}. Best is trial 51 with value: 0.0938971101636744.
[I 2026-03-20 05:26:04,559] Trial 76 pruned. 
[I 2026-03-20 05:27:59,047] Trial 77 pruned. 
[I 2026-03-20 05:31:29,587] Trial 78 finished with value: 0.09430742748232832 and parameters: {'n_estimators': 779, 'max_depth': 14, 'min_samples_leaf': 4, 'min_samples_split': 6, 'max_features': 0.3, 'class_weight': None}. Best is trial 51 with value: 0.0938971101636744.
[I 2026-03-20 05:32:09,037] Trial 79 pruned. 
[I 2026-03-20 05:33:29,933] Trial 80 pruned. 
[I 2026-03-20 05:37:21,298] Trial 81 finished with value: 0.09391065407379316 and parameters: {'n_estimators': 863, 'max_depth': 14, 'min_samples_leaf': 5, 'min_samples_split': 8, 'max_features': 0.3, 'class_weight': None}. Best is trial 51 with value: 0.0938971101636744.
[I 2026-03-20 05:40:56,193] Trial 82 finished with value: 0.09391548437106374 and parameters: {'n_estimators': 801, 'max_depth': 14, 'min_samples_leaf': 5, 'min_samples_split': 8, 'max_features': 0.3, 'class_weight': None}. Best is trial 51 with value: 0.0938971101636744.
[I 2026-03-20 05:41:36,785] Trial 83 pruned. 
[I 2026-03-20 05:41:48,295] Trial 84 pruned. 
[I 2026-03-20 05:45:48,987] Trial 85 finished with value: 0.09418131279013331 and parameters: {'n_estimators': 892, 'max_depth': 14, 'min_samples_leaf': 4, 'min_samples_split': 8, 'max_features': 0.3, 'class_weight': None}. Best is trial 51 with value: 0.0938971101636744.
[I 2026-03-20 05:46:00,109] Trial 86 pruned. 
[I 2026-03-20 05:46:42,703] Trial 87 pruned. 
[I 2026-03-20 05:50:35,464] Trial 88 finished with value: 0.09399939845024927 and parameters: {'n_estimators': 875, 'max_depth': 14, 'min_samples_leaf': 5, 'min_samples_split': 11, 'max_features': 0.3, 'class_weight': None}. Best is trial 51 with value: 0.0938971101636744.
[I 2026-03-20 05:51:01,453] Trial 89 pruned. 
[I 2026-03-20 05:51:58,931] Trial 90 pruned. 
[I 2026-03-20 05:55:38,803] Trial 91 finished with value: 0.09389997802511099 and parameters: {'n_estimators': 823, 'max_depth': 14, 'min_samples_leaf': 5, 'min_samples_split': 7, 'max_features': 0.3, 'class_weight': None}. Best is trial 51 with value: 0.0938971101636744.
[I 2026-03-20 05:59:01,367] Trial 92 finished with value: 0.09393573958381538 and parameters: {'n_estimators': 757, 'max_depth': 14, 'min_samples_leaf': 5, 'min_samples_split': 6, 'max_features': 0.3, 'class_weight': None}. Best is trial 51 with value: 0.0938971101636744.
[I 2026-03-20 05:59:15,100] Trial 93 pruned. 
[I 2026-03-20 06:03:06,505] Trial 94 finished with value: 0.09391065407379316 and parameters: {'n_estimators': 863, 'max_depth': 14, 'min_samples_leaf': 5, 'min_samples_split': 8, 'max_features': 0.3, 'class_weight': None}. Best is trial 51 with value: 0.0938971101636744.
[I 2026-03-20 06:04:18,859] Trial 95 pruned. 
[I 2026-03-20 06:09:41,929] Trial 96 finished with value: 0.09458462214643837 and parameters: {'n_estimators': 801, 'max_depth': 14, 'min_samples_leaf': 4, 'min_samples_split': 9, 'max_features': 0.5, 'class_weight': None}. Best is trial 51 with value: 0.0938971101636744.
[I 2026-03-20 06:09:53,277] Trial 97 pruned. 
[I 2026-03-20 06:11:41,894] Trial 98 pruned. 
[I 2026-03-20 06:15:41,432] Trial 99 finished with value: 0.09417457708805003 and parameters: {'n_estimators': 881, 'max_depth': 14, 'min_samples_leaf': 4, 'min_samples_split': 7, 'max_features': 0.3, 'class_weight': None}. Best is trial 51 with value: 0.0938971101636744.
{
  "study": "binary_rf",
  "best_logloss": 0.0938971101636744,
  "best_metrics": {
    "accuracy": 0.9742459688271927,
    "precision": 0.7512493354598617,
    "recall": 0.03062433040163145,
    "f1": 0.05856406033651653,
    "roc_auc": 0.8720906259979586,
    "pr_auc": 0.2402905636625301,
    "logloss": 0.0938971101636744
  },
  "best_params": {
    "n_estimators": 841,
    "max_depth": 14,
    "min_samples_leaf": 5,
    "min_samples_split": 8,
    "max_features": 0.3,
    "class_weight": null
  },
  "n_trials": 100
}
