Job: tune-multiclass-rf
Repo: /dcs/23/u5514578/cs310/y3p
PWD: /dcs/23/u5514578/cs310/y3p
Python: /dcs/23/u5514578/cs310/y3p/venv/bin/python
src import OK
Task=multiclass Model=rf DataFile=data/processed/dataset2.csv NTrials=50
Running on tiger-04
[I 2026-03-20 01:06:37,148] Trial 0 finished with value: 1.1361469034207694 and parameters: {'n_estimators': 574, 'max_depth': None, 'min_samples_leaf': 1, 'min_samples_split': 18, 'max_features': 0.5, 'class_weight': None}. Best is trial 0 with value: 1.1361469034207694.
[I 2026-03-20 01:06:40,688] Trial 1 finished with value: 1.0931161171224373 and parameters: {'n_estimators': 383, 'max_depth': 20, 'min_samples_leaf': 2, 'min_samples_split': 7, 'max_features': 0.3, 'class_weight': None}. Best is trial 1 with value: 1.0931161171224373.
[I 2026-03-20 01:06:44,808] Trial 2 finished with value: 0.9399548154325996 and parameters: {'n_estimators': 808, 'max_depth': 14, 'min_samples_leaf': 4, 'min_samples_split': 3, 'max_features': 'sqrt', 'class_weight': None}. Best is trial 2 with value: 0.9399548154325996.
[I 2026-03-20 01:06:51,070] Trial 3 finished with value: 0.9903447714410213 and parameters: {'n_estimators': 863, 'max_depth': 20, 'min_samples_leaf': 8, 'min_samples_split': 19, 'max_features': 0.3, 'class_weight': 'balanced'}. Best is trial 2 with value: 0.9399548154325996.
[I 2026-03-20 01:06:53,324] Trial 4 finished with value: 0.9927982078010624 and parameters: {'n_estimators': 589, 'max_depth': 6, 'min_samples_leaf': 2, 'min_samples_split': 17, 'max_features': 'log2', 'class_weight': None}. Best is trial 2 with value: 0.9399548154325996.
[I 2026-03-20 01:07:02,719] Trial 5 finished with value: 1.0869260706547605 and parameters: {'n_estimators': 929, 'max_depth': 20, 'min_samples_leaf': 7, 'min_samples_split': 8, 'max_features': 0.5, 'class_weight': None}. Best is trial 2 with value: 0.9399548154325996.
[I 2026-03-20 01:07:05,833] Trial 6 finished with value: 1.029066647121831 and parameters: {'n_estimators': 319, 'max_depth': 14, 'min_samples_leaf': 6, 'min_samples_split': 10, 'max_features': 0.5, 'class_weight': 'balanced'}. Best is trial 2 with value: 0.9399548154325996.
[I 2026-03-20 01:07:07,969] Trial 7 finished with value: 0.9503054281692316 and parameters: {'n_estimators': 449, 'max_depth': 6, 'min_samples_leaf': 2, 'min_samples_split': 19, 'max_features': 0.3, 'class_weight': None}. Best is trial 2 with value: 0.9399548154325996.
[I 2026-03-20 01:07:12,311] Trial 8 finished with value: 1.0215414356859225 and parameters: {'n_estimators': 1008, 'max_depth': None, 'min_samples_leaf': 9, 'min_samples_split': 18, 'max_features': 'log2', 'class_weight': 'balanced'}. Best is trial 2 with value: 0.9399548154325996.
[I 2026-03-20 01:07:17,503] Trial 9 finished with value: 1.054164250688351 and parameters: {'n_estimators': 523, 'max_depth': 14, 'min_samples_leaf': 3, 'min_samples_split': 11, 'max_features': 0.5, 'class_weight': 'balanced'}. Best is trial 2 with value: 0.9399548154325996.
[I 2026-03-20 01:07:22,635] Trial 10 finished with value: 0.9475473508413635 and parameters: {'n_estimators': 1156, 'max_depth': 10, 'min_samples_leaf': 4, 'min_samples_split': 2, 'max_features': 'sqrt', 'class_weight': None}. Best is trial 2 with value: 0.9399548154325996.
[I 2026-03-20 01:07:27,889] Trial 11 finished with value: 0.9476161166807587 and parameters: {'n_estimators': 1183, 'max_depth': 10, 'min_samples_leaf': 4, 'min_samples_split': 2, 'max_features': 'sqrt', 'class_weight': None}. Best is trial 2 with value: 0.9399548154325996.
[I 2026-03-20 01:07:31,230] Trial 12 finished with value: 0.9472325584407555 and parameters: {'n_estimators': 758, 'max_depth': 10, 'min_samples_leaf': 5, 'min_samples_split': 2, 'max_features': 'sqrt', 'class_weight': None}. Best is trial 2 with value: 0.9399548154325996.
[I 2026-03-20 01:07:32,885] Trial 13 pruned. 
[I 2026-03-20 01:07:36,467] Trial 14 finished with value: 0.9404643198475823 and parameters: {'n_estimators': 740, 'max_depth': 14, 'min_samples_leaf': 6, 'min_samples_split': 6, 'max_features': 'sqrt', 'class_weight': None}. Best is trial 2 with value: 0.9399548154325996.
[I 2026-03-20 01:07:37,657] Trial 15 finished with value: 0.9429559045266502 and parameters: {'n_estimators': 230, 'max_depth': 14, 'min_samples_leaf': 7, 'min_samples_split': 6, 'max_features': 'sqrt', 'class_weight': None}. Best is trial 2 with value: 0.9399548154325996.
[I 2026-03-20 01:07:40,755] Trial 16 finished with value: 0.9434204277288704 and parameters: {'n_estimators': 671, 'max_depth': 14, 'min_samples_leaf': 10, 'min_samples_split': 5, 'max_features': 'sqrt', 'class_weight': None}. Best is trial 2 with value: 0.9399548154325996.
[I 2026-03-20 01:07:42,952] Trial 17 pruned. 
[I 2026-03-20 01:07:48,412] Trial 18 finished with value: 0.9809511896133418 and parameters: {'n_estimators': 1079, 'max_depth': 14, 'min_samples_leaf': 4, 'min_samples_split': 8, 'max_features': 'sqrt', 'class_weight': 'balanced'}. Best is trial 2 with value: 0.9399548154325996.
[I 2026-03-20 01:07:51,566] Trial 19 finished with value: 0.9403918578426727 and parameters: {'n_estimators': 666, 'max_depth': 14, 'min_samples_leaf': 8, 'min_samples_split': 4, 'max_features': 'sqrt', 'class_weight': None}. Best is trial 2 with value: 0.9399548154325996.
[I 2026-03-20 01:07:54,671] Trial 20 finished with value: 0.9434204277288704 and parameters: {'n_estimators': 671, 'max_depth': 14, 'min_samples_leaf': 10, 'min_samples_split': 14, 'max_features': 'sqrt', 'class_weight': None}. Best is trial 2 with value: 0.9399548154325996.
[I 2026-03-20 01:07:58,564] Trial 21 finished with value: 0.9409186178426567 and parameters: {'n_estimators': 827, 'max_depth': 14, 'min_samples_leaf': 8, 'min_samples_split': 4, 'max_features': 'sqrt', 'class_weight': None}. Best is trial 2 with value: 0.9399548154325996.
[I 2026-03-20 01:08:03,059] Trial 22 finished with value: 0.9405797162331636 and parameters: {'n_estimators': 945, 'max_depth': 14, 'min_samples_leaf': 7, 'min_samples_split': 4, 'max_features': 'sqrt', 'class_weight': None}. Best is trial 2 with value: 0.9399548154325996.
[I 2026-03-20 01:08:06,166] Trial 23 finished with value: 0.9403205753818638 and parameters: {'n_estimators': 650, 'max_depth': 14, 'min_samples_leaf': 8, 'min_samples_split': 10, 'max_features': 'sqrt', 'class_weight': None}. Best is trial 2 with value: 0.9399548154325996.
[I 2026-03-20 01:08:06,719] Trial 24 pruned. 
[I 2026-03-20 01:08:08,118] Trial 25 pruned. 
[I 2026-03-20 01:08:08,704] Trial 26 pruned. 
[I 2026-03-20 01:08:11,088] Trial 27 finished with value: 0.938815406859464 and parameters: {'n_estimators': 478, 'max_depth': 14, 'min_samples_leaf': 5, 'min_samples_split': 3, 'max_features': 'sqrt', 'class_weight': None}. Best is trial 27 with value: 0.938815406859464.
[I 2026-03-20 01:08:13,433] Trial 28 finished with value: 0.9394476726307672 and parameters: {'n_estimators': 465, 'max_depth': 14, 'min_samples_leaf': 5, 'min_samples_split': 12, 'max_features': 'sqrt', 'class_weight': None}. Best is trial 27 with value: 0.938815406859464.
[I 2026-03-20 01:08:15,742] Trial 29 finished with value: 0.9382586405877472 and parameters: {'n_estimators': 407, 'max_depth': None, 'min_samples_leaf': 5, 'min_samples_split': 12, 'max_features': 'sqrt', 'class_weight': None}. Best is trial 29 with value: 0.9382586405877472.
[I 2026-03-20 01:08:16,068] Trial 30 pruned. 
[I 2026-03-20 01:08:18,752] Trial 31 finished with value: 0.9406225425638197 and parameters: {'n_estimators': 445, 'max_depth': None, 'min_samples_leaf': 3, 'min_samples_split': 12, 'max_features': 'sqrt', 'class_weight': None}. Best is trial 29 with value: 0.9382586405877472.
[I 2026-03-20 01:08:19,207] Trial 32 pruned. 
[I 2026-03-20 01:08:20,054] Trial 33 pruned. 
[I 2026-03-20 01:08:21,265] Trial 34 finished with value: 0.940768538649508 and parameters: {'n_estimators': 205, 'max_depth': None, 'min_samples_leaf': 5, 'min_samples_split': 13, 'max_features': 'sqrt', 'class_weight': None}. Best is trial 29 with value: 0.9382586405877472.
[I 2026-03-20 01:08:21,960] Trial 35 pruned. 
[I 2026-03-20 01:08:22,298] Trial 36 pruned. 
[I 2026-03-20 01:08:23,241] Trial 37 pruned. 
[I 2026-03-20 01:08:24,578] Trial 38 pruned. 
[I 2026-03-20 01:08:25,460] Trial 39 pruned. 
[I 2026-03-20 01:08:25,989] Trial 40 pruned. 
[I 2026-03-20 01:08:28,108] Trial 41 finished with value: 0.9419677840810481 and parameters: {'n_estimators': 423, 'max_depth': 14, 'min_samples_leaf': 6, 'min_samples_split': 11, 'max_features': 'sqrt', 'class_weight': None}. Best is trial 29 with value: 0.9382586405877472.
[I 2026-03-20 01:08:32,371] Trial 42 finished with value: 0.9333533091598275 and parameters: {'n_estimators': 892, 'max_depth': 14, 'min_samples_leaf': 5, 'min_samples_split': 20, 'max_features': 'sqrt', 'class_weight': None}. Best is trial 42 with value: 0.9333533091598275.
[I 2026-03-20 01:08:36,914] Trial 43 finished with value: 0.9394948660903395 and parameters: {'n_estimators': 951, 'max_depth': 14, 'min_samples_leaf': 5, 'min_samples_split': 19, 'max_features': 'sqrt', 'class_weight': None}. Best is trial 42 with value: 0.9333533091598275.
[I 2026-03-20 01:08:41,295] Trial 44 finished with value: 0.9333687319446154 and parameters: {'n_estimators': 912, 'max_depth': 14, 'min_samples_leaf': 5, 'min_samples_split': 20, 'max_features': 'sqrt', 'class_weight': None}. Best is trial 42 with value: 0.9333533091598275.
[I 2026-03-20 01:08:46,181] Trial 45 finished with value: 0.9402607776272788 and parameters: {'n_estimators': 1038, 'max_depth': 14, 'min_samples_leaf': 6, 'min_samples_split': 20, 'max_features': 'sqrt', 'class_weight': None}. Best is trial 42 with value: 0.9333533091598275.
[I 2026-03-20 01:08:46,964] Trial 46 pruned. 
[I 2026-03-20 01:08:47,227] Trial 47 pruned. 
[I 2026-03-20 01:08:48,077] Trial 48 pruned. 
[I 2026-03-20 01:08:54,007] Trial 49 finished with value: 0.938614241014266 and parameters: {'n_estimators': 1089, 'max_depth': None, 'min_samples_leaf': 4, 'min_samples_split': 18, 'max_features': 'sqrt', 'class_weight': None}. Best is trial 42 with value: 0.9333533091598275.
{
  "study": "multiclass_rf",
  "best_logloss": 0.9333533091598275,
  "best_metrics": {
    "accuracy": 0.605627268642367,
    "precision": 0.48608329021147795,
    "recall": 0.4816110305311243,
    "f1": 0.4606791290955054,
    "roc_auc": 0.852121174663386,
    "pr_auc": 0.5285958665004344,
    "logloss": 0.9333533091598275
  },
  "best_params": {
    "n_estimators": 892,
    "max_depth": 14,
    "min_samples_leaf": 5,
    "min_samples_split": 20,
    "max_features": "sqrt",
    "class_weight": null
  },
  "n_trials": 50
}
