Job: tune-multiclass-tcn
Repo: /dcs/23/u5514578/cs310/y3p
PWD: /dcs/23/u5514578/cs310/y3p
Python: /dcs/23/u5514578/cs310/y3p/venv/bin/python
src import OK
Task=multiclass Model=tcn DataFile=data/processed/dataset2.csv NTrials=50
Running on tiger-04
[I 2026-03-20 01:07:16,400] Trial 0 finished with value: 1.1283350243213495 and parameters: {'learning_rate': 0.0003071057367777374, 'batch_size': 32, 'filters': 16, 'kernel_size': 2, 'dropout': 0.008233797718320978, 'pooling': 'gap'}. Best is trial 0 with value: 1.1283350243213495.
[I 2026-03-20 01:07:53,778] Trial 1 finished with value: 1.3643006044436814 and parameters: {'learning_rate': 0.00018891200276189413, 'batch_size': 128, 'filters': 16, 'kernel_size': 2, 'dropout': 0.1465447373174767, 'pooling': 'last'}. Best is trial 0 with value: 1.1283350243213495.
[I 2026-03-20 01:08:32,407] Trial 2 finished with value: 1.2865400727897653 and parameters: {'learning_rate': 0.00018187859051288225, 'batch_size': 64, 'filters': 16, 'kernel_size': 3, 'dropout': 0.12184550766934828, 'pooling': 'last'}. Best is trial 0 with value: 1.1283350243213495.
[I 2026-03-20 01:09:15,301] Trial 3 finished with value: 1.138293199670208 and parameters: {'learning_rate': 0.0003738105868191798, 'batch_size': 64, 'filters': 16, 'kernel_size': 4, 'dropout': 0.07394178221021082, 'pooling': 'gap'}. Best is trial 0 with value: 1.1283350243213495.
[I 2026-03-20 01:09:50,219] Trial 4 finished with value: 1.1004550846401626 and parameters: {'learning_rate': 0.0016684619386293483, 'batch_size': 128, 'filters': 32, 'kernel_size': 3, 'dropout': 0.3314950036607718, 'pooling': 'gap'}. Best is trial 4 with value: 1.1004550846401626.
[I 2026-03-20 01:10:33,829] Trial 5 finished with value: 1.1571572581918304 and parameters: {'learning_rate': 0.0005082341959721457, 'batch_size': 64, 'filters': 16, 'kernel_size': 3, 'dropout': 0.29160286721639495, 'pooling': 'gap'}. Best is trial 4 with value: 1.1004550846401626.
[I 2026-03-20 01:11:17,502] Trial 6 finished with value: 1.3103420169961533 and parameters: {'learning_rate': 0.00029266761285490743, 'batch_size': 64, 'filters': 16, 'kernel_size': 3, 'dropout': 0.3548850970305306, 'pooling': 'gap'}. Best is trial 4 with value: 1.1004550846401626.
[I 2026-03-20 01:11:57,443] Trial 7 finished with value: 1.0761002708911531 and parameters: {'learning_rate': 0.0008471354625326559, 'batch_size': 128, 'filters': 32, 'kernel_size': 3, 'dropout': 0.25456416450551217, 'pooling': 'last'}. Best is trial 7 with value: 1.0761002708911531.
[I 2026-03-20 01:12:34,675] Trial 8 finished with value: 1.0970542202901477 and parameters: {'learning_rate': 0.0015162513677579245, 'batch_size': 128, 'filters': 64, 'kernel_size': 3, 'dropout': 0.2533615026041694, 'pooling': 'gap'}. Best is trial 7 with value: 1.0761002708911531.
[I 2026-03-20 01:13:34,371] Trial 9 finished with value: 1.2438336071878255 and parameters: {'learning_rate': 0.00017487722087172874, 'batch_size': 32, 'filters': 16, 'kernel_size': 4, 'dropout': 0.3442922333025374, 'pooling': 'last'}. Best is trial 7 with value: 1.0761002708911531.
[I 2026-03-20 01:14:18,614] Trial 10 finished with value: 1.1211725512408781 and parameters: {'learning_rate': 0.0008130502155540437, 'batch_size': 128, 'filters': 32, 'kernel_size': 2, 'dropout': 0.22624523627256127, 'pooling': 'last'}. Best is trial 7 with value: 1.0761002708911531.
[I 2026-03-20 01:14:24,625] Trial 11 pruned. 
[I 2026-03-20 01:14:31,900] Trial 12 pruned. 
[I 2026-03-20 01:15:12,740] Trial 13 finished with value: 1.0748944551467958 and parameters: {'learning_rate': 0.001090666672277606, 'batch_size': 128, 'filters': 32, 'kernel_size': 3, 'dropout': 0.1766826744164253, 'pooling': 'last'}. Best is trial 13 with value: 1.0748944551467958.
[I 2026-03-20 01:15:20,334] Trial 14 pruned. 
[I 2026-03-20 01:16:13,683] Trial 15 finished with value: 1.1074227170136504 and parameters: {'learning_rate': 0.0010983056864368808, 'batch_size': 32, 'filters': 32, 'kernel_size': 3, 'dropout': 0.192786122409996, 'pooling': 'last'}. Best is trial 13 with value: 1.0748944551467958.
[I 2026-03-20 01:17:07,687] Trial 16 finished with value: 1.106170192239816 and parameters: {'learning_rate': 0.0005671757728683416, 'batch_size': 128, 'filters': 32, 'kernel_size': 3, 'dropout': 0.39547851635258136, 'pooling': 'last'}. Best is trial 13 with value: 1.0748944551467958.
[I 2026-03-20 01:17:13,607] Trial 17 pruned. 
[I 2026-03-20 01:18:18,676] Trial 18 finished with value: 1.1138665930472271 and parameters: {'learning_rate': 0.00010334685497693354, 'batch_size': 128, 'filters': 32, 'kernel_size': 4, 'dropout': 0.0566336966609404, 'pooling': 'last'}. Best is trial 13 with value: 1.0748944551467958.
[I 2026-03-20 01:19:24,108] Trial 19 finished with value: 1.1115892613457443 and parameters: {'learning_rate': 0.000674583646064348, 'batch_size': 32, 'filters': 32, 'kernel_size': 2, 'dropout': 0.19266254806508312, 'pooling': 'last'}. Best is trial 13 with value: 1.0748944551467958.
[I 2026-03-20 01:20:12,290] Trial 20 finished with value: 1.0895772832795123 and parameters: {'learning_rate': 0.0012702640119742765, 'batch_size': 128, 'filters': 32, 'kernel_size': 3, 'dropout': 0.29916371507789113, 'pooling': 'last'}. Best is trial 13 with value: 1.0748944551467958.
[I 2026-03-20 01:21:04,124] Trial 21 finished with value: 1.0654317935310353 and parameters: {'learning_rate': 0.0012208142144753873, 'batch_size': 128, 'filters': 32, 'kernel_size': 3, 'dropout': 0.3189536660208673, 'pooling': 'last'}. Best is trial 21 with value: 1.0654317935310353.
[I 2026-03-20 01:21:10,161] Trial 22 pruned. 
[I 2026-03-20 01:21:16,477] Trial 23 pruned. 
[I 2026-03-20 01:22:10,815] Trial 24 finished with value: 1.0664432460565625 and parameters: {'learning_rate': 0.0009766116950841498, 'batch_size': 128, 'filters': 32, 'kernel_size': 3, 'dropout': 0.3917517615367896, 'pooling': 'last'}. Best is trial 21 with value: 1.0654317935310353.
[I 2026-03-20 01:23:01,499] Trial 25 finished with value: 1.0962340391554788 and parameters: {'learning_rate': 0.0010987090446043452, 'batch_size': 128, 'filters': 32, 'kernel_size': 3, 'dropout': 0.39966732227818796, 'pooling': 'last'}. Best is trial 21 with value: 1.0654317935310353.
[I 2026-03-20 01:23:06,991] Trial 26 pruned. 
[I 2026-03-20 01:24:03,656] Trial 27 finished with value: 1.0691853972983192 and parameters: {'learning_rate': 0.0010589362059425878, 'batch_size': 128, 'filters': 32, 'kernel_size': 3, 'dropout': 0.3566123403248158, 'pooling': 'last'}. Best is trial 21 with value: 1.0654317935310353.
[I 2026-03-20 01:24:14,409] Trial 28 pruned. 
[I 2026-03-20 01:24:24,202] Trial 29 pruned. 
[I 2026-03-20 01:24:30,167] Trial 30 pruned. 
[I 2026-03-20 01:24:38,579] Trial 31 pruned. 
[I 2026-03-20 01:25:31,829] Trial 32 finished with value: 1.103351548777392 and parameters: {'learning_rate': 0.0014102420180941377, 'batch_size': 128, 'filters': 32, 'kernel_size': 3, 'dropout': 0.16363409249568595, 'pooling': 'last'}. Best is trial 21 with value: 1.0654317935310353.
[I 2026-03-20 01:26:32,457] Trial 33 finished with value: 1.0792318310373692 and parameters: {'learning_rate': 0.0007436542676831027, 'batch_size': 128, 'filters': 32, 'kernel_size': 3, 'dropout': 0.37738368886125445, 'pooling': 'last'}. Best is trial 21 with value: 1.0654317935310353.
[I 2026-03-20 01:26:40,146] Trial 34 pruned. 
[I 2026-03-20 01:26:46,556] Trial 35 pruned. 
[I 2026-03-20 01:26:53,491] Trial 36 pruned. 
[I 2026-03-20 01:27:57,709] Trial 37 finished with value: 1.085583635143911 and parameters: {'learning_rate': 0.0002938494356478034, 'batch_size': 128, 'filters': 32, 'kernel_size': 2, 'dropout': 0.12853164389612134, 'pooling': 'last'}. Best is trial 21 with value: 1.0654317935310353.
[I 2026-03-20 01:28:02,425] Trial 38 pruned. 
[I 2026-03-20 01:28:08,498] Trial 39 pruned. 
[I 2026-03-20 01:28:14,478] Trial 40 pruned. 
[I 2026-03-20 01:29:10,160] Trial 41 finished with value: 1.1608102783766627 and parameters: {'learning_rate': 0.000821005070007452, 'batch_size': 128, 'filters': 32, 'kernel_size': 3, 'dropout': 0.2826921991439654, 'pooling': 'last'}. Best is trial 21 with value: 1.0654317935310353.
[I 2026-03-20 01:30:10,478] Trial 42 finished with value: 1.1164062111587776 and parameters: {'learning_rate': 0.0011669892063352, 'batch_size': 128, 'filters': 32, 'kernel_size': 3, 'dropout': 0.24858969350016008, 'pooling': 'last'}. Best is trial 21 with value: 1.0654317935310353.
[I 2026-03-20 01:31:11,991] Trial 43 finished with value: 1.0942101253043637 and parameters: {'learning_rate': 0.0009085335099160831, 'batch_size': 128, 'filters': 32, 'kernel_size': 3, 'dropout': 0.3473327404789286, 'pooling': 'last'}. Best is trial 21 with value: 1.0654317935310353.
[I 2026-03-20 01:31:18,974] Trial 44 pruned. 
[I 2026-03-20 01:31:25,655] Trial 45 pruned. 
[I 2026-03-20 01:31:32,803] Trial 46 pruned. 
[I 2026-03-20 01:31:40,867] Trial 47 pruned. 
[I 2026-03-20 01:31:47,777] Trial 48 pruned. 
[I 2026-03-20 01:32:53,041] Trial 49 finished with value: 1.0889655838902685 and parameters: {'learning_rate': 0.0009829684663351373, 'batch_size': 128, 'filters': 32, 'kernel_size': 3, 'dropout': 0.26314811980528, 'pooling': 'last'}. Best is trial 21 with value: 1.0654317935310353.
{
  "study": "multiclass_tcn",
  "best_logloss": 1.0654317935310353,
  "best_metrics": {
    "accuracy": 0.5747061566103092,
    "precision": 0.4403361278382009,
    "recall": 0.4726864898975391,
    "f1": 0.4434156393515757,
    "roc_auc": 0.7998487148069959,
    "pr_auc": 0.4890342203932603,
    "logloss": 1.0654317935310353
  },
  "best_params": {
    "learning_rate": 0.0012208142144753873,
    "batch_size": 128,
    "filters": 32,
    "kernel_size": 3,
    "dropout": 0.3189536660208673,
    "pooling": "last"
  },
  "n_trials": 50
}
