number,value,datetime_start,datetime_complete,duration,params_C,params_calib_cv,params_calib_method,params_class_weight,params_gamma,params_kernel,params_max_iter,params_tol,state
0,,2026-02-26 10:30:12.005713,2026-02-26 10:30:13.190493,0 days 00:00:01.184780,0.04207988669606638,5,isotonic,,6.025215736203858e-05,rbf,,,FAIL
1,1.6432645749037615,2026-02-26 11:11:04.159155,2026-02-26 11:11:05.899756,0 days 00:00:01.740601,0.04207988669606638,5,isotonic,,6.025215736203858e-05,rbf,,,COMPLETE
2,1.4622309385493077,2026-02-26 11:11:05.950887,2026-02-26 11:11:06.989341,0 days 00:00:01.038454,0.053370327626039576,3,isotonic,,8.260808399079601e-05,rbf,,,COMPLETE
3,1.4289183665936693,2026-02-26 11:11:07.035276,2026-02-26 11:11:08.103748,0 days 00:00:01.068472,0.19069966103000435,5,isotonic,balanced,,linear,5594.0,0.0013826232179369874,COMPLETE
4,1.23810390157611,2026-02-26 11:11:08.191153,2026-02-26 11:11:13.684166,0 days 00:00:05.493013,11.015056790269638,5,sigmoid,balanced,,linear,3758.0,1.6536937182824424e-05,COMPLETE
5,1.2740977492613035,2026-02-26 11:11:13.729799,2026-02-26 11:11:15.074751,0 days 00:00:01.344952,0.17654048052495078,3,sigmoid,balanced,0.003984190594434687,rbf,,,COMPLETE
6,1.3643025080575477,2026-02-26 11:11:15.103696,2026-02-26 11:11:15.477756,0 days 00:00:00.374060,0.0027698899227562817,5,isotonic,balanced,,linear,2814.0,6.0803901902966035e-06,COMPLETE
7,1.2379419310087891,2026-02-26 11:11:15.501964,2026-02-26 11:11:22.583174,0 days 00:00:07.081210,10.25616274847308,5,sigmoid,,,linear,19764.0,1.987021538542864e-06,COMPLETE
8,1.2277375689835734,2026-02-26 11:11:22.635987,2026-02-26 11:11:23.789024,0 days 00:00:01.153037,0.27155819552829413,3,sigmoid,,3.79616689580081e-05,rbf,,,COMPLETE
9,1.4357806212217004,2026-02-26 11:11:23.833810,2026-02-26 11:11:24.836905,0 days 00:00:01.003095,35.387588647792406,3,isotonic,,0.002296543234463434,rbf,,,COMPLETE
10,1.1668268196272777,2026-02-26 11:11:24.879265,2026-02-26 11:11:25.258901,0 days 00:00:00.379636,0.001339971723117972,5,sigmoid,,,linear,2565.0,2.7012557725439094e-06,COMPLETE
11,1.1693375107009976,2026-02-26 11:11:25.314423,2026-02-26 11:11:25.675255,0 days 00:00:00.360832,0.0010907785690006102,5,sigmoid,,,linear,12181.0,0.0003624038247549049,COMPLETE
12,1.1699297293213442,2026-02-26 11:11:25.722500,2026-02-26 11:11:26.195686,0 days 00:00:00.473186,0.0010428435182166151,5,sigmoid,,,linear,12980.0,0.000489126677270306,COMPLETE
13,1.1647651602639135,2026-02-26 11:11:26.227538,2026-02-26 11:11:26.635164,0 days 00:00:00.407626,0.007395912886954799,5,sigmoid,,,linear,10944.0,0.009548617037703395,COMPLETE
14,1.1689021317096948,2026-02-26 11:11:26.682921,2026-02-26 11:11:27.102295,0 days 00:00:00.419374,0.010745497168558821,5,sigmoid,,,linear,8977.0,0.008641710001999729,COMPLETE
15,1.167059093255681,2026-02-26 11:11:27.128290,2026-02-26 11:11:27.604503,0 days 00:00:00.476213,0.009220226338493745,5,sigmoid,,,linear,16908.0,4.292547213342915e-05,COMPLETE
16,1.1650557608214203,2026-02-26 11:11:27.632388,2026-02-26 11:11:28.195260,0 days 00:00:00.562872,0.007614073830653058,5,sigmoid,,,linear,8493.0,0.009190514349421168,COMPLETE
17,1.1679269728188513,2026-02-26 11:11:28.226750,2026-02-26 11:11:28.757717,0 days 00:00:00.530967,0.009904734163365915,5,sigmoid,,,linear,7937.0,0.009342405156686955,COMPLETE
18,1.417067965687818,2026-02-26 11:11:28.787603,2026-02-26 11:11:31.036000,0 days 00:00:02.248397,1.0831123516495262,5,sigmoid,,,linear,9921.0,0.00225695992583105,PRUNED
19,1.4430948808769666,2026-02-26 11:11:31.061207,2026-02-26 11:11:32.233187,0 days 00:00:01.171980,1.4016620989668847,3,sigmoid,balanced,,linear,14627.0,0.0027453612584523064,PRUNED
20,1.2965799297574112,2026-02-26 11:11:32.259965,2026-02-26 11:11:32.743163,0 days 00:00:00.483198,0.02192352444403328,5,sigmoid,,,linear,6948.0,0.00018525786750759715,PRUNED
21,1.161288185108516,2026-02-26 11:11:32.773195,2026-02-26 11:11:33.156659,0 days 00:00:00.383464,0.0029847018146340783,5,sigmoid,,,linear,10840.0,0.0009100234347247846,COMPLETE
22,1.1612479267991636,2026-02-26 11:11:33.202752,2026-02-26 11:11:33.614273,0 days 00:00:00.411521,0.004149364539862382,5,sigmoid,,,linear,10089.0,0.0037179009590030225,COMPLETE
23,1.1611250667654507,2026-02-26 11:11:33.659953,2026-02-26 11:11:34.058622,0 days 00:00:00.398669,0.003479336387787658,5,sigmoid,,,linear,10999.0,0.0010675223741567115,COMPLETE
24,1.1612361255454462,2026-02-26 11:11:34.105779,2026-02-26 11:11:34.568476,0 days 00:00:00.462697,0.003074194099613775,5,sigmoid,,,linear,13628.0,0.0008450763666354556,COMPLETE
25,1.1611943375171596,2026-02-26 11:11:34.599361,2026-02-26 11:11:35.002024,0 days 00:00:00.402663,0.00316197992324567,5,sigmoid,,,linear,15087.0,7.60532000432085e-05,COMPLETE
26,1.1613557790090834,2026-02-26 11:11:35.032005,2026-02-26 11:11:35.457584,0 days 00:00:00.425579,0.0028933451728162854,5,sigmoid,,,linear,15107.0,9.077719261585464e-05,COMPLETE
27,1.4186208947519685,2026-02-26 11:11:35.490340,2026-02-26 11:11:36.824389,0 days 00:00:01.334049,0.03395890114561526,3,sigmoid,,0.9712905031234869,rbf,,,PRUNED
28,1.3465267527947387,2026-02-26 11:11:36.856226,2026-02-26 11:11:37.368453,0 days 00:00:00.512227,0.024278908812347434,5,isotonic,balanced,,linear,17313.0,4.381148226795729e-05,PRUNED
29,1.3560956818780405,2026-02-26 11:11:37.391656,2026-02-26 11:11:38.201574,0 days 00:00:00.809918,0.07363953212333864,5,sigmoid,,,linear,13615.0,0.00019161572103016525,PRUNED
30,2.1369261281935397,2026-02-26 11:11:38.226276,2026-02-26 11:11:40.681862,0 days 00:00:02.455586,0.06855258051074001,5,isotonic,,0.9821466567389898,rbf,,,PRUNED
31,1.4177760115268294,2026-02-26 11:11:40.706085,2026-02-26 11:11:43.390685,0 days 00:00:02.684600,1.1983778713078364,5,sigmoid,,,linear,16211.0,0.000689919457758249,PRUNED
32,1.1611775075150088,2026-02-26 11:11:43.414469,2026-02-26 11:11:43.779033,0 days 00:00:00.364564,0.0038796886816621335,5,sigmoid,,,linear,12035.0,0.003232325702368217,COMPLETE
33,1.163084181762469,2026-02-26 11:11:43.813006,2026-02-26 11:11:44.173167,0 days 00:00:00.360161,0.002005451147653505,5,sigmoid,,,linear,11884.0,0.001412575119462864,COMPLETE
34,1.1616487112413274,2026-02-26 11:11:44.199330,2026-02-26 11:11:44.582779,0 days 00:00:00.383449,0.004741482901937035,5,sigmoid,,,linear,13753.0,0.0001482869717141767,COMPLETE
35,1.3483019731083559,2026-02-26 11:11:44.608445,2026-02-26 11:11:45.060765,0 days 00:00:00.452320,0.023750230043832275,5,isotonic,,,linear,15560.0,0.0003461742497374849,PRUNED
36,1.356505695940019,2026-02-26 11:11:45.083790,2026-02-26 11:11:46.417932,0 days 00:00:01.334142,0.017837167251450695,3,sigmoid,balanced,0.030892144003612475,rbf,,,PRUNED
37,1.161893544502671,2026-02-26 11:11:46.441841,2026-02-26 11:11:46.818043,0 days 00:00:00.376202,0.004988742336799623,5,sigmoid,,,linear,12484.0,0.003615063425169337,COMPLETE
38,2.1027085719048175,2026-02-26 11:11:46.845967,2026-02-26 11:11:47.829193,0 days 00:00:00.983226,0.1048549848199652,5,isotonic,balanced,,linear,18693.0,6.83826333111646e-05,PRUNED
39,1.150494092666484,2026-02-26 11:11:47.853484,2026-02-26 11:11:48.163917,0 days 00:00:00.310433,0.001955116882910721,3,sigmoid,,,linear,13986.0,0.0013622084992200721,COMPLETE
40,1.4093508333084537,2026-02-26 11:11:48.209341,2026-02-26 11:11:49.516720,0 days 00:00:01.307379,0.017377355590176925,3,sigmoid,balanced,0.06179099378323133,rbf,,,PRUNED
41,1.352190701579648,2026-02-26 11:11:49.540181,2026-02-26 11:11:49.819948,0 days 00:00:00.279767,0.001801493621209157,3,isotonic,,,linear,14840.0,0.0017163718393650358,COMPLETE
42,1.1483792117267584,2026-02-26 11:11:49.845547,2026-02-26 11:11:50.142350,0 days 00:00:00.296803,0.0027579716228857275,3,sigmoid,,,linear,13801.0,0.0008942978515543303,COMPLETE
43,1.1512840047834065,2026-02-26 11:11:50.186790,2026-02-26 11:11:50.490827,0 days 00:00:00.304037,0.0018130852029934223,3,sigmoid,,,linear,11800.0,0.004548302137444393,COMPLETE
44,1.1524020353922353,2026-02-26 11:11:50.516774,2026-02-26 11:11:50.819909,0 days 00:00:00.303135,0.0016538288141923281,3,sigmoid,,,linear,11640.0,0.004876422907994433,COMPLETE
45,1.1494323006660256,2026-02-26 11:11:50.846658,2026-02-26 11:11:51.146375,0 days 00:00:00.299717,0.0022169380041035303,3,sigmoid,,,linear,9680.0,0.00484555248448766,COMPLETE
46,1.153549057528896,2026-02-26 11:11:51.175487,2026-02-26 11:11:51.496639,0 days 00:00:00.321152,0.0015216817663398633,3,sigmoid,,,linear,5525.0,0.004084195666416769,COMPLETE
47,1.1576466983737757,2026-02-26 11:11:51.523288,2026-02-26 11:11:51.819767,0 days 00:00:00.296479,0.0011909406662637518,3,sigmoid,,,linear,10202.0,0.005576687858594515,COMPLETE
48,1.2826505496900644,2026-02-26 11:11:51.848019,2026-02-26 11:11:52.850949,0 days 00:00:01.002930,0.01458583101025885,3,sigmoid,,0.0007216810248930895,rbf,,,PRUNED
49,1.150678158315568,2026-02-26 11:11:52.874834,2026-02-26 11:11:53.175788,0 days 00:00:00.300954,0.0019193175491652227,3,sigmoid,,,linear,9218.0,0.005439347712236622,COMPLETE
50,1.4476498265555309,2026-02-26 11:11:53.209994,2026-02-26 11:11:54.870939,0 days 00:00:01.660945,65.27504384088233,3,sigmoid,,,linear,6996.0,0.002127895744891848,PRUNED
51,1.2701219828264836,2026-02-26 11:11:54.897611,2026-02-26 11:11:55.138258,0 days 00:00:00.240647,0.007322427108389061,3,sigmoid,balanced,,linear,12868.0,0.005776270622320214,PRUNED
52,1.1505506971710797,2026-02-26 11:11:55.161214,2026-02-26 11:11:56.282096,0 days 00:00:01.120882,0.001944003608761959,3,sigmoid,,,linear,9117.0,0.005390787983073815,COMPLETE
53,1.150458611894869,2026-02-26 11:11:56.307939,2026-02-26 11:11:56.612324,0 days 00:00:00.304385,0.0019621873664300168,3,sigmoid,,,linear,8666.0,0.0015027112498306701,COMPLETE
54,1.2309287741710007,2026-02-26 11:11:56.639874,2026-02-26 11:11:56.914931,0 days 00:00:00.275057,0.00565620514093936,3,sigmoid,,,linear,9483.0,1.089262898096918e-06,PRUNED
55,1.1599032671709824,2026-02-26 11:11:56.937144,2026-02-26 11:11:57.237123,0 days 00:00:00.299979,0.0010618111200588565,3,sigmoid,,,linear,7809.0,0.0015269820499140016,COMPLETE
56,1.4280852783102858,2026-02-26 11:11:57.264808,2026-02-26 11:11:58.757615,0 days 00:00:01.492807,0.43418637120008297,3,sigmoid,,,linear,5579.0,1.2686687367727934e-05,PRUNED
57,1.446101363375538,2026-02-26 11:11:58.790101,2026-02-26 11:12:00.604438,0 days 00:00:01.814337,6.1203882970912185,3,sigmoid,,,linear,8407.0,0.0005638494769552681,PRUNED
58,1.1496032451255833,2026-02-26 11:12:00.629412,2026-02-26 11:12:00.978260,0 days 00:00:00.348848,0.0021654554114210987,3,sigmoid,,,linear,7160.0,0.0003636771893968765,COMPLETE
59,1.1488181771425885,2026-02-26 11:12:01.004244,2026-02-26 11:12:01.317584,0 days 00:00:00.313340,0.002452576748541384,3,sigmoid,,,linear,3601.0,0.00036866344749395674,COMPLETE
60,1.2828506721754174,2026-02-26 11:12:01.348525,2026-02-26 11:12:01.613875,0 days 00:00:00.265350,0.012731571133708175,3,isotonic,,,linear,3619.0,0.0003494653695811562,PRUNED
61,1.3379913573951279,2026-02-26 11:12:01.638533,2026-02-26 11:12:03.113384,0 days 00:00:01.474851,0.015040807544378976,3,sigmoid,,0.08075685196670628,rbf,,,PRUNED
62,1.1495089456514287,2026-02-26 11:12:03.138086,2026-02-26 11:12:03.447626,0 days 00:00:00.309540,0.0021928540406529183,3,sigmoid,,,linear,3750.0,0.0004455277295158778,COMPLETE
63,1.2357296196838168,2026-02-26 11:12:03.474710,2026-02-26 11:12:03.827114,0 days 00:00:00.352404,0.00641739565560416,3,sigmoid,,,linear,4439.0,0.00025456198152689426,PRUNED
64,1.1485364359182648,2026-02-26 11:12:03.849880,2026-02-26 11:12:04.315430,0 days 00:00:00.465550,0.002621116383381692,3,sigmoid,,,linear,2587.0,0.0004780575635170539,COMPLETE
65,1.1482584480158486,2026-02-26 11:12:04.351982,2026-02-26 11:12:04.879620,0 days 00:00:00.527638,0.002928495427651775,3,sigmoid,,,linear,2350.0,0.00043644936758000007,COMPLETE
66,1.2502574635150399,2026-02-26 11:12:04.923631,2026-02-26 11:12:05.230161,0 days 00:00:00.306530,0.009022854001032215,3,sigmoid,,,linear,2631.0,0.0002701679279487485,PRUNED
67,1.1486096967061363,2026-02-26 11:12:05.260724,2026-02-26 11:12:05.568900,0 days 00:00:00.308176,0.002569601410242206,3,sigmoid,,,linear,2076.0,0.0005226282376831496,COMPLETE
68,1.148289743081542,2026-02-26 11:12:05.595981,2026-02-26 11:12:05.927113,0 days 00:00:00.331132,0.0028733538467457134,3,sigmoid,,,linear,3509.0,0.0005499805409659925,COMPLETE
69,1.1489642329466707,2026-02-26 11:12:05.953494,2026-02-26 11:12:06.267190,0 days 00:00:00.313696,0.0040945310323702265,3,sigmoid,,,linear,2023.0,0.0006561751783937855,COMPLETE
70,1.2481097744626088,2026-02-26 11:12:06.312170,2026-02-26 11:12:06.549813,0 days 00:00:00.237643,0.0040016109568364955,3,sigmoid,balanced,,linear,2132.0,0.0006865985773452481,PRUNED
71,1.3384466175398422,2026-02-26 11:12:06.572507,2026-02-26 11:12:06.969618,0 days 00:00:00.397111,0.042727374432394986,3,sigmoid,,,linear,3233.0,0.00014679110332390524,PRUNED
72,1.1483594352073976,2026-02-26 11:12:07.013142,2026-02-26 11:12:07.325954,0 days 00:00:00.312812,0.0027810071901451586,3,sigmoid,,,linear,4700.0,0.0005083380061584378,COMPLETE
73,1.1482116724004992,2026-02-26 11:12:07.354532,2026-02-26 11:12:07.653571,0 days 00:00:00.299039,0.003073335125778532,3,sigmoid,,,linear,4591.0,0.0008802574429766116,COMPLETE
74,1.1483897930191778,2026-02-26 11:12:07.696912,2026-02-26 11:12:08.034868,0 days 00:00:00.337956,0.0027453431678127757,3,sigmoid,,,linear,4361.0,0.0010034873474436261,COMPLETE
75,1.2293287557510308,2026-02-26 11:12:08.062604,2026-02-26 11:12:08.294411,0 days 00:00:00.231807,0.005409495690250342,3,sigmoid,,,linear,4560.0,0.0010029042973427283,PRUNED
76,1.1482171801749237,2026-02-26 11:12:08.319549,2026-02-26 11:12:08.625750,0 days 00:00:00.306201,0.003246298072746384,3,sigmoid,,,linear,4315.0,0.0005056293304332251,COMPLETE
77,1.258990548704355,2026-02-26 11:12:08.651615,2026-02-26 11:12:08.910946,0 days 00:00:00.259331,0.00924354768307818,3,isotonic,,,linear,4394.0,0.00021998725816164153,PRUNED
78,1.3517572664498112,2026-02-26 11:12:08.938353,2026-02-26 11:12:09.892453,0 days 00:00:00.954100,0.01256701112083561,3,sigmoid,,1.1225350392625759e-05,rbf,,,PRUNED
79,1.1562922919281777,2026-02-26 11:12:09.916003,2026-02-26 11:12:10.239510,0 days 00:00:00.323507,0.001282963413337137,3,sigmoid,,,linear,5137.0,0.0008972541179437009,COMPLETE
80,1.1482865437746503,2026-02-26 11:12:10.268330,2026-02-26 11:12:10.575283,0 days 00:00:00.306953,0.0028755461723824617,3,sigmoid,,,linear,6160.0,0.0007633268578726235,COMPLETE
81,1.242786697001958,2026-02-26 11:12:10.601437,2026-02-26 11:12:10.828412,0 days 00:00:00.226975,0.00338724945069941,3,sigmoid,balanced,,linear,6330.0,0.0011619568502552607,PRUNED
82,1.1482067858934262,2026-02-26 11:12:10.851591,2026-02-26 11:12:11.174885,0 days 00:00:00.323294,0.0031119460229022825,3,sigmoid,,,linear,3034.0,0.0007791751468762718,COMPLETE
83,1.2359921607853976,2026-02-26 11:12:11.220613,2026-02-26 11:12:11.464444,0 days 00:00:00.243831,0.006460200680198695,3,sigmoid,,,linear,3188.0,0.0007556233216646602,PRUNED
84,1.1556042165022447,2026-02-26 11:12:11.487507,2026-02-26 11:12:11.787312,0 days 00:00:00.299805,0.0013352407694462425,3,sigmoid,,,linear,4883.0,0.0021434709704171192,COMPLETE
85,1.2232029478847468,2026-02-26 11:12:11.814812,2026-02-26 11:12:12.044787,0 days 00:00:00.229975,0.004501640310921229,3,sigmoid,,,linear,4149.0,0.0011471663256245302,PRUNED
86,1.148298495809861,2026-02-26 11:12:12.068089,2026-02-26 11:12:12.404111,0 days 00:00:00.336022,0.0034455080083658912,3,sigmoid,,,linear,6487.0,0.0008234482852334294,COMPLETE
87,1.1482443998915617,2026-02-26 11:12:12.431930,2026-02-26 11:12:12.746586,0 days 00:00:00.314656,0.003334158739240667,3,sigmoid,,,linear,5935.0,0.0006155349041871771,COMPLETE
88,1.252456810791658,2026-02-26 11:12:12.774636,2026-02-26 11:12:13.013917,0 days 00:00:00.239281,0.008401434591137335,3,isotonic,,,linear,6160.0,0.0005643178556340834,PRUNED
89,1.153744790935582,2026-02-26 11:12:13.038350,2026-02-26 11:12:13.303315,0 days 00:00:00.264965,0.0010013812418274792,3,sigmoid,,,linear,6025.0,0.00028776614273473295,PRUNED
90,1.2828860723959394,2026-02-26 11:12:13.326408,2026-02-26 11:12:14.337259,0 days 00:00:01.010851,0.012408001977179514,3,sigmoid,,0.00046685756221783586,rbf,,,PRUNED
91,1.2172253871424483,2026-02-26 11:12:14.363420,2026-02-26 11:12:14.662737,0 days 00:00:00.299317,0.003641999592708993,3,sigmoid,,,linear,5071.0,0.00014789107894071758,PRUNED
92,1.2275887512802985,2026-02-26 11:12:14.695997,2026-02-26 11:12:14.953799,0 days 00:00:00.257802,0.005147532665653529,3,sigmoid,,,linear,3059.0,0.0007593896062905238,PRUNED
93,1.1482133660646192,2026-02-26 11:12:14.983591,2026-02-26 11:12:15.344363,0 days 00:00:00.360772,0.0030618555056898494,3,sigmoid,,,linear,4051.0,0.0004449546387660335,COMPLETE
94,1.1528454813485918,2026-02-26 11:12:15.494180,2026-02-26 11:12:15.894852,0 days 00:00:00.400672,0.0015992146366831913,3,sigmoid,,,linear,4068.0,0.0006029882807534341,COMPLETE
95,1.148206741777215,2026-02-26 11:12:15.945166,2026-02-26 11:12:16.295243,0 days 00:00:00.350077,0.0031860178260231125,3,sigmoid,,,linear,6556.0,0.00046621954613830583,COMPLETE
96,1.2192199214799502,2026-02-26 11:12:16.339874,2026-02-26 11:12:16.574714,0 days 00:00:00.234840,0.0039265866554529915,3,sigmoid,,,linear,7567.0,0.0004334685944321207,PRUNED
97,1.2379856159585267,2026-02-26 11:12:16.599263,2026-02-26 11:12:16.886297,0 days 00:00:00.287034,0.0067889924314211226,3,sigmoid,,,linear,5799.0,0.0002879214574289241,PRUNED
98,1.1553155314861536,2026-02-26 11:12:16.910226,2026-02-26 11:12:17.212905,0 days 00:00:00.302679,0.001358384318552385,3,sigmoid,,,linear,6478.0,0.0012367368809001133,COMPLETE
99,1.2570405880162008,2026-02-26 11:12:17.239174,2026-02-26 11:12:17.491980,0 days 00:00:00.252806,0.005185460257818946,3,sigmoid,balanced,,linear,5365.0,0.00170783651895967,PRUNED
100,1.444551809397211,2026-02-26 11:12:17.515983,2026-02-26 11:12:19.598867,0 days 00:00:02.082884,3.1306792423705234,3,sigmoid,,,linear,6827.0,0.00020785836168218702,PRUNED
101,1.4183047379612495,2026-02-26 11:12:19.625570,2026-02-26 11:12:20.323990,0 days 00:00:00.698420,0.2703277561458596,3,sigmoid,,,linear,3414.0,0.002643898876252726,PRUNED
102,1.2149355098678187,2026-02-26 11:12:20.349277,2026-02-26 11:12:20.593671,0 days 00:00:00.244394,0.003315316349620717,3,sigmoid,,,linear,4796.0,0.00042665851386060034,PRUNED
103,1.148281477613077,2026-02-26 11:12:20.617578,2026-02-26 11:12:20.947519,0 days 00:00:00.329941,0.002883636763381609,3,sigmoid,,,linear,3920.0,0.0008475282435431587,COMPLETE
104,1.1536165981820818,2026-02-26 11:12:20.975507,2026-02-26 11:12:21.293007,0 days 00:00:00.317500,0.0015146386679526418,3,sigmoid,,,linear,2863.0,0.0007839889888501917,COMPLETE
105,1.2144632475195385,2026-02-26 11:12:21.325919,2026-02-26 11:12:21.564531,0 days 00:00:00.238612,0.0032473295396271396,3,sigmoid,,,linear,3992.0,0.0009354195296168961,PRUNED
106,1.2363166513403379,2026-02-26 11:12:21.588212,2026-02-26 11:12:21.832987,0 days 00:00:00.244775,0.006512880931505542,3,sigmoid,,,linear,3756.0,0.0006467679691095088,PRUNED
107,1.221681248890932,2026-02-26 11:12:21.862481,2026-02-26 11:12:22.108318,0 days 00:00:00.245837,0.004281391754419167,3,sigmoid,,,linear,5405.0,0.0004310148804873586,PRUNED
108,1.4997400236104568,2026-02-26 11:12:22.131192,2026-02-26 11:12:23.798221,0 days 00:00:01.667029,20.07612716737678,3,isotonic,,,linear,6630.0,0.0018118902379872937,PRUNED
109,1.271192651669061,2026-02-26 11:12:23.823437,2026-02-26 11:12:24.825707,0 days 00:00:01.002270,0.011766668164513832,3,sigmoid,,0.013230359376694952,rbf,,,PRUNED
110,1.1488542888071354,2026-02-26 11:12:24.857786,2026-02-26 11:12:25.185135,0 days 00:00:00.327349,0.0024351874880289667,3,sigmoid,,,linear,2514.0,0.0008087820870115874,COMPLETE
111,1.1522948257970103,2026-02-26 11:12:25.217042,2026-02-26 11:12:25.569963,0 days 00:00:00.352921,0.0016672612478310462,3,sigmoid,,,linear,7308.0,0.0002990343043692989,COMPLETE
112,1.214345953480383,2026-02-26 11:12:25.598438,2026-02-26 11:12:25.827251,0 days 00:00:00.228813,0.0032304982871768635,3,sigmoid,,,linear,4650.0,0.0005840272312122873,PRUNED
113,1.148508158148817,2026-02-26 11:12:25.851457,2026-02-26 11:12:26.179424,0 days 00:00:00.327967,0.0026414753791502476,3,sigmoid,,,linear,5997.0,0.0005110530366590147,COMPLETE
114,1.2258859658975083,2026-02-26 11:12:26.210566,2026-02-26 11:12:26.472289,0 days 00:00:00.261723,0.0048940214931467415,3,sigmoid,,,linear,3377.0,0.0003573313617007554,PRUNED
115,1.1494452438732643,2026-02-26 11:12:26.501603,2026-02-26 11:12:26.817155,0 days 00:00:00.315552,0.0022123918024276453,3,sigmoid,,,linear,3909.0,0.0014245053629590562,COMPLETE
116,1.435628282062899,2026-02-26 11:12:26.849444,2026-02-26 11:12:28.121300,0 days 00:00:01.271856,0.7636759116211821,3,sigmoid,,,linear,5222.0,0.0006470222540223605,PRUNED
117,1.2331932892027955,2026-02-26 11:12:28.144862,2026-02-26 11:12:28.387384,0 days 00:00:00.242522,0.0060095040358817894,3,sigmoid,,,linear,5781.0,0.001088618123673939,PRUNED
118,1.3948485314208583,2026-02-26 11:12:28.410895,2026-02-26 11:12:29.018337,0 days 00:00:00.607442,0.13014802893612862,3,sigmoid,,,linear,2468.0,0.00048805306817863733,PRUNED
119,1.2401547811695444,2026-02-26 11:12:29.044166,2026-02-26 11:12:29.287657,0 days 00:00:00.243491,0.00309713432336027,3,sigmoid,balanced,,linear,2975.0,0.00011331942646031586,PRUNED
120,1.2423307237197367,2026-02-26 11:12:29.312735,2026-02-26 11:12:29.578819,0 days 00:00:00.266084,0.007534141362664471,3,sigmoid,,,linear,4762.0,0.00023970362086682442,PRUNED
121,1.1508741070095805,2026-02-26 11:12:29.603167,2026-02-26 11:12:29.920660,0 days 00:00:00.317493,0.0018832722350326243,3,sigmoid,,,linear,4224.0,0.00039288662765290573,COMPLETE
122,1.1486480511147072,2026-02-26 11:12:29.949412,2026-02-26 11:12:30.269692,0 days 00:00:00.320280,0.0025466049313479827,3,sigmoid,,,linear,16507.0,0.0008856176199444573,COMPLETE
