number,value,datetime_start,datetime_complete,duration,params_class_weight,params_criterion,params_max_depth,params_max_features,params_max_samples,params_min_samples_leaf,params_min_samples_split,params_n_estimators,state
259,1.2052938353403488,2026-02-26 10:56:39.268357,2026-02-26 10:56:44.132706,0 days 00:00:04.864349,,gini,12.0,0.23445885417479395,0.602102397634664,8,53,1356,PRUNED
260,1.209745336831598,2026-02-26 10:56:44.159614,2026-02-26 10:56:45.530924,0 days 00:00:01.371310,,gini,,0.2570763184972031,0.5733410909264708,10,50,325,PRUNED
261,1.2080989226041714,2026-02-26 10:56:45.559557,2026-02-26 10:56:51.172337,0 days 00:00:05.612780,,gini,12.0,0.2189258904581045,0.7237134729450421,8,56,1584,PRUNED
262,1.0480890657311037,2026-02-26 10:56:51.199426,2026-02-26 10:56:56.687224,0 days 00:00:05.487798,,gini,,0.23876005260976274,0.5918735629336147,8,52,1512,COMPLETE
263,1.2028466205465527,2026-02-26 10:56:56.718328,2026-02-26 10:57:02.167613,0 days 00:00:05.449285,,gini,,0.24432066653854517,0.5940081339328225,8,54,1520,PRUNED
264,1.2031324899028082,2026-02-26 10:57:02.193695,2026-02-26 10:57:07.525593,0 days 00:00:05.331898,,gini,,0.2648204441657864,0.5518132903571923,8,52,1428,PRUNED
265,1.2286269008489161,2026-02-26 10:57:07.551482,2026-02-26 10:57:13.185790,0 days 00:00:05.634308,,gini,,0.3958751622774181,0.565481167423407,8,54,1559,PRUNED
266,1.097050699704784,2026-02-26 10:57:13.212056,2026-02-26 10:57:17.512116,0 days 00:00:04.300060,balanced,gini,,0.2406432581226741,0.5828490402811777,10,52,1185,PRUNED
267,1.203241815357846,2026-02-26 10:57:17.547728,2026-02-26 10:57:22.933883,0 days 00:00:05.386155,,gini,,0.2562330287751707,0.5436968768492018,8,51,1504,PRUNED
268,1.2104077431497102,2026-02-26 10:57:22.966588,2026-02-26 10:57:28.740798,0 days 00:00:05.774210,,entropy,26.0,0.29514173005413225,0.5906268079205067,6,53,1604,PRUNED
269,1.0677599254681052,2026-02-26 10:57:28.768121,2026-02-26 10:57:34.059888,0 days 00:00:05.291767,,gini,,0.23152527292898428,0.5552475065675964,10,56,1481,PRUNED
270,1.211869970293026,2026-02-26 10:57:34.113096,2026-02-26 10:57:36.825950,0 days 00:00:02.712854,,gini,20.0,0.27518033773938805,0.5739946193451848,8,48,666,PRUNED
271,1.2257355920866508,2026-02-26 10:57:36.853140,2026-02-26 10:57:38.699124,0 days 00:00:01.845984,,gini,8.0,0.09201932542136682,0.5361266308750903,7,54,485,PRUNED
272,1.20937695081226,2026-02-26 10:57:38.725950,2026-02-26 10:57:44.253147,0 days 00:00:05.527197,,gini,,0.2576982043719083,0.5654925379094894,8,49,1547,PRUNED
273,1.2566912745231822,2026-02-26 10:57:44.292571,2026-02-26 10:57:49.436122,0 days 00:00:05.143551,,gini,,0.5582017368666915,0.5280981754946068,8,55,1401,PRUNED
274,1.067075538061862,2026-02-26 10:57:49.463826,2026-02-26 10:57:53.441902,0 days 00:00:03.978076,,gini,,0.22682149666833892,0.5404723388024897,10,52,1091,PRUNED
275,1.0484277714160224,2026-02-26 10:57:53.468624,2026-02-26 10:57:58.256873,0 days 00:00:04.788249,,gini,12.0,0.24187720306451307,0.5531175275574628,8,51,1314,COMPLETE
276,1.2077328152556335,2026-02-26 10:57:58.287590,2026-02-26 10:58:04.363999,0 days 00:00:06.076409,,gini,12.0,0.2722944622522102,0.5539788012206663,8,53,1660,PRUNED
277,1.2032842536273856,2026-02-26 10:58:04.390109,2026-02-26 10:58:10.049501,0 days 00:00:05.659392,,gini,,0.3140752053768757,0.5461372957610751,10,51,1581,PRUNED
278,1.0493137203060283,2026-02-26 10:58:10.087217,2026-02-26 10:58:15.490642,0 days 00:00:05.403425,,gini,12.0,0.24935297071336987,0.5288610707461612,8,55,1503,COMPLETE
279,1.0726113805819875,2026-02-26 10:58:15.536231,2026-02-26 10:58:21.135008,0 days 00:00:05.598777,,gini,26.0,0.15830235313324592,0.5193405575708676,8,49,1601,PRUNED
280,1.2031471448387285,2026-02-26 10:58:21.161292,2026-02-26 10:58:26.355175,0 days 00:00:05.193883,,gini,,0.28531723184944896,0.5359454636334402,8,57,1445,PRUNED
281,1.2024461674919282,2026-02-26 10:58:26.384185,2026-02-26 10:58:34.775173,0 days 00:00:08.390988,,gini,32.0,0.19483240020980047,0.5530251134758306,8,33,2359,PRUNED
282,1.20964343551682,2026-02-26 10:58:34.803334,2026-02-26 10:58:38.284429,0 days 00:00:03.481095,,gini,12.0,0.2646855386341644,0.5927864437422763,10,47,944,PRUNED
283,1.0669856085222638,2026-02-26 10:58:38.309673,2026-02-26 10:58:43.781037,0 days 00:00:05.471364,,gini,16.0,0.22463738583126944,0.541413546668855,7,53,1537,PRUNED
284,1.2138597845306796,2026-02-26 10:58:43.806633,2026-02-26 10:58:49.617060,0 days 00:00:05.810427,,gini,20.0,0.244707139051876,0.5073093933824333,4,50,1640,PRUNED
285,1.0807415721697402,2026-02-26 10:58:49.652876,2026-02-26 10:58:52.906961,0 days 00:00:03.254085,balanced,gini,,0.21470717449453228,0.5596016956903845,8,2,862,PRUNED
286,1.2081236083925817,2026-02-26 10:58:52.933097,2026-02-26 10:59:01.123327,0 days 00:00:08.190230,,gini,12.0,0.25911211080681995,0.5247094398897617,8,45,2303,PRUNED
287,1.2122110526985548,2026-02-26 10:59:01.327588,2026-02-26 10:59:10.063743,0 days 00:00:08.736155,,gini,,0.2395036576851595,0.5477021494702897,9,28,2472,PRUNED
288,1.2179850258518334,2026-02-26 10:59:10.118847,2026-02-26 10:59:11.715259,0 days 00:00:01.596412,,gini,12.0,0.2776299894863285,0.6845047153184103,10,54,390,PRUNED
289,1.204311628393297,2026-02-26 10:59:11.746487,2026-02-26 10:59:17.568331,0 days 00:00:05.821844,,gini,,0.22836032730048317,0.6025232038955871,8,52,1565,PRUNED
290,1.2156887845159619,2026-02-26 10:59:17.599967,2026-02-26 10:59:22.965436,0 days 00:00:05.365469,,gini,12.0,0.20360700003690482,0.8989762319809054,7,56,1477,PRUNED
291,1.2023591476800437,2026-02-26 10:59:22.994493,2026-02-26 10:59:28.564973,0 days 00:00:05.570480,,entropy,,0.29146022104118513,0.6688852594758828,8,58,1524,PRUNED
292,1.2090684454018596,2026-02-26 10:59:28.603468,2026-02-26 10:59:37.229519,0 days 00:00:08.626051,,gini,12.0,0.25212730295628866,0.5791778527610719,8,49,2411,PRUNED
293,1.0670035792929258,2026-02-26 10:59:37.258079,2026-02-26 10:59:42.203077,0 days 00:00:04.944998,,gini,12.0,0.2610658165222909,0.5349809805860043,10,51,1370,PRUNED
294,1.2036381306365884,2026-02-26 10:59:42.232877,2026-02-26 10:59:49.760887,0 days 00:00:07.528010,,gini,,0.23931440702187554,0.6236714772119484,8,53,2131,PRUNED
295,1.049869477988611,2026-02-26 10:59:49.791587,2026-02-26 10:59:57.944596,0 days 00:00:08.153009,,gini,12.0,0.27006759709410133,0.5611755576755788,8,55,2249,COMPLETE
296,1.2781011789365828,2026-02-26 10:59:57.982294,2026-02-26 11:00:03.806347,0 days 00:00:05.824053,,gini,26.0,0.6774003812778103,0.5311693497870177,9,48,1590,PRUNED
297,1.0692551646780433,2026-02-26 11:00:03.832989,2026-02-26 11:00:06.742210,0 days 00:00:02.909221,,gini,,0.21132913297970113,0.5479645281634639,10,40,760,PRUNED
298,1.0692003690915615,2026-02-26 11:00:06.775866,2026-02-26 11:00:14.842220,0 days 00:00:08.066354,,gini,8.0,0.22639356804243416,0.5153121582691119,9,54,2336,PRUNED
299,1.2031115565236372,2026-02-26 11:00:14.869833,2026-02-26 11:00:20.615541,0 days 00:00:05.745708,,gini,20.0,0.1752957603232304,0.6152748798865043,8,52,1633,PRUNED
300,1.2021903602299462,2026-02-26 11:00:20.640454,2026-02-26 11:00:26.619247,0 days 00:00:05.978793,,gini,12.0,0.1289726654492099,0.5836992424874693,6,50,1419,PRUNED
301,1.219215008361396,2026-02-26 11:00:26.751227,2026-02-26 11:00:34.683516,0 days 00:00:07.932289,,gini,,0.2429511646215556,0.7419817907213209,8,51,2213,PRUNED
302,1.0676779156754894,2026-02-26 11:00:34.714994,2026-02-26 11:00:39.337281,0 days 00:00:04.622287,,gini,12.0,0.27524086985307894,0.5391463989471071,8,56,1279,PRUNED
303,1.217913233421563,2026-02-26 11:00:39.363858,2026-02-26 11:00:47.521548,0 days 00:00:08.157690,,gini,,0.25505610098013926,0.5685968182308966,10,4,2280,PRUNED
304,1.0927617057015016,2026-02-26 11:00:47.548792,2026-02-26 11:00:51.281396,0 days 00:00:03.732604,balanced,gini,12.0,0.30263219319219103,0.5236910288585004,9,54,994,PRUNED
305,1.2033986960530119,2026-02-26 11:00:51.365094,2026-02-26 11:01:00.286523,0 days 00:00:08.921429,,gini,,0.18636835076963817,0.5582431354940761,5,49,1535,PRUNED
306,1.2228365856443688,2026-02-26 11:08:19.454706,2026-02-26 11:08:25.727272,0 days 00:00:06.272566,,gini,12.0,0.2312252108295313,0.9299795486630184,8,52,1493,PRUNED
307,1.2185317653589351,2026-02-26 11:08:25.757740,2026-02-26 11:08:32.560477,0 days 00:00:06.802737,,gini,,0.24851439141927562,0.6367310140845733,7,47,1679,PRUNED
308,1.2154000596600527,2026-02-26 11:08:32.586830,2026-02-26 11:08:38.932673,0 days 00:00:06.345843,,gini,12.0,0.21128532788208548,0.8745530910011001,8,53,1573,PRUNED
309,1.2042160586627901,2026-02-26 11:08:38.960604,2026-02-26 11:08:44.822264,0 days 00:00:05.861660,,gini,,0.26729866304819855,0.5931554427705293,8,57,1452,PRUNED
310,1.2157828789753935,2026-02-26 11:08:44.860750,2026-02-26 11:08:53.668947,0 days 00:00:08.808197,,gini,26.0,0.2908306766842944,0.6579597437749274,10,50,2202,PRUNED
311,1.2023870492764037,2026-02-26 11:08:53.708967,2026-02-26 11:09:00.078090,0 days 00:00:06.369123,,gini,12.0,0.2244013672838841,0.5746724182216093,8,51,1607,PRUNED
312,1.0486314499131373,2026-02-26 11:09:00.109578,2026-02-26 11:09:04.843046,0 days 00:00:04.733468,,entropy,16.0,0.24015788242542918,0.553409083009673,7,54,1113,COMPLETE
313,1.209588023019414,2026-02-26 11:09:04.885844,2026-02-26 11:09:09.580204,0 days 00:00:04.694360,,entropy,32.0,0.2550181844698576,0.5552766276601089,6,46,1122,PRUNED
314,1.049036342637851,2026-02-26 11:09:09.607566,2026-02-26 11:09:13.402371,0 days 00:00:03.794805,,entropy,16.0,0.2799072119062277,0.5633239464078577,9,52,874,COMPLETE
315,1.206758143073934,2026-02-26 11:09:13.433358,2026-02-26 11:09:16.929566,0 days 00:00:03.496208,,entropy,26.0,0.2924744322184314,0.5754948813671528,7,55,783,PRUNED
316,1.2020676928963732,2026-02-26 11:09:16.956912,2026-02-26 11:09:21.325182,0 days 00:00:04.368270,,entropy,16.0,0.27577286999395034,0.56426687578853,9,48,1063,PRUNED
317,1.067950847449933,2026-02-26 11:09:21.352620,2026-02-26 11:09:24.394181,0 days 00:00:03.041561,,entropy,8.0,0.30297985073282946,0.5872647450364044,9,53,706,PRUNED
318,1.2352109897661159,2026-02-26 11:09:24.425936,2026-02-26 11:09:29.546149,0 days 00:00:05.120213,,entropy,16.0,0.2830381210009195,0.5981785780049789,7,24,1216,PRUNED
319,1.2054039665547256,2026-02-26 11:09:29.572054,2026-02-26 11:09:34.404751,0 days 00:00:04.832697,,entropy,16.0,0.31291229819784866,0.5707041095293306,9,50,1184,PRUNED
320,1.048443363505467,2026-02-26 11:09:34.432865,2026-02-26 11:09:38.368820,0 days 00:00:03.935955,,entropy,16.0,0.26208238682060586,0.6070533460823004,9,55,918,COMPLETE
321,1.0497358686562488,2026-02-26 11:09:38.406267,2026-02-26 11:09:42.589026,0 days 00:00:04.182759,,entropy,16.0,0.26409923375913363,0.6140053694476387,9,58,986,COMPLETE
322,1.0674854202193942,2026-02-26 11:09:42.619126,2026-02-26 11:09:46.926431,0 days 00:00:04.307305,,entropy,16.0,0.33130432895038975,0.6026841407411245,9,56,1033,PRUNED
323,1.2096401116324964,2026-02-26 11:09:46.953170,2026-02-26 11:09:50.685133,0 days 00:00:03.731963,,entropy,16.0,0.2808429605277384,0.6209805418265588,9,52,878,PRUNED
324,1.0882387015639379,2026-02-26 11:09:50.717871,2026-02-26 11:09:54.682779,0 days 00:00:03.964908,balanced,entropy,16.0,0.2671393725126342,0.6068906958001123,9,55,938,PRUNED
325,1.063438859558016,2026-02-26 11:09:54.717282,2026-02-26 11:09:58.468744,0 days 00:00:03.751462,,entropy,16.0,0.1962180108459386,0.5852975551049225,9,48,889,PRUNED
326,1.202730964517247,2026-02-26 11:09:58.494958,2026-02-26 11:10:02.246042,0 days 00:00:03.751084,,entropy,16.0,0.2650061382232009,0.5969342191595454,9,50,896,PRUNED
327,1.3257709654707972,2026-02-26 11:10:02.293013,2026-02-26 11:10:06.641648,0 days 00:00:04.348635,,entropy,16.0,0.7805629701977964,0.5620370817758246,1,53,918,PRUNED
328,1.05068615965856,2026-02-26 11:10:06.669797,2026-02-26 11:10:10.409729,0 days 00:00:03.739932,,entropy,16.0,0.23287397929630724,0.5762125312774758,9,59,827,PRUNED
329,1.2261178573408884,2026-02-26 11:10:10.437589,2026-02-26 11:10:14.477125,0 days 00:00:04.039536,,entropy,16.0,0.29349111730054744,0.763330162469799,7,51,962,PRUNED
330,1.2144818470151753,2026-02-26 11:10:14.514460,2026-02-26 11:10:18.768770,0 days 00:00:04.254310,,entropy,16.0,0.2544852869505599,0.6952143951012064,6,56,1021,PRUNED
331,1.0494832266717162,2026-02-26 11:10:18.796198,2026-02-26 11:10:23.423795,0 days 00:00:04.627597,,entropy,16.0,0.21849760858415998,0.5524925428936731,9,49,1113,COMPLETE
332,1.2031751279652732,2026-02-26 11:10:23.454498,2026-02-26 11:10:26.833597,0 days 00:00:03.379099,,log_loss,20.0,0.2789665140846358,0.5885709259991481,7,55,798,PRUNED
333,1.0501490601237118,2026-02-26 11:10:26.860485,2026-02-26 11:10:32.965230,0 days 00:00:06.104745,,entropy,16.0,0.24922552649383775,0.6104077214063424,9,57,1491,COMPLETE
334,1.0483376052601918,2026-02-26 11:10:32.997788,2026-02-26 11:10:39.264361,0 days 00:00:06.266573,,entropy,16.0,0.23513809134846012,0.5670992137322214,9,53,1532,COMPLETE
335,1.2021258055066093,2026-02-26 11:10:39.308728,2026-02-26 11:10:45.601765,0 days 00:00:06.293037,,entropy,16.0,0.21067508112636493,0.5654152893151052,9,36,1539,PRUNED
336,1.0497351140806175,2026-02-26 11:10:45.628403,2026-02-26 11:10:51.465406,0 days 00:00:05.837003,,entropy,16.0,0.2307456947956092,0.5545509536577267,9,54,1451,COMPLETE
337,1.209080751285744,2026-02-26 11:10:51.499014,2026-02-26 11:10:56.957980,0 days 00:00:05.458966,,entropy,16.0,0.26526632118668225,0.64451393158326,9,47,1367,PRUNED
338,1.220779245032194,2026-02-26 11:10:56.985409,2026-02-26 11:11:02.969311,0 days 00:00:05.983902,,entropy,16.0,0.4435029724649949,0.5771115412685087,9,53,1525,PRUNED
339,1.0504699303030587,2026-02-26 11:11:02.997170,2026-02-26 11:11:08.460837,0 days 00:00:05.463667,,entropy,16.0,0.2410389268033727,0.5456647015132317,9,44,1413,PRUNED
340,1.0664487885657632,2026-02-26 11:11:08.498390,2026-02-26 11:11:14.235405,0 days 00:00:05.737015,,entropy,16.0,0.19647140873555524,0.5666532184088819,9,51,1496,PRUNED
341,1.0505876200407855,2026-02-26 11:11:14.262877,2026-02-26 11:11:17.786740,0 days 00:00:03.523863,,entropy,20.0,0.22467658866362566,0.5575320409727347,8,52,863,PRUNED
342,1.0490611042433018,2026-02-26 11:11:17.811725,2026-02-26 11:11:23.997099,0 days 00:00:06.185374,,entropy,16.0,0.28060672383950575,0.5433081236812132,8,55,1561,COMPLETE
343,1.048428604157207,2026-02-26 11:11:24.028870,2026-02-26 11:11:28.784343,0 days 00:00:04.755473,,log_loss,16.0,0.25340679561157564,0.510683653627265,8,54,1159,COMPLETE
344,1.24916633303475,2026-02-26 11:11:28.817205,2026-02-26 11:11:32.652193,0 days 00:00:03.834988,,log_loss,16.0,0.06953265421068733,0.5032891450504211,8,54,1074,PRUNED
345,1.092125715977104,2026-02-26 11:11:32.681999,2026-02-26 11:11:37.170990,0 days 00:00:04.488991,balanced,log_loss,16.0,0.31351794100475716,0.5092560151275927,9,56,1167,PRUNED
346,1.0490469926114057,2026-02-26 11:11:37.200761,2026-02-26 11:11:41.640405,0 days 00:00:04.439644,,entropy,16.0,0.25662802354832287,0.5177473400666692,8,54,1108,COMPLETE
347,1.2041225087667977,2026-02-26 11:11:41.670441,2026-02-26 11:11:46.940851,0 days 00:00:05.270410,,log_loss,16.0,0.2702938635851405,0.5780143819016927,8,53,1328,PRUNED
348,1.0495774124737423,2026-02-26 11:11:46.967829,2026-02-26 11:11:51.797901,0 days 00:00:04.830072,,log_loss,16.0,0.29753922496920016,0.5157527461599558,6,55,1135,COMPLETE
349,1.2064675712411,2026-02-26 11:11:51.827870,2026-02-26 11:11:54.057648,0 days 00:00:02.229778,,gini,32.0,0.2539622316982615,0.5640910673491204,7,57,503,PRUNED
350,1.0484056839350802,2026-02-26 11:11:54.084250,2026-02-26 11:11:59.291166,0 days 00:00:05.206916,,log_loss,26.0,0.27881851008051206,0.5003533383322437,9,52,1256,COMPLETE
351,1.0496129051994638,2026-02-26 11:11:59.325276,2026-02-26 11:12:04.863248,0 days 00:00:05.537972,,log_loss,26.0,0.23914592726015843,0.5040165781695695,8,53,1317,COMPLETE
352,1.0495843350063123,2026-02-26 11:12:04.904326,2026-02-26 11:12:10.153389,0 days 00:00:05.249063,,log_loss,26.0,0.2616852524682901,0.5073919953155105,8,56,1269,COMPLETE
353,1.0724292736993806,2026-02-26 11:12:10.184110,2026-02-26 11:12:15.005848,0 days 00:00:04.821738,,log_loss,26.0,0.14373137989663634,0.5041636680656022,8,54,1209,PRUNED
354,1.2120848940565077,2026-02-26 11:12:15.032860,2026-02-26 11:12:20.040331,0 days 00:00:05.007471,,log_loss,26.0,0.3498412437219459,0.5165143619118766,8,51,1214,PRUNED
355,1.2054526863694406,2026-02-26 11:12:20.082610,2026-02-26 11:12:25.141643,0 days 00:00:05.059033,,log_loss,26.0,0.25028023054563314,0.7134393476849474,9,52,1236,PRUNED
356,1.229234679208007,2026-02-26 11:12:25.167934,2026-02-26 11:12:27.938637,0 days 00:00:02.770703,,log_loss,26.0,0.28798423599173395,0.5230776704112182,8,18,620,PRUNED
357,1.051628797816363,2026-02-26 11:12:27.975002,2026-02-26 11:12:33.281603,0 days 00:00:05.306601,,log_loss,,0.23689113197270195,0.5013835121108958,9,58,1286,PRUNED
358,1.0505234053212593,2026-02-26 11:12:33.317053,2026-02-26 11:12:38.174776,0 days 00:00:04.857723,,log_loss,20.0,0.2751399688380072,0.5123886776965648,8,54,1155,PRUNED
359,1.0502758415067839,2026-02-26 11:12:38.206587,2026-02-26 11:12:44.024824,0 days 00:00:05.818237,,log_loss,,0.2601710782122938,0.5305426590672222,7,55,1383,PRUNED
360,1.0679812126258013,2026-02-26 11:12:44.063324,2026-02-26 11:12:49.998303,0 days 00:00:05.934979,,gini,,0.24723797478369833,0.5269553599515205,8,53,1257,PRUNED
361,1.2257699507195263,2026-02-26 11:12:50.034416,2026-02-26 11:12:54.527085,0 days 00:00:04.492669,,gini,26.0,0.21181462177155688,0.6737383979707589,5,50,1045,PRUNED
362,1.2049039694180192,2026-02-26 11:12:54.555546,2026-02-26 11:13:03.877099,0 days 00:00:09.321553,,gini,,0.22711371132329639,0.5407508230250113,8,42,2366,PRUNED
363,1.2048372361486583,2026-02-26 11:13:03.913456,2026-02-26 11:13:13.606967,0 days 00:00:09.693511,,gini,,0.27035096635446165,0.5488984804101281,9,46,2445,PRUNED
364,1.0912739404027718,2026-02-26 11:13:13.634529,2026-02-26 11:13:18.397575,0 days 00:00:04.763046,balanced,log_loss,,0.238456316309538,0.5004825531475856,8,51,1176,PRUNED
365,1.2046986511771287,2026-02-26 11:13:18.425466,2026-02-26 11:13:20.428980,0 days 00:00:02.003514,,gini,20.0,0.29740539906682056,0.5854301433492918,9,56,434,PRUNED
366,1.212891347915287,2026-02-26 11:13:20.465448,2026-02-26 11:13:26.424918,0 days 00:00:05.959470,,gini,12.0,0.25613771651278083,0.6296239457813985,8,54,1479,PRUNED
367,1.210865747758287,2026-02-26 11:13:26.452506,2026-02-26 11:13:31.183457,0 days 00:00:04.730951,,gini,8.0,0.28415648814845235,0.5206741752433668,7,52,1071,PRUNED
368,1.2083538568301755,2026-02-26 11:13:31.213999,2026-02-26 11:13:36.751988,0 days 00:00:05.537989,,gini,,0.16827524329234952,0.5531384049374409,8,11,1356,PRUNED
369,1.0482475116772954,2026-02-26 11:13:36.779800,2026-02-26 11:13:41.493225,0 days 00:00:04.713425,,gini,26.0,0.2214507562651288,0.5394420643759779,8,50,1111,COMPLETE
370,1.0702177726450957,2026-02-26 11:13:41.524407,2026-02-26 11:13:45.982666,0 days 00:00:04.458259,,gini,26.0,0.18396891223090137,0.5350331422638087,8,49,1098,PRUNED
371,1.069533865270963,2026-02-26 11:13:46.017759,2026-02-26 11:13:51.033346,0 days 00:00:05.015587,,gini,26.0,0.20336787714934443,0.5397651054587415,8,59,1230,PRUNED
372,1.0496373867984532,2026-02-26 11:13:51.072437,2026-02-26 11:13:55.990895,0 days 00:00:04.918458,,gini,26.0,0.21781352395836281,0.5216264961658953,8,50,1155,COMPLETE
373,1.2022145117412089,2026-02-26 11:13:56.032393,2026-02-26 11:14:00.772904,0 days 00:00:04.740511,,gini,12.0,0.23050745523819285,0.5317446196774135,8,48,1145,PRUNED
374,1.0683206045504454,2026-02-26 11:14:00.801302,2026-02-26 11:14:06.627987,0 days 00:00:05.826685,,gini,26.0,0.20674583874350932,0.5501621808008018,8,57,1434,PRUNED
375,1.0480504570796623,2026-02-26 11:14:06.655554,2026-02-26 11:14:10.956403,0 days 00:00:04.300849,,log_loss,12.0,0.23548232667621058,0.5425986674370314,9,49,1035,COMPLETE
376,1.2367261663428435,2026-02-26 11:14:10.987384,2026-02-26 11:14:15.227788,0 days 00:00:04.240404,,log_loss,12.0,0.5689632496864413,0.5365448256850892,9,50,1003,PRUNED
377,1.0501178692297546,2026-02-26 11:14:15.265834,2026-02-26 11:14:19.806377,0 days 00:00:04.540543,,log_loss,26.0,0.22184900712612615,0.5125588594840749,9,53,1096,PRUNED
378,1.0530709943993362,2026-02-26 11:14:19.834934,2026-02-26 11:14:24.127383,0 days 00:00:04.292449,,gini,12.0,0.19320370298831033,0.5455445709309799,9,55,1037,PRUNED
379,1.050604872420722,2026-02-26 11:14:24.152647,2026-02-26 11:14:28.212049,0 days 00:00:04.059402,,log_loss,12.0,0.23927272444314984,0.5220276421736841,9,51,974,PRUNED
380,1.0627510690926214,2026-02-26 11:14:28.246921,2026-02-26 11:14:32.613942,0 days 00:00:04.367021,,log_loss,12.0,0.21713797741729413,0.5283943691766769,8,48,1043,PRUNED
381,1.0623225001178225,2026-02-26 11:14:32.647320,2026-02-26 11:14:37.256174,0 days 00:00:04.608854,,log_loss,26.0,0.23680028735713501,0.5434896590793346,9,52,1105,PRUNED
382,1.0646279378239711,2026-02-26 11:14:37.283241,2026-02-26 11:14:41.570440,0 days 00:00:04.287199,,log_loss,12.0,0.26454686307729347,0.5578579487527383,9,55,1004,PRUNED
383,1.2020974236497741,2026-02-26 11:14:41.602544,2026-02-26 11:14:45.992447,0 days 00:00:04.389903,,log_loss,12.0,0.24800836655723693,0.5387409040666603,8,47,1079,PRUNED
384,1.0929709027280594,2026-02-26 11:14:46.019800,2026-02-26 11:14:51.049889,0 days 00:00:05.030089,balanced,log_loss,12.0,0.2260374620738466,0.5138233121696282,6,53,1199,PRUNED
385,1.2039790630728753,2026-02-26 11:14:51.098989,2026-02-26 11:14:55.759910,0 days 00:00:04.660921,,gini,26.0,0.27010574531117004,0.5492768956386482,9,49,1139,PRUNED
386,1.2328327358329871,2026-02-26 11:14:55.810641,2026-02-26 11:15:01.278458,0 days 00:00:05.467817,,gini,32.0,0.425309362098427,0.5320688301415177,8,51,1308,PRUNED
387,1.0617670193475157,2026-02-26 11:15:01.305543,2026-02-26 11:15:07.056901,0 days 00:00:05.751358,,log_loss,12.0,0.20437032460536594,0.5571645139185287,7,57,1406,PRUNED
388,1.2136213834261094,2026-02-26 11:15:07.088007,2026-02-26 11:15:13.009143,0 days 00:00:05.921136,,gini,12.0,0.3091697351783602,0.5681436683993648,8,54,1475,PRUNED
