number,value,datetime_start,datetime_complete,duration,params_class_weight,params_criterion,params_max_depth,params_max_features,params_max_samples,params_min_samples_leaf,params_min_samples_split,params_n_estimators,state
778,1.0671694252925916,2026-02-26 11:47:50.914254,2026-02-26 11:47:56.667378,0 days 00:00:05.753124,,gini,26.0,0.21890049412525459,0.5361060278489272,9,50,1603,PRUNED
779,1.2048551172680768,2026-02-26 11:47:56.699665,2026-02-26 11:48:02.304050,0 days 00:00:05.604385,,gini,16.0,0.25396700591074267,0.500420719985259,7,53,1529,PRUNED
780,1.0499941700514948,2026-02-26 11:48:02.335367,2026-02-26 11:48:08.895099,0 days 00:00:06.559732,,log_loss,,0.23382490077877865,0.5859970746205313,8,51,1804,PRUNED
781,1.1991338499571806,2026-02-26 11:48:08.927217,2026-02-26 11:48:13.711498,0 days 00:00:04.784281,,entropy,,0.26906236968933706,0.5500305072472155,8,56,1319,PRUNED
782,1.2042969499774636,2026-02-26 11:48:13.742516,2026-02-26 11:48:19.312991,0 days 00:00:05.570475,,gini,26.0,0.25283303607756846,0.5657755177861639,8,48,1556,PRUNED
783,1.0658494045616789,2026-02-26 11:48:19.345777,2026-02-26 11:48:24.577290,0 days 00:00:05.231513,,gini,16.0,0.20320504183378632,0.5199057484029392,9,52,1471,PRUNED
784,1.0670156996139548,2026-02-26 11:48:24.609195,2026-02-26 11:48:29.885822,0 days 00:00:05.276627,,entropy,8.0,0.223923978869892,0.531686920858208,8,58,1417,PRUNED
785,1.050536789956737,2026-02-26 11:48:29.917294,2026-02-26 11:48:36.344786,0 days 00:00:06.427492,,log_loss,,0.24443646699649724,0.5555354438108732,8,55,1762,PRUNED
786,1.0696696046764673,2026-02-26 11:48:36.377237,2026-02-26 11:48:40.890522,0 days 00:00:04.513285,,gini,,0.17466679352402759,0.5381090985731305,9,54,1257,PRUNED
787,1.230873731764791,2026-02-26 11:48:40.922764,2026-02-26 11:48:45.385042,0 days 00:00:04.462278,,gini,26.0,0.2805876832234215,0.7784031073485393,8,51,1211,PRUNED
788,1.0500497133010227,2026-02-26 11:48:45.418922,2026-02-26 11:48:51.440794,0 days 00:00:06.021872,,entropy,16.0,0.26692094569822433,0.510618181279495,10,47,1662,PRUNED
789,1.0885447619944868,2026-02-26 11:48:51.473296,2026-02-26 11:48:57.136161,0 days 00:00:05.662865,balanced,gini,,0.23258063599035156,0.5758850701802218,7,50,1572,PRUNED
790,1.0492009061032401,2026-02-26 11:48:57.168218,2026-02-26 11:49:01.671941,0 days 00:00:04.503723,,log_loss,,0.2933664304939902,0.5256126579506664,9,53,1150,COMPLETE
791,1.2800138813942619,2026-02-26 11:49:01.708698,2026-02-26 11:49:06.862785,0 days 00:00:05.154087,,gini,20.0,0.5457011637369958,0.6883888745123081,8,49,1371,PRUNED
792,1.0500468753789747,2026-02-26 11:49:06.895367,2026-02-26 11:49:12.364893,0 days 00:00:05.469526,,entropy,26.0,0.2565472660403259,0.5444845719310433,8,56,1501,PRUNED
793,1.200460233384469,2026-02-26 11:49:12.396692,2026-02-26 11:49:17.062966,0 days 00:00:04.666274,,gini,16.0,0.2139907404143641,0.6098993886869492,9,52,1305,PRUNED
794,1.0506014735020415,2026-02-26 11:49:17.097544,2026-02-26 11:49:22.432517,0 days 00:00:05.334973,,log_loss,,0.2440121772513197,0.5200687601596043,8,57,1451,PRUNED
795,1.066854998465341,2026-02-26 11:49:22.464080,2026-02-26 11:49:29.966940,0 days 00:00:07.502860,,gini,32.0,0.22823713690300873,0.5609702557751773,8,54,2063,PRUNED
796,1.2160056375594017,2026-02-26 11:49:29.999338,2026-02-26 11:49:37.656674,0 days 00:00:07.657336,,gini,,0.2686129332095092,0.6417490110304659,8,52,2134,PRUNED
797,1.0496350513785342,2026-02-26 11:49:37.689588,2026-02-26 11:49:42.312492,0 days 00:00:04.622904,,entropy,26.0,0.27927817278485156,0.5387769737326078,10,55,1220,PRUNED
798,1.2007259916902928,2026-02-26 11:49:42.343530,2026-02-26 11:49:46.391057,0 days 00:00:04.047527,,gini,16.0,0.2509742531213661,0.5076647678242199,8,50,1128,PRUNED
799,1.0516537686947323,2026-02-26 11:49:46.422266,2026-02-26 11:49:51.147947,0 days 00:00:04.725681,,log_loss,,0.2041059283782974,0.5977200692997635,9,53,1275,PRUNED
800,1.20023603349515,2026-02-26 11:49:51.179543,2026-02-26 11:49:57.532274,0 days 00:00:06.352731,,gini,,0.23743204964448061,0.5878411623137889,8,55,1768,PRUNED
801,1.0653288610842688,2026-02-26 11:49:57.588233,2026-02-26 11:50:02.098243,0 days 00:00:04.510010,,entropy,26.0,0.30169494055893387,0.5301079564175624,6,60,1174,PRUNED
802,1.2052691183579105,2026-02-26 11:50:02.130312,2026-02-26 11:50:07.215521,0 days 00:00:05.085209,,gini,16.0,0.2619739089294479,0.5537381294412043,8,49,1409,PRUNED
803,1.05197376197466,2026-02-26 11:50:07.249061,2026-02-26 11:50:13.131253,0 days 00:00:05.882192,,log_loss,,0.22004704035127226,0.518451058972189,9,54,1606,PRUNED
804,1.2073838894220805,2026-02-26 11:50:13.163713,2026-02-26 11:50:22.022575,0 days 00:00:08.858862,,gini,,0.28569344216468034,0.5351745804802156,8,51,2497,PRUNED
805,1.065525666233553,2026-02-26 11:50:22.056819,2026-02-26 11:50:27.673499,0 days 00:00:05.616680,,entropy,8.0,0.2459332628815706,0.5469666996024426,9,52,1512,PRUNED
