number,value,datetime_start,datetime_complete,duration,params_C,params_calib_cv,params_calib_method,params_class_weight_mode,params_gamma,params_kernel,params_max_iter,params_pos_weight,params_tol,state
0,0.13482864830572505,2026-02-26 00:57:26.310245,2026-02-26 00:57:34.103199,0 days 00:00:07.792954,0.04207988669606638,5,isotonic,balanced,6.025215736203858e-05,rbf,,,,COMPLETE
1,0.1372334535614921,2026-02-26 00:57:34.226676,2026-02-26 00:57:38.065706,0 days 00:00:03.839030,0.053370327626039576,3,isotonic,balanced,8.260808399079601e-05,rbf,,,,COMPLETE
2,0.13482864830572505,2026-02-26 00:59:43.902137,2026-02-26 00:59:51.791073,0 days 00:00:07.888936,0.04207988669606638,5,isotonic,balanced,6.025215736203858e-05,rbf,,,,COMPLETE
3,0.1372334535614921,2026-02-26 00:59:51.873054,2026-02-26 00:59:55.935199,0 days 00:00:04.062145,0.053370327626039576,3,isotonic,balanced,8.260808399079601e-05,rbf,,,,COMPLETE
4,,2026-02-26 01:00:18.675820,2026-02-26 01:00:22.455148,0 days 00:00:03.779328,0.04207988669606638,5,isotonic,balanced,6.025215736203858e-05,rbf,,,,FAIL
5,,2026-02-26 01:06:10.704138,2026-02-26 01:06:52.116679,0 days 00:00:41.412541,0.04207988669606638,5,isotonic,balanced,6.025215736203858e-05,rbf,,,,FAIL
6,,2026-02-26 10:17:41.491619,2026-02-26 10:18:23.734470,0 days 00:00:42.242851,0.04207988669606638,5,isotonic,balanced,6.025215736203858e-05,rbf,,,,FAIL
7,0.12754909695151492,2026-02-26 10:24:27.227988,2026-02-26 10:27:47.882006,0 days 00:03:20.654018,0.04207988669606638,5,isotonic,balanced,6.025215736203858e-05,rbf,,,,COMPLETE
8,0.11904856045922556,2026-02-26 10:27:47.937618,2026-02-26 10:29:24.463388,0 days 00:01:36.525770,0.053370327626039576,3,isotonic,balanced,8.260808399079601e-05,rbf,,,,COMPLETE
9,0.11714336514055172,2026-02-26 10:29:24.511348,2026-02-26 10:29:29.110949,0 days 00:00:04.599601,8.43101393208247,3,sigmoid,custom,,linear,11256.0,27.50868998350635,6.290644294586145e-06,COMPLETE
10,0.11102872679566286,2026-02-26 10:29:29.157507,2026-02-26 10:32:47.962193,0 days 00:03:18.804686,0.1653693718282443,5,sigmoid,balanced,3.0786517836196185e-05,rbf,,,,COMPLETE
11,0.14494087214759693,2026-02-26 10:32:48.006457,2026-02-26 10:33:50.275714,0 days 00:01:02.269257,1.2030178871154673,5,isotonic,custom,0.005414413211338522,rbf,,18.607612737929685,,COMPLETE
12,0.11331063513869104,2026-02-26 10:33:50.317345,2026-02-26 10:33:52.386573,0 days 00:00:02.069228,0.009548041810464166,3,sigmoid,balanced,,linear,7856.0,,1.5167330688076198e-06,COMPLETE
13,0.11299426290687184,2026-02-26 10:33:52.413580,2026-02-26 10:33:53.861223,0 days 00:00:01.447643,0.0012297288957910158,5,sigmoid,custom,,linear,18338.0,110.49792135622293,0.0076456837836056,COMPLETE
14,0.11303096312424274,2026-02-26 10:33:53.901383,2026-02-26 10:33:55.424703,0 days 00:00:01.523320,0.001196137216832821,5,sigmoid,custom,,linear,19854.0,117.55682524539162,0.004990937239757115,COMPLETE
15,0.11399201938080827,2026-02-26 10:33:55.454691,2026-02-26 10:33:59.883561,0 days 00:00:04.428870,29.48231121350256,5,sigmoid,custom,,linear,19978.0,101.49961900352919,0.007607975591334988,COMPLETE
16,0.1101674217146252,2026-02-26 10:33:59.913393,2026-02-26 10:34:00.585865,0 days 00:00:00.672472,0.0012101306518726902,5,sigmoid,custom,,linear,13896.0,8.232956023329505,0.00022769339956247382,COMPLETE
17,0.11406991519641259,2026-02-26 10:34:00.636578,2026-02-26 10:34:07.370785,0 days 00:00:06.734207,0.7120334719331592,5,sigmoid,custom,,linear,2407.0,9.120004013527092,0.00015282726063969233,COMPLETE
18,0.11366865170390393,2026-02-26 10:34:07.397553,2026-02-26 10:34:08.443133,0 days 00:00:01.045580,0.00574743740336265,5,sigmoid,custom,,linear,13489.0,8.848387792335625,0.00014343781402099907,PRUNED
19,0.11358379549160232,2026-02-26 10:34:08.476827,2026-02-26 10:39:51.977664,0 days 00:05:43.500837,0.5812090161683624,5,sigmoid,custom,0.5904029530517971,rbf,,44.12314314415587,,COMPLETE
20,0.10919609984575712,2026-02-26 10:39:52.006353,2026-02-26 10:39:57.876861,0 days 00:00:05.870508,4.394576447232801,5,sigmoid,balanced,,linear,14039.0,,0.0007487901881661367,PRUNED
21,0.11148964140103215,2026-02-26 10:39:57.905919,2026-02-26 10:40:37.752722,0 days 00:00:39.846803,67.72972478679702,5,sigmoid,balanced,0.002865930401667481,rbf,,,,COMPLETE
22,0.11515457033193448,2026-02-26 10:40:37.792009,2026-02-26 10:40:46.126818,0 days 00:00:08.334809,0.16634783211001627,5,sigmoid,custom,,linear,6753.0,15.793222157881068,1.4946555983928273e-05,PRUNED
23,0.11237170343415033,2026-02-26 10:40:46.158375,2026-02-26 10:40:47.677542,0 days 00:00:01.519167,0.004920094325255434,5,sigmoid,balanced,,linear,15094.0,,0.0005124391179202885,PRUNED
24,0.11023466523431176,2026-02-26 10:40:47.703266,2026-02-26 10:41:25.629441,0 days 00:00:37.926175,82.644112357862,5,sigmoid,balanced,0.003710272331277597,rbf,,,,COMPLETE
25,0.11571818914730599,2026-02-26 10:41:25.658087,2026-02-26 10:43:03.352391,0 days 00:01:37.694304,2.444626493876018,5,sigmoid,balanced,0.0018461870586846852,rbf,,,,COMPLETE
26,0.10706375303657387,2026-02-26 10:43:03.387269,2026-02-26 10:43:33.904694,0 days 00:00:30.517425,15.06532213289809,5,sigmoid,balanced,0.03833499244521219,rbf,,,,COMPLETE
27,0.10691823250447026,2026-02-26 10:43:33.952885,2026-02-26 10:44:05.028964,0 days 00:00:31.076079,94.46037857139818,5,sigmoid,balanced,0.05067783841951689,rbf,,,,COMPLETE
28,0.10777648986649442,2026-02-26 10:44:05.073866,2026-02-26 10:47:01.975870,0 days 00:02:56.902004,21.8984870868776,5,sigmoid,balanced,0.2741829502051562,rbf,,,,COMPLETE
29,0.10815239109746992,2026-02-26 10:47:02.012813,2026-02-26 10:47:35.617674,0 days 00:00:33.604861,19.648070704573634,3,sigmoid,balanced,0.20570075428449078,rbf,,,,COMPLETE
30,0.10701331849692661,2026-02-26 10:47:35.653767,2026-02-26 10:48:07.100388,0 days 00:00:31.446621,29.264337561605398,5,sigmoid,balanced,0.05842867296505429,rbf,,,,COMPLETE
31,0.10675724384318439,2026-02-26 10:48:07.137056,2026-02-26 10:48:38.014562,0 days 00:00:30.877506,41.27812977330814,5,sigmoid,balanced,0.04033271090953131,rbf,,,,COMPLETE
32,0.10665651935711515,2026-02-26 10:48:38.075168,2026-02-26 10:49:09.206338,0 days 00:00:31.131170,45.21288185620837,5,sigmoid,balanced,0.034210911347614975,rbf,,,,COMPLETE
33,0.10674431277661,2026-02-26 10:49:09.266941,2026-02-26 10:49:41.337076,0 days 00:00:32.070135,50.17713621336573,5,sigmoid,balanced,0.023129879350141214,rbf,,,,COMPLETE
34,0.10685018670561527,2026-02-26 10:49:41.365759,2026-02-26 10:50:13.686648,0 days 00:00:32.320889,50.867535142487775,5,sigmoid,balanced,0.020535468579315996,rbf,,,,COMPLETE
35,0.10766983819845936,2026-02-26 10:50:13.713862,2026-02-26 10:50:48.041596,0 days 00:00:34.327734,50.54403931365894,5,sigmoid,balanced,0.011884115282463263,rbf,,,,COMPLETE
36,0.10744196368249144,2026-02-26 10:50:48.076002,2026-02-26 10:51:21.157662,0 days 00:00:33.081660,7.855860162749438,5,sigmoid,balanced,0.020778558504482635,rbf,,,,COMPLETE
37,0.1126399129068782,2026-02-26 10:51:21.189871,2026-02-26 10:51:53.027894,0 days 00:00:31.838023,42.97669744489191,3,isotonic,balanced,0.0009503533342390386,rbf,,,,PRUNED
38,0.11993674854660681,2026-02-26 10:51:53.075273,2026-02-26 10:52:28.703065,0 days 00:00:35.627792,12.475173689073277,5,isotonic,balanced,0.011809346629041196,rbf,,,,COMPLETE
39,0.10717148720451626,2026-02-26 10:52:28.736576,2026-02-26 10:53:08.767776,0 days 00:00:40.031200,41.96361815096058,5,sigmoid,balanced,0.10883076276957179,rbf,,,,COMPLETE
40,0.11705093483837148,2026-02-26 10:53:08.795400,2026-02-26 10:53:55.867301,0 days 00:00:47.071901,8.249636822927823,3,isotonic,balanced,0.0005297523653272855,rbf,,,,PRUNED
41,0.10704560774512392,2026-02-26 10:53:55.909360,2026-02-26 10:54:38.795498,0 days 00:00:42.886138,3.7159124192078026,5,sigmoid,balanced,0.01878051994358399,rbf,,,,COMPLETE
42,0.1070897054394186,2026-02-26 10:54:38.832478,2026-02-26 10:55:22.739715,0 days 00:00:43.907237,56.77318250807969,5,sigmoid,balanced,0.12373096048743278,rbf,,,,COMPLETE
43,0.10143038444121372,2026-02-26 10:55:22.771083,2026-02-26 10:55:39.372999,0 days 00:00:16.601916,29.995433152904575,3,isotonic,balanced,0.008139115128010202,rbf,,,,PRUNED
44,0.10672697167940329,2026-02-26 10:55:39.395948,2026-02-26 10:56:09.832657,0 days 00:00:30.436709,89.67591216318486,5,sigmoid,balanced,0.03783620945641945,rbf,,,,COMPLETE
45,0.10674172469799426,2026-02-26 10:56:09.866498,2026-02-26 10:56:40.442712,0 days 00:00:30.576214,62.77317820787261,5,sigmoid,balanced,0.03863087053261567,rbf,,,,COMPLETE
46,0.10678012475929663,2026-02-26 10:56:40.475794,2026-02-26 10:57:11.265017,0 days 00:00:30.789223,95.33072580438787,5,sigmoid,balanced,0.04126067101213696,rbf,,,,COMPLETE
47,0.1071589634668995,2026-02-26 10:57:11.291489,2026-02-26 10:57:47.225257,0 days 00:00:35.933768,11.830097418431336,5,sigmoid,balanced,0.09107690410077708,rbf,,,,COMPLETE
48,0.10830934247024385,2026-02-26 10:57:47.253157,2026-02-26 11:01:09.458486,0 days 00:03:22.205329,36.21251630870279,5,sigmoid,balanced,0.31264902808895867,rbf,,,,COMPLETE
49,0.10677595108724056,2026-02-26 11:12:08.099583,2026-02-26 11:12:38.696345,0 days 00:00:30.596762,24.281708108750575,5,sigmoid,balanced,0.04017555853350587,rbf,,,,COMPLETE
50,0.10066305915976945,2026-02-26 11:12:38.728277,2026-02-26 11:18:57.423975,0 days 00:06:18.695698,16.988249078074332,5,sigmoid,balanced,0.8319856164499779,rbf,,,,PRUNED
51,0.11582167278178586,2026-02-26 11:18:57.449335,2026-02-26 11:19:12.175353,0 days 00:00:14.726018,66.38035939214815,3,isotonic,balanced,0.023789850119717754,rbf,,,,COMPLETE
52,0.10719589839233264,2026-02-26 11:19:12.215275,2026-02-26 11:19:49.126470,0 days 00:00:36.911195,64.93398485765766,5,sigmoid,balanced,0.09845942625033002,rbf,,,,COMPLETE
53,0.09277921074120973,2026-02-26 11:19:49.155761,2026-02-26 11:20:41.676989,0 days 00:00:52.521228,6.094125426825979,5,sigmoid,balanced,0.007619783897043568,rbf,,,,PRUNED
54,0.10676741889306776,2026-02-26 11:20:41.703451,2026-02-26 11:21:12.230849,0 days 00:00:30.527398,24.87971310836659,5,sigmoid,balanced,0.031032129659694253,rbf,,,,COMPLETE
55,0.10709830691817661,2026-02-26 11:21:12.265774,2026-02-26 11:21:43.745360,0 days 00:00:31.479586,34.93241503609504,5,sigmoid,balanced,0.06604876230219983,rbf,,,,COMPLETE
56,0.10692691814454322,2026-02-26 11:21:43.780966,2026-02-26 11:22:42.159249,0 days 00:00:58.378283,75.45960585706695,5,sigmoid,balanced,0.17553274572068786,rbf,,,,COMPLETE
57,0.10696062280302843,2026-02-26 11:22:42.353934,2026-02-26 11:23:13.164595,0 days 00:00:30.810661,22.822478012169917,5,sigmoid,balanced,0.02457282153932844,rbf,,,,COMPLETE
58,0.09087843884612609,2026-02-26 11:23:13.194167,2026-02-26 11:23:46.266318,0 days 00:00:33.072151,96.06309471362098,5,sigmoid,balanced,0.013489306544751754,rbf,,,,PRUNED
59,0.09551371822347972,2026-02-26 11:23:46.291471,2026-02-26 11:24:27.922963,0 days 00:00:41.631492,11.569689621267381,5,sigmoid,custom,0.004991150051360761,rbf,,57.02248375210939,,PRUNED
60,0.10598184068659226,2026-02-26 11:24:27.948547,2026-02-26 11:25:12.009853,0 days 00:00:44.061306,1.4166747096307422,5,sigmoid,balanced,0.04031387454567317,rbf,,,,COMPLETE
61,0.104626120272918,2026-02-26 11:25:12.059136,2026-02-26 11:26:25.763060,0 days 00:01:13.703924,0.2671873415336475,5,sigmoid,balanced,0.07115996162910974,rbf,,,,COMPLETE
62,0.11657410427424998,2026-02-26 11:26:25.819693,2026-02-26 11:26:34.755766,0 days 00:00:08.936073,0.13968169831582672,5,sigmoid,custom,,linear,2777.0,65.3114450805332,2.9019779776444995e-05,PRUNED
63,0.10634254865743513,2026-02-26 11:26:34.786564,2026-02-26 11:27:15.962288,0 days 00:00:41.175724,1.2267983233587592,5,sigmoid,balanced,0.06201282284799075,rbf,,,,COMPLETE
64,0.08991135876885983,2026-02-26 11:27:16.009392,2026-02-26 11:31:33.955523,0 days 00:04:17.946131,0.379721876469888,5,sigmoid,balanced,0.41630195068884934,rbf,,,,PRUNED
65,0.1067457121375055,2026-02-26 11:31:33.987191,2026-02-26 11:32:11.565941,0 days 00:00:37.578750,1.5938762451550796,5,sigmoid,balanced,0.08317361196001063,rbf,,,,COMPLETE
66,0.10463071503493722,2026-02-26 11:32:11.594159,2026-02-26 11:33:24.370119,0 days 00:01:12.775960,0.3063960184285188,5,sigmoid,balanced,0.05245993048234012,rbf,,,,COMPLETE
67,0.10650245978621616,2026-02-26 11:33:24.400101,2026-02-26 11:34:57.481965,0 days 00:01:33.081864,0.21599580127672807,5,sigmoid,balanced,0.2016686213240643,rbf,,,,COMPLETE
68,0.10531879798311225,2026-02-26 11:34:57.517908,2026-02-26 11:36:13.929864,0 days 00:01:16.411956,0.25539501127469494,5,sigmoid,balanced,0.14503376724454276,rbf,,,,COMPLETE
69,0.1058946412192027,2026-02-26 11:36:13.961603,2026-02-26 11:37:37.927368,0 days 00:01:23.965765,0.24767861771407493,5,sigmoid,balanced,0.176221703229853,rbf,,,,COMPLETE
70,0.12542755798709276,2026-02-26 11:37:37.961628,2026-02-26 11:37:43.217104,0 days 00:00:05.255476,0.10124364984456921,3,sigmoid,balanced,,linear,6856.0,,1.3189728028275167e-06,PRUNED
71,0.10594608323446612,2026-02-26 11:37:43.250351,2026-02-26 11:38:51.910565,0 days 00:01:08.660214,0.4066477303047662,5,sigmoid,balanced,0.16162530320027704,rbf,,,,COMPLETE
72,0.09173129647258496,2026-02-26 11:38:51.937893,2026-02-26 11:43:14.099521,0 days 00:04:22.161628,0.42072219417849477,5,isotonic,custom,0.41876886844905015,rbf,,28.941824166061885,,PRUNED
73,0.09722293730407656,2026-02-26 11:43:14.140030,2026-02-26 11:49:21.434857,0 days 00:06:07.294827,0.7885709617926605,5,sigmoid,balanced,0.6808056415314045,rbf,,,,PRUNED
74,0.10571531269725865,2026-02-26 11:49:21.465695,2026-02-26 11:50:40.743003,0 days 00:01:19.277308,0.2674313320761821,5,sigmoid,balanced,0.1661685659535706,rbf,,,,COMPLETE
75,0.10541064119337355,2026-02-26 11:50:40.779694,2026-02-26 11:51:57.223389,0 days 00:01:16.443695,0.2645754120218909,5,sigmoid,balanced,0.1492844437255605,rbf,,,,COMPLETE
76,0.10536527065024726,2026-02-26 11:51:57.252486,2026-02-26 11:53:11.452515,0 days 00:01:14.200029,0.2795503247309824,5,sigmoid,balanced,0.14330084753849356,rbf,,,,COMPLETE
77,0.10524275223319757,2026-02-26 11:53:11.481607,2026-02-26 11:54:27.521847,0 days 00:01:16.040240,0.256654547949156,5,sigmoid,balanced,0.13937054370407984,rbf,,,,COMPLETE
78,0.08930908410937388,2026-02-26 11:54:27.551271,2026-02-26 11:58:21.631197,0 days 00:03:54.079926,0.262029457300621,5,sigmoid,balanced,0.36941121323841475,rbf,,,,PRUNED
79,0.10456644115606784,2026-02-26 11:58:21.664066,2026-02-26 12:00:19.125623,0 days 00:01:57.461557,0.07766849527934991,5,sigmoid,balanced,0.13745545006836737,rbf,,,,COMPLETE
80,0.11784700739387208,2026-02-26 12:00:19.180546,2026-02-26 12:00:22.428992,0 days 00:00:03.248446,0.024340419779787126,5,sigmoid,balanced,,linear,9394.0,,0.0013203688293384115,PRUNED
81,0.10468648729675686,2026-02-26 12:00:22.452380,2026-02-26 12:02:18.092850,0 days 00:01:55.640470,0.08256812195741765,5,sigmoid,balanced,0.141886923064782,rbf,,,,COMPLETE
82,0.08832506735790646,2026-02-26 12:02:18.121962,2026-02-26 12:03:32.653695,0 days 00:01:14.531733,0.0778367714897789,3,sigmoid,balanced,0.2785228726431429,rbf,,,,PRUNED
83,0.11214558448471894,2026-02-26 12:03:32.679523,2026-02-26 12:04:46.798687,0 days 00:01:14.119164,0.07160530698604724,5,isotonic,custom,0.12753140172688465,rbf,,14.248006029513084,,COMPLETE
84,0.10752193761534205,2026-02-26 12:04:46.826226,2026-02-26 12:06:41.564053,0 days 00:01:54.737827,0.13726403944965362,5,sigmoid,balanced,0.23044662700601684,rbf,,,,COMPLETE
85,0.09491552668458063,2026-02-26 12:06:41.592351,2026-02-26 12:12:09.181469,0 days 00:05:27.589118,0.33655179113821276,5,sigmoid,balanced,0.5566495671620113,rbf,,,,PRUNED
86,0.10380475875801838,2026-02-26 12:12:09.206507,2026-02-26 12:14:17.616660,0 days 00:02:08.410153,0.03575265776018722,5,sigmoid,balanced,0.07968999800689697,rbf,,,,COMPLETE
87,0.10376885019484616,2026-02-26 12:14:17.663328,2026-02-26 12:16:27.253104,0 days 00:02:09.589776,0.03246021583587636,5,sigmoid,balanced,0.06616848303144837,rbf,,,,COMPLETE
88,0.10389461661546166,2026-02-26 12:16:27.296940,2026-02-26 12:18:42.153162,0 days 00:02:14.856222,0.028186620483830232,5,sigmoid,balanced,0.07664038999323053,rbf,,,,COMPLETE
89,0.10386625210217497,2026-02-26 12:18:42.182018,2026-02-26 12:20:56.734383,0 days 00:02:14.552365,0.029724966369118297,5,sigmoid,balanced,0.07801038700682487,rbf,,,,COMPLETE
90,0.10376997555187906,2026-02-26 12:20:56.762280,2026-02-26 12:23:06.795234,0 days 00:02:10.032954,0.030731946829614134,5,sigmoid,balanced,0.06075403180027898,rbf,,,,COMPLETE
91,0.10378291219171894,2026-02-26 12:23:06.823766,2026-02-26 12:25:16.724454,0 days 00:02:09.900688,0.03349406042608866,5,sigmoid,balanced,0.07059631307110674,rbf,,,,COMPLETE
92,0.10382222198702458,2026-02-26 12:25:16.752462,2026-02-26 12:27:28.858415,0 days 00:02:12.105953,0.03235937114875505,5,sigmoid,balanced,0.07761289621003128,rbf,,,,COMPLETE
93,0.11671808206200109,2026-02-26 12:27:28.886771,2026-02-26 12:27:33.087118,0 days 00:00:04.200347,0.016264119616059374,5,sigmoid,balanced,,linear,4803.0,,4.891755195698303e-05,PRUNED
94,0.10374055881567049,2026-02-26 12:27:33.110745,2026-02-26 12:29:39.430174,0 days 00:02:06.319429,0.03671199060227741,5,sigmoid,balanced,0.06942445281813157,rbf,,,,COMPLETE
95,0.10378222764824815,2026-02-26 12:29:39.477820,2026-02-26 12:31:49.349842,0 days 00:02:09.872022,0.035110062564749626,5,sigmoid,balanced,0.07512473349597788,rbf,,,,COMPLETE
96,0.10386705965756267,2026-02-26 12:31:49.378380,2026-02-26 12:34:03.414177,0 days 00:02:14.035797,0.03378994328116909,5,sigmoid,balanced,0.08871766931352443,rbf,,,,COMPLETE
97,0.10064112792614295,2026-02-26 12:34:03.443018,2026-02-26 12:37:21.461389,0 days 00:03:18.018371,0.03046791983017571,5,sigmoid,balanced,1.1127968534340974e-05,rbf,,,,PRUNED
98,0.10391444710599843,2026-02-26 12:37:21.487227,2026-02-26 12:39:24.984193,0 days 00:02:03.496966,0.046284208368466855,5,sigmoid,balanced,0.08774940679794452,rbf,,,,COMPLETE
99,0.0866311553968476,2026-02-26 12:39:25.012799,2026-02-26 12:41:33.741743,0 days 00:02:08.728944,0.03156167141868778,5,sigmoid,balanced,0.05323947405616042,rbf,,,,PRUNED
100,0.10021474943554874,2026-02-26 12:41:33.766316,2026-02-26 12:43:08.448011,0 days 00:01:34.681695,0.017499663984968186,3,sigmoid,balanced,0.00021973326058218282,rbf,,,,PRUNED
101,0.11172888580396564,2026-02-26 12:43:08.473016,2026-02-26 12:45:16.929516,0 days 00:02:08.456500,0.035581329340331175,5,isotonic,balanced,0.0764869938218943,rbf,,,,COMPLETE
102,0.09500484411766451,2026-02-26 12:45:16.958175,2026-02-26 12:47:39.059911,0 days 00:02:22.101736,0.02153061156091996,5,sigmoid,balanced,0.015447675664502539,rbf,,,,PRUNED
103,0.10401973625375889,2026-02-26 12:47:39.086938,2026-02-26 12:49:41.935464,0 days 00:02:02.848526,0.05121796203943163,5,sigmoid,balanced,0.09738748007512718,rbf,,,,COMPLETE
104,0.10394191517253785,2026-02-26 12:49:41.963487,2026-02-26 12:51:46.551779,0 days 00:02:04.588292,0.04608633274916957,5,sigmoid,balanced,0.09166999776426717,rbf,,,,COMPLETE
105,0.08821732853795419,2026-02-26 12:51:46.581162,2026-02-26 12:53:40.432113,0 days 00:01:53.850951,0.06087716060099598,5,sigmoid,balanced,0.03163476982921156,rbf,,,,PRUNED
106,0.08954943099052083,2026-02-26 12:53:40.458959,2026-02-26 12:56:10.826013,0 days 00:02:30.367054,0.012878675408660962,5,sigmoid,balanced,0.05429749931713716,rbf,,,,PRUNED
107,0.10376569764130925,2026-02-26 12:56:10.852079,2026-02-26 12:58:17.434402,0 days 00:02:06.582323,0.03894995082558198,5,sigmoid,balanced,0.07299112037358493,rbf,,,,COMPLETE
108,0.08985485727060236,2026-02-26 12:58:17.462646,2026-02-26 13:00:21.608545,0 days 00:02:04.145899,0.03866334571618159,5,sigmoid,balanced,0.029561702884860257,rbf,,,,PRUNED
109,0.10381341340226109,2026-02-26 13:00:21.633379,2026-02-26 13:02:22.094182,0 days 00:02:00.460803,0.02647787392454699,5,sigmoid,custom,0.06987615749152062,rbf,,41.34568204772192,,COMPLETE
110,0.0859734254087323,2026-02-26 13:02:22.122966,2026-02-26 13:04:23.792537,0 days 00:02:01.669571,0.02125751260288642,5,sigmoid,custom,0.04807545188976529,rbf,,37.9049510790254,,PRUNED
111,0.10427119241008605,2026-02-26 13:04:23.825280,2026-02-26 13:06:59.454274,0 days 00:02:35.628994,0.015884478131911406,5,sigmoid,custom,0.06652542812256024,rbf,,75.67468477265763,,COMPLETE
112,0.10359267547931908,2026-02-26 13:07:00.412559,2026-02-26 13:08:28.157063,0 days 00:01:27.744504,0.05685152462402032,5,sigmoid,custom,0.10329975634345404,rbf,,22.421552850077784,,COMPLETE
113,0.1076460981828248,2026-02-26 13:08:28.205985,2026-02-26 13:10:22.442691,0 days 00:01:54.236706,0.061921992300674106,5,sigmoid,custom,0.23206529892668074,rbf,,22.505355130052145,,COMPLETE
114,0.10439289841331093,2026-02-26 13:10:22.470983,2026-02-26 13:12:22.259411,0 days 00:01:59.788428,0.03679141596194256,5,sigmoid,custom,0.11712867649181495,rbf,,46.0745003313021,,COMPLETE
115,0.10390679797930535,2026-02-26 13:12:22.288730,2026-02-26 13:14:23.191070,0 days 00:02:00.902340,0.02521947567807782,5,sigmoid,custom,0.1015313442247678,rbf,,33.518148260770985,,COMPLETE
116,0.10265879523124917,2026-02-26 13:14:23.219587,2026-02-26 13:15:36.260507,0 days 00:01:13.040920,0.012334294960436545,5,sigmoid,custom,0.045748968926021025,rbf,,13.233319213358918,,COMPLETE
117,0.10268175496304699,2026-02-26 13:15:36.307966,2026-02-26 13:16:45.561660,0 days 00:01:09.253694,0.010777760608997706,5,sigmoid,custom,0.046709486036883144,rbf,,12.526007011892826,,COMPLETE
118,0.08854818600486296,2026-02-26 13:16:45.589651,2026-02-26 13:17:58.571833,0 days 00:01:12.982182,0.010840617992115732,5,sigmoid,custom,0.02931691874107112,rbf,,13.304169583163286,,PRUNED
119,0.11434187252784937,2026-02-26 13:17:58.597593,2026-02-26 13:18:00.228266,0 days 00:00:01.630673,0.006400527393325977,5,sigmoid,custom,,linear,16608.0,10.783743941985831,4.833240634787503e-06,PRUNED
