number,value,datetime_start,datetime_complete,duration,params_class_weight,params_criterion,params_max_depth,params_max_features,params_max_samples,params_min_samples_leaf,params_min_samples_split,params_n_estimators,state
389,1.2024243823962968,2026-02-26 11:15:13.036295,2026-02-26 11:15:16.929532,0 days 00:00:03.893237,,gini,20.0,0.25059989887262785,0.5251108425700318,8,52,946,PRUNED
390,1.0496771254360393,2026-02-26 11:15:16.956839,2026-02-26 11:15:18.565002,0 days 00:00:01.608163,,gini,12.0,0.23367498108997337,0.5432760258589419,8,56,306,COMPLETE
391,1.2018878829603412,2026-02-26 11:15:18.596091,2026-02-26 11:15:24.680203,0 days 00:00:06.084112,,gini,12.0,0.2628423558870528,0.510787375458249,9,50,1524,PRUNED
392,1.2235420108142536,2026-02-26 11:15:24.708528,2026-02-26 11:15:29.776460,0 days 00:00:05.067932,,gini,26.0,0.32576534674695684,0.5963164653763452,9,45,1245,PRUNED
393,1.0489403238398618,2026-02-26 11:15:29.802661,2026-02-26 11:15:36.287528,0 days 00:00:06.484867,,log_loss,16.0,0.21842185918916127,0.5541197173755451,7,53,1610,COMPLETE
394,1.2099641200660176,2026-02-26 11:15:36.324778,2026-02-26 11:15:40.896367,0 days 00:00:04.571589,,gini,12.0,0.18497137266727234,0.5354551761847981,8,15,1121,PRUNED
395,1.2033785039930744,2026-02-26 11:15:40.925290,2026-02-26 11:15:45.258790,0 days 00:00:04.333500,,gini,12.0,0.2469030180247414,0.5790999165819739,9,51,1069,PRUNED
396,1.2391217202175835,2026-02-26 11:15:45.287921,2026-02-26 11:15:51.643780,0 days 00:00:06.355859,,gini,8.0,0.47857936801555706,0.5236359640344996,8,49,1570,PRUNED
397,1.2103395145596691,2026-02-26 11:15:51.671229,2026-02-26 11:15:55.967152,0 days 00:00:04.295923,,gini,26.0,0.2735901201770826,0.6084948544902234,8,54,1004,PRUNED
398,1.2100865490218278,2026-02-26 11:15:56.000243,2026-02-26 11:16:01.774441,0 days 00:00:05.774198,,gini,16.0,0.2883926913106962,0.5488092207459496,8,53,1443,PRUNED
399,1.0633300596943045,2026-02-26 11:16:01.803891,2026-02-26 11:16:08.130817,0 days 00:00:06.326926,,log_loss,12.0,0.23692114066615058,0.5695930619414424,8,56,1513,PRUNED
400,1.0672391485060582,2026-02-26 11:16:08.167759,2026-02-26 11:16:13.057650,0 days 00:00:04.889891,,gini,12.0,0.2567972688544325,0.5392878357170864,9,50,1167,PRUNED
401,1.0681441056382184,2026-02-26 11:16:13.091697,2026-02-26 11:16:18.325412,0 days 00:00:05.233715,,gini,20.0,0.20764077673105444,0.5144024643048092,8,55,1289,PRUNED
402,1.2081576890924117,2026-02-26 11:16:18.356259,2026-02-26 11:16:24.976934,0 days 00:00:06.620675,,entropy,16.0,0.22960912892687263,0.7839924984661079,9,52,1637,PRUNED
403,1.2126869872246064,2026-02-26 11:16:25.005257,2026-02-26 11:16:30.385892,0 days 00:00:05.380635,,gini,26.0,0.2805981339569055,0.5579225244940321,8,47,1338,PRUNED
404,1.2595627060648802,2026-02-26 11:16:30.422100,2026-02-26 11:16:36.846467,0 days 00:00:06.424367,,gini,12.0,0.608375139231137,0.5289809507182629,8,54,1548,PRUNED
405,1.2014340292307921,2026-02-26 11:16:36.882641,2026-02-26 11:16:42.850642,0 days 00:00:05.968001,,gini,12.0,0.2439135981607132,0.5886894149585038,7,58,1485,PRUNED
406,1.0860679777367181,2026-02-26 11:16:42.887181,2026-02-26 11:16:49.372985,0 days 00:00:06.485804,balanced,log_loss,16.0,0.30261291535477547,0.6212851492987308,8,49,1587,PRUNED
407,1.2075019865505923,2026-02-26 11:16:49.402451,2026-02-26 11:16:53.919370,0 days 00:00:04.516919,,gini,32.0,0.25638954645866474,0.5473597462038837,8,51,1055,PRUNED
408,1.0753102853221854,2026-02-26 11:16:53.955023,2026-02-26 11:16:58.746526,0 days 00:00:04.791503,,entropy,12.0,0.1529980596916919,0.5000918852734122,9,38,1198,PRUNED
409,1.049900543982589,2026-02-26 11:16:58.783839,2026-02-26 11:17:00.526211,0 days 00:00:01.742372,,gini,26.0,0.22013156536464704,0.5201792698080667,8,52,355,COMPLETE
410,1.06671477847424,2026-02-26 11:17:00.563276,2026-02-26 11:17:09.619252,0 days 00:00:09.055976,,gini,12.0,0.27174631829910584,0.5632856340156566,9,56,2317,PRUNED
411,1.2029315758899368,2026-02-26 11:17:09.646465,2026-02-26 11:17:19.072366,0 days 00:00:09.425901,,gini,20.0,0.19969167056815276,0.6032307823746825,8,48,2412,PRUNED
412,1.2343646999872413,2026-02-26 11:17:19.130419,2026-02-26 11:17:24.847919,0 days 00:00:05.717500,,gini,16.0,0.4019735131933644,0.5737561956099874,8,54,1394,PRUNED
413,1.0511509263132388,2026-02-26 11:17:24.883734,2026-02-26 11:17:31.017715,0 days 00:00:06.133981,,log_loss,12.0,0.24238971226661507,0.5345922807194778,6,55,1513,PRUNED
414,1.0492579023621231,2026-02-26 11:17:31.046234,2026-02-26 11:17:37.317878,0 days 00:00:06.271644,,gini,,0.2592637984081626,0.556665892921104,9,51,1556,COMPLETE
415,1.0481079100019168,2026-02-26 11:17:37.363884,2026-02-26 11:17:42.012312,0 days 00:00:04.648428,,entropy,12.0,0.23367366126309003,0.5117693021934356,8,57,1126,COMPLETE
416,1.0669226354622081,2026-02-26 11:17:42.052749,2026-02-26 11:17:46.587283,0 days 00:00:04.534534,,entropy,12.0,0.17375523566878234,0.5096607797170427,8,53,1132,PRUNED
417,1.049479161242245,2026-02-26 11:17:46.621192,2026-02-26 11:17:56.547328,0 days 00:00:09.926136,,entropy,12.0,0.21807099413870437,0.5081581060558901,7,50,2488,COMPLETE
418,1.2149648046138877,2026-02-26 11:17:56.592303,2026-02-26 11:18:01.243001,0 days 00:00:04.650698,,entropy,12.0,0.2308102463429103,0.8246909030111684,9,46,1100,PRUNED
419,1.0545576782674568,2026-02-26 11:18:01.276909,2026-02-26 11:18:06.205782,0 days 00:00:04.928873,,entropy,12.0,0.2097329087209271,0.5012699560204359,9,52,1198,PRUNED
420,1.0524117750670938,2026-02-26 11:18:06.234468,2026-02-26 11:18:10.510213,0 days 00:00:04.275745,,entropy,12.0,0.19181477393498292,0.5176327158042852,8,48,1031,PRUNED
421,1.0628574076501636,2026-02-26 11:18:10.557621,2026-02-26 11:18:14.609498,0 days 00:00:04.051877,,entropy,12.0,0.22890682852247812,0.5247419241555331,9,53,966,PRUNED
422,1.048627212490625,2026-02-26 11:18:14.637616,2026-02-26 11:18:19.395856,0 days 00:00:04.758240,,entropy,12.0,0.24072818044156796,0.5838984765437268,8,55,1144,COMPLETE
423,1.097030182491394,2026-02-26 11:18:19.437062,2026-02-26 11:18:24.090310,0 days 00:00:04.653248,balanced,entropy,12.0,0.23963193474938266,0.5791883622749722,8,59,1136,PRUNED
424,1.051345839858284,2026-02-26 11:18:24.132269,2026-02-26 11:18:28.999741,0 days 00:00:04.867472,,entropy,,0.21596895931345356,0.5958388366502408,8,55,1175,PRUNED
425,1.2174488218324067,2026-02-26 11:18:29.035365,2026-02-26 11:18:34.223606,0 days 00:00:05.188241,,entropy,16.0,0.22868985645950704,0.5884769343677881,8,9,1254,PRUNED
426,1.2059309652676693,2026-02-26 11:18:34.267225,2026-02-26 11:18:38.736968,0 days 00:00:04.469743,,entropy,12.0,0.24755528673682764,0.5813900168053726,8,50,1081,PRUNED
427,1.067101731442431,2026-02-26 11:18:38.774421,2026-02-26 11:18:43.251879,0 days 00:00:04.477458,,entropy,8.0,0.20563449300130074,0.6001257190074354,9,53,1106,PRUNED
428,1.049172822715542,2026-02-26 11:18:43.285060,2026-02-26 11:18:45.766117,0 days 00:00:02.481057,,entropy,12.0,0.24041403996914046,0.5720636216767491,6,57,547,COMPLETE
429,1.2017848628094996,2026-02-26 11:18:45.804837,2026-02-26 11:18:50.477437,0 days 00:00:04.672600,,entropy,,0.21952615006110937,0.615217972768824,8,54,1141,PRUNED
430,1.201670280935545,2026-02-26 11:18:50.505770,2026-02-26 11:18:55.468882,0 days 00:00:04.963112,,entropy,12.0,0.2523779248988786,0.5890208336040009,8,51,1182,PRUNED
431,1.0516395222358812,2026-02-26 11:18:55.496637,2026-02-26 11:19:00.505560,0 days 00:00:05.008923,,entropy,16.0,0.19648285656426068,0.563716652486139,7,49,1219,PRUNED
432,1.209252222716726,2026-02-26 11:19:00.540164,2026-02-26 11:19:06.393809,0 days 00:00:05.853645,,entropy,,0.2367512343085315,0.5725057770821019,9,35,1444,PRUNED
433,1.2028919122696222,2026-02-26 11:19:06.434056,2026-02-26 11:19:10.702852,0 days 00:00:04.268796,,log_loss,12.0,0.26611117131387885,0.5941357667463323,9,52,1015,PRUNED
434,1.0489430776091813,2026-02-26 11:19:10.738544,2026-02-26 11:19:13.562150,0 days 00:00:02.823606,,entropy,20.0,0.22594855561769436,0.6065258628503415,8,55,638,COMPLETE
435,1.212216334541201,2026-02-26 11:19:13.607268,2026-02-26 11:19:18.148804,0 days 00:00:04.541536,,log_loss,12.0,0.2873923008426882,0.5808298132597047,8,48,1105,PRUNED
436,1.0494171276790214,2026-02-26 11:19:18.178478,2026-02-26 11:19:22.172813,0 days 00:00:03.994335,,entropy,,0.24209606550125023,0.5638702864091549,7,53,928,COMPLETE
437,1.2315240322958758,2026-02-26 11:19:22.204725,2026-02-26 11:19:25.226458,0 days 00:00:03.021733,,log_loss,16.0,0.25594313989736567,0.5103678893954263,5,22,695,PRUNED
438,1.0673683075385407,2026-02-26 11:19:25.255187,2026-02-26 11:19:32.109341,0 days 00:00:06.854154,,entropy,12.0,0.17973516843991835,0.5502516524383089,9,51,1717,PRUNED
439,1.0664313658779323,2026-02-26 11:19:32.141176,2026-02-26 11:19:36.527669,0 days 00:00:04.386493,,gini,32.0,0.20939777323122608,0.5600388004481237,8,54,1068,PRUNED
440,1.048077008972744,2026-02-26 11:19:36.556043,2026-02-26 11:19:41.748663,0 days 00:00:05.192620,,entropy,,0.2759578727861327,0.5150548694402975,8,57,1258,COMPLETE
441,1.0666613880200875,2026-02-26 11:19:41.801336,2026-02-26 11:19:47.101681,0 days 00:00:05.300345,,entropy,,0.37673622042046967,0.5142034929474788,8,60,1279,PRUNED
442,1.0500961900634276,2026-02-26 11:19:47.129746,2026-02-26 11:19:52.359568,0 days 00:00:05.229822,,entropy,,0.298005308239459,0.5203637164694186,8,58,1258,PRUNED
443,1.0480499419431875,2026-02-26 11:19:52.393083,2026-02-26 11:19:57.906205,0 days 00:00:05.513122,,entropy,,0.2797405863663698,0.508617891178299,8,56,1329,COMPLETE
444,1.0896441011076599,2026-02-26 11:19:57.955639,2026-02-26 11:20:03.206821,0 days 00:00:05.251182,balanced,entropy,,0.3245015961020551,0.5033062823314549,8,57,1237,PRUNED
445,1.212402995929441,2026-02-26 11:20:03.236677,2026-02-26 11:20:08.843449,0 days 00:00:05.606772,,entropy,,0.3083874858224665,0.5172565033083077,2,57,1369,PRUNED
446,1.0496546668572786,2026-02-26 11:20:08.884530,2026-02-26 11:20:14.513508,0 days 00:00:05.628978,,entropy,,0.2866294220835672,0.5113712138039757,7,58,1346,COMPLETE
447,1.0495083401459424,2026-02-26 11:20:14.559239,2026-02-26 11:20:20.056232,0 days 00:00:05.496993,,entropy,,0.2862357685939066,0.5058693554562893,8,56,1320,COMPLETE
448,1.0498833105841698,2026-02-26 11:20:20.096205,2026-02-26 11:20:25.470186,0 days 00:00:05.373981,,entropy,,0.2759025892160615,0.5007907835914536,8,56,1316,COMPLETE
449,1.0509336446756243,2026-02-26 11:20:25.510474,2026-02-26 11:20:30.779927,0 days 00:00:05.269453,,entropy,,0.3011423219750351,0.5257985876997072,8,58,1274,PRUNED
450,1.0493097443539536,2026-02-26 11:20:30.816815,2026-02-26 11:20:35.756145,0 days 00:00:04.939330,,entropy,,0.2745390729710828,0.5131471456631241,8,56,1204,COMPLETE
451,1.2783473705226238,2026-02-26 11:20:35.804787,2026-02-26 11:20:41.583621,0 days 00:00:05.778834,,entropy,,0.5201589301665601,0.8463563812610031,7,59,1354,PRUNED
452,1.0489745374840216,2026-02-26 11:20:41.621717,2026-02-26 11:20:46.996839,0 days 00:00:05.375122,,entropy,,0.2666860686443755,0.5269993084917404,8,55,1300,COMPLETE
453,1.2230844104644876,2026-02-26 11:20:47.038846,2026-02-26 11:20:52.895867,0 days 00:00:05.857021,,entropy,,0.2825342073062795,0.7999348153628839,8,57,1417,PRUNED
454,1.048844868214592,2026-02-26 11:20:52.923619,2026-02-26 11:20:58.185348,0 days 00:00:05.261729,,entropy,,0.2610165019939916,0.5189588789155296,8,55,1251,COMPLETE
455,1.0517632175344636,2026-02-26 11:20:58.225968,2026-02-26 11:21:04.446639,0 days 00:00:06.220671,,entropy,,0.2951010176584028,0.5362412782830329,8,56,1460,PRUNED
456,1.0491546436599235,2026-02-26 11:21:04.485926,2026-02-26 11:21:09.330159,0 days 00:00:04.844233,,entropy,16.0,0.3183866013010554,0.528896341355165,8,54,1169,COMPLETE
457,1.0491046402507784,2026-02-26 11:21:09.375789,2026-02-26 11:21:14.392335,0 days 00:00:05.016546,,log_loss,,0.27645330137615937,0.5100252062201802,8,57,1220,COMPLETE
458,1.0496218785196865,2026-02-26 11:21:14.441283,2026-02-26 11:21:19.270596,0 days 00:00:04.829313,,entropy,,0.2541058556532042,0.5428121544337806,4,55,1149,COMPLETE
459,1.0514272864115646,2026-02-26 11:21:19.313002,2026-02-26 11:21:25.025021,0 days 00:00:05.712019,,entropy,16.0,0.26426330098651307,0.5244903501119971,8,54,1395,PRUNED
460,1.0492174220203387,2026-02-26 11:21:25.059606,2026-02-26 11:21:30.387420,0 days 00:00:05.327814,,log_loss,,0.2508756255479758,0.5356389898134317,7,59,1271,COMPLETE
461,1.053722145000372,2026-02-26 11:21:30.436146,2026-02-26 11:21:36.593238,0 days 00:00:06.157092,,entropy,8.0,0.2725126639990975,0.5167460916338447,8,53,1511,PRUNED
462,1.0488748619075658,2026-02-26 11:21:36.635731,2026-02-26 11:21:42.089676,0 days 00:00:05.453945,,entropy,,0.24889079877322298,0.5468265700364485,8,56,1311,COMPLETE
463,1.086645271432091,2026-02-26 11:21:42.121436,2026-02-26 11:21:47.036866,0 days 00:00:04.915430,balanced,log_loss,,0.2940902288697104,0.5014287371126047,8,53,1190,PRUNED
464,1.0897202949402554,2026-02-26 11:21:47.074485,2026-02-26 11:21:49.084311,0 days 00:00:02.009826,,entropy,16.0,0.11653176622174737,0.528391383974649,8,54,452,PRUNED
465,1.0504194538826146,2026-02-26 11:21:49.123603,2026-02-26 11:21:54.682959,0 days 00:00:05.559356,,entropy,,0.23215862296921883,0.5013401649969792,7,58,1362,PRUNED
466,1.0478803964836756,2026-02-26 11:21:54.711452,2026-02-26 11:22:00.949366,0 days 00:00:06.237914,,log_loss,12.0,0.26803357281127194,0.5426239695727195,8,50,1466,COMPLETE
467,1.206471301582329,2026-02-26 11:22:00.992033,2026-02-26 11:22:06.822686,0 days 00:00:05.830653,,log_loss,16.0,0.28492007417149223,0.5523717432196776,8,50,1439,PRUNED
468,1.2035680672860494,2026-02-26 11:22:06.851811,2026-02-26 11:22:11.581434,0 days 00:00:04.729623,,log_loss,12.0,0.30769953277474826,0.5171251350053606,8,49,1151,PRUNED
469,1.0480971211149424,2026-02-26 11:22:11.623188,2026-02-26 11:22:17.366866,0 days 00:00:05.743678,,entropy,,0.27002915483453427,0.5421971523165484,9,51,1396,COMPLETE
470,1.04965250551044,2026-02-26 11:22:17.401281,2026-02-26 11:22:23.191977,0 days 00:00:05.790696,,log_loss,,0.2750733042044563,0.5382146155510922,9,52,1404,COMPLETE
471,1.2546013101299696,2026-02-26 11:22:23.229875,2026-02-26 11:22:28.900102,0 days 00:00:05.670227,,entropy,,0.7313813349996203,0.5278432083311231,9,51,1302,PRUNED
472,1.0486489538437243,2026-02-26 11:22:28.943985,2026-02-26 11:22:34.690111,0 days 00:00:05.746126,,log_loss,,0.2930748977581621,0.5148615209231524,9,51,1368,COMPLETE
473,1.2258198563996905,2026-02-26 11:22:34.728218,2026-02-26 11:22:40.440944,0 days 00:00:05.712726,,log_loss,,0.3043607028173596,0.5415872837694222,9,27,1386,PRUNED
474,1.0505445403711322,2026-02-26 11:22:40.473570,2026-02-26 11:22:46.057803,0 days 00:00:05.584233,,log_loss,,0.26908543149843994,0.5125643928129802,9,51,1346,PRUNED
475,1.051841335597397,2026-02-26 11:22:46.087926,2026-02-26 11:22:51.614257,0 days 00:00:05.526331,,log_loss,,0.2909022397538202,0.5317523884257784,9,52,1339,PRUNED
476,1.0502578445656225,2026-02-26 11:22:51.651186,2026-02-26 11:22:57.566633,0 days 00:00:05.915447,,log_loss,,0.3392737294807835,0.5222372034719288,9,51,1381,PRUNED
477,1.0608801934632195,2026-02-26 11:22:57.596744,2026-02-26 11:23:03.678625,0 days 00:00:06.081881,,log_loss,,0.2631817435908086,0.5461526844623819,9,50,1427,PRUNED
478,1.205637614858101,2026-02-26 11:23:03.715162,2026-02-26 11:23:09.017013,0 days 00:00:05.301851,,log_loss,,0.28174480200066404,0.6063296214574668,9,52,1293,PRUNED
479,1.0661585741278221,2026-02-26 11:23:09.046630,2026-02-26 11:23:14.058275,0 days 00:00:05.011645,,log_loss,32.0,0.2646873129084453,0.507965982844742,9,52,1232,PRUNED
480,1.0494730979808307,2026-02-26 11:23:14.088580,2026-02-26 11:23:20.050102,0 days 00:00:05.961522,,log_loss,16.0,0.25483915311433597,0.5531641871193542,9,53,1465,COMPLETE
481,1.050435710811041,2026-02-26 11:23:20.094568,2026-02-26 11:23:25.704320,0 days 00:00:05.609752,,log_loss,,0.29446541796982517,0.5344704075057956,9,50,1351,PRUNED
482,1.2337562418676327,2026-02-26 11:23:25.732813,2026-02-26 11:23:31.495855,0 days 00:00:05.763042,,entropy,,0.2767232922394896,0.5949315667517724,8,20,1390,PRUNED
483,1.2240260758782302,2026-02-26 11:23:31.524867,2026-02-26 11:23:37.337646,0 days 00:00:05.812779,,log_loss,,0.25464965965104086,0.520956290866258,6,30,1427,PRUNED
484,1.0867111454129086,2026-02-26 11:23:37.367130,2026-02-26 11:23:42.520721,0 days 00:00:05.153591,balanced,entropy,16.0,0.31023393717798114,0.618153816330945,7,55,1256,PRUNED
485,1.0528398952995055,2026-02-26 11:23:42.553767,2026-02-26 11:23:47.975476,0 days 00:00:05.421709,,entropy,,0.24096123984993745,0.5003339484164716,8,53,1325,PRUNED
486,1.0509227961352767,2026-02-26 11:23:48.007027,2026-02-26 11:23:52.813816,0 days 00:00:04.806789,,log_loss,,0.2696569584513632,0.5408581974426734,9,51,1110,PRUNED
487,1.0502096495894782,2026-02-26 11:23:52.857132,2026-02-26 11:23:58.881196,0 days 00:00:06.024064,,entropy,16.0,0.28544388230346573,0.5721065243824072,9,54,1459,PRUNED
488,1.0536681081339023,2026-02-26 11:23:58.919970,2026-02-26 11:24:03.889748,0 days 00:00:04.969778,,log_loss,8.0,0.24723405316076474,0.5839386201476239,8,56,1205,PRUNED
489,1.0498268558404864,2026-02-26 11:24:03.928736,2026-02-26 11:24:08.613238,0 days 00:00:04.684502,,entropy,,0.26474430618810363,0.5584703437947027,9,52,1072,PRUNED
490,1.0497751835411582,2026-02-26 11:24:08.652249,2026-02-26 11:24:14.253302,0 days 00:00:05.601053,,entropy,26.0,0.23625519411242962,0.5110513154193479,8,53,1376,PRUNED
491,1.2220551180272294,2026-02-26 11:24:14.289560,2026-02-26 11:24:19.216732,0 days 00:00:04.927172,,log_loss,,0.29388592274527653,0.5455349715433631,1,57,1179,PRUNED
492,1.0497691605892143,2026-02-26 11:24:19.247067,2026-02-26 11:24:25.268580,0 days 00:00:06.021513,,entropy,12.0,0.2568907413760877,0.5258702461962276,8,50,1480,PRUNED
493,1.0608673697160067,2026-02-26 11:24:25.295029,2026-02-26 11:24:28.858927,0 days 00:00:03.563898,,log_loss,16.0,0.31786312569356584,0.5182505093608316,8,55,826,PRUNED
494,1.0669989441621406,2026-02-26 11:24:28.887449,2026-02-26 11:24:34.147183,0 days 00:00:05.259734,,entropy,,0.16231250015221205,0.5363279969592342,5,51,1292,PRUNED
495,1.2021295424293466,2026-02-26 11:24:34.175225,2026-02-26 11:24:39.936926,0 days 00:00:05.761701,,entropy,12.0,0.2745043187603838,0.5648421618368522,7,52,1425,PRUNED
496,1.0503350593080063,2026-02-26 11:24:39.965252,2026-02-26 11:24:42.585225,0 days 00:00:02.619973,,log_loss,,0.22099365255249329,0.6008752033143143,9,60,588,PRUNED
497,1.200356629200791,2026-02-26 11:24:42.612893,2026-02-26 11:24:46.245978,0 days 00:00:03.633085,,entropy,12.0,0.24886668641102988,0.5534909165219409,8,55,768,PRUNED
498,1.201582218765828,2026-02-26 11:24:46.278432,2026-02-26 11:24:52.053464,0 days 00:00:05.775032,,log_loss,16.0,0.2360511540006567,0.5856627156202666,6,53,1105,PRUNED
499,1.0510064175106355,2026-02-26 11:24:52.088329,2026-02-26 11:24:57.214742,0 days 00:00:05.126413,,entropy,26.0,0.2646407841477929,0.5130084956846932,9,57,1238,PRUNED
500,1.0485676022807013,2026-02-26 11:24:57.244335,2026-02-26 11:25:02.035099,0 days 00:00:04.790764,,entropy,,0.28063886407043415,0.5002967246670215,8,54,1132,COMPLETE
501,1.0501894850085276,2026-02-26 11:25:02.067848,2026-02-26 11:25:06.752121,0 days 00:00:04.684273,,entropy,12.0,0.22012715969673935,0.5001312466637284,8,54,1139,PRUNED
502,1.2037251080481934,2026-02-26 11:25:06.788631,2026-02-26 11:25:11.530463,0 days 00:00:04.741832,,entropy,32.0,0.2803420177408145,0.6135113655605008,8,56,1142,PRUNED
503,1.2281899756975494,2026-02-26 11:25:11.565984,2026-02-26 11:25:15.733556,0 days 00:00:04.167572,,entropy,,0.2464988369072826,0.9170517786143165,8,55,983,PRUNED
504,1.0695093269994964,2026-02-26 11:25:15.763278,2026-02-26 11:25:20.075240,0 days 00:00:04.311962,,entropy,12.0,0.19531366558497035,0.507704367275467,8,54,1052,PRUNED
505,1.2073648111290114,2026-02-26 11:25:20.110751,2026-02-26 11:25:21.894462,0 days 00:00:01.783711,balanced,entropy,16.0,0.26203645733846365,0.8807483762768578,8,54,380,PRUNED
506,1.0508177079300054,2026-02-26 11:25:21.932762,2026-02-26 11:25:26.806349,0 days 00:00:04.873587,,entropy,,0.22874116187333246,0.5297906160239874,8,58,1165,PRUNED
507,1.0491012588375548,2026-02-26 11:25:26.834906,2026-02-26 11:25:31.319362,0 days 00:00:04.484456,,entropy,12.0,0.24157583408183456,0.545699431099149,8,56,1081,COMPLETE
508,1.2051287116617595,2026-02-26 11:25:31.363530,2026-02-26 11:25:35.650643,0 days 00:00:04.287113,,entropy,,0.2761749348277892,0.5707826994080392,8,53,1038,PRUNED
509,1.0518492102999777,2026-02-26 11:25:35.680377,2026-02-26 11:25:40.547177,0 days 00:00:04.866800,,entropy,26.0,0.20828186671613227,0.5000981071092715,8,57,1182,PRUNED
510,1.1996322079796011,2026-02-26 11:25:40.586721,2026-02-26 11:25:45.238494,0 days 00:00:04.651773,,entropy,12.0,0.25549564464470353,0.5547209390510447,8,52,1130,PRUNED
511,1.20001279547587,2026-02-26 11:25:45.268583,2026-02-26 11:25:49.788698,0 days 00:00:04.520115,,entropy,16.0,0.22644121905232695,0.5917518177085842,8,54,1099,PRUNED
512,1.0496295947917529,2026-02-26 11:25:49.818662,2026-02-26 11:25:55.088524,0 days 00:00:05.269862,,entropy,,0.26732015873874765,0.5227565907032568,8,53,1217,COMPLETE
513,1.2078675160229528,2026-02-26 11:25:55.132021,2026-02-26 11:26:01.316900,0 days 00:00:06.184879,,entropy,12.0,0.3557171853460919,0.5382560996456621,7,55,1492,PRUNED
514,1.050858570306717,2026-02-26 11:26:01.356788,2026-02-26 11:26:05.695141,0 days 00:00:04.338353,,entropy,,0.2865360498330022,0.5665516435035232,8,56,1002,PRUNED
515,1.2025576693273534,2026-02-26 11:26:05.725165,2026-02-26 11:26:09.558049,0 days 00:00:03.832884,,entropy,12.0,0.30645627197375125,0.579611375777382,7,59,903,PRUNED
516,1.2060530561392193,2026-02-26 11:26:09.588899,2026-02-26 11:26:12.707166,0 days 00:00:03.118267,,entropy,8.0,0.24534058933171424,0.6282358438122917,8,49,730,PRUNED
517,1.0489918679562156,2026-02-26 11:26:12.739087,2026-02-26 11:26:19.277276,0 days 00:00:06.538189,,entropy,16.0,0.2560442216747085,0.5096036819110356,8,50,1613,COMPLETE
