number,value,datetime_start,datetime_complete,duration,params_class_weight,params_criterion,params_max_depth,params_max_features,params_max_samples,params_min_samples_leaf,params_min_samples_split,params_n_estimators,state
648,1.2763939450442134,2026-02-26 11:37:08.981908,2026-02-26 11:37:10.724667,0 days 00:00:01.742759,,gini,12.0,0.23227862314654585,0.9986550023481243,2,38,424,PRUNED
649,1.219152989311049,2026-02-26 11:37:10.767004,2026-02-26 11:37:12.082114,0 days 00:00:01.315110,,gini,,0.25926489977794315,0.5386217315219259,3,48,300,PRUNED
650,1.0537281575589144,2026-02-26 11:37:12.125940,2026-02-26 11:37:18.272700,0 days 00:00:06.146760,,entropy,12.0,0.19524027754161552,0.5293562273451085,8,52,1639,PRUNED
651,1.065915023376169,2026-02-26 11:37:18.314017,2026-02-26 11:37:22.659558,0 days 00:00:04.345541,,log_loss,,0.15714342008704474,0.5453567792265924,8,53,1188,PRUNED
652,1.244423498651924,2026-02-26 11:37:22.698894,2026-02-26 11:37:30.269871,0 days 00:00:07.570977,,gini,26.0,0.24110673469326938,0.5231742181355741,5,12,2055,PRUNED
653,1.0665403162246456,2026-02-26 11:37:30.307621,2026-02-26 11:37:33.295223,0 days 00:00:02.987602,,gini,16.0,0.20762079554535984,0.5574744332348368,9,57,800,PRUNED
654,1.0623981459497323,2026-02-26 11:37:33.326256,2026-02-26 11:37:38.155470,0 days 00:00:04.829214,,entropy,12.0,0.2589101211227236,0.5357410273600748,8,55,1309,PRUNED
655,1.205382452608471,2026-02-26 11:37:38.193625,2026-02-26 11:37:42.767833,0 days 00:00:04.574208,,gini,,0.2270754155781282,0.5728725632771859,7,49,1257,PRUNED
656,1.2008108426260966,2026-02-26 11:37:42.805940,2026-02-26 11:37:46.685199,0 days 00:00:03.879259,balanced,log_loss,12.0,0.2700426814277201,0.5897367200299661,8,54,1048,PRUNED
657,1.0657175863214166,2026-02-26 11:37:46.728386,2026-02-26 11:37:51.335291,0 days 00:00:04.606905,,gini,,0.24653166097670126,0.5492322155502695,9,52,1214,PRUNED
658,1.0500996486550456,2026-02-26 11:37:51.372326,2026-02-26 11:37:55.436137,0 days 00:00:04.063811,,entropy,16.0,0.21863942502824799,0.5166738028680918,8,50,1094,PRUNED
659,1.2027268538947158,2026-02-26 11:37:55.476673,2026-02-26 11:37:58.967474,0 days 00:00:03.490801,,gini,26.0,0.12553155728376755,0.7669004921204597,10,58,970,PRUNED
660,1.0673206787525689,2026-02-26 11:37:58.997386,2026-02-26 11:38:02.316006,0 days 00:00:03.318620,,log_loss,8.0,0.23750350409440968,0.5657472540449212,8,53,897,PRUNED
661,1.2048784081063135,2026-02-26 11:38:02.345448,2026-02-26 11:38:07.151099,0 days 00:00:04.805651,,gini,,0.2638532764127284,0.5314777461051949,9,47,1334,PRUNED
662,1.0488600416046823,2026-02-26 11:38:07.195095,2026-02-26 11:38:12.827780,0 days 00:00:05.632685,,entropy,12.0,0.25131973770426025,0.5430024871003443,8,56,1552,COMPLETE
663,1.2101839779354948,2026-02-26 11:38:12.871410,2026-02-26 11:38:17.117865,0 days 00:00:04.246455,,gini,,0.27630919763737427,0.5264035891248819,7,53,1157,PRUNED
664,1.23317452710644,2026-02-26 11:38:17.155389,2026-02-26 11:38:21.995361,0 days 00:00:04.839972,,gini,16.0,0.43252752982419274,0.5089319650302396,8,51,1273,PRUNED
665,1.0499560693789505,2026-02-26 11:38:22.037649,2026-02-26 11:38:26.484574,0 days 00:00:04.446925,,log_loss,26.0,0.20578904561837535,0.6044447436934827,9,55,1183,PRUNED
666,1.2062986454056273,2026-02-26 11:38:26.515840,2026-02-26 11:38:28.692567,0 days 00:00:02.176727,,entropy,12.0,0.23529632823782623,0.583914068710467,4,50,554,PRUNED
667,1.2013106703882561,2026-02-26 11:38:28.725003,2026-02-26 11:38:37.348220,0 days 00:00:08.623217,,gini,,0.2570189783522735,0.5560527054306019,8,54,2428,PRUNED
668,1.22250924512761,2026-02-26 11:38:37.391132,2026-02-26 11:38:38.887576,0 days 00:00:01.496444,,gini,12.0,0.22635173968618544,0.8390682143074097,8,57,358,PRUNED
669,1.049835414578447,2026-02-26 11:38:38.918489,2026-02-26 11:38:44.822102,0 days 00:00:05.903613,,entropy,20.0,0.289558588959128,0.5232739313767957,9,52,1607,PRUNED
670,1.206050539650989,2026-02-26 11:38:44.857648,2026-02-26 11:38:48.861899,0 days 00:00:04.004251,,log_loss,16.0,0.2687803162918439,0.6516081701746766,8,55,1080,PRUNED
671,1.25846660019736,2026-02-26 11:38:48.899320,2026-02-26 11:38:52.902456,0 days 00:00:04.003136,,gini,26.0,0.3873781263168482,0.5370913352990204,8,25,1006,PRUNED
672,1.0699488449720131,2026-02-26 11:38:53.167158,2026-02-26 11:38:57.627647,0 days 00:00:04.460489,,gini,,0.1863912723622429,0.5474177570356215,9,59,1237,PRUNED
673,1.205339782333954,2026-02-26 11:38:57.655750,2026-02-26 11:39:03.698642,0 days 00:00:06.042892,,entropy,12.0,0.24693830282606127,0.61437762786659,8,49,1667,PRUNED
674,1.050613610177742,2026-02-26 11:39:03.745184,2026-02-26 11:39:09.171488,0 days 00:00:05.426304,,log_loss,32.0,0.21560537763619392,0.5143896829216645,8,51,1376,PRUNED
675,1.0907274593333707,2026-02-26 11:39:09.209016,2026-02-26 11:39:12.063075,0 days 00:00:02.854059,balanced,gini,,0.2324836788237085,0.5616858088052213,7,55,660,PRUNED
676,1.205275114024048,2026-02-26 11:39:12.092661,2026-02-26 11:39:17.852213,0 days 00:00:05.759552,,gini,12.0,0.25425231175313645,0.5952500517343303,9,48,1580,PRUNED
677,1.201174873300048,2026-02-26 11:39:17.891996,2026-02-26 11:39:22.816394,0 days 00:00:04.924398,,entropy,26.0,0.2775323018924808,0.5347133441499187,8,53,1307,PRUNED
678,1.2242462915515453,2026-02-26 11:39:22.855928,2026-02-26 11:39:28.337555,0 days 00:00:05.481627,,gini,16.0,0.2961795849025809,0.705673015974306,8,52,1505,PRUNED
679,1.0569718832664223,2026-02-26 11:39:28.374418,2026-02-26 11:39:32.585789,0 days 00:00:04.211371,,log_loss,,0.1713488546720233,0.5772240793838503,9,56,1125,PRUNED
680,1.2019482217221618,2026-02-26 11:39:32.616234,2026-02-26 11:39:36.962746,0 days 00:00:04.346512,,gini,12.0,0.2656040435345431,0.5186128993573603,8,50,1193,PRUNED
681,1.0487732368074223,2026-02-26 11:39:36.999858,2026-02-26 11:39:41.730204,0 days 00:00:04.730346,,entropy,,0.23993397743570818,0.5431088893120347,8,54,1252,COMPLETE
682,1.0679979060576081,2026-02-26 11:39:41.766216,2026-02-26 11:39:46.871623,0 days 00:00:05.105407,,gini,12.0,0.219464669704682,0.5086434454360929,10,51,1417,PRUNED
683,1.0614065380689537,2026-02-26 11:39:46.907988,2026-02-26 11:39:52.095037,0 days 00:00:05.187049,,log_loss,26.0,0.24937752175526684,0.552495891778388,7,56,1355,PRUNED
684,1.1996150391640465,2026-02-26 11:39:52.133138,2026-02-26 11:39:57.682537,0 days 00:00:05.549399,,gini,16.0,0.20219421664194914,0.5271751756247683,9,53,1573,PRUNED
685,1.2164534824679134,2026-02-26 11:39:57.718320,2026-02-26 11:40:01.898681,0 days 00:00:04.180361,,entropy,,0.2753259472292776,0.8189218246804373,8,54,1107,PRUNED
686,1.0658826394734597,2026-02-26 11:40:01.930044,2026-02-26 11:40:07.310610,0 days 00:00:05.380566,,gini,12.0,0.23151275921822356,0.565302226899593,8,58,1516,PRUNED
687,1.2109508961377162,2026-02-26 11:40:07.344381,2026-02-26 11:40:14.220870,0 days 00:00:06.876489,,gini,,0.2601048328225547,0.5001675579120455,9,9,1879,PRUNED
688,1.2121423902354436,2026-02-26 11:40:14.255616,2026-02-26 11:40:17.830702,0 days 00:00:03.575086,,log_loss,8.0,0.29871820800194043,0.6260749002270453,8,49,947,PRUNED
689,1.200427951019157,2026-02-26 11:40:17.871984,2026-02-26 11:40:21.135397,0 days 00:00:03.263413,,entropy,12.0,0.24423202421863907,0.5363883365430203,8,52,832,PRUNED
690,1.2094060893163399,2026-02-26 11:40:21.179725,2026-02-26 11:40:23.230909,0 days 00:00:02.051184,,gini,26.0,0.21193994773446953,0.5207688835824539,8,44,508,PRUNED
691,1.2093428246816778,2026-02-26 11:40:23.272230,2026-02-26 11:40:31.646571,0 days 00:00:08.374341,,gini,16.0,0.3267640486123496,0.5450014394446703,9,57,2353,PRUNED
692,1.2052689648868342,2026-02-26 11:40:31.690411,2026-02-26 11:40:36.050362,0 days 00:00:04.359951,,log_loss,,0.28430870447975065,0.5780589669119566,7,55,1175,PRUNED
693,1.0910110308327106,2026-02-26 11:40:36.082030,2026-02-26 11:40:39.997530,0 days 00:00:03.915500,balanced,entropy,12.0,0.2713891370750111,0.5560907094681854,8,53,1043,PRUNED
694,1.0647415467506887,2026-02-26 11:40:40.028572,2026-02-26 11:40:44.566847,0 days 00:00:04.538275,,gini,,0.22967322970505968,0.5311243740099129,8,51,1231,PRUNED
695,1.2000503158921827,2026-02-26 11:40:44.597901,2026-02-26 11:40:49.303055,0 days 00:00:04.705154,,gini,16.0,0.25579874930442753,0.5115180047214737,10,45,1295,PRUNED
696,1.0653712598323726,2026-02-26 11:40:49.362802,2026-02-26 11:40:55.084281,0 days 00:00:05.721479,,entropy,26.0,0.1951100480023653,0.5911734714427174,8,54,1539,PRUNED
697,1.2582973495911178,2026-02-26 11:40:55.115851,2026-02-26 11:41:01.193197,0 days 00:00:06.077346,,gini,,0.48997093263620384,0.6019665086576359,8,50,1628,PRUNED
698,1.0511157656833512,2026-02-26 11:41:01.244642,2026-02-26 11:41:06.534859,0 days 00:00:05.290217,,log_loss,12.0,0.24196675448251484,0.5223296784887924,5,56,1430,PRUNED
699,1.2298708089705088,2026-02-26 11:41:06.567598,2026-02-26 11:41:12.074080,0 days 00:00:05.506482,,gini,20.0,0.3104609094504569,0.5383965257355812,9,20,1491,PRUNED
700,1.2041379627747457,2026-02-26 11:41:12.105479,2026-02-26 11:41:16.323815,0 days 00:00:04.218336,,gini,,0.22035154906381985,0.5630367691729578,9,36,1141,PRUNED
701,1.1999681580053134,2026-02-26 11:41:16.360690,2026-02-26 11:41:21.727105,0 days 00:00:05.366415,,entropy,12.0,0.2637165646406128,0.5470973998685702,8,52,1387,PRUNED
702,1.1994740911595991,2026-02-26 11:41:21.757802,2026-02-26 11:41:26.609015,0 days 00:00:04.851213,,log_loss,32.0,0.2844434001656211,0.509138086398476,8,49,1335,PRUNED
703,1.2185298736643935,2026-02-26 11:41:26.642168,2026-02-26 11:41:29.561656,0 days 00:00:02.919488,,gini,16.0,0.24480634970029846,0.5304845760813821,9,29,762,PRUNED
704,1.2009731747563281,2026-02-26 11:41:29.592198,2026-02-26 11:41:33.500394,0 days 00:00:03.908196,,gini,26.0,0.25760601633136065,0.5550901967476766,8,58,1072,PRUNED
705,1.0620424695725044,2026-02-26 11:41:33.543708,2026-02-26 11:41:35.339405,0 days 00:00:01.795697,,entropy,,0.22890250227801462,0.5719785152853046,8,51,420,PRUNED
706,1.3751382020967025,2026-02-26 11:41:35.385559,2026-02-26 11:41:36.879153,0 days 00:00:01.493594,,log_loss,12.0,0.7532506700640981,0.7931787026372998,8,54,306,PRUNED
707,1.2059198099090138,2026-02-26 11:41:36.926408,2026-02-26 11:41:40.213991,0 days 00:00:03.287583,,gini,,0.2718479959829795,0.5191525678467628,9,47,881,PRUNED
708,1.2054414003787244,2026-02-26 11:41:40.267007,2026-02-26 11:41:45.571348,0 days 00:00:05.304341,,gini,12.0,0.2401176706140039,0.6361495433464087,8,53,1464,PRUNED
709,1.0519415453152248,2026-02-26 11:41:45.616216,2026-02-26 11:41:50.166480,0 days 00:00:04.550264,,entropy,16.0,0.2076260799434585,0.6130724155034027,8,56,1211,PRUNED
710,1.0660450559343426,2026-02-26 11:41:50.214575,2026-02-26 11:41:54.932865,0 days 00:00:04.718290,,gini,26.0,0.2900340054515742,0.5413187719162328,10,51,1297,PRUNED
711,1.2424333040449067,2026-02-26 11:41:54.972380,2026-02-26 11:42:00.939995,0 days 00:00:05.967615,,log_loss,,0.6346456084440355,0.5272809472656749,8,55,1545,PRUNED
712,1.1989412892454685,2026-02-26 11:42:01.004988,2026-02-26 11:42:07.169626,0 days 00:00:06.164638,,gini,12.0,0.1794665658995889,0.5862724824412482,9,53,1008,PRUNED
713,1.0487003633930876,2026-02-26 11:42:07.201998,2026-02-26 11:42:11.567301,0 days 00:00:04.365303,,entropy,,0.25683542977513585,0.5515093580860065,7,54,1158,COMPLETE
714,1.0655643438799782,2026-02-26 11:42:11.614473,2026-02-26 11:42:15.624795,0 days 00:00:04.010322,,gini,12.0,0.22206908486999782,0.5003510006158923,8,48,1102,PRUNED
715,1.0873058695472513,2026-02-26 11:42:15.669346,2026-02-26 11:42:21.462268,0 days 00:00:05.792922,balanced,log_loss,26.0,0.2723956477488432,0.5161740040309244,8,50,1597,PRUNED
716,1.0664154198389602,2026-02-26 11:42:21.491722,2026-02-26 11:42:25.986386,0 days 00:00:04.494664,,gini,16.0,0.24868769092166199,0.5322566292476584,9,57,1241,PRUNED
717,1.0507319411614047,2026-02-26 11:42:26.030471,2026-02-26 11:42:34.781792,0 days 00:00:08.751321,,entropy,,0.23420328440654634,0.5656237380479734,8,52,2381,PRUNED
718,1.0669069145354853,2026-02-26 11:42:34.823920,2026-02-26 11:42:39.893465,0 days 00:00:05.069545,,gini,12.0,0.1978566755629267,0.5425693398721598,8,55,1417,PRUNED
719,1.210465271515499,2026-02-26 11:42:39.926224,2026-02-26 11:42:45.309036,0 days 00:00:05.382812,,gini,8.0,0.2993848336018321,0.6009166313424331,8,60,1498,PRUNED
720,1.0491097274594765,2026-02-26 11:42:45.350336,2026-02-26 11:42:50.316220,0 days 00:00:04.965884,,log_loss,,0.2641209957772929,0.515868445720132,9,53,1346,COMPLETE
721,1.051574676018164,2026-02-26 11:42:50.366157,2026-02-26 11:42:55.935870,0 days 00:00:05.569713,,entropy,26.0,0.21717229614028855,0.5498107625070583,8,56,1532,PRUNED
722,1.2040706863064714,2026-02-26 11:42:55.970395,2026-02-26 11:43:04.837472,0 days 00:00:08.867077,,gini,16.0,0.27494617669429255,0.5792946099870346,10,51,2463,PRUNED
723,1.2273335008052415,2026-02-26 11:43:04.869426,2026-02-26 11:43:09.522056,0 days 00:00:04.652630,,gini,12.0,0.24903346647411467,0.5088170349262514,1,52,1282,PRUNED
724,1.0493836954505191,2026-02-26 11:43:09.554856,2026-02-26 11:43:14.033394,0 days 00:00:04.478538,,log_loss,,0.2327528969723068,0.5289206233160736,9,54,1193,COMPLETE
725,1.213041619591998,2026-02-26 11:43:14.090152,2026-02-26 11:43:19.409654,0 days 00:00:05.319502,,entropy,12.0,0.28803281617240406,0.5592106167039781,7,41,1448,PRUNED
726,1.2017382257811025,2026-02-26 11:43:19.456692,2026-02-26 11:43:23.589322,0 days 00:00:04.132630,,gini,,0.25053847051712413,0.5374231346802922,8,50,1139,PRUNED
727,1.2000114649911533,2026-02-26 11:43:23.620342,2026-02-26 11:43:28.785280,0 days 00:00:05.164938,,gini,26.0,0.21673148428651975,0.5239021444599015,9,48,1390,PRUNED
728,1.2046640260049948,2026-02-26 11:43:28.816164,2026-02-26 11:43:34.848651,0 days 00:00:06.032487,,entropy,16.0,0.2686578945518132,0.5708045296830773,6,57,1673,PRUNED
729,1.2057159183891983,2026-02-26 11:43:34.885679,2026-02-26 11:43:40.605220,0 days 00:00:05.719541,,log_loss,20.0,0.31301572449682746,0.5381051458848567,8,52,1574,PRUNED
730,1.0757723043221605,2026-02-26 11:43:40.645021,2026-02-26 11:43:44.155842,0 days 00:00:03.510821,,gini,,0.14190530972592563,0.6201028570911501,8,55,939,PRUNED
731,1.066686680012348,2026-02-26 11:43:44.200796,2026-02-26 11:43:48.031124,0 days 00:00:03.830328,,gini,12.0,0.23630474872171583,0.507486231203136,8,59,1052,PRUNED
732,1.0962943553255133,2026-02-26 11:43:48.068628,2026-02-26 11:43:54.377020,0 days 00:00:06.308392,balanced,entropy,32.0,0.2572904723291857,0.5493354818039746,9,58,1721,PRUNED
733,1.2090285549496516,2026-02-26 11:43:54.419001,2026-02-26 11:43:59.022315,0 days 00:00:04.603314,,gini,,0.20575669689496406,0.5925805883773622,8,49,1255,PRUNED
734,1.0499466254228478,2026-02-26 11:43:59.058070,2026-02-26 11:44:06.587055,0 days 00:00:07.528985,,log_loss,12.0,0.2805557549483486,0.521712403732909,8,54,2098,PRUNED
735,1.2074833432271745,2026-02-26 11:44:06.627754,2026-02-26 11:44:11.938327,0 days 00:00:05.310573,,gini,16.0,0.22803469939584878,0.608092521120265,8,50,1479,PRUNED
736,1.0661586905087521,2026-02-26 11:44:11.977009,2026-02-26 11:44:16.321789,0 days 00:00:04.344780,,entropy,26.0,0.18592813468074312,0.5612592491719641,10,46,1194,PRUNED
737,1.2027117762886566,2026-02-26 11:44:16.353339,2026-02-26 11:44:22.230030,0 days 00:00:05.876691,,gini,,0.24477333990573544,0.5361805926243562,7,52,1635,PRUNED
738,1.0659799250332351,2026-02-26 11:44:22.265471,2026-02-26 11:44:23.863881,0 days 00:00:01.598410,,log_loss,12.0,0.2629371558698653,0.5094019879064554,9,56,378,PRUNED
739,1.284070779855312,2026-02-26 11:44:23.893692,2026-02-26 11:44:28.233905,0 days 00:00:04.340213,,gini,,0.7766227345392134,0.5259228083638557,9,53,1098,PRUNED
740,1.0500361603140766,2026-02-26 11:44:28.266594,2026-02-26 11:44:33.869728,0 days 00:00:05.603134,,entropy,12.0,0.29238914312075676,0.5502072773747757,8,55,1526,PRUNED
741,1.2192991998395017,2026-02-26 11:44:33.900040,2026-02-26 11:44:38.821637,0 days 00:00:04.921597,,gini,16.0,0.24027509006082548,0.7424243493979514,8,52,1345,PRUNED
742,1.201974147693255,2026-02-26 11:44:38.861674,2026-02-26 11:44:40.674067,0 days 00:00:01.812393,,gini,26.0,0.27918649040907756,0.5162980124443571,8,54,443,PRUNED
743,1.0505483672745288,2026-02-26 11:44:40.704574,2026-02-26 11:44:44.978513,0 days 00:00:04.273939,,log_loss,,0.22078465776654294,0.5800951355946348,9,49,1141,PRUNED
744,1.2188590523127663,2026-02-26 11:44:45.014216,2026-02-26 11:44:49.763255,0 days 00:00:04.749039,,gini,12.0,0.3467418387275483,0.5398046299555365,8,51,1297,PRUNED
745,1.0489249448611497,2026-02-26 11:44:49.803983,2026-02-26 11:44:57.350256,0 days 00:00:07.546273,,entropy,,0.2642254487043611,0.530182679612583,8,53,2022,COMPLETE
746,1.0662135435773794,2026-02-26 11:44:57.397152,2026-02-26 11:45:01.059858,0 days 00:00:03.662706,,gini,8.0,0.25398878901333455,0.5589694533171171,8,56,998,PRUNED
747,1.0664012549742425,2026-02-26 11:45:01.096181,2026-02-26 11:45:06.272164,0 days 00:00:05.175983,,log_loss,12.0,0.20138157987355068,0.5004739607005263,9,57,1417,PRUNED
748,1.2099563098063368,2026-02-26 11:45:06.303595,2026-02-26 11:45:11.991697,0 days 00:00:05.688102,,gini,26.0,0.30735219785653123,0.5472590526659157,7,55,1578,PRUNED
749,1.0665615819362313,2026-02-26 11:45:12.031886,2026-02-26 11:45:14.770128,0 days 00:00:02.738242,,entropy,16.0,0.16265002955203722,0.5709653980961487,8,50,710,PRUNED
750,1.093159041211059,2026-02-26 11:45:14.810652,2026-02-26 11:45:19.356305,0 days 00:00:04.545653,balanced,gini,,0.23318489745494034,0.5182678751905976,8,51,1234,PRUNED
751,1.2112376875993918,2026-02-26 11:45:19.386581,2026-02-26 11:45:24.959667,0 days 00:00:05.573086,,gini,12.0,0.27739178342010234,0.5933312674035846,9,53,1494,PRUNED
752,1.1999826575347052,2026-02-26 11:45:24.998737,2026-02-26 11:45:30.314558,0 days 00:00:05.315821,,log_loss,,0.2465870639133596,0.5317666991874629,8,47,1458,PRUNED
753,1.0489458628844646,2026-02-26 11:45:30.355389,2026-02-26 11:45:34.758535,0 days 00:00:04.403146,,entropy,26.0,0.20930221806109262,0.5449926323469817,8,54,1195,COMPLETE
754,1.2037292152282546,2026-02-26 11:45:34.792798,2026-02-26 11:45:40.336125,0 days 00:00:05.543327,,gini,16.0,0.26227939881925016,0.523344695654521,8,52,1549,PRUNED
755,1.199735184289702,2026-02-26 11:45:40.375527,2026-02-26 11:45:44.333494,0 days 00:00:03.957967,,gini,12.0,0.22699825572365226,0.5091393921711387,8,57,1094,PRUNED
756,1.2058197652994447,2026-02-26 11:45:44.364243,2026-02-26 11:45:49.252423,0 days 00:00:04.888180,,entropy,,0.29731577769124024,0.5559460564709977,9,48,1334,PRUNED
757,1.0498849698303376,2026-02-26 11:45:49.292420,2026-02-26 11:45:54.607904,0 days 00:00:05.315484,,log_loss,12.0,0.24125323600414622,0.5839905259274344,8,53,1390,PRUNED
758,1.065429525018896,2026-02-26 11:45:54.651260,2026-02-26 11:45:56.114515,0 days 00:00:01.463255,,gini,,0.27373907568997674,0.5367375671603235,10,58,345,PRUNED
759,1.0671070407380794,2026-02-26 11:45:56.155018,2026-02-26 11:46:00.764754,0 days 00:00:04.609736,,gini,32.0,0.21880485218769147,0.5662074477257945,9,55,1268,PRUNED
760,1.2098775467100256,2026-02-26 11:46:00.804934,2026-02-26 11:46:03.983158,0 days 00:00:03.178224,,entropy,26.0,0.2561273468116963,0.6038585720788568,7,51,830,PRUNED
761,1.2177630368697698,2026-02-26 11:46:04.019822,2026-02-26 11:46:08.337324,0 days 00:00:04.317502,,log_loss,20.0,0.3246662945835338,0.5168183003416661,4,50,1164,PRUNED
762,1.202433342214374,2026-02-26 11:46:08.369437,2026-02-26 11:46:12.240838,0 days 00:00:03.871401,,gini,16.0,0.2845044544541741,0.542429408130834,8,54,1053,PRUNED
763,1.0475218118402476,2026-02-26 11:46:12.274109,2026-02-26 11:46:18.831628,0 days 00:00:06.557519,,gini,,0.24997362707771106,0.5283566655468698,8,52,1813,COMPLETE
764,1.2027252236372232,2026-02-26 11:46:18.866919,2026-02-26 11:46:25.643827,0 days 00:00:06.776908,,gini,,0.2330775605764376,0.5503795122372771,8,49,1901,PRUNED
765,1.0531823409887666,2026-02-26 11:46:25.678087,2026-02-26 11:46:32.802755,0 days 00:00:07.124668,,entropy,,0.21309266575396035,0.5315480357775307,9,50,1921,PRUNED
766,1.208561165746412,2026-02-26 11:46:32.832766,2026-02-26 11:46:38.742142,0 days 00:00:05.909376,,gini,,0.24405201786584024,0.6144207913084037,8,52,1638,PRUNED
767,1.268801320499137,2026-02-26 11:46:38.774425,2026-02-26 11:46:45.239156,0 days 00:00:06.464731,,log_loss,,0.7118372508336985,0.5617418136524944,8,51,1689,PRUNED
768,1.0694262697615804,2026-02-26 11:46:45.273077,2026-02-26 11:46:52.292429,0 days 00:00:07.019352,,gini,,0.1951072797111312,0.5411126349246719,9,51,1986,PRUNED
769,1.0503201207631585,2026-02-26 11:46:52.324741,2026-02-26 11:46:57.643240,0 days 00:00:05.318499,,entropy,,0.2284339708174468,0.5287947388951182,8,57,1451,PRUNED
770,1.0995627797470364,2026-02-26 11:46:57.687222,2026-02-26 11:47:04.017050,0 days 00:00:06.329828,balanced,gini,,0.2545581453152662,0.5738331302264141,10,59,1714,PRUNED
771,1.2004135183123679,2026-02-26 11:47:04.049891,2026-02-26 11:47:10.698715,0 days 00:00:06.648824,,log_loss,,0.24076608361181337,0.5556756813488575,8,49,1841,PRUNED
772,1.2020370420501232,2026-02-26 11:47:10.736487,2026-02-26 11:47:16.529088,0 days 00:00:05.792601,,gini,,0.22638828926527696,0.5971839320042689,7,55,1608,PRUNED
773,1.2139235239800776,2026-02-26 11:47:16.561654,2026-02-26 11:47:23.207573,0 days 00:00:06.645919,,entropy,,0.2530806742180679,0.6259246466486422,5,52,1827,PRUNED
774,1.2007852429497368,2026-02-26 11:47:23.255514,2026-02-26 11:47:28.698074,0 days 00:00:05.442560,,gini,,0.2109132127974852,0.5453242638812735,6,56,1513,PRUNED
775,1.0661370229923761,2026-02-26 11:47:28.730813,2026-02-26 11:47:37.377980,0 days 00:00:08.647167,,log_loss,,0.18883056649535682,0.5243258178865281,9,53,2401,PRUNED
776,1.2168624199299671,2026-02-26 11:47:37.409281,2026-02-26 11:47:42.433863,0 days 00:00:05.024582,,gini,,0.26591281733828953,0.5117841362501186,8,34,1372,PRUNED
777,1.2135867557256454,2026-02-26 11:47:42.465433,2026-02-26 11:47:50.882005,0 days 00:00:08.416572,,entropy,,0.24055730284815457,0.8093036973742989,8,54,2334,PRUNED
