number,value,datetime_start,datetime_complete,duration,params_C,params_calib_cv,params_calib_method,params_class_weight,params_gamma,params_kernel,params_max_iter,params_tol,state
246,1.2158589142076022,2026-02-26 11:13:18.876045,2026-02-26 11:13:19.127361,0 days 00:00:00.251316,0.003447577981125872,3,sigmoid,,,linear,14284.0,1.295749042034941e-05,PRUNED
247,1.2179387488374938,2026-02-26 11:13:19.152336,2026-02-26 11:13:19.432500,0 days 00:00:00.280164,0.0015785068522581934,5,sigmoid,,,linear,5913.0,0.0013237459638501788,PRUNED
248,1.209700314218594,2026-02-26 11:13:19.458187,2026-02-26 11:13:19.692855,0 days 00:00:00.234668,0.0024935491097200575,3,sigmoid,,,linear,12560.0,0.0007928876971930629,PRUNED
249,1.2217529385780086,2026-02-26 11:13:19.719220,2026-02-26 11:13:19.964389,0 days 00:00:00.245169,0.004291860762401772,3,sigmoid,,,linear,6581.0,0.0006194602225450626,PRUNED
250,1.2141961568464414,2026-02-26 11:13:19.990855,2026-02-26 11:13:20.258130,0 days 00:00:00.267275,0.003208884076189551,3,sigmoid,,,linear,5169.0,0.0003778440751047203,PRUNED
