number,value,datetime_start,datetime_complete,duration,params_class_weight,params_criterion,params_max_depth,params_max_features,params_max_samples,params_min_samples_leaf,params_min_samples_split,params_n_estimators,state
518,1.0504857012888933,2026-02-26 11:26:19.317691,2026-02-26 11:26:24.563886,0 days 00:00:05.246195,,entropy,,0.21631337826406072,0.5469057309781911,8,52,1268,PRUNED
519,1.049561496706691,2026-02-26 11:26:24.600608,2026-02-26 11:26:29.507846,0 days 00:00:04.907238,,entropy,12.0,0.236713801505591,0.5323177848135131,8,55,1178,COMPLETE
520,1.0663967135193146,2026-02-26 11:26:29.541471,2026-02-26 11:26:34.079229,0 days 00:00:04.537758,,entropy,26.0,0.18264043821898082,0.5601423508149148,8,53,1119,PRUNED
521,1.2064455328310146,2026-02-26 11:26:34.115143,2026-02-26 11:26:40.362006,0 days 00:00:06.246863,,entropy,,0.2764713093378227,0.6056400133393429,8,54,1532,PRUNED
522,1.0857427062432699,2026-02-26 11:26:40.389489,2026-02-26 11:26:44.933411,0 days 00:00:04.543922,balanced,gini,12.0,0.26144468825273404,0.5220316456907463,7,50,1060,PRUNED
523,1.1997639400158209,2026-02-26 11:26:44.970231,2026-02-26 11:26:50.928649,0 days 00:00:05.958418,,entropy,,0.2445237722771675,0.5936632969290957,6,57,1482,PRUNED
524,1.208895671580145,2026-02-26 11:26:50.960612,2026-02-26 11:26:55.879303,0 days 00:00:04.918691,,gini,16.0,0.29263349607778694,0.5442860394099486,8,52,1216,PRUNED
525,1.0490585451724872,2026-02-26 11:26:55.926696,2026-02-26 11:27:02.308489,0 days 00:00:06.381793,,entropy,12.0,0.3251001854656064,0.5083515736905164,8,56,1562,COMPLETE
526,1.0771125273099345,2026-02-26 11:27:02.340303,2026-02-26 11:27:06.922068,0 days 00:00:04.581765,,gini,,0.13739482128511865,0.5311579572025986,8,51,1129,PRUNED
527,1.04966029478013,2026-02-26 11:27:06.970211,2026-02-26 11:27:11.024838,0 days 00:00:04.054627,,entropy,,0.20541102341599662,0.5781408088469396,8,53,958,PRUNED
528,1.2810694088894656,2026-02-26 11:27:11.064573,2026-02-26 11:27:16.097946,0 days 00:00:05.033373,,gini,12.0,0.056346357371121036,0.5521919843453685,7,55,1314,PRUNED
529,1.2006062862439375,2026-02-26 11:27:16.135646,2026-02-26 11:27:21.119352,0 days 00:00:04.983706,,gini,32.0,0.231463390490098,0.5180889140779392,8,49,1245,PRUNED
530,1.2009375477864652,2026-02-26 11:27:21.154706,2026-02-26 11:27:25.425305,0 days 00:00:04.270599,,entropy,16.0,0.2728187102840801,0.5692515605911,8,58,1026,PRUNED
531,1.0483271844531024,2026-02-26 11:27:25.457147,2026-02-26 11:27:30.293488,0 days 00:00:04.836341,,gini,26.0,0.25288728218092593,0.5370824241318239,8,54,1178,COMPLETE
532,1.245757941193295,2026-02-26 11:27:30.327479,2026-02-26 11:27:35.275667,0 days 00:00:04.948188,,gini,26.0,0.3009110400384776,0.5343121423007233,4,33,1193,PRUNED
533,1.216651039514378,2026-02-26 11:27:35.312539,2026-02-26 11:27:40.389618,0 days 00:00:05.077079,,gini,26.0,0.25690888633870074,0.5216242821667927,3,52,1213,PRUNED
534,1.2086122259990781,2026-02-26 11:27:40.430845,2026-02-26 11:27:46.999230,0 days 00:00:06.568385,,gini,26.0,0.27233029602276465,0.5119604496178287,8,51,1665,PRUNED
535,1.202896909222265,2026-02-26 11:27:47.030243,2026-02-26 11:27:54.309863,0 days 00:00:07.279620,,gini,26.0,0.28647394944005083,0.5285516208932919,8,54,1853,PRUNED
536,1.2031205727198553,2026-02-26 11:27:54.340456,2026-02-26 11:27:59.368046,0 days 00:00:05.027590,,gini,26.0,0.2496168526369461,0.5396699416522256,8,55,1258,PRUNED
537,1.20251070542327,2026-02-26 11:27:59.398901,2026-02-26 11:28:06.961222,0 days 00:00:07.562321,,gini,26.0,0.27296661561498914,0.5101500097745517,8,50,1928,PRUNED
538,1.0472202813157694,2026-02-26 11:28:06.999732,2026-02-26 11:28:11.721816,0 days 00:00:04.722084,,gini,26.0,0.2233022065043174,0.5240069195243422,8,56,1155,COMPLETE
539,1.2218192954781488,2026-02-26 11:28:11.771260,2026-02-26 11:28:17.877228,0 days 00:00:06.105968,,gini,26.0,0.19371370731415136,0.9650696649643645,4,57,1524,PRUNED
540,1.0675192338335322,2026-02-26 11:28:17.915025,2026-02-26 11:28:23.197754,0 days 00:00:05.282729,,gini,26.0,0.21892965797632952,0.5221837046479233,9,57,1293,PRUNED
541,1.0728118935566906,2026-02-26 11:28:23.234542,2026-02-26 11:28:25.504028,0 days 00:00:02.269486,,gini,26.0,0.1719426094613049,0.5000833223345946,8,59,518,PRUNED
542,1.0668856828147362,2026-02-26 11:28:25.541482,2026-02-26 11:28:30.271786,0 days 00:00:04.730304,,gini,26.0,0.2078867133128389,0.5300714699725334,8,52,1178,PRUNED
543,1.0999273491023571,2026-02-26 11:28:30.313245,2026-02-26 11:28:36.809388,0 days 00:00:06.496143,balanced,gini,26.0,0.22077300174004366,0.5001500558936322,8,56,1594,PRUNED
544,1.2039760806747095,2026-02-26 11:28:36.846237,2026-02-26 11:28:42.664493,0 days 00:00:05.818256,,gini,26.0,0.2613136279611263,0.5212529950979506,9,49,1450,PRUNED
545,1.2124090395216556,2026-02-26 11:28:42.704967,2026-02-26 11:28:47.680346,0 days 00:00:04.975379,,gini,26.0,0.305742239792237,0.5375004171981544,8,53,1234,PRUNED
546,1.0651188844875799,2026-02-26 11:28:47.755019,2026-02-26 11:28:53.443423,0 days 00:00:05.688404,,gini,26.0,0.23397920708604583,0.5178712856183917,9,54,1407,PRUNED
547,1.201982489393967,2026-02-26 11:28:53.479785,2026-02-26 11:28:58.735486,0 days 00:00:05.255701,,gini,26.0,0.28583452065882736,0.5419985155123382,8,58,1316,PRUNED
548,1.0494240357453162,2026-02-26 11:28:58.769836,2026-02-26 11:29:03.584485,0 days 00:00:04.814649,,gini,26.0,0.25461653799559625,0.5094991697632215,8,56,1177,COMPLETE
549,1.0663960971802737,2026-02-26 11:29:03.630961,2026-02-26 11:29:09.558851,0 days 00:00:05.927890,,gini,,0.2233205162494605,0.5263327003661811,9,53,1496,PRUNED
550,1.2050359810031102,2026-02-26 11:29:09.589160,2026-02-26 11:29:15.733398,0 days 00:00:06.144238,,gini,26.0,0.26980392062497444,0.5296439832128929,8,51,1560,PRUNED
551,1.2018048756761084,2026-02-26 11:29:15.763826,2026-02-26 11:29:20.845334,0 days 00:00:05.081508,,gini,,0.24707238406252702,0.5449763571396326,10,50,1263,PRUNED
552,1.0533983124466744,2026-02-26 11:29:20.884220,2026-02-26 11:29:26.386780,0 days 00:00:05.502560,,log_loss,,0.19615089620730852,0.508425173309071,8,48,1354,PRUNED
553,1.2156535034518152,2026-02-26 11:29:26.416111,2026-02-26 11:29:29.198527,0 days 00:00:02.782416,,gini,26.0,0.285667075361052,0.5367858699383713,9,40,645,PRUNED
554,1.0663153724179115,2026-02-26 11:29:29.228193,2026-02-26 11:29:32.728270,0 days 00:00:03.500077,,gini,,0.2301199237359754,0.5137128863108658,8,54,846,PRUNED
555,1.2079732723155576,2026-02-26 11:29:32.778179,2026-02-26 11:29:38.616928,0 days 00:00:05.838749,,gini,,0.2610973656698258,0.5505175350391044,8,51,1431,PRUNED
556,1.052408407880198,2026-02-26 11:29:38.646493,2026-02-26 11:29:45.931974,0 days 00:00:07.285481,,log_loss,8.0,0.24802598861545094,0.5222471970662677,9,53,1801,PRUNED
557,1.2102309012740038,2026-02-26 11:29:45.966512,2026-02-26 11:29:50.689107,0 days 00:00:04.722595,,gini,,0.30326416254241434,0.5336435762395904,8,55,1165,PRUNED
558,1.0664360356312743,2026-02-26 11:29:50.727272,2026-02-26 11:29:56.681098,0 days 00:00:05.953826,,gini,26.0,0.20970938213315699,0.5437365033508952,8,50,1506,PRUNED
559,1.2166979571937762,2026-02-26 11:29:56.725458,2026-02-26 11:30:06.387086,0 days 00:00:09.661628,,gini,,0.27958745997193196,0.637491852592416,8,52,2443,PRUNED
560,1.0504959422094988,2026-02-26 11:30:06.426599,2026-02-26 11:30:13.003825,0 days 00:00:06.577226,,log_loss,,0.23469703035078254,0.5178340679850215,9,56,1629,PRUNED
561,1.2205834531685749,2026-02-26 11:30:13.038784,2026-02-26 11:30:18.017511,0 days 00:00:04.978727,,gini,,0.31885529951754826,0.6196668259508803,8,52,1208,PRUNED
562,1.0941651057845994,2026-02-26 11:30:18.053839,2026-02-26 11:30:23.147630,0 days 00:00:05.093791,balanced,gini,26.0,0.2618389971815967,0.5283889975356285,8,58,1284,PRUNED
563,1.0711964495720179,2026-02-26 11:30:23.189305,2026-02-26 11:30:27.506788,0 days 00:00:04.317483,,log_loss,32.0,0.15049707523944175,0.5004536016490441,2,51,1073,PRUNED
564,1.067324824755301,2026-02-26 11:30:27.548836,2026-02-26 11:30:33.426072,0 days 00:00:05.877236,,gini,,0.2462078966518747,0.559501380287462,10,60,1476,PRUNED
565,1.0667916842471146,2026-02-26 11:30:33.454893,2026-02-26 11:30:38.150843,0 days 00:00:04.695950,,gini,,0.22414304901757154,0.5488502766394224,8,55,1135,PRUNED
566,1.2023625319903517,2026-02-26 11:30:38.184629,2026-02-26 11:30:44.640967,0 days 00:00:06.456338,,gini,12.0,0.2939296306091125,0.5119929214559052,9,49,1584,PRUNED
567,1.0504197232659311,2026-02-26 11:30:44.670417,2026-02-26 11:30:51.023570,0 days 00:00:06.353153,,log_loss,,0.26980623411345983,0.5363244497247821,9,54,1543,PRUNED
568,1.0673597398754657,2026-02-26 11:30:51.056759,2026-02-26 11:30:56.616324,0 days 00:00:05.559565,,gini,26.0,0.18184841474579527,0.5267041844510277,8,48,1395,PRUNED
569,1.2254621996923067,2026-02-26 11:30:56.657697,2026-02-26 11:31:02.149814,0 days 00:00:05.492117,,gini,12.0,0.3370983726321883,0.6098056842776907,8,53,1347,PRUNED
570,1.2026873394364566,2026-02-26 11:31:02.190834,2026-02-26 11:31:07.129980,0 days 00:00:04.939146,,gini,,0.256314017972735,0.554949939132102,8,57,1228,PRUNED
571,1.0509463686660565,2026-02-26 11:31:07.168339,2026-02-26 11:31:10.566246,0 days 00:00:03.397907,,log_loss,26.0,0.23617635705784543,0.5149088330992128,9,55,790,PRUNED
572,1.0666469720656415,2026-02-26 11:31:10.605730,2026-02-26 11:31:15.039558,0 days 00:00:04.433828,,gini,12.0,0.2094360978882544,0.5416834413748731,8,50,1099,PRUNED
573,1.2024789963727032,2026-02-26 11:31:15.078941,2026-02-26 11:31:24.811806,0 days 00:00:09.732865,,gini,,0.2783821093522315,0.5241461321052032,8,52,2499,PRUNED
574,1.2092998559183397,2026-02-26 11:31:24.841784,2026-02-26 11:31:30.600134,0 days 00:00:05.758350,,gini,12.0,0.26446859663058586,0.5084257146211895,5,58,1445,PRUNED
575,1.0492297207973913,2026-02-26 11:31:30.637796,2026-02-26 11:31:35.661425,0 days 00:00:05.023629,,log_loss,,0.24583716132638797,0.5619159454554445,8,54,1166,COMPLETE
576,1.067116945276412,2026-02-26 11:31:35.704936,2026-02-26 11:31:42.519579,0 days 00:00:06.814643,,gini,26.0,0.22366462030269282,0.5356259254309875,9,56,1753,PRUNED
577,1.2187439511594707,2026-02-26 11:31:42.548537,2026-02-26 11:31:48.580872,0 days 00:00:06.032335,,gini,12.0,0.2909743076062796,0.5006417527629438,3,53,1516,PRUNED
578,1.205209371312878,2026-02-26 11:31:48.610090,2026-02-26 11:31:52.362807,0 days 00:00:03.752717,,gini,8.0,0.27854638562740613,0.5492518391831946,8,52,915,PRUNED
579,1.0687344290854424,2026-02-26 11:31:52.408504,2026-02-26 11:31:54.534029,0 days 00:00:02.125525,,log_loss,,0.19620450613502272,0.522678831149964,8,49,471,PRUNED
580,1.2283888135138747,2026-02-26 11:31:54.563676,2026-02-26 11:31:59.992681,0 days 00:00:05.429005,,gini,,0.46044112630701095,0.5428285875410032,9,56,1252,PRUNED
581,1.0896968237330105,2026-02-26 11:32:00.024177,2026-02-26 11:32:05.398069,0 days 00:00:05.373892,balanced,gini,12.0,0.2532672159662914,0.5163554868230565,8,43,1337,PRUNED
582,1.0503688370053323,2026-02-26 11:32:05.443967,2026-02-26 11:32:11.381991,0 days 00:00:05.938024,,gini,26.0,0.23793132912429135,0.5322635758365443,10,51,1474,PRUNED
583,1.2101953569957071,2026-02-26 11:32:11.412052,2026-02-26 11:32:16.123578,0 days 00:00:04.711526,,log_loss,,0.2660469143027905,0.5993810183878722,8,47,1132,PRUNED
584,1.0678706095492068,2026-02-26 11:32:16.152905,2026-02-26 11:32:22.603750,0 days 00:00:06.450845,,gini,12.0,0.21464215216716856,0.5524084047377616,8,54,1589,PRUNED
585,1.203738514928138,2026-02-26 11:32:22.652651,2026-02-26 11:32:28.363671,0 days 00:00:05.711020,,gini,,0.297700979677936,0.5623797067087428,8,57,1406,PRUNED
586,1.0527489615224515,2026-02-26 11:32:28.393179,2026-02-26 11:32:32.656009,0 days 00:00:04.262830,,log_loss,12.0,0.2273660220878486,0.5123457004796635,9,51,1020,PRUNED
587,1.1992724168511792,2026-02-26 11:32:32.685717,2026-02-26 11:32:37.586323,0 days 00:00:04.900606,,gini,,0.249934126293008,0.5301212164848573,8,55,1218,PRUNED
588,1.2027505280080497,2026-02-26 11:32:37.635301,2026-02-26 11:32:42.331732,0 days 00:00:04.696431,,gini,26.0,0.2750582439453112,0.5407757847901012,9,53,1165,PRUNED
589,1.2039711471431955,2026-02-26 11:32:42.361337,2026-02-26 11:32:47.547054,0 days 00:00:05.185717,,gini,32.0,0.31561043656993165,0.5199241704334353,10,53,1289,PRUNED
590,1.0581552309754225,2026-02-26 11:32:47.575610,2026-02-26 11:32:49.482194,0 days 00:00:01.906584,,log_loss,12.0,0.23825807454925646,0.5705842940930868,8,59,405,PRUNED
591,1.212295509958095,2026-02-26 11:32:49.520862,2026-02-26 11:32:53.648818,0 days 00:00:04.127956,,gini,,0.10130383568653592,0.5082445941395355,8,24,1054,PRUNED
592,1.2770167393376308,2026-02-26 11:32:53.684670,2026-02-26 11:32:58.103274,0 days 00:00:04.418604,,gini,12.0,0.6774003812778103,0.5545969422885537,9,54,1093,PRUNED
593,1.2119143936791226,2026-02-26 11:32:58.140440,2026-02-26 11:33:03.663466,0 days 00:00:05.523026,,gini,,0.26160788016865877,0.628661786278567,8,52,1514,PRUNED
594,1.0506194807156948,2026-02-26 11:33:03.695700,2026-02-26 11:33:09.935442,0 days 00:00:06.239742,,log_loss,26.0,0.285437163918767,0.5326415401279293,9,50,1661,PRUNED
595,1.0656435878576138,2026-02-26 11:33:09.973395,2026-02-26 11:33:15.550124,0 days 00:00:05.576729,,gini,,0.2084567722576998,0.5449315236032574,8,56,1554,PRUNED
596,1.2094010117217866,2026-02-26 11:33:15.588643,2026-02-26 11:33:20.757295,0 days 00:00:05.168652,,gini,12.0,0.25089475306750575,0.6082911725486533,8,49,1424,PRUNED
597,1.2096123927778102,2026-02-26 11:33:20.786802,2026-02-26 11:33:25.244960,0 days 00:00:04.458158,,entropy,16.0,0.2265780167647783,0.7296096764002411,8,51,1207,PRUNED
598,1.199173204741504,2026-02-26 11:33:25.283113,2026-02-26 11:33:30.039800,0 days 00:00:04.756687,,gini,,0.26916949106227,0.5194459283044344,8,55,1316,PRUNED
599,1.2204379617070866,2026-02-26 11:33:30.078389,2026-02-26 11:33:34.786066,0 days 00:00:04.707677,,log_loss,12.0,0.19144381083490514,0.5933241127912988,7,4,1270,PRUNED
600,1.215876424479517,2026-02-26 11:33:34.840323,2026-02-26 11:33:43.590337,0 days 00:00:08.750014,balanced,gini,26.0,0.5190426398199147,0.5273841648753987,9,52,2389,PRUNED
601,1.2149610550418304,2026-02-26 11:33:43.628721,2026-02-26 11:33:48.734009,0 days 00:00:05.105288,,entropy,,0.23996453152428682,0.7548648955030461,8,54,1377,PRUNED
602,1.2072004878056193,2026-02-26 11:33:48.763494,2026-02-26 11:33:52.911149,0 days 00:00:04.147655,,gini,8.0,0.30321630710053005,0.559939837416904,8,47,1142,PRUNED
603,1.0747221886020482,2026-02-26 11:33:52.943593,2026-02-26 11:33:55.600154,0 days 00:00:02.656561,,gini,12.0,0.16704804802093576,0.5003942613139578,9,57,694,PRUNED
604,1.0508344236709275,2026-02-26 11:33:55.642377,2026-02-26 11:34:01.531609,0 days 00:00:05.889232,,entropy,,0.25862654462974954,0.5390221321473281,10,51,1616,PRUNED
605,1.0484612864345473,2026-02-26 11:34:01.561471,2026-02-26 11:34:07.089055,0 days 00:00:05.527584,,log_loss,16.0,0.2834476520743084,0.5117861252868775,8,53,1453,COMPLETE
606,1.201245364796118,2026-02-26 11:34:07.134406,2026-02-26 11:34:12.959948,0 days 00:00:05.825542,,log_loss,16.0,0.21590667783159728,0.525520761416829,7,49,1460,PRUNED
607,1.049808286600775,2026-02-26 11:34:12.998283,2026-02-26 11:34:19.214432,0 days 00:00:06.216149,,log_loss,16.0,0.23809739456177673,0.5477486128645654,9,50,1481,PRUNED
608,1.1999606763229889,2026-02-26 11:34:19.247668,2026-02-26 11:34:25.537380,0 days 00:00:06.289712,,log_loss,16.0,0.2536860729088288,0.5792952129283221,8,52,1453,PRUNED
609,1.2013765322708223,2026-02-26 11:34:25.569465,2026-02-26 11:34:31.739418,0 days 00:00:06.169953,,log_loss,16.0,0.2910856817085516,0.5355204787726789,8,53,1541,PRUNED
610,1.2488708387281309,2026-02-26 11:34:31.772458,2026-02-26 11:34:37.543581,0 days 00:00:05.771123,,log_loss,16.0,0.6125076056271413,0.5182501777471035,8,51,1371,PRUNED
611,1.0488803125479937,2026-02-26 11:34:37.573016,2026-02-26 11:34:43.400001,0 days 00:00:05.826985,,log_loss,16.0,0.27461191293663273,0.564869016901205,9,53,1412,COMPLETE
612,1.0503372716222175,2026-02-26 11:34:43.436045,2026-02-26 11:34:50.588382,0 days 00:00:07.152337,,log_loss,16.0,0.23235207093938248,0.5497593046654092,8,48,1513,PRUNED
613,1.2064811242585958,2026-02-26 11:34:50.621289,2026-02-26 11:34:57.609062,0 days 00:00:06.987773,,log_loss,16.0,0.25993013972452883,0.6150277706935292,8,50,1488,PRUNED
614,1.2560829229544295,2026-02-26 11:34:57.642753,2026-02-26 11:35:03.549065,0 days 00:00:05.906312,,log_loss,16.0,0.5802508507974632,0.5295801238963105,7,52,1437,PRUNED
615,1.0522713443702252,2026-02-26 11:35:03.588532,2026-02-26 11:35:09.843125,0 days 00:00:06.254593,,log_loss,16.0,0.19960632323865213,0.5994270292025468,9,58,1578,PRUNED
616,1.0499641680405614,2026-02-26 11:35:09.881285,2026-02-26 11:35:15.122787,0 days 00:00:05.241502,,log_loss,26.0,0.24684168744916937,0.54021080958621,8,56,1349,PRUNED
617,1.067530757558577,2026-02-26 11:35:15.153491,2026-02-26 11:35:20.848353,0 days 00:00:05.694862,,gini,12.0,0.22540789696527763,0.5121332008297302,8,55,1535,PRUNED
618,1.0916832026339285,2026-02-26 11:35:20.879958,2026-02-26 11:35:25.984744,0 days 00:00:05.104786,balanced,gini,12.0,0.26751552332649947,0.5727731827394922,9,52,1409,PRUNED
619,1.22031682786359,2026-02-26 11:35:26.017099,2026-02-26 11:35:29.639111,0 days 00:00:03.622012,,log_loss,20.0,0.40840758772607866,0.5881739237127265,8,54,938,PRUNED
620,1.2066765230541023,2026-02-26 11:35:29.673756,2026-02-26 11:35:35.776609,0 days 00:00:06.102853,,gini,16.0,0.2836549499321551,0.5572686010620941,9,51,1704,PRUNED
621,1.0679723481258991,2026-02-26 11:35:35.808651,2026-02-26 11:35:41.083316,0 days 00:00:05.274665,,gini,26.0,0.2136765030285127,0.5233609790889174,8,60,1467,PRUNED
622,1.231945175166802,2026-02-26 11:35:41.114299,2026-02-26 11:35:48.636800,0 days 00:00:07.522501,,log_loss,12.0,0.29959530740677487,0.8562920114840844,8,48,1977,PRUNED
623,1.20149703298238,2026-02-26 11:35:48.668296,2026-02-26 11:35:50.865150,0 days 00:00:02.196854,,gini,12.0,0.24577184087751947,0.5370628385826429,8,55,564,PRUNED
624,1.1999931052057404,2026-02-26 11:35:50.899044,2026-02-26 11:35:55.633822,0 days 00:00:04.734778,,gini,16.0,0.26912504057326575,0.5496843089834009,10,53,1318,PRUNED
625,1.0661653453260895,2026-02-26 11:35:55.673290,2026-02-26 11:36:01.132461,0 days 00:00:05.459171,,gini,26.0,0.22746916647393636,0.5107889560912658,9,57,1494,PRUNED
626,1.226498133530812,2026-02-26 11:36:01.491310,2026-02-26 11:36:04.783161,0 days 00:00:03.291851,,log_loss,12.0,0.2553899953108957,0.9388095789596012,8,50,863,PRUNED
627,1.2050649910337217,2026-02-26 11:36:04.813652,2026-02-26 11:36:09.865911,0 days 00:00:05.052259,,gini,32.0,0.2830114549892175,0.5288536632557314,8,53,1384,PRUNED
628,1.2433221907355247,2026-02-26 11:36:09.900088,2026-02-26 11:36:16.016020,0 days 00:00:06.115932,,gini,12.0,0.3126059116176532,0.5427241966499022,7,16,1604,PRUNED
629,1.0504119056635075,2026-02-26 11:36:16.048284,2026-02-26 11:36:20.750354,0 days 00:00:04.702070,,log_loss,16.0,0.24352994191386024,0.5212642002901119,8,56,1274,PRUNED
630,1.2091291340860868,2026-02-26 11:36:20.789319,2026-02-26 11:36:26.400821,0 days 00:00:05.611502,,gini,26.0,0.2645844421965292,0.5664486836316834,8,46,1559,PRUNED
631,1.06663329464663,2026-02-26 11:36:26.438297,2026-02-26 11:36:31.659990,0 days 00:00:05.221693,,gini,12.0,0.21194082277233894,0.5562641549371229,9,52,1455,PRUNED
632,1.2012422716237936,2026-02-26 11:36:31.690627,2026-02-26 11:36:37.035091,0 days 00:00:05.344464,,gini,8.0,0.17956854769526748,0.5193734038160577,8,49,1514,PRUNED
633,1.0479013135178177,2026-02-26 11:36:37.077287,2026-02-26 11:36:38.579128,0 days 00:00:01.501841,,log_loss,16.0,0.23042041276547,0.5308605899805758,8,54,339,COMPLETE
634,1.0663130813174793,2026-02-26 11:36:38.621655,2026-02-26 11:36:40.115564,0 days 00:00:01.493909,,gini,12.0,0.20538842273071112,0.5361093411575707,9,58,360,PRUNED
635,1.0615476193384588,2026-02-26 11:36:40.146140,2026-02-26 11:36:42.107177,0 days 00:00:01.961037,,gini,26.0,0.2292420756354966,0.5488408035881706,8,55,458,PRUNED
636,1.2207548277373172,2026-02-26 11:36:42.147502,2026-02-26 11:36:44.069230,0 days 00:00:01.921728,,gini,12.0,0.2187403578435862,0.6214597872240641,8,31,468,PRUNED
637,1.0958007704978963,2026-02-26 11:36:44.105593,2026-02-26 11:36:47.092582,0 days 00:00:02.986989,balanced,log_loss,26.0,0.23732308214199527,0.5405613752932553,9,56,738,PRUNED
638,1.2028508571527832,2026-02-26 11:36:47.123158,2026-02-26 11:36:48.497452,0 days 00:00:01.374294,,gini,16.0,0.20020363219812456,0.5765586893588707,10,54,317,PRUNED
639,1.0659758209302204,2026-02-26 11:36:48.533216,2026-02-26 11:36:52.139976,0 days 00:00:03.606760,,gini,,0.1874516447654828,0.5308464314467937,8,59,984,PRUNED
640,1.0619185528275632,2026-02-26 11:36:52.169830,2026-02-26 11:36:54.229820,0 days 00:00:02.059990,,log_loss,12.0,0.23160775862098132,0.5585504030304579,8,57,498,PRUNED
641,1.2004036898782189,2026-02-26 11:36:54.260520,2026-02-26 11:36:55.849019,0 days 00:00:01.588499,,gini,,0.2205949968003808,0.6074564971389895,9,54,390,PRUNED
642,1.2060900269261765,2026-02-26 11:36:55.879414,2026-02-26 11:36:57.449013,0 days 00:00:01.569599,,gini,12.0,0.2522560185449033,0.5450639088076142,7,51,391,PRUNED
643,1.230565185644487,2026-02-26 11:36:57.479725,2026-02-26 11:36:58.866848,0 days 00:00:01.387123,,log_loss,32.0,0.08281692381898112,0.5858455220962681,8,54,345,PRUNED
644,1.2017034853893116,2026-02-26 11:36:58.906449,2026-02-26 11:37:03.378162,0 days 00:00:04.471713,,gini,26.0,0.24158574254801032,0.5304923395413025,8,50,1227,PRUNED
645,1.0687580821394191,2026-02-26 11:37:03.418795,2026-02-26 11:37:04.834772,0 days 00:00:01.415977,,gini,20.0,0.21885716935972566,0.5531625127866819,9,55,339,PRUNED
646,1.2155525126623463,2026-02-26 11:37:04.863196,2026-02-26 11:37:06.537986,0 days 00:00:01.674790,,gini,,0.24779911971094792,0.5991016708182247,8,56,417,PRUNED
647,1.20524257191135,2026-02-26 11:37:06.574306,2026-02-26 11:37:08.951818,0 days 00:00:02.377512,,log_loss,16.0,0.3686047464636156,0.5686344536821862,10,51,605,PRUNED
