number,value,datetime_start,datetime_complete,duration,params_class_weight,params_criterion,params_max_depth,params_max_features,params_max_samples,params_min_samples_leaf,params_min_samples_split,params_n_estimators,state
0,1.2343769847877653,2026-02-26 10:30:07.489581,2026-02-26 10:30:11.512536,0 days 00:00:04.022955,balanced,gini,,0.06543837072185184,0.9849549260809971,7,43,1124,COMPLETE
1,1.1483072960068204,2026-02-26 10:30:11.563089,2026-02-26 10:30:17.507249,0 days 00:00:05.944160,balanced,entropy,12.0,0.43567582881020867,0.7962072844310213,8,13,1454,COMPLETE
2,1.1386849071733185,2026-02-26 10:30:17.554478,2026-02-26 10:30:26.721126,0 days 00:00:09.166648,balanced,log_loss,,0.24408498620001268,0.831261142176991,1,55,2425,COMPLETE
3,1.0907609081590346,2026-02-26 10:30:26.785702,2026-02-26 10:30:34.401389,0 days 00:00:07.615687,balanced,log_loss,,0.25351177383042195,0.9143687545759647,4,24,2006,COMPLETE
4,1.134644245178531,2026-02-26 10:30:34.448462,2026-02-26 10:30:36.434111,0 days 00:00:01.985649,balanced,gini,,0.3188492964082044,0.5579345297625649,8,6,464,COMPLETE
5,1.1609298302994393,2026-02-26 10:30:36.461927,2026-02-26 10:30:40.386475,0 days 00:00:03.924548,balanced,gini,12.0,0.42034669727329305,0.7613664146909971,6,47,1015,COMPLETE
6,1.2624495184811606,2026-02-26 10:30:40.414911,2026-02-26 10:30:44.821155,0 days 00:00:04.406244,balanced,entropy,8.0,0.7472732392569299,0.9040601897822085,3,11,991,COMPLETE
7,1.1029618189275134,2026-02-26 10:30:44.849717,2026-02-26 10:30:50.493047,0 days 00:00:05.643330,,log_loss,8.0,0.4330604769331743,0.7087055015743895,9,2,1487,COMPLETE
8,1.2079731155485909,2026-02-26 10:30:50.519486,2026-02-26 10:30:57.025676,0 days 00:00:06.506190,,log_loss,12.0,0.5071732504849227,0.7513395116144308,3,4,1441,COMPLETE
9,1.1523646501095919,2026-02-26 10:30:57.054711,2026-02-26 10:31:02.220101,0 days 00:00:05.165390,balanced,gini,,0.4518310130560688,0.5451448850272042,7,39,1377,COMPLETE
10,1.115663644089906,2026-02-26 10:31:02.247607,2026-02-26 10:31:10.429249,0 days 00:00:08.181642,,log_loss,26.0,0.0660899200881811,0.9538323976412588,4,27,2355,COMPLETE
11,1.111758818363171,2026-02-26 10:31:10.476257,2026-02-26 10:31:17.968111,0 days 00:00:07.491854,,log_loss,8.0,0.6487037795297326,0.6484844790233055,10,23,1938,COMPLETE
12,1.065384457452471,2026-02-26 10:31:17.995006,2026-02-26 10:31:25.472108,0 days 00:00:07.477102,,log_loss,16.0,0.2639258111759889,0.6608835888001323,10,19,1978,COMPLETE
13,1.0671539022675445,2026-02-26 10:31:25.530547,2026-02-26 10:31:32.931203,0 days 00:00:07.400656,,log_loss,16.0,0.2148524508096742,0.6624323211135577,5,22,1999,COMPLETE
14,1.063423291101054,2026-02-26 10:31:32.958516,2026-02-26 10:31:40.079379,0 days 00:00:07.120863,,log_loss,16.0,0.16814013095154207,0.6426066899743498,5,34,1973,COMPLETE
15,1.0625872971456949,2026-02-26 10:31:40.126097,2026-02-26 10:31:46.465794,0 days 00:00:06.339697,,log_loss,16.0,0.15368449995979666,0.612855231824376,10,34,1781,COMPLETE
16,1.0535541293878448,2026-02-26 10:31:46.510352,2026-02-26 10:31:53.021027,0 days 00:00:06.510675,,entropy,16.0,0.1561881812392633,0.595742693179045,6,34,1758,COMPLETE
17,1.0579892428149769,2026-02-26 10:31:53.068941,2026-02-26 10:31:59.191671,0 days 00:00:06.122730,,entropy,20.0,0.1304029682126843,0.5136095131955983,1,33,1685,COMPLETE
18,1.2431110684801443,2026-02-26 10:31:59.222205,2026-02-26 10:32:05.264524,0 days 00:00:06.042319,,entropy,20.0,0.33513704478958306,0.5320838087997769,1,50,1640,PRUNED
19,1.059878467670114,2026-02-26 10:32:05.288154,2026-02-26 10:32:07.944457,0 days 00:00:02.656303,,entropy,32.0,0.12575318799471846,0.5852306392660565,2,38,678,COMPLETE
20,1.2842616892149572,2026-02-26 10:32:07.973642,2026-02-26 10:32:16.231783,0 days 00:00:08.258141,,entropy,20.0,0.5570824815852988,0.5270619558742973,6,30,2235,PRUNED
21,1.06521695973939,2026-02-26 10:32:16.255596,2026-02-26 10:32:18.098018,0 days 00:00:01.842422,,entropy,32.0,0.14216557500038118,0.5901418810865834,2,39,386,COMPLETE
22,1.0675002499861068,2026-02-26 10:32:18.123946,2026-02-26 10:32:20.601205,0 days 00:00:02.477259,,entropy,32.0,0.10090883020974163,0.5035458274036096,2,39,633,COMPLETE
23,1.2730816523145065,2026-02-26 10:32:20.628179,2026-02-26 10:32:23.431748,0 days 00:00:02.803569,,entropy,32.0,0.3363330094693805,0.5812114652218368,2,32,721,PRUNED
24,1.0555706479474194,2026-02-26 10:32:23.456129,2026-02-26 10:32:27.982728,0 days 00:00:04.526599,,entropy,20.0,0.17312464294621133,0.7046041324067966,1,60,1212,COMPLETE
25,1.0880857306870237,2026-02-26 10:32:28.011124,2026-02-26 10:32:32.534499,0 days 00:00:04.523375,,entropy,20.0,0.20693716275370272,0.6890915557841027,1,60,1225,PRUNED
26,1.2373527211758721,2026-02-26 10:32:32.560083,2026-02-26 10:32:38.779037,0 days 00:00:06.218954,,entropy,20.0,0.30817224947721145,0.6980810591545082,4,51,1703,PRUNED
27,1.281414580812145,2026-02-26 10:32:38.807990,2026-02-26 10:32:43.182604,0 days 00:00:04.374614,,entropy,20.0,0.0504361673626281,0.6144736076760968,3,46,1280,PRUNED
28,1.050255845475991,2026-02-26 10:32:43.205969,2026-02-26 10:32:49.101050,0 days 00:00:05.895081,,entropy,26.0,0.1903141506330311,0.7329890179777707,7,59,1581,COMPLETE
29,1.0634528833911117,2026-02-26 10:32:49.150209,2026-02-26 10:32:53.226038,0 days 00:00:04.075829,,entropy,26.0,0.20831693982741722,0.7991836870181559,7,60,1087,COMPLETE
30,1.2563923328142415,2026-02-26 10:32:53.257880,2026-02-26 10:32:56.641914,0 days 00:00:03.384034,,gini,26.0,0.3608233943404755,0.8488776931539118,7,56,898,PRUNED
31,1.0899735291739758,2026-02-26 10:32:56.667977,2026-02-26 10:33:02.294557,0 days 00:00:05.626580,,entropy,26.0,0.10964417544213695,0.7291947099434162,8,56,1614,PRUNED
32,1.0515229918788687,2026-02-26 10:33:02.317970,2026-02-26 10:33:07.913779,0 days 00:00:05.595809,,entropy,20.0,0.18025143236568958,0.7809930223496393,6,51,1536,COMPLETE
33,1.0500887135555714,2026-02-26 10:33:07.943653,2026-02-26 10:33:14.527519,0 days 00:00:06.583866,,entropy,20.0,0.18863828758161785,0.7965591903125341,6,52,1815,COMPLETE
34,1.2296431088506012,2026-02-26 10:33:14.572386,2026-02-26 10:33:21.194692,0 days 00:00:06.622306,,entropy,26.0,0.2778360795178326,0.7883943619433049,6,52,1822,PRUNED
35,1.0843505300571108,2026-02-26 10:33:21.219867,2026-02-26 10:33:29.125827,0 days 00:00:07.905960,balanced,entropy,16.0,0.21984513906758996,0.8567069358345405,7,44,2144,PRUNED
36,1.0991705715813538,2026-02-26 10:33:29.150653,2026-02-26 10:33:34.532565,0 days 00:00:05.381912,,entropy,20.0,0.08810275312508102,0.7959731823772965,5,53,1537,PRUNED
37,1.0900236643257593,2026-02-26 10:33:34.556095,2026-02-26 10:33:41.238082,0 days 00:00:06.681987,balanced,gini,26.0,0.281375170269199,0.8965680298374457,8,48,1841,PRUNED
38,1.2658604480325375,2026-02-26 10:33:41.262986,2026-02-26 10:33:46.318402,0 days 00:00:05.055416,,entropy,12.0,0.39470217855193535,0.8321548763488196,6,42,1344,PRUNED
39,1.105034410759996,2026-02-26 10:33:46.341549,2026-02-26 10:33:54.094513,0 days 00:00:07.752964,balanced,entropy,,0.17470751902947754,0.770695085821569,8,55,2136,PRUNED
40,1.2570275270391364,2026-02-26 10:33:54.118184,2026-02-26 10:33:59.795335,0 days 00:00:05.677151,,entropy,16.0,0.2448239486323519,0.7288261843565587,6,17,1530,PRUNED
41,1.050903375833256,2026-02-26 10:33:59.821549,2026-02-26 10:34:04.173006,0 days 00:00:04.351457,,entropy,20.0,0.1741008579534453,0.7348667693459485,5,59,1163,COMPLETE
42,1.0619495592951989,2026-02-26 10:34:04.200860,2026-02-26 10:34:09.407981,0 days 00:00:05.207121,,entropy,20.0,0.18769325006208762,0.8118464323828305,5,58,1417,COMPLETE
43,1.2243452113619089,2026-02-26 10:34:09.436276,2026-02-26 10:34:15.165412,0 days 00:00:05.729136,,entropy,20.0,0.2358313231091397,0.7398589412613622,4,49,1571,PRUNED
44,1.239299878260566,2026-02-26 10:34:15.190705,2026-02-26 10:34:21.157467,0 days 00:00:05.966762,,gini,8.0,0.07779607204308474,0.8740890701774304,6,57,1746,PRUNED
45,1.0854178243481527,2026-02-26 10:34:21.181408,2026-02-26 10:34:28.159595,0 days 00:00:06.978187,balanced,entropy,12.0,0.29829912282489035,0.7618754396702722,7,53,1884,PRUNED
46,1.2189184566705045,2026-02-26 10:34:28.185110,2026-02-26 10:34:32.501722,0 days 00:00:04.316612,,entropy,20.0,0.1387524393233766,0.9862845659408341,5,45,1126,PRUNED
47,1.2448163292150987,2026-02-26 10:34:32.523564,2026-02-26 10:34:36.100161,0 days 00:00:03.576597,,entropy,,0.24578809068225044,0.9275133114228716,9,11,914,PRUNED
48,1.051008596342209,2026-02-26 10:34:36.125822,2026-02-26 10:34:41.361309,0 days 00:00:05.235487,,gini,16.0,0.1888677405697616,0.7753955958288969,7,54,1431,COMPLETE
49,1.0514122775317662,2026-02-26 10:34:41.392572,2026-02-26 10:34:46.292111,0 days 00:00:04.899539,,gini,20.0,0.19925730507314654,0.776180087902285,7,53,1334,COMPLETE
50,1.3255782323253384,2026-02-26 10:34:46.319197,2026-02-26 10:34:51.625299,0 days 00:00:05.306102,balanced,gini,26.0,0.7535951199124846,0.8082946687149513,8,54,1329,PRUNED
51,1.0500234865958897,2026-02-26 10:34:51.650067,2026-02-26 10:34:56.983613,0 days 00:00:05.333546,,gini,20.0,0.1954914716682377,0.7774241867184188,7,58,1463,COMPLETE
52,1.0502461934073335,2026-02-26 10:34:57.031043,2026-02-26 10:35:02.445710,0 days 00:00:05.414667,,gini,20.0,0.20018021335085276,0.7481931610627132,9,58,1443,COMPLETE
53,1.2655463792703858,2026-02-26 10:35:02.473175,2026-02-26 10:35:07.864497,0 days 00:00:05.391322,,gini,20.0,0.48130536550719366,0.7472027453677696,8,58,1454,PRUNED
54,1.306387039803872,2026-02-26 10:35:07.888105,2026-02-26 10:35:12.453013,0 days 00:00:04.564908,,gini,8.0,0.7036710762947163,0.7142315472517111,9,58,1165,PRUNED
55,1.214660601603174,2026-02-26 10:35:12.476826,2026-02-26 10:35:17.680432,0 days 00:00:05.203606,,gini,20.0,0.26102611893436467,0.7555566034876952,9,56,1437,PRUNED
56,1.0841631866974302,2026-02-26 10:35:17.704944,2026-02-26 10:35:23.462223,0 days 00:00:05.757279,,gini,16.0,0.11329467884520725,0.8152700155504209,7,60,1636,PRUNED
57,1.0488064381109885,2026-02-26 10:35:23.490918,2026-02-26 10:35:27.377258,0 days 00:00:03.886340,,gini,20.0,0.2274653925413661,0.6833480215815381,9,48,1035,COMPLETE
58,1.2353606599745166,2026-02-26 10:35:27.423852,2026-02-26 10:35:31.388921,0 days 00:00:03.965069,,gini,20.0,0.3696914550726953,0.6824924078115979,9,49,1015,PRUNED
59,1.05092509867301,2026-02-26 10:35:31.413881,2026-02-26 10:35:36.060725,0 days 00:00:04.646844,,gini,20.0,0.23249597022977525,0.6711401740697674,10,42,1250,COMPLETE
60,1.0772957504928626,2026-02-26 10:35:36.088665,2026-02-26 10:35:39.359865,0 days 00:00:03.271200,,gini,20.0,0.14968051768818086,0.6470647779141402,9,58,895,PRUNED
61,1.0505969669672903,2026-02-26 10:35:39.384382,2026-02-26 10:35:43.986462,0 days 00:00:04.602080,,gini,20.0,0.2261568714086317,0.6775948603097409,10,43,1249,COMPLETE
62,1.2789391644618737,2026-02-26 10:35:44.014704,2026-02-26 10:35:47.102156,0 days 00:00:03.087452,,gini,20.0,0.5486547900093033,0.7162537044992203,10,47,799,PRUNED
63,1.0533875835457864,2026-02-26 10:35:47.126611,2026-02-26 10:35:51.131969,0 days 00:00:04.005358,,gini,20.0,0.28788514968688683,0.6296332888733325,10,51,1076,COMPLETE
64,1.234512313132596,2026-02-26 10:35:51.159984,2026-02-26 10:35:55.501461,0 days 00:00:04.341477,,gini,20.0,0.32612544212577055,0.6769507908559853,9,36,1170,PRUNED
65,1.38819165676207,2026-02-26 10:35:55.527254,2026-02-26 10:36:01.216813,0 days 00:00:05.689559,,log_loss,20.0,0.7984274682516339,0.7367174940197317,10,29,1293,PRUNED
66,1.0753450689931936,2026-02-26 10:36:01.260485,2026-02-26 10:36:04.805799,0 days 00:00:03.545314,,gini,20.0,0.15674435642784268,0.7214119548089234,9,55,962,PRUNED
67,1.0751763214703702,2026-02-26 10:36:04.829751,2026-02-26 10:36:10.833350,0 days 00:00:06.003599,,gini,12.0,0.22525551193379398,0.7018133234456859,5,59,1680,PRUNED
68,1.224014773499729,2026-02-26 10:36:10.865246,2026-02-26 10:36:14.764348,0 days 00:00:03.899102,,gini,32.0,0.2632152561446417,0.6620957793540494,4,56,1073,PRUNED
69,1.0817968214137248,2026-02-26 10:36:14.788965,2026-02-26 10:36:23.387019,0 days 00:00:08.598054,,log_loss,20.0,0.11587900837545007,0.7586631668397856,8,50,2494,PRUNED
70,1.0884134350148882,2026-02-26 10:36:23.423271,2026-02-26 10:36:28.588663,0 days 00:00:05.165392,balanced,gini,26.0,0.203257759225756,0.8271492710828735,8,41,1375,PRUNED
71,1.0619920992007228,2026-02-26 10:36:28.613891,2026-02-26 10:36:33.059716,0 days 00:00:04.445825,,gini,20.0,0.22840113876914503,0.6765725916488111,10,44,1210,COMPLETE
72,1.0581611758060683,2026-02-26 10:36:33.088696,2026-02-26 10:36:37.598608,0 days 00:00:04.509912,,gini,20.0,0.16371353057837842,0.6363865356566889,10,41,1243,COMPLETE
73,1.0511866898479547,2026-02-26 10:36:37.626662,2026-02-26 10:36:42.232462,0 days 00:00:04.605800,,gini,20.0,0.21586015767345623,0.688169804040567,10,47,1253,COMPLETE
74,1.049018047208906,2026-02-26 10:36:42.259257,2026-02-26 10:36:48.053135,0 days 00:00:05.793878,,gini,,0.2516563552957222,0.6695749347753697,10,52,1592,COMPLETE
75,1.0775019202465481,2026-02-26 10:36:48.079760,2026-02-26 10:36:53.351237,0 days 00:00:05.271477,,gini,,0.13178910705632282,0.6991756692603711,9,54,1501,PRUNED
76,1.048291050753732,2026-02-26 10:36:53.375451,2026-02-26 10:36:59.240500,0 days 00:00:05.865049,,gini,,0.18584239341375533,0.6157977063054421,6,51,1583,COMPLETE
77,1.2189199030994065,2026-02-26 10:36:59.292088,2026-02-26 10:37:05.486459,0 days 00:00:06.194371,,gini,,0.2699420376493458,0.615693107077588,6,52,1725,PRUNED
78,1.2199086743760232,2026-02-26 10:37:05.512622,2026-02-26 10:37:11.272387,0 days 00:00:05.759765,,gini,,0.30841121282375705,0.553025786689593,6,48,1602,PRUNED
79,1.0513935139011155,2026-02-26 10:37:11.297470,2026-02-26 10:37:18.099875,0 days 00:00:06.802405,,gini,,0.19172309730472986,0.6574982663949636,7,50,1904,COMPLETE
80,1.0504722678942031,2026-02-26 10:37:18.126289,2026-02-26 10:37:24.728262,0 days 00:00:06.601973,,gini,,0.24386662108259302,0.570192509562271,10,46,1783,COMPLETE
81,1.0490615121295905,2026-02-26 10:37:24.757978,2026-02-26 10:37:32.028498,0 days 00:00:07.270520,,gini,,0.24432781189391786,0.5991122581620818,10,52,2043,COMPLETE
82,1.0497726394725118,2026-02-26 10:37:32.058753,2026-02-26 10:37:38.478325,0 days 00:00:06.419572,,gini,,0.254076118453116,0.6012238187163333,10,52,1777,COMPLETE
83,1.2158459542983644,2026-02-26 10:37:38.513696,2026-02-26 10:37:45.844595,0 days 00:00:07.330899,,gini,,0.34320674513270055,0.6018681449340396,9,56,2048,PRUNED
84,1.0501763626305507,2026-02-26 10:37:45.877118,2026-02-26 10:37:53.372505,0 days 00:00:07.495387,,gini,,0.2531138961613444,0.6207781835716327,10,51,2042,COMPLETE
85,1.2144059002008973,2026-02-26 10:37:53.402661,2026-02-26 10:38:00.759005,0 days 00:00:07.356344,,gini,,0.29284948168954067,0.6016134432033483,10,52,2063,PRUNED
86,1.0489316763234937,2026-02-26 10:38:00.783364,2026-02-26 10:38:08.909338,0 days 00:00:08.125974,,gini,,0.24992324996715082,0.5724957325463245,10,49,2279,COMPLETE
87,1.091477474345671,2026-02-26 10:38:08.948091,2026-02-26 10:38:17.195357,0 days 00:00:08.247266,balanced,gini,,0.25392018914752695,0.564350014667753,10,49,2350,PRUNED
88,1.2195750554115878,2026-02-26 10:38:17.219488,2026-02-26 10:38:25.651842,0 days 00:00:08.432354,,gini,,0.3160747984716006,0.6251163284631347,10,46,2316,PRUNED
89,1.0506646855993869,2026-02-26 10:38:25.678591,2026-02-26 10:38:33.509430,0 days 00:00:07.830839,,gini,,0.2760593609106116,0.5769186447126926,10,51,2202,COMPLETE
90,1.0499261695985826,2026-02-26 10:38:33.537316,2026-02-26 10:38:40.590103,0 days 00:00:07.052787,,log_loss,,0.2517632297118875,0.5397124102903232,10,53,1970,COMPLETE
91,1.0505809617276152,2026-02-26 10:38:40.618749,2026-02-26 10:38:48.020006,0 days 00:00:07.401257,,log_loss,,0.26189190924318057,0.5399107881861896,10,53,1971,COMPLETE
92,1.0519004296736063,2026-02-26 10:38:48.114490,2026-02-26 10:38:54.718238,0 days 00:00:06.603748,,log_loss,,0.21638157172142203,0.5142218988256955,9,51,1852,COMPLETE
93,1.0501556799846266,2026-02-26 10:38:54.747035,2026-02-26 10:39:02.344789,0 days 00:00:07.597754,,log_loss,,0.24629386025193759,0.5584802637855294,10,49,2095,COMPLETE
94,1.0511080622040474,2026-02-26 10:39:02.371146,2026-02-26 10:39:10.096668,0 days 00:00:07.725522,,log_loss,,0.2977014560385771,0.5937971721612922,10,48,2139,COMPLETE
95,1.0510220339009613,2026-02-26 10:39:10.125426,2026-02-26 10:39:18.546429,0 days 00:00:08.421003,,log_loss,,0.35016677678676317,0.5552156548547157,10,54,2287,COMPLETE
96,1.247182460780858,2026-02-26 10:39:18.574151,2026-02-26 10:39:26.636483,0 days 00:00:08.062332,,log_loss,,0.37869013266852214,0.5341906940184922,9,7,2206,PRUNED
97,1.0554707764685218,2026-02-26 10:39:26.661319,2026-02-26 10:39:33.549205,0 days 00:00:06.887886,,log_loss,,0.185031580341028,0.5760756132882461,10,49,1937,PRUNED
98,1.0500093825644718,2026-02-26 10:39:33.574041,2026-02-26 10:39:40.059949,0 days 00:00:06.485908,,log_loss,,0.2082120300358748,0.6055154071027913,9,55,1810,COMPLETE
99,1.0731123042017952,2026-02-26 10:39:40.087568,2026-02-26 10:39:46.091117,0 days 00:00:06.003549,,log_loss,8.0,0.16522020541912782,0.607522702857617,9,55,1670,PRUNED
100,1.122777743716417,2026-02-26 10:39:46.121764,2026-02-26 10:39:52.378066,0 days 00:00:06.256302,balanced,log_loss,,0.14551699323162157,0.6348061044812034,9,52,1800,PRUNED
101,1.05004554549383,2026-02-26 10:39:52.400153,2026-02-26 10:39:59.852514,0 days 00:00:07.452361,,log_loss,,0.24182265351176507,0.5919818076884793,10,53,2094,COMPLETE
102,1.0617253242753957,2026-02-26 10:39:59.880863,2026-02-26 10:40:02.085679,0 days 00:00:02.204816,,log_loss,,0.20793171386392284,0.5852976084495312,10,53,549,PRUNED
103,1.0501964380252766,2026-02-26 10:40:02.109599,2026-02-26 10:40:08.789501,0 days 00:00:06.679902,,log_loss,,0.23806966622976677,0.5237427429580097,9,57,1870,COMPLETE
104,1.2320257508175627,2026-02-26 10:40:08.817334,2026-02-26 10:40:16.153626,0 days 00:00:07.336292,,log_loss,,0.41542773428654517,0.5929450460925921,6,55,1973,PRUNED
105,1.0706131962190366,2026-02-26 10:40:16.180328,2026-02-26 10:40:22.990842,0 days 00:00:06.810514,,log_loss,32.0,0.17642616791518514,0.6508028414443208,10,26,1921,PRUNED
106,1.049686146729091,2026-02-26 10:40:23.014460,2026-02-26 10:40:30.249186,0 days 00:00:07.234726,,gini,,0.28197111264729646,0.6052466112191293,9,57,2017,COMPLETE
107,1.0484213856506146,2026-02-26 10:40:30.275121,2026-02-26 10:40:38.280541,0 days 00:00:08.005420,,gini,,0.27604508102477304,0.5468795466386068,9,54,2250,COMPLETE
108,1.0704162883910433,2026-02-26 10:40:38.306842,2026-02-26 10:40:46.942472,0 days 00:00:08.635630,,gini,,0.3281106721242106,0.5432016888276934,9,57,2397,PRUNED
109,1.070233564741454,2026-02-26 10:40:46.966477,2026-02-26 10:40:55.021966,0 days 00:00:08.055489,,gini,,0.28247487105218466,0.5699102165268559,8,54,2280,PRUNED
110,1.2118250296494366,2026-02-26 10:40:55.046776,2026-02-26 10:41:02.115318,0 days 00:00:07.068542,,gini,12.0,0.304390658456451,0.6090432888235294,8,59,1996,PRUNED
111,1.0520553259953187,2026-02-26 10:41:02.139552,2026-02-26 10:41:09.769703,0 days 00:00:07.630151,,gini,,0.22556523340751689,0.5509480800691753,9,57,2104,PRUNED
112,1.0500354654442348,2026-02-26 10:41:09.794208,2026-02-26 10:41:17.505626,0 days 00:00:07.711418,,gini,,0.27363519890849347,0.5007378634018649,9,55,2182,COMPLETE
113,1.0493341024121794,2026-02-26 10:41:17.532468,2026-02-26 10:41:25.293267,0 days 00:00:07.760799,,gini,,0.27126485704832815,0.513863759054018,9,55,2195,COMPLETE
114,1.0518548430042538,2026-02-26 10:41:25.321272,2026-02-26 10:41:31.724110,0 days 00:00:06.402838,,gini,,0.2062180580822946,0.5291959912271332,9,50,1752,PRUNED
115,1.050282254602846,2026-02-26 10:41:31.748773,2026-02-26 10:41:37.158686,0 days 00:00:05.409913,,gini,,0.25802629261387405,0.5142485435197826,8,56,1496,COMPLETE
116,1.050020260376271,2026-02-26 10:41:37.186361,2026-02-26 10:41:45.226906,0 days 00:00:08.040545,,gini,,0.27706991892038013,0.5804624136934055,9,60,2265,COMPLETE
117,1.2099360991256185,2026-02-26 10:41:45.253432,2026-02-26 10:41:53.166523,0 days 00:00:07.913091,,gini,,0.28289741851384564,0.5801103513915944,9,54,2241,PRUNED
118,1.2368046817968497,2026-02-26 10:41:53.197728,2026-02-26 10:42:01.870531,0 days 00:00:08.672803,,gini,,0.3187244190243397,0.565087558259296,3,52,2392,PRUNED
119,1.067833789109012,2026-02-26 10:42:01.901937,2026-02-26 10:42:09.960059,0 days 00:00:08.058122,,gini,,0.2677276851477184,0.6181522341991517,9,60,2278,PRUNED
120,1.0511967640797655,2026-02-26 10:42:09.985498,2026-02-26 10:42:17.660341,0 days 00:00:07.674843,,gini,,0.23276117387875195,0.6397176906757016,9,57,2151,PRUNED
121,1.2092269877251498,2026-02-26 10:42:17.684838,2026-02-26 10:42:26.145706,0 days 00:00:08.460868,,gini,,0.2922804477566396,0.6014286227946263,8,59,2345,PRUNED
122,1.0708148814427156,2026-02-26 10:42:26.170288,2026-02-26 10:42:31.770608,0 days 00:00:05.600320,,gini,8.0,0.21466218862076208,0.523259004942763,8,56,1590,PRUNED
123,1.049334459767841,2026-02-26 10:42:31.795910,2026-02-26 10:42:39.684065,0 days 00:00:07.888155,,gini,,0.2516905260695665,0.5418403306066997,9,58,2236,COMPLETE
124,1.2170744471763273,2026-02-26 10:42:39.711336,2026-02-26 10:42:48.454903,0 days 00:00:08.743567,,gini,,0.25124727635954874,0.5505874874102015,9,19,2455,PRUNED
125,1.0508672865099586,2026-02-26 10:42:48.489092,2026-02-26 10:42:56.648916,0 days 00:00:08.159824,,gini,,0.26889987898308504,0.5377921314435598,9,53,2252,COMPLETE
126,1.224314223201737,2026-02-26 10:42:56.677282,2026-02-26 10:43:04.556544,0 days 00:00:07.879262,balanced,gini,,0.6210306431429766,0.5656275184674863,10,55,2182,PRUNED
127,1.0692838206600257,2026-02-26 10:43:04.581637,2026-02-26 10:43:11.916670,0 days 00:00:07.335033,,gini,,0.3025993743756281,0.5880499996595648,9,60,2074,PRUNED
