number,value,datetime_start,datetime_complete,duration,params_class_weight,params_criterion,params_max_depth,params_max_features,params_max_samples,params_min_samples_leaf,params_min_samples_split,params_n_estimators,state
128,1.0508453863659377,2026-02-26 10:43:11.943226,2026-02-26 10:43:19.378221,0 days 00:00:07.434995,,gini,,0.23435888522508733,0.6258230244174057,10,50,2026,COMPLETE
129,1.0486745103725652,2026-02-26 10:43:19.407836,2026-02-26 10:43:27.384492,0 days 00:00:07.976656,,gini,,0.28271535624018496,0.516175288189868,9,47,2223,COMPLETE
130,1.059827135122527,2026-02-26 10:43:27.415276,2026-02-26 10:43:28.902061,0 days 00:00:01.486785,,gini,32.0,0.2534805639659467,0.5464857031012729,10,47,321,PRUNED
131,1.0507227790529996,2026-02-26 10:43:28.937989,2026-02-26 10:43:36.574768,0 days 00:00:07.636779,,gini,,0.2842470727596448,0.5129713459007416,9,51,2133,COMPLETE
132,1.0504454670617025,2026-02-26 10:43:36.603511,2026-02-26 10:43:44.775159,0 days 00:00:08.171648,,gini,,0.22356236210490932,0.5110592704699235,9,48,2318,COMPLETE
133,1.050057533579876,2026-02-26 10:43:44.823213,2026-02-26 10:43:52.904370,0 days 00:00:08.081157,,gini,,0.31017586242079415,0.523770569741595,9,52,2227,COMPLETE
134,1.2428798667344385,2026-02-26 10:43:52.939154,2026-02-26 10:44:00.825712,0 days 00:00:07.886558,,gini,,0.33330049044809384,0.999101339309026,10,54,2174,PRUNED
135,1.069289134112001,2026-02-26 10:44:00.850057,2026-02-26 10:44:09.437172,0 days 00:00:08.587115,,gini,,0.27478678634543463,0.5815438905741203,9,56,2409,PRUNED
136,1.0505904644004047,2026-02-26 10:44:09.461257,2026-02-26 10:44:16.170821,0 days 00:00:06.709564,,gini,16.0,0.26154514386847305,0.5340574577231469,10,45,1837,COMPLETE
137,1.0506065945297631,2026-02-26 10:44:16.199484,2026-02-26 10:44:23.340125,0 days 00:00:07.140641,,gini,,0.23889676508313296,0.5564020850585596,9,58,2011,COMPLETE
138,1.0491934371486373,2026-02-26 10:44:23.368304,2026-02-26 10:44:31.237483,0 days 00:00:07.869179,,gini,12.0,0.21630915889032482,0.6094239817558875,8,50,2240,COMPLETE
139,1.0686809619842303,2026-02-26 10:44:31.265371,2026-02-26 10:44:38.128701,0 days 00:00:06.863330,,gini,12.0,0.19463441449875926,0.6131361305342853,8,50,1948,PRUNED
140,1.0511573393396123,2026-02-26 10:44:38.154400,2026-02-26 10:44:44.242342,0 days 00:00:06.087942,,gini,,0.2136610977974966,0.608013256219043,10,47,1690,PRUNED
141,1.208594123416214,2026-02-26 10:44:44.268256,2026-02-26 10:44:52.375153,0 days 00:00:08.106897,,gini,12.0,0.24904764392511716,0.5950051399285284,8,49,2270,PRUNED
142,1.2139068284572314,2026-02-26 10:44:52.412568,2026-02-26 10:45:00.527545,0 days 00:00:08.114977,,gini,12.0,0.28970642143959435,0.6288213663391998,9,53,2319,PRUNED
143,1.0672997598193457,2026-02-26 10:45:00.554584,2026-02-26 10:45:08.354044,0 days 00:00:07.799460,,gini,12.0,0.23095310959038504,0.5759821969422142,9,51,2210,PRUNED
144,1.0484169178031528,2026-02-26 10:45:08.379314,2026-02-26 10:45:16.954048,0 days 00:00:08.574734,,gini,,0.2651236579439768,0.6024466746724233,10,52,2362,COMPLETE
145,1.0714522930943484,2026-02-26 10:45:16.983572,2026-02-26 10:45:25.534496,0 days 00:00:08.550924,,gini,,0.1785942369163343,0.6453073314007414,10,52,2460,PRUNED
146,1.0690226605552535,2026-02-26 10:45:25.560354,2026-02-26 10:45:32.964394,0 days 00:00:07.404040,,gini,,0.20311381625458252,0.600696184563234,10,50,2115,PRUNED
147,1.237720969952351,2026-02-26 10:45:32.990363,2026-02-26 10:45:41.620508,0 days 00:00:08.630145,,gini,,0.46400640985640307,0.5633134695406029,10,48,2369,PRUNED
148,1.0994292442403468,2026-02-26 10:45:41.656311,2026-02-26 10:45:48.332004,0 days 00:00:06.675693,balanced,gini,,0.22074930063892942,0.6202636215294154,10,54,1890,PRUNED
149,1.0510642171011573,2026-02-26 10:45:48.355646,2026-02-26 10:45:56.634462,0 days 00:00:08.278816,,gini,26.0,0.26072117311433235,0.5429518663541983,10,53,2353,PRUNED
150,1.0696103473995746,2026-02-26 10:45:56.668276,2026-02-26 10:46:02.505028,0 days 00:00:05.836752,,gini,8.0,0.2418053045882367,0.5189521088844291,10,51,1654,PRUNED
151,1.0499569063878147,2026-02-26 10:46:02.530137,2026-02-26 10:46:10.637635,0 days 00:00:08.107498,,gini,,0.27476481261488395,0.505307840588773,9,55,2246,COMPLETE
152,1.0513289494538405,2026-02-26 10:46:10.670524,2026-02-26 10:46:18.510999,0 days 00:00:07.840475,,gini,,0.2676249779106977,0.5007907835914536,9,55,2224,PRUNED
153,1.2072785168222662,2026-02-26 10:46:18.535046,2026-02-26 10:46:26.749069,0 days 00:00:08.214023,,gini,,0.30069482820102705,0.5291213144790086,9,52,2162,PRUNED
154,1.0504454152955485,2026-02-26 10:46:26.774376,2026-02-26 10:46:33.995260,0 days 00:00:07.220884,,gini,,0.25475256045256983,0.5100810545209922,10,55,2044,COMPLETE
155,1.068372635795512,2026-02-26 10:46:34.024054,2026-02-26 10:46:42.273367,0 days 00:00:08.249313,,gini,,0.2874414439421527,0.5430721809933647,9,57,2309,PRUNED
156,1.221619320515438,2026-02-26 10:46:42.298548,2026-02-26 10:46:50.118607,0 days 00:00:07.820059,,gini,,0.31928820936678914,0.6530812665792258,9,49,2198,PRUNED
157,1.0495588873200787,2026-02-26 10:46:50.144188,2026-02-26 10:46:56.370231,0 days 00:00:06.226043,,gini,12.0,0.24087345218358167,0.5948327870780359,8,53,1735,COMPLETE
158,1.2111577020054638,2026-02-26 10:46:56.407776,2026-02-26 10:47:02.664753,0 days 00:00:06.256977,,gini,12.0,0.24352524682127882,0.5878997027365805,8,45,1721,PRUNED
159,1.0479678427043673,2026-02-26 10:47:02.691336,2026-02-26 10:47:08.332378,0 days 00:00:05.641042,,gini,12.0,0.27577986206742666,0.5718549248449248,8,53,1565,COMPLETE
160,1.0487917174160986,2026-02-26 10:47:08.384732,2026-02-26 10:47:14.026621,0 days 00:00:05.641889,,gini,12.0,0.23793544118402424,0.570601174368697,8,52,1566,COMPLETE
161,1.050458544875137,2026-02-26 10:47:14.055191,2026-02-26 10:47:19.630812,0 days 00:00:05.575621,,gini,12.0,0.22727404386908198,0.5700254393339391,8,53,1543,COMPLETE
162,1.049619000922211,2026-02-26 10:47:19.661317,2026-02-26 10:47:25.440033,0 days 00:00:05.778716,,gini,12.0,0.2571402684318242,0.5580243552755764,7,51,1611,COMPLETE
163,1.2107108122755896,2026-02-26 10:47:25.468401,2026-02-26 10:47:31.227225,0 days 00:00:05.758824,,gini,12.0,0.2672123387473748,0.5970306651754866,7,51,1620,PRUNED
164,1.2081910266430347,2026-02-26 10:47:31.252702,2026-02-26 10:47:36.946871,0 days 00:00:05.694169,,gini,12.0,0.23349428111451392,0.5765800062094687,7,49,1563,PRUNED
165,1.2149004276025819,2026-02-26 10:47:36.973632,2026-02-26 10:47:42.691279,0 days 00:00:05.717647,,gini,12.0,0.29259613201612095,0.5542253013811163,8,50,1609,PRUNED
166,1.0676387334457864,2026-02-26 10:47:42.717455,2026-02-26 10:47:47.988600,0 days 00:00:05.271145,,gini,12.0,0.21840304016297615,0.5874734442902847,8,47,1468,PRUNED
167,1.2091076821592888,2026-02-26 10:47:48.035522,2026-02-26 10:47:53.433247,0 days 00:00:05.397725,,gini,12.0,0.2510972594083499,0.6115331684712466,7,52,1518,PRUNED
168,1.2103753858973516,2026-02-26 10:47:53.478391,2026-02-26 10:47:59.749285,0 days 00:00:06.270894,,gini,12.0,0.27981686863824623,0.560615947511962,8,48,1770,PRUNED
169,1.0676860846149443,2026-02-26 10:47:59.774791,2026-02-26 10:48:04.922671,0 days 00:00:05.147880,,gini,12.0,0.19373510264496155,0.6656046058672549,8,51,1385,PRUNED
170,1.0872965091157059,2026-02-26 10:48:04.948571,2026-02-26 10:48:10.802035,0 days 00:00:05.853464,balanced,gini,12.0,0.2619751642600989,0.5715145915645526,7,50,1651,PRUNED
171,1.0495379224568224,2026-02-26 10:48:10.840736,2026-02-26 10:48:16.896823,0 days 00:00:06.056087,,gini,12.0,0.24759122439094908,0.5364324307020732,8,54,1694,COMPLETE
172,1.0491424174849429,2026-02-26 10:48:16.933140,2026-02-26 10:48:22.858135,0 days 00:00:05.924995,,gini,12.0,0.24092196720020284,0.531656002556149,8,54,1667,COMPLETE
173,1.050149264908658,2026-02-26 10:48:22.887200,2026-02-26 10:48:28.476187,0 days 00:00:05.588987,,gini,12.0,0.2395147185322681,0.5292870399497183,8,54,1566,COMPLETE
174,1.207317434755738,2026-02-26 10:48:28.505275,2026-02-26 10:48:34.410158,0 days 00:00:05.904883,,gini,12.0,0.22166041149190024,0.5365679831808676,8,37,1625,PRUNED
175,1.0503569920037568,2026-02-26 10:48:34.445015,2026-02-26 10:48:40.466716,0 days 00:00:06.021701,,gini,12.0,0.2390529372531902,0.5510469757374568,8,54,1695,COMPLETE
176,1.0484501909684032,2026-02-26 10:48:40.495587,2026-02-26 10:48:43.563917,0 days 00:00:03.068330,,gini,12.0,0.27111898902608766,0.5223397730956286,8,53,805,COMPLETE
177,1.0692042545420242,2026-02-26 10:48:43.594101,2026-02-26 10:48:46.376084,0 days 00:00:02.781983,,gini,12.0,0.2061966538432906,0.5241697435449568,8,53,744,PRUNED
178,1.2043487935296853,2026-02-26 10:48:46.400647,2026-02-26 10:48:48.889194,0 days 00:00:02.488547,,gini,12.0,0.26603820672496503,0.5479209143518227,8,52,671,PRUNED
179,1.0600067258081365,2026-02-26 10:48:48.914445,2026-02-26 10:48:51.201340,0 days 00:00:02.286895,,gini,12.0,0.25307567832282807,0.5150723396816939,7,50,577,PRUNED
180,1.0487861709896364,2026-02-26 10:48:51.227465,2026-02-26 10:48:56.644769,0 days 00:00:05.417304,,gini,12.0,0.22993041104786305,0.5376030070301315,8,54,1513,COMPLETE
181,1.0509314448830096,2026-02-26 10:48:56.675769,2026-02-26 10:49:02.315316,0 days 00:00:05.639547,,gini,12.0,0.2321596890723937,0.5324055578462332,8,52,1527,PRUNED
182,1.0495048930184105,2026-02-26 10:49:02.341657,2026-02-26 10:49:07.917130,0 days 00:00:05.575473,,gini,12.0,0.21800084811741421,0.5607907308651958,8,53,1559,COMPLETE
183,1.0502852793213167,2026-02-26 10:49:07.946786,2026-02-26 10:49:13.313827,0 days 00:00:05.367041,,gini,12.0,0.21311786917143458,0.522292534431488,8,54,1503,COMPLETE
184,1.0693753206820187,2026-02-26 10:49:13.343217,2026-02-26 10:49:16.318504,0 days 00:00:02.975287,,gini,12.0,0.19373808371835566,0.5428085664721416,8,53,805,PRUNED
185,1.0691835759749648,2026-02-26 10:49:16.343517,2026-02-26 10:49:21.883513,0 days 00:00:05.539996,,gini,12.0,0.1686028669061103,0.5646856132445708,8,56,1575,PRUNED
186,1.0497834126147214,2026-02-26 10:49:21.912600,2026-02-26 10:49:27.941775,0 days 00:00:06.029175,,gini,12.0,0.22660764378862316,0.5383117337946269,8,54,1686,COMPLETE
187,1.2051467917297953,2026-02-26 10:49:27.971248,2026-02-26 10:49:33.239818,0 days 00:00:05.268570,,gini,12.0,0.24283874517300513,0.5505822545120688,8,56,1430,PRUNED
188,1.0680194780006202,2026-02-26 10:49:33.269019,2026-02-26 10:49:38.541958,0 days 00:00:05.272939,,gini,12.0,0.20936136990303034,0.5197066946143856,8,53,1471,PRUNED
189,1.0688711413840388,2026-02-26 10:49:38.568407,2026-02-26 10:49:44.124398,0 days 00:00:05.555991,,gini,32.0,0.1866632617225085,0.5798411601795191,8,52,1577,PRUNED
190,1.2061581073135679,2026-02-26 10:49:44.153361,2026-02-26 10:49:50.016658,0 days 00:00:05.863297,,gini,16.0,0.30123982468232313,0.5288385239744355,8,55,1648,PRUNED
191,1.209477778899704,2026-02-26 10:49:50.049347,2026-02-26 10:49:55.704132,0 days 00:00:05.654785,,gini,12.0,0.2619083629112257,0.562117484042017,7,51,1600,PRUNED
192,1.048776519560596,2026-02-26 10:49:55.730295,2026-02-26 10:50:01.430665,0 days 00:00:05.700370,,gini,12.0,0.24980386983396333,0.5563852053311914,8,49,1537,COMPLETE
193,1.211610501846968,2026-02-26 10:50:01.461287,2026-02-26 10:50:06.845253,0 days 00:00:05.383966,,gini,12.0,0.27544869460089094,0.5693589547227419,8,49,1471,PRUNED
194,1.0480724491983093,2026-02-26 10:50:06.891150,2026-02-26 10:50:12.421226,0 days 00:00:05.530076,,gini,12.0,0.2281280524191378,0.5440257505463642,8,48,1539,COMPLETE
195,1.208772653919728,2026-02-26 10:50:12.449894,2026-02-26 10:50:17.901480,0 days 00:00:05.451586,,gini,12.0,0.22789611992575695,0.5451520874950266,4,46,1533,PRUNED
196,1.2043255886536584,2026-02-26 10:50:17.942286,2026-02-26 10:50:22.951234,0 days 00:00:05.008948,,gini,12.0,0.21402218397969067,0.5569486912386913,8,48,1405,PRUNED
197,1.0482241974172801,2026-02-26 10:50:22.982454,2026-02-26 10:50:28.697849,0 days 00:00:05.715395,,gini,12.0,0.25015509269530284,0.5347753655575032,8,49,1546,COMPLETE
198,1.2040966486794884,2026-02-26 10:50:28.728504,2026-02-26 10:50:34.086157,0 days 00:00:05.357653,,gini,12.0,0.27346786402669915,0.5181447420357397,8,47,1508,PRUNED
199,1.0490457352112643,2026-02-26 10:50:34.112831,2026-02-26 10:50:39.686619,0 days 00:00:05.573788,,gini,12.0,0.22315529896784908,0.5319725570660189,8,49,1551,COMPLETE
200,1.0509871251734793,2026-02-26 10:50:39.723348,2026-02-26 10:50:43.410704,0 days 00:00:03.687356,,gini,26.0,0.2934779951863129,0.5057819184267844,8,46,977,PRUNED
201,1.0501958923794128,2026-02-26 10:50:43.437193,2026-02-26 10:50:49.054638,0 days 00:00:05.617445,,gini,12.0,0.22827100550138113,0.5305176601580586,8,48,1572,COMPLETE
202,1.067641050300664,2026-02-26 10:50:49.091319,2026-02-26 10:50:54.616415,0 days 00:00:05.525096,,gini,12.0,0.19850398317907925,0.5489655182912215,8,49,1548,PRUNED
203,1.0508889101561045,2026-02-26 10:50:54.641460,2026-02-26 10:51:00.183834,0 days 00:00:05.542374,,gini,12.0,0.2476694845739487,0.5279647828656685,8,50,1477,PRUNED
204,1.2043931656321305,2026-02-26 10:51:00.231099,2026-02-26 10:51:05.647601,0 days 00:00:05.416502,,gini,12.0,0.22647937711146995,0.5342025776704051,8,44,1526,PRUNED
205,1.0696462735365075,2026-02-26 10:51:05.673814,2026-02-26 10:51:13.818774,0 days 00:00:08.144960,,gini,8.0,0.26384015704872704,0.5433596774841263,8,50,2328,PRUNED
206,1.05023549087157,2026-02-26 10:51:13.851147,2026-02-26 10:51:21.836834,0 days 00:00:07.985687,,gini,12.0,0.21038365461738442,0.5120371679974578,8,49,2293,COMPLETE
207,1.0491891372828364,2026-02-26 10:51:21.866196,2026-02-26 10:51:26.766452,0 days 00:00:04.900256,,gini,12.0,0.240840470658459,0.5688050946267715,8,51,1306,COMPLETE
208,1.2062017141854036,2026-02-26 10:51:26.795977,2026-02-26 10:51:31.768167,0 days 00:00:04.972190,,gini,12.0,0.24169292215257948,0.5723809114808447,8,48,1399,PRUNED
209,1.2326006856362615,2026-02-26 10:51:31.802607,2026-02-26 10:51:36.686838,0 days 00:00:04.884231,balanced,gini,12.0,0.5056332135021379,0.6920652816466157,9,51,1327,PRUNED
210,1.2060394663612062,2026-02-26 10:51:36.712006,2026-02-26 10:51:40.558457,0 days 00:00:03.846451,,gini,12.0,0.2596749987848409,0.5515670902205096,9,47,1055,PRUNED
211,1.2046073564229187,2026-02-26 10:51:40.595680,2026-02-26 10:51:46.084778,0 days 00:00:05.489098,,gini,12.0,0.23851019459304304,0.560420305938614,8,51,1558,PRUNED
212,1.20406532114775,2026-02-26 10:51:46.127172,2026-02-26 10:51:49.171045,0 days 00:00:03.043873,,gini,12.0,0.22070948605134122,0.5783014111584092,8,49,826,PRUNED
213,1.208032764770798,2026-02-26 10:51:49.220647,2026-02-26 10:51:57.232725,0 days 00:00:08.012078,,gini,12.0,0.2810981596505717,0.5385760991812607,8,52,2235,PRUNED
214,1.0674790234459652,2026-02-26 10:51:57.258729,2026-02-26 10:52:00.643617,0 days 00:00:03.384888,,gini,12.0,0.24512882509700337,0.5579360036739193,8,50,922,PRUNED
215,1.0500135161505795,2026-02-26 10:52:00.670125,2026-02-26 10:52:06.394061,0 days 00:00:05.723936,,gini,12.0,0.20364306264734217,0.5866696511384903,8,51,1606,COMPLETE
216,1.067615374667231,2026-02-26 10:52:06.422279,2026-02-26 10:52:11.725709,0 days 00:00:05.303430,,gini,16.0,0.182175352968505,0.5439554471074342,8,31,1499,PRUNED
217,1.2048058642836244,2026-02-26 10:52:11.753149,2026-02-26 10:52:15.831551,0 days 00:00:04.078402,,gini,32.0,0.25543536860464017,0.5244583636656374,8,52,1140,PRUNED
218,1.2097629183074232,2026-02-26 10:52:15.873652,2026-02-26 10:52:21.625760,0 days 00:00:05.752108,,gini,12.0,0.23099631901780726,0.5675654799545564,7,49,1637,PRUNED
219,1.2042477554854196,2026-02-26 10:52:21.652695,2026-02-26 10:52:26.946052,0 days 00:00:05.293357,,gini,12.0,0.2720144493403631,0.5009285610654439,9,53,1434,PRUNED
220,1.2114652980297276,2026-02-26 10:52:26.980575,2026-02-26 10:52:35.513477,0 days 00:00:08.532902,,gini,12.0,0.2163701199068027,0.5174625070596768,9,14,2425,PRUNED
221,1.0678547935935512,2026-02-26 10:52:35.551491,2026-02-26 10:52:41.172090,0 days 00:00:05.620599,,gini,12.0,0.2521372576686878,0.5377089679194506,8,54,1587,PRUNED
222,1.0490936467130922,2026-02-26 10:52:41.198371,2026-02-26 10:52:49.161499,0 days 00:00:07.963128,,gini,12.0,0.24551131565534262,0.537047085349988,8,54,2260,COMPLETE
223,1.2052916077085776,2026-02-26 10:52:49.207719,2026-02-26 10:52:57.212829,0 days 00:00:08.005110,,gini,12.0,0.2338138426801723,0.5532066261780441,8,52,2256,PRUNED
224,1.048848625485542,2026-02-26 10:52:57.237964,2026-02-26 10:53:04.891966,0 days 00:00:07.654002,,gini,12.0,0.2678339332756831,0.5311908827297611,8,55,2168,COMPLETE
225,1.2041644426514937,2026-02-26 10:53:04.922119,2026-02-26 10:53:12.595542,0 days 00:00:07.673423,,gini,12.0,0.28380078330997344,0.5225527049932511,8,55,2198,PRUNED
226,1.207106598246395,2026-02-26 10:53:12.634006,2026-02-26 10:53:20.472974,0 days 00:00:07.838968,,gini,,0.26545713372753593,0.5332771124313302,7,56,2171,PRUNED
227,1.2196346986474624,2026-02-26 10:53:20.509022,2026-02-26 10:53:28.489832,0 days 00:00:07.980810,,gini,12.0,0.24804752134394398,0.5156905666825288,2,50,2284,PRUNED
228,1.0683004179095474,2026-02-26 10:53:28.516890,2026-02-26 10:53:36.362776,0 days 00:00:07.845886,,gini,,0.2695718435531991,0.5297508741720212,9,55,2232,PRUNED
229,1.2106425014865119,2026-02-26 10:53:36.388993,2026-02-26 10:53:44.787086,0 days 00:00:08.398093,,gini,8.0,0.28618384553439014,0.5465511265845616,8,51,2366,PRUNED
230,1.0489211919089434,2026-02-26 10:53:44.814669,2026-02-26 10:53:52.908964,0 days 00:00:08.094295,,gini,26.0,0.2564503684757198,0.5385003357326532,8,57,2300,COMPLETE
231,1.0669463088703088,2026-02-26 10:53:52.938577,2026-02-26 10:54:01.037701,0 days 00:00:08.099124,,gini,12.0,0.256176293300433,0.5403492901900115,8,58,2308,PRUNED
232,1.0496647351440598,2026-02-26 10:54:01.067020,2026-02-26 10:54:09.172481,0 days 00:00:08.105461,,gini,26.0,0.23990205986546323,0.5285705613999059,8,57,2262,COMPLETE
233,1.2176829562648868,2026-02-26 10:54:09.203216,2026-02-26 10:54:17.027346,0 days 00:00:07.824130,,gini,26.0,0.26287744202509783,0.7090795488537233,8,54,2149,PRUNED
234,1.0473222925367989,2026-02-26 10:54:17.053915,2026-02-26 10:54:18.947578,0 days 00:00:01.893663,,gini,,0.24787688211181264,0.5493158037664556,8,56,456,COMPLETE
235,1.0698285036213266,2026-02-26 10:54:18.996455,2026-02-26 10:54:20.723657,0 days 00:00:01.727202,,gini,12.0,0.23254987469509483,0.5102668750938769,8,56,429,PRUNED
236,1.212833183944276,2026-02-26 10:54:20.749788,2026-02-26 10:54:23.502723,0 days 00:00:02.752935,,gini,26.0,0.30412673576568866,0.5496252701860739,8,53,734,PRUNED
237,1.2099062975425918,2026-02-26 10:54:23.529407,2026-02-26 10:54:25.595313,0 days 00:00:02.065906,,gini,26.0,0.2747557755504062,0.6310421445723372,8,48,529,PRUNED
238,1.2094562394505366,2026-02-26 10:54:25.622204,2026-02-26 10:54:33.856016,0 days 00:00:08.233812,,gini,26.0,0.24739366702141144,0.6169231683911915,8,54,2346,PRUNED
239,1.2136512460210362,2026-02-26 10:54:33.900827,2026-02-26 10:54:41.922766,0 days 00:00:08.021939,,gini,,0.22933942429002624,0.5232459506159124,5,46,2292,PRUNED
240,1.2028968797431705,2026-02-26 10:54:41.949650,2026-02-26 10:54:47.491292,0 days 00:00:05.541642,,gini,12.0,0.2622866131475407,0.5692105064249716,8,55,1504,PRUNED
241,1.0502515079441994,2026-02-26 10:54:47.517453,2026-02-26 10:54:55.426666,0 days 00:00:07.909213,,gini,,0.24990797110534563,0.5369914019621722,8,57,2232,COMPLETE
242,1.0491089837146106,2026-02-26 10:54:55.457909,2026-02-26 10:55:03.339258,0 days 00:00:07.881349,,gini,,0.2426557759581579,0.5467352928466749,10,52,2222,COMPLETE
243,1.2197195153129246,2026-02-26 10:55:03.369994,2026-02-26 10:55:11.354917,0 days 00:00:07.984923,,gini,,0.23900535623962454,0.9650696649643645,10,52,2177,PRUNED
244,1.2026656002729235,2026-02-26 10:55:11.390996,2026-02-26 10:55:19.787387,0 days 00:00:08.396391,,gini,,0.27523747721381153,0.554699531386843,10,51,2390,PRUNED
245,1.0493667937641327,2026-02-26 10:55:19.825853,2026-02-26 10:55:27.569496,0 days 00:00:07.743643,,gini,,0.21936023437363653,0.5470130481677494,10,50,2191,COMPLETE
246,1.0688929836084518,2026-02-26 10:55:27.597902,2026-02-26 10:55:31.375373,0 days 00:00:03.777471,,gini,,0.2899863724400983,0.5350100660892876,10,53,1031,PRUNED
247,1.0811009556083544,2026-02-26 10:55:31.400468,2026-02-26 10:55:34.567361,0 days 00:00:03.166893,balanced,gini,12.0,0.25605702883341974,0.5591848317593494,10,22,847,PRUNED
248,1.2038218154529128,2026-02-26 10:55:34.600583,2026-02-26 10:55:42.151069,0 days 00:00:07.550486,,gini,,0.23413090929265934,0.5840266832807208,8,49,2101,PRUNED
249,1.067558854376826,2026-02-26 10:55:42.177231,2026-02-26 10:55:47.613709,0 days 00:00:05.436478,,gini,12.0,0.2033991955816698,0.5207488686703295,8,52,1537,PRUNED
250,1.0493803654425191,2026-02-26 10:55:47.646530,2026-02-26 10:55:55.846346,0 days 00:00:08.199816,,entropy,12.0,0.26613054463210617,0.5304224407840629,8,55,2325,COMPLETE
251,1.0511635723387966,2026-02-26 10:55:55.885310,2026-02-26 10:55:58.254859,0 days 00:00:02.369549,,gini,,0.24693440495101102,0.5447744733664477,10,53,593,PRUNED
252,1.2219928358328604,2026-02-26 10:55:58.280202,2026-02-26 10:56:06.231624,0 days 00:00:07.951422,,gini,20.0,0.2231644878221828,0.5727933740491566,3,47,2269,PRUNED
253,1.2100164248783043,2026-02-26 10:56:06.257401,2026-02-26 10:56:12.226539,0 days 00:00:05.969138,,gini,12.0,0.2821725112946561,0.5626045698915747,8,50,1632,PRUNED
254,1.0483189701448599,2026-02-26 10:56:12.260404,2026-02-26 10:56:17.579058,0 days 00:00:05.318654,,gini,,0.23783350897163177,0.5934416267455556,8,54,1465,COMPLETE
255,1.068094672833255,2026-02-26 10:56:17.609712,2026-02-26 10:56:22.941915,0 days 00:00:05.332203,,gini,16.0,0.2166661246891304,0.5882407043177582,8,52,1456,PRUNED
256,1.203596067753627,2026-02-26 10:56:22.968945,2026-02-26 10:56:28.300072,0 days 00:00:05.331127,,gini,32.0,0.23525583049099144,0.5989052478226234,8,54,1486,PRUNED
257,1.2120484304802526,2026-02-26 10:56:28.326574,2026-02-26 10:56:33.802686,0 days 00:00:05.476112,,gini,12.0,0.25003058872495704,0.6096288809243443,8,51,1539,PRUNED
258,1.2082238166937904,2026-02-26 10:56:33.829226,2026-02-26 10:56:39.242757,0 days 00:00:05.413531,,gini,,0.20253894152069302,0.5814337127534353,7,48,1458,PRUNED
